id,username,text,likes,retweets,replies,total_interactions,post_date_iso,date,year,month,day,hour,text_clean,text_no_links,mentions,hashtags,urls,n_mentions,n_hashtags,n_urls,char_count,word_count,amplification_ratio,reach_tier,cluster,cluster_prob
353.0,ellsilo,"Jak się jej nie podoba, to niech się zapisze do PiSu",0,0,0,0,"Jun 3, 2025 · 3:10 PM UTC",,,,,,"Jak się jej nie podoba, to niech się zapisze do PiSu","Jak się jej nie podoba, to niech się zapisze do PiSu",,,,0,0,0,52,11,0.0,niski,11,0.8370958500803739
522.0,misieq4484,"Na obronę @WiolaPaprocka powiem że kandydata mieliście absolutnie beznadziejnego. Jego głos, intonacja są zaprzeczeniem vibe przywódcy a sugerują jakiegoś coacha albo showmena. Tak daleko zaniosła go przedewszystkim ośmiogwiazdkowa nienawiść do PiSu.",0,2,0,2,"Jun 3, 2025 · 2:38 PM UTC",,,,,,"Na obronę powiem że kandydata mieliście absolutnie beznadziejnego. Jego głos, intonacja są zaprzeczeniem vibe przywódcy a sugerują jakiegoś coacha albo showmena. Tak daleko zaniosła go przedewszystkim ośmiogwiazdkowa nienawiść do PiSu.","Na obronę powiem że kandydata mieliście absolutnie beznadziejnego. Jego głos, intonacja są zaprzeczeniem vibe przywódcy a sugerują jakiegoś coacha albo showmena. Tak daleko zaniosła go przedewszystkim ośmiogwiazdkowa nienawiść do PiSu.",@WiolaPaprocka,,,1,0,0,235,30,2.0,wysoki,11,0.3222730131632361
652.0,konesereu,"Skoro 75% oglądających to PiS, to chyba jednak podoba im się to medium?",0,0,0,0,"Jun 3, 2025 · 3:12 PM UTC",,,,,,"Skoro 75% oglądających to PiS, to chyba jednak podoba im się to medium?","Skoro 75% oglądających to PiS, to chyba jednak podoba im się to medium?",,,,0,0,0,71,13,0.0,niski,11,0.4215881528413883
371.0,wys_dawid,Nie. @trzaskowski_ ma poparcie 6 147 797 ludzi. Reszta to ludzie którzy bardziej nienawidzą PiSu niż Platformy. 🤷‍,0,0,0,0,"Jun 3, 2025 · 4:03 PM UTC",,,,,,Nie. ma poparcie 6 147 797 ludzi. Reszta to ludzie którzy bardziej nienawidzą PiSu niż Platformy. 🤷‍,Nie. ma poparcie 6 147 797 ludzi. Reszta to ludzie którzy bardziej nienawidzą PiSu niż Platformy. 🤷‍,@trzaskowski_,,,1,0,0,100,17,0.0,niski,11,0.4332018740561977
734.0,es_dawid,Obecny rząd i większość można nazwać silniczkowym. Premiera i polityków PO interesują jedynie opinie Silnych Razem czyli betonu PO. Podobnie było w latach 2010-2015 i marszami KODu. Dla większości młodych jest to bardzo obciachowe. Do tego podsycanie polaryzacji...,0,0,0,0,"Jun 3, 2025 · 4:05 PM UTC",,,,,,Obecny rząd i większość można nazwać silniczkowym. Premiera i polityków PO interesują jedynie opinie Silnych Razem czyli betonu PO. Podobnie było w latach 2010-2015 i marszami KODu. Dla większości młodych jest to bardzo obciachowe. Do tego podsycanie polaryzacji...,Obecny rząd i większość można nazwać silniczkowym. Premiera i polityków PO interesują jedynie opinie Silnych Razem czyli betonu PO. Podobnie było w latach 2010-2015 i marszami KODu. Dla większości młodych jest to bardzo obciachowe. Do tego podsycanie polaryzacji...,,,,0,0,0,265,38,0.0,niski,11,0.4447613062791797
4.0,mateuszpluta02,"Poparcie dla @trzaskowski_ w II turze 2020 i 2025 w grupach wiekowych. Młodzi, którzy masowo poszli w 2023 odsunąć PiS od władzy, w niedzielę zagłosowali na kandydata PiS, torując J. Kaczyńskiemu drogę powrotu do władzy. Polityka przewrotną jest",7,29,46,82,"Jun 3, 2025 · 4:10 PM UTC",,,,,,"Poparcie dla w II turze 2020 i 2025 w grupach wiekowych. Młodzi, którzy masowo poszli w 2023 odsunąć PiS od władzy, w niedzielę zagłosowali na kandydata PiS, torując J. Kaczyńskiemu drogę powrotu do władzy. Polityka przewrotną jest","Poparcie dla w II turze 2020 i 2025 w grupach wiekowych. Młodzi, którzy masowo poszli w 2023 odsunąć PiS od władzy, w niedzielę zagłosowali na kandydata PiS, torując J. Kaczyńskiemu drogę powrotu do władzy. Polityka przewrotną jest",@trzaskowski_,,,1,0,0,231,37,0.63,wysoki,11,0.4560638352696389
601.0,rundfunkeuropa,"Granie anty-PiS-em już nie działa. Albo ma się realne propozycje, albo się przegrywa.",0,0,0,0,"Jun 3, 2025 · 5:03 PM UTC",,,,,,"Granie anty-PiS-em już nie działa. Albo ma się realne propozycje, albo się przegrywa.","Granie anty-PiS-em już nie działa. Albo ma się realne propozycje, albo się przegrywa.",,,,0,0,0,85,13,0.0,niski,11,0.8370958500803739
8.0,orsondzi,"Idealnie w punkt. Zero nauki na błędach i podpatrywania konkurencji. Całkowity brak chwalenia się sukcesami i mądrego straszenia ich zabraniem - PiS wróci i zabierze InVitro. Czy ktoś powiedział ludziom na wsi, że węgiel jest tańszy niż za PiS-u? No właśnie.",1,1,2,4,"Jun 3, 2025 · 9:45 AM UTC",,,,,,"Idealnie w punkt. Zero nauki na błędach i podpatrywania konkurencji. Całkowity brak chwalenia się sukcesami i mądrego straszenia ich zabraniem - PiS wróci i zabierze InVitro. Czy ktoś powiedział ludziom na wsi, że węgiel jest tańszy niż za PiS-u? No właśnie.","Idealnie w punkt. Zero nauki na błędach i podpatrywania konkurencji. Całkowity brak chwalenia się sukcesami i mądrego straszenia ich zabraniem - PiS wróci i zabierze InVitro. Czy ktoś powiedział ludziom na wsi, że węgiel jest tańszy niż za PiS-u? No właśnie.",,,,0,0,0,258,41,0.5,wysoki,11,0.6428818272168801
774.0,comasztom,Rozpacz po przegranych wyborach zatruwa wam duzsze. Za dwa lata to konfederacja będzie wybierać przystawki do większości w sejmie. Wasze wycie nic nie zmieni. Dla wyborców konfy Trzaskowski był nie do przyjęcia i tyle w temacie.,0,0,0,0,"Jun 3, 2025 · 6:12 PM UTC",,,,,,Rozpacz po przegranych wyborach zatruwa wam duzsze. Za dwa lata to konfederacja będzie wybierać przystawki do większości w sejmie. Wasze wycie nic nie zmieni. Dla wyborców konfy Trzaskowski był nie do przyjęcia i tyle w temacie.,Rozpacz po przegranych wyborach zatruwa wam duzsze. Za dwa lata to konfederacja będzie wybierać przystawki do większości w sejmie. Wasze wycie nic nie zmieni. Dla wyborców konfy Trzaskowski był nie do przyjęcia i tyle w temacie.,,,,0,0,0,228,36,0.0,niski,11,0.3430897702679072
819.0,kesik993,PiS ma tubę propagandową dla starszych (republika) i dla młodszych (Kanał Zero). I to zadziałało. A koalicja rządowa całkowicie położyła komunikację i polityczny marketing.,0,2,1,3,"Jun 3, 2025 · 4:21 PM UTC",,,,,,PiS ma tubę propagandową dla starszych (republika) i dla młodszych (Kanał Zero). I to zadziałało. A koalicja rządowa całkowicie położyła komunikację i polityczny marketing.,PiS ma tubę propagandową dla starszych (republika) i dla młodszych (Kanał Zero). I to zadziałało. A koalicja rządowa całkowicie położyła komunikację i polityczny marketing.,,,,0,0,0,172,24,2.0,wysoki,11,1.0
494.0,deantes23123046,Czyli tak czy inaczej kończy się rządami PiS,0,0,0,0,"Jun 3, 2025 · 7:59 PM UTC",,,,,,Czyli tak czy inaczej kończy się rządami PiS,Czyli tak czy inaczej kończy się rządami PiS,,,,0,0,0,44,8,0.0,niski,11,0.7782520075958032
613.0,palbow_79,Za dwa lata to może nie być i PiSu i KO - bo te partie mogą się zwyczajnie podzielić.,0,0,0,0,"Jun 3, 2025 · 8:00 PM UTC",,,,,,Za dwa lata to może nie być i PiSu i KO - bo te partie mogą się zwyczajnie podzielić.,Za dwa lata to może nie być i PiSu i KO - bo te partie mogą się zwyczajnie podzielić.,,,,0,0,0,85,19,0.0,niski,11,0.6845914726962187
455.0,rowerykiem,Bartoszyce? Co tam się odjaniepawniło . Tam zawsze był PiS i wieczne narzekania,0,0,0,0,"Jun 4, 2025 · 8:16 AM UTC",,,,,,Bartoszyce? Co tam się odjaniepawniło . Tam zawsze był PiS i wieczne narzekania,Bartoszyce? Co tam się odjaniepawniło . Tam zawsze był PiS i wieczne narzekania,,,,0,0,0,79,13,0.0,niski,11,0.8370958500803739
102.0,topg2137,"""Ale kto będzie wtedy yebał tutaj PiS i KonfederuSSję?"" to oni was beda jebac, juz to widac, jak wyje marszalek i inni, kolejne wybory jak tak dalej pojdzie beda wygladac tak: pis - 30% po - 25% konfa - 20% braun/razem - 5-10% ogryzki lewice / holownie / psl 3%",0,0,0,0,"Jun 4, 2025 · 10:17 AM UTC",,,,,,"""Ale kto będzie wtedy yebał tutaj PiS i KonfederuSSję?"" to oni was beda jebac, juz to widac, jak wyje marszalek i inni, kolejne wybory jak tak dalej pojdzie beda wygladac tak: pis - 30% po - 25% konfa - 20% braun/razem - 5-10% ogryzki lewice / holownie / psl 3%","""Ale kto będzie wtedy yebał tutaj PiS i KonfederuSSję?"" to oni was beda jebac, juz to widac, jak wyje marszalek i inni, kolejne wybory jak tak dalej pojdzie beda wygladac tak: pis - 30% po - 25% konfa - 20% braun/razem - 5-10% ogryzki lewice / holownie / psl 3%",,,,0,0,0,261,50,0.0,niski,11,0.4245716583401286
967.0,pignatjew,Jakoś wam chłopacy i diewczyny nie wierzę …. To wy w 2015 roku podkopaliście Lewice i daliście PiSowi władzę samodzielną. Teraz rząd Tuska jest jedyną zaporą przed powrotem PiSu i nadzieją 10.200 tyś ludzi którzy głosowali na Rafała,0,0,0,0,"Jun 4, 2025 · 6:07 AM UTC",,,,,,Jakoś wam chłopacy i diewczyny nie wierzę …. To wy w 2015 roku podkopaliście Lewice i daliście PiSowi władzę samodzielną. Teraz rząd Tuska jest jedyną zaporą przed powrotem PiSu i nadzieją 10.200 tyś ludzi którzy głosowali na Rafała,Jakoś wam chłopacy i diewczyny nie wierzę …. To wy w 2015 roku podkopaliście Lewice i daliście PiSowi władzę samodzielną. Teraz rząd Tuska jest jedyną zaporą przed powrotem PiSu i nadzieją 10.200 tyś ludzi którzy głosowali na Rafała,,,,0,0,0,232,38,0.0,niski,11,0.6088686066765845
476.0,tomek_pl_,"1. Kto lepszy? 2. PiS propaganda działa tylko na debili ale masz rację, że 50% Polaków to debile, tu zgoda 3. Niby co było takiego beznadziejnego w tym sztabie? 4. 🤔???",0,0,0,0,"Jun 4, 2025 · 11:20 AM UTC",,,,,,"1. Kto lepszy? 2. PiS propaganda działa tylko na debili ale masz rację, że 50% Polaków to debile, tu zgoda 3. Niby co było takiego beznadziejnego w tym sztabie? 4. 🤔???","1. Kto lepszy? 2. PiS propaganda działa tylko na debili ale masz rację, że 50% Polaków to debile, tu zgoda 3. Niby co było takiego beznadziejnego w tym sztabie? 4. 🤔???",,,,0,0,0,168,31,0.0,niski,11,0.4473566473213425
13.0,iiannamagdalena,"Istotne różnice polegają również na tym, że gdyby rząd PiSu miał na swoim koncie tak potężny sukces jak odblokowanie miliardów z KPO, zbudowałby na tym całą kampanię ubierając w patriotyzm. A gdyby Trzaskowski miał na swoim koncie choć jeden z potężnych brudów Nawrockiego, PiS nie musiałby Go unicestwiać. Sami byśmy to zrobili nie przebierając w słowach.",3,124,44,171,"Jun 4, 2025 · 11:48 AM UTC",,,,,,"Istotne różnice polegają również na tym, że gdyby rząd PiSu miał na swoim koncie tak potężny sukces jak odblokowanie miliardów z KPO, zbudowałby na tym całą kampanię ubierając w patriotyzm. A gdyby Trzaskowski miał na swoim koncie choć jeden z potężnych brudów Nawrockiego, PiS nie musiałby Go unicestwiać. Sami byśmy to zrobili nie przebierając w słowach.","Istotne różnice polegają również na tym, że gdyby rząd PiSu miał na swoim koncie tak potężny sukces jak odblokowanie miliardów z KPO, zbudowałby na tym całą kampanię ubierając w patriotyzm. A gdyby Trzaskowski miał na swoim koncie choć jeden z potężnych brudów Nawrockiego, PiS nie musiałby Go unicestwiać. Sami byśmy to zrobili nie przebierając w słowach.",,,,0,0,0,356,56,2.82,wysoki,11,0.512961440707999
238.0,jolaiza29,To niech w końcu pójdą sami skoro mają prawo tam być. Zwykli wyborcy PSL od dawna głosują na PiS.,0,0,0,0,"Jun 4, 2025 · 12:55 PM UTC",,,,,,To niech w końcu pójdą sami skoro mają prawo tam być. Zwykli wyborcy PSL od dawna głosują na PiS.,To niech w końcu pójdą sami skoro mają prawo tam być. Zwykli wyborcy PSL od dawna głosują na PiS.,,,,0,0,0,97,19,0.0,niski,11,1.0
809.0,thaulus,"Wyborcy Pisu nie młodnieją a za 2 lata 16 latkowie co byli na wiecach Mentzena już będą mogli głosować. W parlamentarnych nie ma też takiego parcia że trzeba głosować na PiS by PO nie wygrało, można zagłosować na KKP albo Konfederację bo jest więcej niż jeden co wejdzie do rządu",0,0,0,0,"Jun 4, 2025 · 1:00 PM UTC",,,,,,"Wyborcy Pisu nie młodnieją a za 2 lata 16 latkowie co byli na wiecach Mentzena już będą mogli głosować. W parlamentarnych nie ma też takiego parcia że trzeba głosować na PiS by PO nie wygrało, można zagłosować na KKP albo Konfederację bo jest więcej niż jeden co wejdzie do rządu","Wyborcy Pisu nie młodnieją a za 2 lata 16 latkowie co byli na wiecach Mentzena już będą mogli głosować. W parlamentarnych nie ma też takiego parcia że trzeba głosować na PiS by PO nie wygrało, można zagłosować na KKP albo Konfederację bo jest więcej niż jeden co wejdzie do rządu",,,,0,0,0,279,50,0.0,niski,11,0.5877627446618996
117.0,jacob_st9,"Brednie? PiS miał najwięcej procentowo, ale większość zdobyła opozycja i to ona zgodnie z prawem stworzyła rząd. Tusk? 538 634 głosy – rekord od ’89. Gliński w tym samym okręgu? 135 tysięcy. Troll? Pudło. Gdybym był z PiS, może też bredziłbym jak ty.",0,0,0,0,"Jun 4, 2025 · 1:59 PM UTC",,,,,,"Brednie? PiS miał najwięcej procentowo, ale większość zdobyła opozycja i to ona zgodnie z prawem stworzyła rząd. Tusk? 538 634 głosy – rekord od ’89. Gliński w tym samym okręgu? 135 tysięcy. Troll? Pudło. Gdybym był z PiS, może też bredziłbym jak ty.","Brednie? PiS miał najwięcej procentowo, ale większość zdobyła opozycja i to ona zgodnie z prawem stworzyła rząd. Tusk? 538 634 głosy – rekord od ’89. Gliński w tym samym okręgu? 135 tysięcy. Troll? Pudło. Gdybym był z PiS, może też bredziłbym jak ty.",,,,0,0,0,250,43,0.0,niski,11,0.5038806704165021
258.0,domi_dlugosz,"Jest to mocno ironiczne, że pierwszy transfer po tych wyborach to odejście z PiS, które uważa, że to K15.10 się rozpada",2,39,33,74,"Jun 4, 2025 · 11:33 AM UTC",,,,,,"Jest to mocno ironiczne, że pierwszy transfer po tych wyborach to odejście z PiS, które uważa, że to K15.10 się rozpada","Jest to mocno ironiczne, że pierwszy transfer po tych wyborach to odejście z PiS, które uważa, że to K15.10 się rozpada",,,,0,0,0,119,21,1.18,wysoki,11,0.8352105724997667
29.0,usmiechuk,"O wynikach końcowych zdecydują ci, którzy nie podali ankieterom na kogo zagłosowali, a było ich bardzo dużo.. Czyżby to byli zwolennicy Konfederacji..? 🤔 Zbyt szybko się cieszysz, a już niedługo zapłacisz, za to co robisz 🤣🤣",0,1,0,1,"Jun 1, 2025 · 7:34 PM UTC",,,,,,"O wynikach końcowych zdecydują ci, którzy nie podali ankieterom na kogo zagłosowali, a było ich bardzo dużo.. Czyżby to byli zwolennicy Konfederacji..? 🤔 Zbyt szybko się cieszysz, a już niedługo zapłacisz, za to co robisz 🤣🤣","O wynikach końcowych zdecydują ci, którzy nie podali ankieterom na kogo zagłosowali, a było ich bardzo dużo.. Czyżby to byli zwolennicy Konfederacji..? 🤔 Zbyt szybko się cieszysz, a już niedługo zapłacisz, za to co robisz 🤣🤣",,,,0,0,0,224,36,1.0,średni,11,0.3430897702679072
462.0,marekbrzeg,I. Leszczyna w sejmie: PiS rozdawał pieniądze... swoim. My robimy - odwrotnie!,2,28,42,72,"Jun 4, 2025 · 11:14 AM UTC",,,,,,I. Leszczyna w sejmie: PiS rozdawał pieniądze... swoim. My robimy - odwrotnie!,I. Leszczyna w sejmie: PiS rozdawał pieniądze... swoim. My robimy - odwrotnie!,,,,0,0,0,78,12,0.67,wysoki,11,0.8013892815364848
891.0,arturoganiaczyk,"Nadal 2 do 1.Przeglosuje ich Pisior?Im większa liczba ,tym słuszniejsza racja.Dobrze ,że to większościową ordynacja,bo z kilkoma partiami byśmy się pożegnali.",0,0,0,0,"Jun 4, 2025 · 7:09 PM UTC",,,,,,"Nadal 2 do 1.Przeglosuje ich Pisior?Im większa liczba ,tym słuszniejsza racja.Dobrze ,że to większościową ordynacja,bo z kilkoma partiami byśmy się pożegnali.","Nadal 2 do 1.Przeglosuje ich Pisior?Im większa liczba ,tym słuszniejsza racja.Dobrze ,że to większościową ordynacja,bo z kilkoma partiami byśmy się pożegnali.",,,,0,0,0,158,21,0.0,niski,11,0.5958246313903237
776.0,arturthecaptain,Niech ten PiS już nie rządzi bo oszukują wybory,0,0,0,0,"Jun 5, 2025 · 9:57 AM UTC",,,,,,Niech ten PiS już nie rządzi bo oszukują wybory,Niech ten PiS już nie rządzi bo oszukują wybory,,,,0,0,0,47,9,0.0,niski,11,1.0
346.0,0jtaki,"#Wybory2025 szanowni Państwo proszę zerknąć jak propagandysta PO wypowiada się o PiS i zastanówcie się czy to ta mowa nienawiści, z którą tak zaciekle walczą. #GiertychDebil",0,0,0,0,10-06-25,2025-06-10,2025.0,6.0,10.0,0.0,"Wybory2025 szanowni Państwo proszę zerknąć jak propagandysta PO wypowiada się o PiS i zastanówcie się czy to ta mowa nienawiści, z którą tak zaciekle walczą. GiertychDebil","szanowni Państwo proszę zerknąć jak propagandysta PO wypowiada się o PiS i zastanówcie się czy to ta mowa nienawiści, z którą tak zaciekle walczą.",,#Wybory2025|#GiertychDebil,,0,2,0,171,26,0.0,niski,11,1.0
4.0,szykom89,"Prokuratura Okręgowa w Warszawie dostała zawiadomienie przeciwko @DariuszMatecki. Chodzi o aplikację posła @pisorgpl #PiS, która mogła wpływać przestępczo na wybory prezydenckie. Prokuratura otrzymała zawiadomienie to od #ABW. #Prezydent2025 #matecki #Wybory2025 #PiStoMafia",0,2,1,3,10-06-25,2025-06-10,2025.0,6.0,10.0,0.0,"Prokuratura Okręgowa w Warszawie dostała zawiadomienie przeciwko . Chodzi o aplikację posła PiS, która mogła wpływać przestępczo na wybory prezydenckie. Prokuratura otrzymała zawiadomienie to od ABW. Prezydent2025 matecki Wybory2025 PiStoMafia","Prokuratura Okręgowa w Warszawie dostała zawiadomienie przeciwko . Chodzi o aplikację posła , która mogła wpływać przestępczo na wybory prezydenckie. Prokuratura otrzymała zawiadomienie to od .",@DariuszMatecki|@pisorgpl,#PiS|#ABW|#Prezydent2025|#matecki|#Wybory2025|#PiStoMafia,,2,6,0,243,30,2.0,średni,11,0.3040888820706146
8.0,marianvanbuuren,"Jeśli PiS sfałszował wybory będąc w opozycji, pozbawionym finansowania i atakowanym przez mainstreamowy ściek... to sobie kurwa na tę ""nieuczciwą"" wygraną zapracował. STOP THE RECOUNT #wyboryprezydenckie #wybory2025",0,0,0,0,18-06-25,2025-06-18,2025.0,6.0,18.0,0.0,"Jeśli PiS sfałszował wybory będąc w opozycji, pozbawionym finansowania i atakowanym przez mainstreamowy ściek... to sobie kurwa na tę ""nieuczciwą"" wygraną zapracował. STOP THE RECOUNT wyboryprezydenckie wybory2025","Jeśli PiS sfałszował wybory będąc w opozycji, pozbawionym finansowania i atakowanym przez mainstreamowy ściek... to sobie kurwa na tę ""nieuczciwą"" wygraną zapracował. STOP THE RECOUNT",,#wyboryprezydenckie|#wybory2025,,0,2,0,213,27,0.0,niski,11,1.0
9.0,kotczarny,"To nie byłoby takie głupie, #Korona zyskałaby struktury i pieniądze a PSL pewne wejście do sejmu. Nie licząc Kosiniaków w zarządzie to doly PSL mają te same poglądy co Korona i nawet na Brauna głosowały w tych wyborach. #wybory2025",0,0,0,0,17-06-25,2025-06-17,2025.0,6.0,17.0,0.0,"To nie byłoby takie głupie, Korona zyskałaby struktury i pieniądze a PSL pewne wejście do sejmu. Nie licząc Kosiniaków w zarządzie to doly PSL mają te same poglądy co Korona i nawet na Brauna głosowały w tych wyborach. wybory2025","To nie byłoby takie głupie, zyskałaby struktury i pieniądze a PSL pewne wejście do sejmu. Nie licząc Kosiniaków w zarządzie to doly PSL mają te same poglądy co Korona i nawet na Brauna głosowały w tych wyborach.",,#Korona|#wybory2025,,0,2,0,229,39,0.0,niski,11,0.4010140492025097
10.0,monikamichaows6,"PiS krok po kroku zabiera nam demokrację. Zdeptali konstytucję, zabetonowali sądy, prokuratury. W sposób zorganizowany opanowali komisje wyborcze. To działanie celowe. Nie możemy pozwolić, aby nasze głosy zostały przypisane komuś innemu. #wybory2025 #PrzeliczmyGłosy",1,2,0,3,19-06-25,2025-06-19,2025.0,6.0,19.0,0.0,"PiS krok po kroku zabiera nam demokrację. Zdeptali konstytucję, zabetonowali sądy, prokuratury. W sposób zorganizowany opanowali komisje wyborcze. To działanie celowe. Nie możemy pozwolić, aby nasze głosy zostały przypisane komuś innemu. wybory2025 PrzeliczmyGłosy","PiS krok po kroku zabiera nam demokrację. Zdeptali konstytucję, zabetonowali sądy, prokuratury. W sposób zorganizowany opanowali komisje wyborcze. To działanie celowe. Nie możemy pozwolić, aby nasze głosy zostały przypisane komuś innemu.",,#wybory2025|#PrzeliczmyGłosy,,0,2,0,264,33,2.0,średni,11,0.3169754376630664
3.0,tygodnikopolska,"Politycy PiS twierdzą, iż w nawoływaniu do ponownego liczenia głosów chodzi, o to, że „ktoś chce ukraść ludziom wybory”. Czyżby się obawiali, że po ponownym przeliczeniu, pod nadzorem sędziów, okaże się, że Karol Nawrocki nie wygrał? #wybory2025 #Wybory opolska360.pl/wybory-2025-po…",0,2,0,2,20-06-25,2025-06-20,2025.0,6.0,20.0,0.0,"Politycy PiS twierdzą, iż w nawoływaniu do ponownego liczenia głosów chodzi, o to, że „ktoś chce ukraść ludziom wybory”. Czyżby się obawiali, że po ponownym przeliczeniu, pod nadzorem sędziów, okaże się, że Karol Nawrocki nie wygrał? wybory2025 Wybory","Politycy PiS twierdzą, iż w nawoływaniu do ponownego liczenia głosów chodzi, o to, że „ktoś chce ukraść ludziom wybory”. Czyżby się obawiali, że po ponownym przeliczeniu, pod nadzorem sędziów, okaże się, że Karol Nawrocki nie wygrał?",,#wybory2025|#Wybory,opolska360.pl/wybory-2025-po…,0,2,1,251,38,2.0,średni,11,0.3843667692159759
5.0,arek_grzegorz,"Adrian sPałacu straszy stanem wojennym, bo naród chce poznać prawdziwe wyniki wyborów... #wybory2025",0,12,0,12,22-06-25,2025-06-22,2025.0,6.0,22.0,0.0,"Adrian sPałacu straszy stanem wojennym, bo naród chce poznać prawdziwe wyniki wyborów... wybory2025","Adrian sPałacu straszy stanem wojennym, bo naród chce poznać prawdziwe wyniki wyborów...",,#wybory2025,,0,1,0,99,13,12.0,wysoki,11,0.2841598373577728
3.0,marek_li_,"Trudno posądzać portal córki sędziego Rzeplińskiego Róży, że sprzyja PiS i prawicy. Analiza pokazuje, że #wybory2025 nie wyróżniały się żadnymi specjalnymi anomaliami. mamprawowiedziec.pl/czytelni…",0,0,0,0,23-06-25,2025-06-23,2025.0,6.0,23.0,0.0,"Trudno posądzać portal córki sędziego Rzeplińskiego Róży, że sprzyja PiS i prawicy. Analiza pokazuje, że wybory2025 nie wyróżniały się żadnymi specjalnymi anomaliami.","Trudno posądzać portal córki sędziego Rzeplińskiego Róży, że sprzyja PiS i prawicy. Analiza pokazuje, że nie wyróżniały się żadnymi specjalnymi anomaliami.",,#wybory2025,mamprawowiedziec.pl/czytelni…,0,1,1,166,22,0.0,niski,11,0.6190315333188023
5.0,szykom89,Prezes @OficjalnyJK z partyjnymi kolegami z @pisorgpl #PiS w 2014 nie potrafili też się pogodzić z przegraną? #Prezydent2025 #AferyPiS #SfałszowaneWybory #PiStoMafia #PAD #PKW #Prezydent @prezydentpl #duda @AndrzejDuda @NawrockiKn #Wybory2025 @PanstwKomWyb #nawrocki #kaczyński,0,3,1,4,24-06-25,2025-06-24,2025.0,6.0,24.0,0.0,Prezes z partyjnymi kolegami z PiS w 2014 nie potrafili też się pogodzić z przegraną? Prezydent2025 AferyPiS SfałszowaneWybory PiStoMafia PAD PKW Prezydent duda Wybory2025 nawrocki kaczyński,Prezes z partyjnymi kolegami z w 2014 nie potrafili też się pogodzić z przegraną?,@OficjalnyJK|@pisorgpl|@prezydentpl|@AndrzejDuda|@NawrockiKn|@PanstwKomWyb,#PiS|#Prezydent2025|#AferyPiS|#SfałszowaneWybory|#PiStoMafia|#PAD|#PKW|#Prezydent|#duda|#Wybory2025|#nawrocki|#kaczyński,,6,12,0,190,26,3.0,średni,11,0.5562329304666735
5.0,idzpodpradpl,"Prokurator generalny nie zrobił nic, by naprawić państwo po PiS! Prok. Blajerski w #IPPTVNaŻywo #wybory2025 #BodnarDoDymisji #policzmyglosy @Adbodnar @donaldtusk @GiertychRoman",1,6,0,7,26-06-25,2025-06-26,2025.0,6.0,26.0,0.0,"Prokurator generalny nie zrobił nic, by naprawić państwo po PiS! Prok. Blajerski w IPPTVNaŻywo wybory2025 BodnarDoDymisji policzmyglosy","Prokurator generalny nie zrobił nic, by naprawić państwo po PiS! Prok. Blajerski w",@Adbodnar|@donaldtusk|@GiertychRoman,#IPPTVNaŻywo|#wybory2025|#BodnarDoDymisji|#policzmyglosy,,3,4,0,135,17,6.0,wysoki,11,0.3112554130959458
6.0,tenodpainta,"Sławomir Mentzen – ekonomista, przedsiębiorca, lider Nowej Nadziei. Kandydat Konfederacji na prezydenta 2025. Wszystko co trzeba o nim wiedzieć – w 55 sekund #mentzen #Konfederacja #wybory2025",0,0,1,1,26-06-25,2025-06-26,2025.0,6.0,26.0,0.0,"Sławomir Mentzen – ekonomista, przedsiębiorca, lider Nowej Nadziei. Kandydat Konfederacji na prezydenta 2025. Wszystko co trzeba o nim wiedzieć – w 55 sekund mentzen Konfederacja wybory2025","Sławomir Mentzen – ekonomista, przedsiębiorca, lider Nowej Nadziei. Kandydat Konfederacji na prezydenta 2025. Wszystko co trzeba o nim wiedzieć – w 55 sekund",,#mentzen|#Konfederacja|#wybory2025,,0,3,0,189,26,0.0,średni,11,0.2514502471280759
7.0,aaadddaaammm87,"Tusk dziś wykonuje polecenia Ursuli, a Giertych i Lis podważają wybory. Ale co jeśli gra na czas? Gdy Ursula upadnie, on może się od niej odciąć, zgonić winę na innych… i sam wskoczyć na jej fotel. Podwójna gra? Patrzmy uważnie. #SN #Tusk #UE #Wybory2025",0,0,0,0,28-06-25,2025-06-28,2025.0,6.0,28.0,0.0,"Tusk dziś wykonuje polecenia Ursuli, a Giertych i Lis podważają wybory. Ale co jeśli gra na czas? Gdy Ursula upadnie, on może się od niej odciąć, zgonić winę na innych… i sam wskoczyć na jej fotel. Podwójna gra? Patrzmy uważnie. SN Tusk UE Wybory2025","Tusk dziś wykonuje polecenia Ursuli, a Giertych i Lis podważają wybory. Ale co jeśli gra na czas? Gdy Ursula upadnie, on może się od niej odciąć, zgonić winę na innych… i sam wskoczyć na jej fotel. Podwójna gra? Patrzmy uważnie.",,#SN|#Tusk|#UE|#Wybory2025,,0,4,0,250,44,0.0,niski,11,0.3422340158871819
