id,username,text,likes,retweets,replies,total_interactions,post_date_iso,date,year,month,day,hour,text_clean,text_no_links,mentions,hashtags,urls,n_mentions,n_hashtags,n_urls,char_count,word_count,amplification_ratio,reach_tier,cluster,cluster_prob
81.0,anna_vxz,A wiesz że Nawrocki w I turze miał mniej bo głosowaliśmy np. na Mentzena?,0,0,0,0,09-06-25,2025-06-09,2025.0,6.0,9.0,0.0,A wiesz że Nawrocki w I turze miał mniej bo głosowaliśmy np. na Mentzena?,A wiesz że Nawrocki w I turze miał mniej bo głosowaliśmy np. na Mentzena?,,,,0,0,0,73,14,0.0,niski,14,0.9846619219848368
20.0,artur31200842,Nawrocki jest. Aczkolwiek jak by były powtórzone wybory to nie zdziwił bym się jak by wygrał Braun lub Mentzen..,0,0,0,0,09-06-25,2025-06-09,2025.0,6.0,9.0,0.0,Nawrocki jest. Aczkolwiek jak by były powtórzone wybory to nie zdziwił bym się jak by wygrał Braun lub Mentzen..,Nawrocki jest. Aczkolwiek jak by były powtórzone wybory to nie zdziwił bym się jak by wygrał Braun lub Mentzen..,,,,0,0,0,112,19,0.0,niski,14,1.0
9.0,bartoszszczepa,"Ciekawa by była 2 tura Zandberg Nawrocki. Wtedy wyborcy Mentzena podzielili by się na pół, a wśród wyborców Brauna byłaby mniejsza mobilizacja.",0,0,0,0,09-06-25,2025-06-09,2025.0,6.0,9.0,0.0,"Ciekawa by była 2 tura Zandberg Nawrocki. Wtedy wyborcy Mentzena podzielili by się na pół, a wśród wyborców Brauna byłaby mniejsza mobilizacja.","Ciekawa by była 2 tura Zandberg Nawrocki. Wtedy wyborcy Mentzena podzielili by się na pół, a wśród wyborców Brauna byłaby mniejsza mobilizacja.",,,,0,0,0,143,22,0.0,niski,14,1.0
23.0,ryszardw1957,Milerr to komuch i niech nikogo nie zmyli co on obecnie mówi . Przypomnijcie sobie jak głosował w PE . Przejdzie wam szybko . Brudziński nie podskakuj dobrze ci radzę . Podziękuj nam bo bez nas Nawrocki nie wygra . Macie 25% Konfa z Braunem będą rośli bo Polska upada ...,0,0,0,0,09-06-25,2025-06-09,2025.0,6.0,9.0,0.0,Milerr to komuch i niech nikogo nie zmyli co on obecnie mówi . Przypomnijcie sobie jak głosował w PE . Przejdzie wam szybko . Brudziński nie podskakuj dobrze ci radzę . Podziękuj nam bo bez nas Nawrocki nie wygra . Macie 25% Konfa z Braunem będą rośli bo Polska upada ...,Milerr to komuch i niech nikogo nie zmyli co on obecnie mówi . Przypomnijcie sobie jak głosował w PE . Przejdzie wam szybko . Brudziński nie podskakuj dobrze ci radzę . Podziękuj nam bo bez nas Nawrocki nie wygra . Macie 25% Konfa z Braunem będą rośli bo Polska upada ...,,,,0,0,0,271,51,0.0,niski,14,1.0
78.0,ahaahaokok,"Masz rację, druga tura bez Trzaskowskiego, bo prowadził nielegalną kampanię. Niech Nawrocki walczy z Mentzenem.",0,0,0,0,09-06-25,2025-06-09,2025.0,6.0,9.0,0.0,"Masz rację, druga tura bez Trzaskowskiego, bo prowadził nielegalną kampanię. Niech Nawrocki walczy z Mentzenem.","Masz rację, druga tura bez Trzaskowskiego, bo prowadził nielegalną kampanię. Niech Nawrocki walczy z Mentzenem.",,,,0,0,0,111,15,0.0,niski,14,1.0
10.0,anonimowy987,"Konfederacja rosnie kadrowo, to nie jest partia sezonowa. Co do Mentzena - sumujac wynim Brauna i Mentzena to ponad 20% bylo. Nawrocki w marcu nie byl jeszcze w betonie PiS rozpoznawalny, bo zbyt pokrecili poczatkowo jego kampanie.",0,0,0,0,10-06-25,2025-06-10,2025.0,6.0,10.0,0.0,"Konfederacja rosnie kadrowo, to nie jest partia sezonowa. Co do Mentzena - sumujac wynim Brauna i Mentzena to ponad 20% bylo. Nawrocki w marcu nie byl jeszcze w betonie PiS rozpoznawalny, bo zbyt pokrecili poczatkowo jego kampanie.","Konfederacja rosnie kadrowo, to nie jest partia sezonowa. Co do Mentzena - sumujac wynim Brauna i Mentzena to ponad 20% bylo. Nawrocki w marcu nie byl jeszcze w betonie PiS rozpoznawalny, bo zbyt pokrecili poczatkowo jego kampanie.",,,,0,0,0,231,37,0.0,niski,14,1.0
96.0,mrmadsmax,"Wymień kogoś z konfy kto może objąc tekę ministra spraw zagranicznych? Albo ministra pracy? ps. Nawrocki spadał poniżej Mentzena, a nie startował spod Mentzena. To były bajki.",0,0,0,0,10-06-25,2025-06-10,2025.0,6.0,10.0,0.0,"Wymień kogoś z konfy kto może objąc tekę ministra spraw zagranicznych? Albo ministra pracy? ps. Nawrocki spadał poniżej Mentzena, a nie startował spod Mentzena. To były bajki.","Wymień kogoś z konfy kto może objąc tekę ministra spraw zagranicznych? Albo ministra pracy? ps. Nawrocki spadał poniżej Mentzena, a nie startował spod Mentzena. To były bajki.",,,,0,0,0,175,27,0.0,niski,14,1.0
932.0,jakubmajmurek,"O roli jaką w kampanii odegrały męskie emocje, lęki i archetypy rozmawiam z psychoterapeutą i seksuologiem Andrzejem Gryżewskim oraz badaczem męskości Wojciechem Śmieją: AG: Nawrocki zaimponował wyborcom, bo w dużej mierze znormalizował męskie zachowania, które były społecznie piętnowane jako żenujące i przemocowe. Nawrocki wysyła swoim wyborcom komunikat: możecie być „męskimi mężczyznami”, ważna jest fizyczna krzepa, spędzanie czasu w męskim gronie. Mężczyźni, którzy ciągle słyszą, jak się mają zmieniać, uczyć wrażliwości, uczyć się rozmawiać z kobietami, łapią się na ten komunikat. W moim gabinecie tłumaczą to tym, że mają dość ciągle uciekającej im poprzeczki społecznych oczekiwań. WŚ: Nawrocki jest mniej więcej rówieśnikiem Silnego [z Wojny polsko-ruskiej Masłowskiej]. Tak jak on pochodzi z Gdańska i związany jest ze światem kibolskim. Nawrocki to Silny, który zamienił dres na garnitur, zrobił doktorat, został dyrektorem muzeum, a w końcu prezydentem-elektem. Gdyby to napisała Masłowska jako kontynuację, byłoby to nieźle przegiętą historią, a okazuje się naszą nieodległą przyszłością. Ten kibolski kontekst jest tu bardzo istotny. W Niesamowitej słowiańszczyźnie Maria Janion pisała o szczególnej roli, jaką w organizowaniu polskiej polityczności odgrywały homospołeczne grupy mężczyzn: filomaci, filareci, legioniści Piłsudskiego, leśni z AK i z AL. W ostatnich dekadach – i o tym też Janion pisała – tę rolę przejęły właśnie grupy kibicowskie. krytykapolityczna.pl/kraj/po…",0,0,0,0,10-06-25,2025-06-10,2025.0,6.0,10.0,0.0,"O roli jaką w kampanii odegrały męskie emocje, lęki i archetypy rozmawiam z psychoterapeutą i seksuologiem Andrzejem Gryżewskim oraz badaczem męskości Wojciechem Śmieją: AG: Nawrocki zaimponował wyborcom, bo w dużej mierze znormalizował męskie zachowania, które były społecznie piętnowane jako żenujące i przemocowe. Nawrocki wysyła swoim wyborcom komunikat: możecie być „męskimi mężczyznami”, ważna jest fizyczna krzepa, spędzanie czasu w męskim gronie. Mężczyźni, którzy ciągle słyszą, jak się mają zmieniać, uczyć wrażliwości, uczyć się rozmawiać z kobietami, łapią się na ten komunikat. W moim gabinecie tłumaczą to tym, że mają dość ciągle uciekającej im poprzeczki społecznych oczekiwań. WŚ: Nawrocki jest mniej więcej rówieśnikiem Silnego [z Wojny polsko-ruskiej Masłowskiej]. Tak jak on pochodzi z Gdańska i związany jest ze światem kibolskim. Nawrocki to Silny, który zamienił dres na garnitur, zrobił doktorat, został dyrektorem muzeum, a w końcu prezydentem-elektem. Gdyby to napisała Masłowska jako kontynuację, byłoby to nieźle przegiętą historią, a okazuje się naszą nieodległą przyszłością. Ten kibolski kontekst jest tu bardzo istotny. W Niesamowitej słowiańszczyźnie Maria Janion pisała o szczególnej roli, jaką w organizowaniu polskiej polityczności odgrywały homospołeczne grupy mężczyzn: filomaci, filareci, legioniści Piłsudskiego, leśni z AK i z AL. W ostatnich dekadach – i o tym też Janion pisała – tę rolę przejęły właśnie grupy kibicowskie.","O roli jaką w kampanii odegrały męskie emocje, lęki i archetypy rozmawiam z psychoterapeutą i seksuologiem Andrzejem Gryżewskim oraz badaczem męskości Wojciechem Śmieją: AG: Nawrocki zaimponował wyborcom, bo w dużej mierze znormalizował męskie zachowania, które były społecznie piętnowane jako żenujące i przemocowe. Nawrocki wysyła swoim wyborcom komunikat: możecie być „męskimi mężczyznami”, ważna jest fizyczna krzepa, spędzanie czasu w męskim gronie. Mężczyźni, którzy ciągle słyszą, jak się mają zmieniać, uczyć wrażliwości, uczyć się rozmawiać z kobietami, łapią się na ten komunikat. W moim gabinecie tłumaczą to tym, że mają dość ciągle uciekającej im poprzeczki społecznych oczekiwań. WŚ: Nawrocki jest mniej więcej rówieśnikiem Silnego [z Wojny polsko-ruskiej Masłowskiej]. Tak jak on pochodzi z Gdańska i związany jest ze światem kibolskim. Nawrocki to Silny, który zamienił dres na garnitur, zrobił doktorat, został dyrektorem muzeum, a w końcu prezydentem-elektem. Gdyby to napisała Masłowska jako kontynuację, byłoby to nieźle przegiętą historią, a okazuje się naszą nieodległą przyszłością. Ten kibolski kontekst jest tu bardzo istotny. W Niesamowitej słowiańszczyźnie Maria Janion pisała o szczególnej roli, jaką w organizowaniu polskiej polityczności odgrywały homospołeczne grupy mężczyzn: filomaci, filareci, legioniści Piłsudskiego, leśni z AK i z AL. W ostatnich dekadach – i o tym też Janion pisała – tę rolę przejęły właśnie grupy kibicowskie.",,,krytykapolityczna.pl/kraj/po…,0,0,1,1466,204,0.0,niski,14,1.0
132.0,nosoycarlosxdd,"Cuando Kaczynski sugirió que había que empezar a moverse para tumbar a Tus tras la victoria de Nawrocki, Mentzen no tardó ni una hora en responderle que debían sentarse a hablar en qué estrategia iban a tener que llevar a cabo",0,0,0,0,10-06-25,2025-06-10,2025.0,6.0,10.0,0.0,"Cuando Kaczynski sugirió que había que empezar a moverse para tumbar a Tus tras la victoria de Nawrocki, Mentzen no tardó ni una hora en responderle que debían sentarse a hablar en qué estrategia iban a tener que llevar a cabo","Cuando Kaczynski sugirió que había que empezar a moverse para tumbar a Tus tras la victoria de Nawrocki, Mentzen no tardó ni una hora en responderle que debían sentarse a hablar en qué estrategia iban a tener que llevar a cabo",,,,0,0,0,226,41,0.0,niski,14,1.0
22.0,wojtek1911k,"Zwał jak zwał, jak Nawrocki by powiedział że sprywatyzuje kopalnie to by na pewno wygrał wybory...😂. Tacy to konserwatyści o Zanbergowych poglądach kto da więcej.",0,0,0,0,24-06-25,2025-06-24,2025.0,6.0,24.0,0.0,"Zwał jak zwał, jak Nawrocki by powiedział że sprywatyzuje kopalnie to by na pewno wygrał wybory...😂. Tacy to konserwatyści o Zanbergowych poglądach kto da więcej.","Zwał jak zwał, jak Nawrocki by powiedział że sprywatyzuje kopalnie to by na pewno wygrał wybory...😂. Tacy to konserwatyści o Zanbergowych poglądach kto da więcej.",,,,0,0,0,162,25,0.0,niski,14,1.0
17.0,jc02899,Ilu konkretnie nie głosowało? Bo ja jestem wyborcą Mentzena i znam też kilku i głosowaliśmy na mniejsze zło czyli Nawrocki. Trzaskowski był beznadziejnym i niebezpiecznym kandydatem więc trzeba było zagłosować na Nawrockiego.,0,0,0,0,26-06-25,2025-06-26,2025.0,6.0,26.0,0.0,Ilu konkretnie nie głosowało? Bo ja jestem wyborcą Mentzena i znam też kilku i głosowaliśmy na mniejsze zło czyli Nawrocki. Trzaskowski był beznadziejnym i niebezpiecznym kandydatem więc trzeba było zagłosować na Nawrockiego.,Ilu konkretnie nie głosowało? Bo ja jestem wyborcą Mentzena i znam też kilku i głosowaliśmy na mniejsze zło czyli Nawrocki. Trzaskowski był beznadziejnym i niebezpiecznym kandydatem więc trzeba było zagłosować na Nawrockiego.,,,,0,0,0,225,32,0.0,niski,14,1.0
196.0,ozjasz2137,"Fakt że Nawrocki podpisał deklarację Toruńską mogło skłonić wielu wyborców Mentzena do zagłosowania na niego, szczególnie tych co nie chcieli iść na 2 turę.",0,0,0,0,27-06-25,2025-06-27,2025.0,6.0,27.0,0.0,"Fakt że Nawrocki podpisał deklarację Toruńską mogło skłonić wielu wyborców Mentzena do zagłosowania na niego, szczególnie tych co nie chcieli iść na 2 turę.","Fakt że Nawrocki podpisał deklarację Toruńską mogło skłonić wielu wyborców Mentzena do zagłosowania na niego, szczególnie tych co nie chcieli iść na 2 turę.",,,,0,0,0,156,24,0.0,niski,14,1.0
332.0,ozjasz2137,"Fakt że Nawrocki podpisał deklarację Toruńską mógł skłonić wielu wyborców Mentzena do zagłosowania, szczególnie tych co nie chcieli iść na 2 turę.",0,0,0,0,27-06-25,2025-06-27,2025.0,6.0,27.0,0.0,"Fakt że Nawrocki podpisał deklarację Toruńską mógł skłonić wielu wyborców Mentzena do zagłosowania, szczególnie tych co nie chcieli iść na 2 turę.","Fakt że Nawrocki podpisał deklarację Toruńską mógł skłonić wielu wyborców Mentzena do zagłosowania, szczególnie tych co nie chcieli iść na 2 turę.",,,,0,0,0,146,22,0.0,niski,14,1.0
235.0,marcin__w,"Obstawiam, że @PiotrWiel ma rację. Dzisiejszy wpis Tuska, to nie zapowiedź blokowania zaprzysiężenia K. Nawrockiego. To reakcja na ciekawą sekwencję spotkań: Mentzen - Nawrocki Mentzen - Kosiniak Kosiniak - Nawrocki. Podobno Mentzen z Kosiniakiem rozmawiali o możliwym wykolejeniu obecnego rządu. Stąd Tusk pisał ""nie dajcie się podzielić"". Incydent KOwy bardzo możliwy.",2,52,13,67,26-06-25,2025-06-26,2025.0,6.0,26.0,0.0,"Obstawiam, że ma rację. Dzisiejszy wpis Tuska, to nie zapowiedź blokowania zaprzysiężenia K. Nawrockiego. To reakcja na ciekawą sekwencję spotkań: Mentzen - Nawrocki Mentzen - Kosiniak Kosiniak - Nawrocki. Podobno Mentzen z Kosiniakiem rozmawiali o możliwym wykolejeniu obecnego rządu. Stąd Tusk pisał ""nie dajcie się podzielić"". Incydent KOwy bardzo możliwy.","Obstawiam, że ma rację. Dzisiejszy wpis Tuska, to nie zapowiedź blokowania zaprzysiężenia K. Nawrockiego. To reakcja na ciekawą sekwencję spotkań: Mentzen - Nawrocki Mentzen - Kosiniak Kosiniak - Nawrocki. Podobno Mentzen z Kosiniakiem rozmawiali o możliwym wykolejeniu obecnego rządu. Stąd Tusk pisał ""nie dajcie się podzielić"". Incydent KOwy bardzo możliwy.",@PiotrWiel,,,1,0,0,359,50,4.0,wysoki,14,1.0
476.0,babaisfloat,Przy jakiej frekwencji? Ponad połowa głosowała na Brauna bo Nawrocki im nie podszedł. Może warto najpierw się zastanowić/sprawdzić info w sondażowniach?,0,0,0,0,28-06-25,2025-06-28,2025.0,6.0,28.0,0.0,Przy jakiej frekwencji? Ponad połowa głosowała na Brauna bo Nawrocki im nie podszedł. Może warto najpierw się zastanowić/sprawdzić info w sondażowniach?,Przy jakiej frekwencji? Ponad połowa głosowała na Brauna bo Nawrocki im nie podszedł. Może warto najpierw się zastanowić/sprawdzić info w sondażowniach?,,,,0,0,0,152,21,0.0,niski,14,0.9735572868574728
12.0,roderyk11,"Bo w tych wyborach nie było istotne to czy Nawrocki jest obywatelski czy nie. Chodziło tylko o to, by powstrzymać Trzaskowskiego. Gdyby w II turze zamiast Nawrockiego był Mentzen, to zagłosowałbym na Mentzena. Ba, w II turze to nawet na Zandberga bym zagłosował, byle przeciw PO.",0,0,0,0,29-06-25,2025-06-29,2025.0,6.0,29.0,0.0,"Bo w tych wyborach nie było istotne to czy Nawrocki jest obywatelski czy nie. Chodziło tylko o to, by powstrzymać Trzaskowskiego. Gdyby w II turze zamiast Nawrockiego był Mentzen, to zagłosowałbym na Mentzena. Ba, w II turze to nawet na Zandberga bym zagłosował, byle przeciw PO.","Bo w tych wyborach nie było istotne to czy Nawrocki jest obywatelski czy nie. Chodziło tylko o to, by powstrzymać Trzaskowskiego. Gdyby w II turze zamiast Nawrockiego był Mentzen, to zagłosowałbym na Mentzena. Ba, w II turze to nawet na Zandberga bym zagłosował, byle przeciw PO.",,,,0,0,0,279,46,0.0,niski,14,1.0
273.0,lucy89359085,"Nawrocki wygrał dzięki wyborcom Mentzena i Brauna, ale do Kaczyńskiego to chyba nie dotarło .",0,0,0,0,02-07-25,2025-07-02,2025.0,7.0,2.0,0.0,"Nawrocki wygrał dzięki wyborcom Mentzena i Brauna, ale do Kaczyńskiego to chyba nie dotarło .","Nawrocki wygrał dzięki wyborcom Mentzena i Brauna, ale do Kaczyńskiego to chyba nie dotarło .",,,,0,0,0,93,15,0.0,niski,14,1.0
9.0,boymic535,"I po to były te ostatnie wybory, żeby Karol Nawrocki mógł ułaskawiać takie kreatury jak Grigorij Braun.",0,1,0,1,03-07-25,2025-07-03,2025.0,7.0,3.0,0.0,"I po to były te ostatnie wybory, żeby Karol Nawrocki mógł ułaskawiać takie kreatury jak Grigorij Braun.","I po to były te ostatnie wybory, żeby Karol Nawrocki mógł ułaskawiać takie kreatury jak Grigorij Braun.",,,,0,0,0,103,17,1.0,średni,14,0.9735572868574728
214.0,tuvauskas,Nie pytaj Nie pytaj jak Nawrocki wypowiadał się o rządach PiS u Mentzena,0,0,0,0,03-07-25,2025-07-03,2025.0,7.0,3.0,0.0,Nie pytaj Nie pytaj jak Nawrocki wypowiadał się o rządach PiS u Mentzena,Nie pytaj Nie pytaj jak Nawrocki wypowiadał się o rządach PiS u Mentzena,,,,0,0,0,72,13,0.0,niski,14,1.0
21.0,klimczewskipawe,"Bez głosów Brauna Nawrocki by nie został prezydentem. Wygrał jedynie 369 591 głosami. Braun ""przekazał"" 99% swego elektoratu Nawrockiemu czyi około 1,2 mln głosów. Mentzen przekazał blisko 400 000 głosów Trzaskowskiemu, takie to było piwo. pawelklimczewski.pl/2025/06/…",6,1,2,0,,,,,,,"Bez głosów Brauna Nawrocki by nie został prezydentem. Wygrał jedynie 369 591 głosami. Braun ""przekazał"" 99% swego elektoratu Nawrockiemu czyi około 1,2 mln głosów. Mentzen przekazał blisko 400 000 głosów Trzaskowskiemu, takie to było piwo.","Bez głosów Brauna Nawrocki by nie został prezydentem. Wygrał jedynie 369 591 głosami. Braun ""przekazał"" 99% swego elektoratu Nawrockiemu czyi około 1,2 mln głosów. Mentzen przekazał blisko 400 000 głosów Trzaskowskiemu, takie to było piwo.",,,pawelklimczewski.pl/2025/06/…,0,0,1,239,35,0.5,niski,14,1.0
4.0,dorotar966,Kaczyński powinien zaprosić Menzena do rozmowy a Menzen nie powinien odpowiadać wyzwiskami . Przypomnę że Menzen zrobił to samo przed druga turą wyborów z Nawrockim . Nawrocki odpowiedział dojrzałością mimo że to wyglądało na prowokacje i próbę ośmieszenia Nawrockiego,0,0,0,0,30-07-25,2025-07-30,2025.0,7.0,30.0,0.0,Kaczyński powinien zaprosić Menzena do rozmowy a Menzen nie powinien odpowiadać wyzwiskami . Przypomnę że Menzen zrobił to samo przed druga turą wyborów z Nawrockim . Nawrocki odpowiedział dojrzałością mimo że to wyglądało na prowokacje i próbę ośmieszenia Nawrockiego,Kaczyński powinien zaprosić Menzena do rozmowy a Menzen nie powinien odpowiadać wyzwiskami . Przypomnę że Menzen zrobił to samo przed druga turą wyborów z Nawrockim . Nawrocki odpowiedział dojrzałością mimo że to wyglądało na prowokacje i próbę ośmieszenia Nawrockiego,,,,0,0,0,268,39,0.0,niski,14,1.0
3.0,kacperwier19615,To dzięki Mentzenowi i jego wyborcom Nawrocki wygrał.,0,0,0,0,30-07-25,2025-07-30,2025.0,7.0,30.0,0.0,To dzięki Mentzenowi i jego wyborcom Nawrocki wygrał.,To dzięki Mentzenowi i jego wyborcom Nawrocki wygrał.,,,,0,0,0,53,8,0.0,niski,14,1.0
26.0,adam_abramczyk,"Ostatnie godziny pokazują, że Mentzen nie ma żadnej ochoty na koalicję z PiS po wyborach. Stąd ta nerwowość u Kaczyńskiego i jego wierchuszki. Tak jak wczoraj pisałem. Wszystko wskazuje na to, że #KO utrzyma się przy władzy, a Nawrocki dla PiS będzie obciążeniem, a nie wsparciem.",9,57,173,239,30-07-25,2025-07-30,2025.0,7.0,30.0,0.0,"Ostatnie godziny pokazują, że Mentzen nie ma żadnej ochoty na koalicję z PiS po wyborach. Stąd ta nerwowość u Kaczyńskiego i jego wierchuszki. Tak jak wczoraj pisałem. Wszystko wskazuje na to, że KO utrzyma się przy władzy, a Nawrocki dla PiS będzie obciążeniem, a nie wsparciem.","Ostatnie godziny pokazują, że Mentzen nie ma żadnej ochoty na koalicję z PiS po wyborach. Stąd ta nerwowość u Kaczyńskiego i jego wierchuszki. Tak jak wczoraj pisałem. Wszystko wskazuje na to, że utrzyma się przy władzy, a Nawrocki dla PiS będzie obciążeniem, a nie wsparciem.",,#KO,,0,1,0,279,46,0.33,wysoki,14,1.0
32.0,egonschel,"Hehe, Mecieniasie, Mentzen zrobil całe G w tej kwestii. Prezydent Nawrocki wykonał potrzebny gest. I tyle. A poparcie dla Konfiguracji Mantzena właśnie zaczyna topniec. I w tym zasługa raczej Mentzena niz Pana Kaczynskiego.",0,0,0,0,30-07-25,2025-07-30,2025.0,7.0,30.0,0.0,"Hehe, Mecieniasie, Mentzen zrobil całe G w tej kwestii. Prezydent Nawrocki wykonał potrzebny gest. I tyle. A poparcie dla Konfiguracji Mantzena właśnie zaczyna topniec. I w tym zasługa raczej Mentzena niz Pana Kaczynskiego.","Hehe, Mecieniasie, Mentzen zrobil całe G w tej kwestii. Prezydent Nawrocki wykonał potrzebny gest. I tyle. A poparcie dla Konfiguracji Mantzena właśnie zaczyna topniec. I w tym zasługa raczej Mentzena niz Pana Kaczynskiego.",,,,0,0,0,223,33,0.0,niski,14,1.0
220.0,pis_plis,"Gdyby PiS był pewien wygranej Nawrockiego nie zapraszalby Hołowni na kolacyjki,a Nawrocki nie odwiedzałby go jeszcze przed zaprzysiężeniem. Kaczyński potrzebował poparcia Mentzena w wyborach prezydenckich, a potem się na niego wypiął. Z Hołownią będzie to samo. Dla JK to pionki.",0,63,5,68,30-07-25,2025-07-30,2025.0,7.0,30.0,0.0,"Gdyby PiS był pewien wygranej Nawrockiego nie zapraszalby Hołowni na kolacyjki,a Nawrocki nie odwiedzałby go jeszcze przed zaprzysiężeniem. Kaczyński potrzebował poparcia Mentzena w wyborach prezydenckich, a potem się na niego wypiął. Z Hołownią będzie to samo. Dla JK to pionki.","Gdyby PiS był pewien wygranej Nawrockiego nie zapraszalby Hołowni na kolacyjki,a Nawrocki nie odwiedzałby go jeszcze przed zaprzysiężeniem. Kaczyński potrzebował poparcia Mentzena w wyborach prezydenckich, a potem się na niego wypiął. Z Hołownią będzie to samo. Dla JK to pionki.",,,,0,0,0,279,40,12.6,wysoki,14,1.0
387.0,janmolskiiii,"Stary, ale jednak PiS(Nawrocki) podpisał deklaracje Toruńska, która miała niektóre punkty tak bezsensowne, ze nawet Mentzen się śmiał z tego, że Nawrocki w całości podpisał ja. Ludzie z pisu? Nie powiedziałbym, tu mamy inna optykę i będziemy się różnic (przy całej mojej sympati) tu obie strony dowalają do pieca, czy sympatycy, czy liderzy, ale to jednak Mentzen zbyt grubo pojechał nazywając Kaczyńskiego gangsterem i sugerując, że śmierć Leppera to wina Kaczyńskiego. W tym wypadku, jedni i drudzy są tu winni. Mentzen i NN za histeryczna reakcje, bo zobaczyli hasło „mieszkanie prawem nie towarem” zrównując PiS z komunistami i socjalizmem (a jak wiemy z opisu tak nie było) i że PiS już chce ich dociskać. A z drugiej mamy strony PiS Który przeliczył się i odpalił niepotrzebnie wiedząc jak konfa będzie reagowała. Bo to kompletnie 2 lata przed wyborami nie ma sensu. Tym bardziej z takimi hasłami. Strasznie głupi pomysł. A jednak powinniśmy być zjednoczeni i razem działać, bo to nie PiS konf czy KPP jest tu wrogiem, ale Tusk. I tyle. Eh oby się niektórzy ogarnęli no.",0,0,0,0,30-07-25,2025-07-30,2025.0,7.0,30.0,0.0,"Stary, ale jednak PiS(Nawrocki) podpisał deklaracje Toruńska, która miała niektóre punkty tak bezsensowne, ze nawet Mentzen się śmiał z tego, że Nawrocki w całości podpisał ja. Ludzie z pisu? Nie powiedziałbym, tu mamy inna optykę i będziemy się różnic (przy całej mojej sympati) tu obie strony dowalają do pieca, czy sympatycy, czy liderzy, ale to jednak Mentzen zbyt grubo pojechał nazywając Kaczyńskiego gangsterem i sugerując, że śmierć Leppera to wina Kaczyńskiego. W tym wypadku, jedni i drudzy są tu winni. Mentzen i NN za histeryczna reakcje, bo zobaczyli hasło „mieszkanie prawem nie towarem” zrównując PiS z komunistami i socjalizmem (a jak wiemy z opisu tak nie było) i że PiS już chce ich dociskać. A z drugiej mamy strony PiS Który przeliczył się i odpalił niepotrzebnie wiedząc jak konfa będzie reagowała. Bo to kompletnie 2 lata przed wyborami nie ma sensu. Tym bardziej z takimi hasłami. Strasznie głupi pomysł. A jednak powinniśmy być zjednoczeni i razem działać, bo to nie PiS konf czy KPP jest tu wrogiem, ale Tusk. I tyle. Eh oby się niektórzy ogarnęli no.","Stary, ale jednak PiS(Nawrocki) podpisał deklaracje Toruńska, która miała niektóre punkty tak bezsensowne, ze nawet Mentzen się śmiał z tego, że Nawrocki w całości podpisał ja. Ludzie z pisu? Nie powiedziałbym, tu mamy inna optykę i będziemy się różnic (przy całej mojej sympati) tu obie strony dowalają do pieca, czy sympatycy, czy liderzy, ale to jednak Mentzen zbyt grubo pojechał nazywając Kaczyńskiego gangsterem i sugerując, że śmierć Leppera to wina Kaczyńskiego. W tym wypadku, jedni i drudzy są tu winni. Mentzen i NN za histeryczna reakcje, bo zobaczyli hasło „mieszkanie prawem nie towarem” zrównując PiS z komunistami i socjalizmem (a jak wiemy z opisu tak nie było) i że PiS już chce ich dociskać. A z drugiej mamy strony PiS Który przeliczył się i odpalił niepotrzebnie wiedząc jak konfa będzie reagowała. Bo to kompletnie 2 lata przed wyborami nie ma sensu. Tym bardziej z takimi hasłami. Strasznie głupi pomysł. A jednak powinniśmy być zjednoczeni i razem działać, bo to nie PiS konf czy KPP jest tu wrogiem, ale Tusk. I tyle. Eh oby się niektórzy ogarnęli no.",,,,0,0,0,1076,177,0.0,niski,14,1.0
798.0,pawel11p,"Nawrocki podpisał tą deklarację żeby wygrać wybory a Gdyby Mentzen tą deklarację Kaczyńskiego podpisał, to wybory by przegrał i to z kretesem.",0,0,0,0,31-07-25,2025-07-31,2025.0,7.0,31.0,0.0,"Nawrocki podpisał tą deklarację żeby wygrać wybory a Gdyby Mentzen tą deklarację Kaczyńskiego podpisał, to wybory by przegrał i to z kretesem.","Nawrocki podpisał tą deklarację żeby wygrać wybory a Gdyby Mentzen tą deklarację Kaczyńskiego podpisał, to wybory by przegrał i to z kretesem.",,,,0,0,0,142,22,0.0,niski,14,1.0
