id,username,text,likes,retweets,replies,total_interactions,post_date_iso,date,year,month,day,hour,text_clean,text_no_links,mentions,hashtags,urls,n_mentions,n_hashtags,n_urls,char_count,word_count,amplification_ratio,reach_tier,cluster,cluster_prob
9.0,wis1ek,"ciekawe jakie będzie zimowe okienko, po którym będą wybory, czy przypadkiem się nie odpalą zimą.",0,0,0,0,01-09-25,2025-09-01,2025.0,9.0,1.0,0.0,"ciekawe jakie będzie zimowe okienko, po którym będą wybory, czy przypadkiem się nie odpalą zimą.","ciekawe jakie będzie zimowe okienko, po którym będą wybory, czy przypadkiem się nie odpalą zimą.",,,,0,0,0,96,15,0.0,niski,52,1.0
7.0,carlitokielce,Wybory w Stanach będą szybciej niż myślicie.,0,0,0,0,02-09-25,2025-09-02,2025.0,9.0,2.0,0.0,Wybory w Stanach będą szybciej niż myślicie.,Wybory w Stanach będą szybciej niż myślicie.,,,,0,0,0,44,7,0.0,niski,52,1.0
21.0,kowalska300,Bye szybciej i przeprowadzić przedterminowe wybory.,0,0,0,0,05-09-25,2025-09-05,2025.0,9.0,5.0,0.0,Bye szybciej i przeprowadzić przedterminowe wybory.,Bye szybciej i przeprowadzić przedterminowe wybory.,,,,0,0,0,51,6,0.0,niski,52,1.0
8.0,bogdan_rzonca,O tym były te wybory i o Tym będą następne. O Polsce❗️,13,315,78,406,06-09-25,2025-09-06,2025.0,9.0,6.0,0.0,O tym były te wybory i o Tym będą następne. O Polsce❗️,O tym były te wybory i o Tym będą następne. O Polsce❗️,,,,0,0,0,54,12,4.04,wysoki,52,1.0
121.0,pppiekarz,"Dymisje waszego rządu. Da się? Do końca roku? Przedwczesne wybory na nowy rok. Jedziecie, dacie radę :)",0,0,0,0,08-09-25,2025-09-08,2025.0,9.0,8.0,0.0,"Dymisje waszego rządu. Da się? Do końca roku? Przedwczesne wybory na nowy rok. Jedziecie, dacie radę :)","Dymisje waszego rządu. Da się? Do końca roku? Przedwczesne wybory na nowy rok. Jedziecie, dacie radę :)",,,,0,0,0,103,17,0.0,niski,52,0.944728784336942
102.0,1972tomek,"Naprawdę myślicie, że będą przyspieszone wybory? Nie będzie, bo KO dopiero zaczyna pompować szmalec.",0,9,2,11,08-09-25,2025-09-08,2025.0,9.0,8.0,0.0,"Naprawdę myślicie, że będą przyspieszone wybory? Nie będzie, bo KO dopiero zaczyna pompować szmalec.","Naprawdę myślicie, że będą przyspieszone wybory? Nie będzie, bo KO dopiero zaczyna pompować szmalec.",,,,0,0,0,100,14,4.5,wysoki,52,1.0
16.0,doko1124,"Obserwuje ich, bo kolejne wybory byli najbliżej finalnego wyniku",0,0,1,1,11-09-25,2025-09-11,2025.0,9.0,11.0,0.0,"Obserwuje ich, bo kolejne wybory byli najbliżej finalnego wyniku","Obserwuje ich, bo kolejne wybory byli najbliżej finalnego wyniku",,,,0,0,0,64,9,0.0,średni,52,1.0
11.0,_corylus_,"Spokojnie, jeszcze góra pół roku i koncert przedwyborczych obietnic zacznie się od nowa. Jak co wybory.",0,0,0,0,15-09-25,2025-09-15,2025.0,9.0,15.0,0.0,"Spokojnie, jeszcze góra pół roku i koncert przedwyborczych obietnic zacznie się od nowa. Jak co wybory.","Spokojnie, jeszcze góra pół roku i koncert przedwyborczych obietnic zacznie się od nowa. Jak co wybory.",,,,0,0,0,103,16,0.0,niski,52,1.0
3.0,gorniak_czeslaw,Kiedy wybory do Dumy? Startujesz?,0,0,0,0,17-09-25,2025-09-17,2025.0,9.0,17.0,0.0,Kiedy wybory do Dumy? Startujesz?,Kiedy wybory do Dumy? Startujesz?,,,,0,0,0,33,5,0.0,niski,52,1.0
24.0,marcin_szczech,"Nie ma żadnego nagłego skoku, konfa od powstania, a nawet jeszcze trochę wcześniej za samego Korwina, co wybory ma coraz wyższe poparcie. To systematyczny wzrost trwający ponad dekadę",0,0,0,0,20-09-25,2025-09-20,2025.0,9.0,20.0,0.0,"Nie ma żadnego nagłego skoku, konfa od powstania, a nawet jeszcze trochę wcześniej za samego Korwina, co wybory ma coraz wyższe poparcie. To systematyczny wzrost trwający ponad dekadę","Nie ma żadnego nagłego skoku, konfa od powstania, a nawet jeszcze trochę wcześniej za samego Korwina, co wybory ma coraz wyższe poparcie. To systematyczny wzrost trwający ponad dekadę",,,,0,0,0,183,28,0.0,niski,52,1.0
8.0,domenyforsale,"Gotowy na polityczne starcie 2026? Domena wybory-2026.pl to Twój bilet do wyborczej gry! Idealna dla kampanii, analiz politycznych, czy newsów z frontu wyborczego. Wartość rośnie wraz z każdą debatą i sondażowym zwrotem akcji. wybory-2026.pl",0,0,0,0,20-09-25,2025-09-20,2025.0,9.0,20.0,0.0,"Gotowy na polityczne starcie 2026? Domena wybory- to Twój bilet do wyborczej gry! Idealna dla kampanii, analiz politycznych, czy newsów z frontu wyborczego. Wartość rośnie wraz z każdą debatą i sondażowym zwrotem akcji. wybory-","Gotowy na polityczne starcie 2026? Domena wybory- to Twój bilet do wyborczej gry! Idealna dla kampanii, analiz politycznych, czy newsów z frontu wyborczego. Wartość rośnie wraz z każdą debatą i sondażowym zwrotem akcji. wybory-",,,2026.pl|2026.pl,0,0,2,227,34,0.0,niski,52,0.9903599320272348
187.0,helenskima42603,"Umiejętne rozegranie tej sprawy może spowodować, że przyspieszone wybory mogą się odbyć jeszcze w tym roku, potencjał tego wałka jest naprawdę imponujący.",0,0,0,0,20-09-25,2025-09-20,2025.0,9.0,20.0,0.0,"Umiejętne rozegranie tej sprawy może spowodować, że przyspieszone wybory mogą się odbyć jeszcze w tym roku, potencjał tego wałka jest naprawdę imponujący.","Umiejętne rozegranie tej sprawy może spowodować, że przyspieszone wybory mogą się odbyć jeszcze w tym roku, potencjał tego wałka jest naprawdę imponujący.",,,,0,0,0,154,22,0.0,niski,52,1.0
1.0,ptrace64,"Już nie długo wybory, już niedługo...",0,0,0,0,21-09-25,2025-09-21,2025.0,9.0,21.0,0.0,"Już nie długo wybory, już niedługo...","Już nie długo wybory, już niedługo...",,,,0,0,0,37,6,0.0,niski,52,0.9638566708217344
9.0,monte_klara,Powołać swoich żeby ukręcili kolejne wybory.,0,1,2,3,22-09-25,2025-09-22,2025.0,9.0,22.0,0.0,Powołać swoich żeby ukręcili kolejne wybory.,Powołać swoich żeby ukręcili kolejne wybory.,,,,0,0,0,44,6,0.5,średni,52,0.940361026397672
18.0,marekoksza,Podobno są jeszcze miejsca w kolejce w Jagodnie na następne wybory,0,0,0,0,23-09-25,2025-09-23,2025.0,9.0,23.0,0.0,Podobno są jeszcze miejsca w kolejce w Jagodnie na następne wybory,Podobno są jeszcze miejsca w kolejce w Jagodnie na następne wybory,,,,0,0,0,66,11,0.0,niski,52,0.9385524283662408
11.0,totalnyamator,Krzysiu ...jak tam wybory ?,0,0,0,0,25-09-25,2025-09-25,2025.0,9.0,25.0,0.0,Krzysiu ...jak tam wybory ?,Krzysiu ...jak tam wybory ?,,,,0,0,0,27,5,0.0,niski,52,0.9791914348669796
34.0,janusz_j_k,Toniemy natychmiastowe wybory i rząd @MorawieckiM,0,0,0,0,25-09-25,2025-09-25,2025.0,9.0,25.0,0.0,Toniemy natychmiastowe wybory i rząd,Toniemy natychmiastowe wybory i rząd,@MorawieckiM,,,1,0,0,36,5,0.0,niski,52,1.0
8.0,marzecmbn,"Czyżby przedterminowe wybory na horyzoncie, że rusza kolejna pula obietnic?",0,0,0,0,26-09-25,2025-09-26,2025.0,9.0,26.0,0.0,"Czyżby przedterminowe wybory na horyzoncie, że rusza kolejna pula obietnic?","Czyżby przedterminowe wybory na horyzoncie, że rusza kolejna pula obietnic?",,,,0,0,0,75,10,0.0,niski,52,1.0
32.0,lukaspawlowski,"W czerwcu pisaliśmy, że wcześniejsze wybory są na stole i że zacznie się od rządu mniejszościowego. Chyba ten proces powoli rusza 😉",2,16,11,29,27-09-25,2025-09-27,2025.0,9.0,27.0,0.0,"W czerwcu pisaliśmy, że wcześniejsze wybory są na stole i że zacznie się od rządu mniejszościowego. Chyba ten proces powoli rusza 😉","W czerwcu pisaliśmy, że wcześniejsze wybory są na stole i że zacznie się od rządu mniejszościowego. Chyba ten proces powoli rusza 😉",,,,0,0,0,131,22,1.45,wysoki,52,1.0
21.0,farmerkapl,Wybory się zbliżają czy jak?,0,2,0,2,27-09-25,2025-09-27,2025.0,9.0,27.0,0.0,Wybory się zbliżają czy jak?,Wybory się zbliżają czy jak?,,,,0,0,0,28,5,2.0,średni,52,1.0
14.0,micha_ruszczyk,"Wybory na wiosnę są możliwe Według @ARozenek Koalicja 15 Października stoi w miejscu, a rozliczenia i kolejne obietnice budzą śmiech i frustrację wśród wyborców. Jak Państwo sądzą, czy koalicja dotrwa do końca kadencji? piped.video/cvnj3GK9IH0?si=olEQ…",0,0,0,0,01-10-25,2025-10-01,2025.0,10.0,1.0,0.0,"Wybory na wiosnę są możliwe Według Koalicja 15 Października stoi w miejscu, a rozliczenia i kolejne obietnice budzą śmiech i frustrację wśród wyborców. Jak Państwo sądzą, czy koalicja dotrwa do końca kadencji? piped.video/cvnj3GK9IH0?si=olEQ…","Wybory na wiosnę są możliwe Według Koalicja 15 Października stoi w miejscu, a rozliczenia i kolejne obietnice budzą śmiech i frustrację wśród wyborców. Jak Państwo sądzą, czy koalicja dotrwa do końca kadencji? piped.video/cvnj3GK9IH0?si=olEQ…",@ARozenek,,,1,0,0,242,33,0.0,niski,52,1.0
22.0,rpasnicki,"Jak będą wybory, to się zobaczy, jaka jest oferta.",0,0,0,0,03-10-25,2025-10-03,2025.0,10.0,3.0,0.0,"Jak będą wybory, to się zobaczy, jaka jest oferta.","Jak będą wybory, to się zobaczy, jaka jest oferta.",,,,0,0,0,50,9,0.0,niski,52,1.0
21.0,jacek53532928,I co wtedy ? Wybory ?,0,0,0,0,07-10-25,2025-10-07,2025.0,10.0,7.0,0.0,I co wtedy ? Wybory ?,I co wtedy ? Wybory ?,,,,0,0,0,21,6,0.0,niski,52,1.0
388.0,bartoszbrzozow9,"Dobrze, że idą nowy wybory i to w czasie ten chory problem będzie wdrażany.",0,0,0,0,14-10-25,2025-10-14,2025.0,10.0,14.0,0.0,"Dobrze, że idą nowy wybory i to w czasie ten chory problem będzie wdrażany.","Dobrze, że idą nowy wybory i to w czasie ten chory problem będzie wdrażany.",,,,0,0,0,75,14,0.0,niski,52,1.0
19.0,halko30384836,Możemy już te wybory zrobić dziś? Mam dość tej zjebanej koalicji,0,0,0,0,15-10-25,2025-10-15,2025.0,10.0,15.0,0.0,Możemy już te wybory zrobić dziś? Mam dość tej zjebanej koalicji,Możemy już te wybory zrobić dziś? Mam dość tej zjebanej koalicji,,,,0,0,0,64,11,0.0,niski,52,1.0
1.0,bartekbeetle,"Upewnijmy sie, ze nie zbliżają się jakieś wybory…",0,0,0,0,17-10-25,2025-10-17,2025.0,10.0,17.0,0.0,"Upewnijmy sie, ze nie zbliżają się jakieś wybory…","Upewnijmy sie, ze nie zbliżają się jakieś wybory…",,,,0,0,0,49,8,0.0,niski,52,1.0
15.0,tenpolityk,Czy @PolaMatysiak przejdzie do @pisorgpl ? #wybory #sonda,0,1,0,1,17-10-25,2025-10-17,2025.0,10.0,17.0,0.0,Czy przejdzie do ? wybory sonda,Czy przejdzie do ?,@PolaMatysiak|@pisorgpl,#wybory|#sonda,,2,2,0,31,6,1.0,średni,52,1.0
14.0,wtrandlane,On teraz tam polazł? Chyba rzeczywiście czekają nas przedterminowe wybory skoro największy nierób (na równie z sojowym golemem z razem) w RP zaczyna latać po mendiach.,0,1,0,1,16-10-25,2025-10-16,2025.0,10.0,16.0,0.0,On teraz tam polazł? Chyba rzeczywiście czekają nas przedterminowe wybory skoro największy nierób (na równie z sojowym golemem z razem) w RP zaczyna latać po mendiach.,On teraz tam polazł? Chyba rzeczywiście czekają nas przedterminowe wybory skoro największy nierób (na równie z sojowym golemem z razem) w RP zaczyna latać po mendiach.,,,,0,0,0,167,26,1.0,średni,52,1.0
20.0,niedziela_pl,"Miało być nowe święto. Półtora roku temu „Rzeczpospolita” informowała o planach uhonorowania specjalnego dnia, upamiętniającego wybory z 15 października. niedziela.pl/artykul/117523/…",0,1,0,1,17-10-25,2025-10-17,2025.0,10.0,17.0,0.0,"Miało być nowe święto. Półtora roku temu „Rzeczpospolita” informowała o planach uhonorowania specjalnego dnia, upamiętniającego wybory z 15 października.","Miało być nowe święto. Półtora roku temu „Rzeczpospolita” informowała o planach uhonorowania specjalnego dnia, upamiętniającego wybory z 15 października.",,,niedziela.pl/artykul/117523/…,0,0,1,153,19,1.0,średni,52,1.0
23.0,mrnixuspl,przeszłe wybory bardzo dobrze prognozują przyszłe wybory,0,0,0,0,18-10-25,2025-10-18,2025.0,10.0,18.0,0.0,przeszłe wybory bardzo dobrze prognozują przyszłe wybory,przeszłe wybory bardzo dobrze prognozują przyszłe wybory,,,,0,0,0,56,7,0.0,niski,52,1.0
22.0,randreoid,To może przyśpieszone wybory i sprawdźmy to?,0,0,0,0,18-10-25,2025-10-18,2025.0,10.0,18.0,0.0,To może przyśpieszone wybory i sprawdźmy to?,To może przyśpieszone wybory i sprawdźmy to?,,,,0,0,0,44,7,0.0,niski,52,1.0
235.0,anna1590963,Wybory jeszcze się nie odbyły.,0,0,1,1,19-10-25,2025-10-19,2025.0,10.0,19.0,0.0,Wybory jeszcze się nie odbyły.,Wybory jeszcze się nie odbyły.,,,,0,0,0,30,5,0.0,średni,52,1.0
29.0,sawomir42894455,Przyjdą wybory i tak zagłosują na oszusta.,0,0,0,0,19-10-25,2025-10-19,2025.0,10.0,19.0,0.0,Przyjdą wybory i tak zagłosują na oszusta.,Przyjdą wybory i tak zagłosują na oszusta.,,,,0,0,0,42,7,0.0,niski,52,0.9426082857304556
1.0,grotgrotu,Zgodnie z sondażami ~70% wyborców nie chce waszych rządów. Kiedy planujecie przyspieszone wybory?,0,0,0,0,20-10-25,2025-10-20,2025.0,10.0,20.0,0.0,Zgodnie z sondażami ~70% wyborców nie chce waszych rządów. Kiedy planujecie przyspieszone wybory?,Zgodnie z sondażami ~70% wyborców nie chce waszych rządów. Kiedy planujecie przyspieszone wybory?,,,,0,0,0,97,13,0.0,niski,52,1.0
23.0,jarekdiabel,A co to juz wybory się zbliżają 🤔,0,0,0,0,20-10-25,2025-10-20,2025.0,10.0,20.0,0.0,A co to juz wybory się zbliżają 🤔,A co to juz wybory się zbliżają 🤔,,,,0,0,0,33,8,0.0,niski,52,1.0
164.0,duk_jacek,"Sondaże nie, ale wybory spędzą z pewnością...",0,1,0,1,21-10-25,2025-10-21,2025.0,10.0,21.0,0.0,"Sondaże nie, ale wybory spędzą z pewnością...","Sondaże nie, ale wybory spędzą z pewnością...",,,,0,0,0,45,7,1.0,średni,52,1.0
16.0,stanczykmaciej,O tym będą te wybory!,45,245,43,333,13-04-23,2023-04-13,2023.0,4.0,13.0,0.0,O tym będą te wybory!,O tym będą te wybory!,,,,0,0,0,21,5,5.7,wysoki,52,0.963835206104354
3.0,mariazawadzka5,"❗❗Kogo interesują wybory kopertowe sprzed pięciu lat. A może kogoś interesuje zeszłoroczny śnieg, nie? To może śnieg sprzed 5 lat?❗❗",0,0,0,0,22-10-25,2025-10-22,2025.0,10.0,22.0,0.0,"❗❗Kogo interesują wybory kopertowe sprzed pięciu lat. A może kogoś interesuje zeszłoroczny śnieg, nie? To może śnieg sprzed 5 lat?❗❗","❗❗Kogo interesują wybory kopertowe sprzed pięciu lat. A może kogoś interesuje zeszłoroczny śnieg, nie? To może śnieg sprzed 5 lat?❗❗",,,,0,0,0,132,20,0.0,niski,52,1.0
14.0,kafurixnew,Widzę nowy spin Nowogrodzkiej pod wybory ...,0,0,0,0,22-10-25,2025-10-22,2025.0,10.0,22.0,0.0,Widzę nowy spin Nowogrodzkiej pod wybory ...,Widzę nowy spin Nowogrodzkiej pod wybory ...,,,,0,0,0,44,7,0.0,niski,52,1.0
106.0,naszeblogipl,"Szykują się zmiany w polityce! Czy możliwe są przyspieszone wybory? W najnowszym artykule analizujemy sytuację, rosnące prawdopodobieństwo nowego rządu i wiele więcej. Zajrzyj na nasz blog, aby dowiedzieć się więcej! ift.tt/1TMcK8O",0,0,0,0,22-10-25,2025-10-22,2025.0,10.0,22.0,0.0,"Szykują się zmiany w polityce! Czy możliwe są przyspieszone wybory? W najnowszym artykule analizujemy sytuację, rosnące prawdopodobieństwo nowego rządu i wiele więcej. Zajrzyj na nasz blog, aby dowiedzieć się więcej! ift.tt/1TMcK8O","Szykują się zmiany w polityce! Czy możliwe są przyspieszone wybory? W najnowszym artykule analizujemy sytuację, rosnące prawdopodobieństwo nowego rządu i wiele więcej. Zajrzyj na nasz blog, aby dowiedzieć się więcej! ift.tt/1TMcK8O",,,,0,0,0,231,31,0.0,niski,52,1.0
19.0,wojciechurban11,"Może by się opłacało zrobić teraz przyspieszone wybory, skoro poparcie rośnie ?",0,0,0,0,23-10-25,2025-10-23,2025.0,10.0,23.0,0.0,"Może by się opłacało zrobić teraz przyspieszone wybory, skoro poparcie rośnie ?","Może by się opłacało zrobić teraz przyspieszone wybory, skoro poparcie rośnie ?",,,,0,0,0,79,12,0.0,niski,52,1.0
18.0,mazovian_333,to będą najdziwniejsze wybory do tej pory,0,0,0,0,23-10-25,2025-10-23,2025.0,10.0,23.0,0.0,to będą najdziwniejsze wybory do tej pory,to będą najdziwniejsze wybory do tej pory,,,,0,0,0,41,7,0.0,niski,52,1.0
27.0,pawe45576721,"Ważne, że po wyborach. Następne wybory za kolejne 4 lata. Nie będzie to już temat kampanii.",0,0,0,0,24-10-25,2025-10-24,2025.0,10.0,24.0,0.0,"Ważne, że po wyborach. Następne wybory za kolejne 4 lata. Nie będzie to już temat kampanii.","Ważne, że po wyborach. Następne wybory za kolejne 4 lata. Nie będzie to już temat kampanii.",,,,0,0,0,91,16,0.0,niski,52,1.0
18.0,maciejnaskret,No to sprawdźmy ten ostatni sondaż. Czy powinny odbyć się przedterminowe wybory?,0,2,0,2,24-10-25,2025-10-24,2025.0,10.0,24.0,0.0,No to sprawdźmy ten ostatni sondaż. Czy powinny odbyć się przedterminowe wybory?,No to sprawdźmy ten ostatni sondaż. Czy powinny odbyć się przedterminowe wybory?,,,,0,0,0,80,12,2.0,średni,52,1.0
27.0,bratwodza,O tym będą te wybory ...,45,535,35,615,29-05-25,2025-05-29,2025.0,5.0,29.0,0.0,O tym będą te wybory ...,O tym będą te wybory ...,,,,0,0,0,24,6,15.29,wysoki,52,1.0
23.0,ekspertjanusz,Wybory są co 4 lata. Zatem co wybory to głosują kolejne cztery nowe roczniki frajerów🤡,0,0,0,0,24-10-25,2025-10-24,2025.0,10.0,24.0,0.0,Wybory są co 4 lata. Zatem co wybory to głosują kolejne cztery nowe roczniki frajerów🤡,Wybory są co 4 lata. Zatem co wybory to głosują kolejne cztery nowe roczniki frajerów🤡,,,,0,0,0,86,15,0.0,niski,52,0.9621106351829304
