id,username,text,likes,retweets,replies,total_interactions,post_date_iso,date,year,month,day,hour,text_clean,text_no_links,mentions,hashtags,urls,n_mentions,n_hashtags,n_urls,char_count,word_count,amplification_ratio,reach_tier,cluster,cluster_prob
679.0,kirimasu_mma,Jak tam byku? Wypłakałeś się już po przegranej? Co nas nie zabije to nas wzmocni. Spotkamy się za 5lat - wtedy w drugiej turze będziesz miał łatwe zwycięstwo. #BraunVSTrzask,0,0,0,0,"Jun 4, 2025 · 2:03 PM UTC",,,,,,Jak tam byku? Wypłakałeś się już po przegranej? Co nas nie zabije to nas wzmocni. Spotkamy się za 5lat - wtedy w drugiej turze będziesz miał łatwe zwycięstwo. BraunVSTrzask,Jak tam byku? Wypłakałeś się już po przegranej? Co nas nie zabije to nas wzmocni. Spotkamy się za 5lat - wtedy w drugiej turze będziesz miał łatwe zwycięstwo.,,#BraunVSTrzask,,0,1,0,172,29,0.0,niski,41,0.6152978354694804
872.0,rudawrona2024,"Zastanawiający jest fakt, że wy w nic nie wierzycie. To się nazywa paranoja, zalecałbym pójść do psychiatry i to zbadać. Dziwne, że wierzycie w kłamstwa takich osobistości jak Matecki i Mejza, a nie wierzycie innym osobą - bez wyroków. To się leczy. Piszę serio.",0,0,0,0,"Jun 4, 2025 · 2:04 PM UTC",,,,,,"Zastanawiający jest fakt, że wy w nic nie wierzycie. To się nazywa paranoja, zalecałbym pójść do psychiatry i to zbadać. Dziwne, że wierzycie w kłamstwa takich osobistości jak Matecki i Mejza, a nie wierzycie innym osobą - bez wyroków. To się leczy. Piszę serio.","Zastanawiający jest fakt, że wy w nic nie wierzycie. To się nazywa paranoja, zalecałbym pójść do psychiatry i to zbadać. Dziwne, że wierzycie w kłamstwa takich osobistości jak Matecki i Mejza, a nie wierzycie innym osobą - bez wyroków. To się leczy. Piszę serio.",,,,0,0,0,262,44,0.0,niski,41,0.739046901813852
873.0,janniezbdn88726,No i ten burdel od półtora roku.I wiemy doskonale kto nim rządzi..,0,0,0,0,"Jun 4, 2025 · 2:04 PM UTC",,,,,,No i ten burdel od półtora roku.I wiemy doskonale kto nim rządzi..,No i ten burdel od półtora roku.I wiemy doskonale kto nim rządzi..,,,,0,0,0,66,12,0.0,niski,41,0.5230397667373022
905.0,2t2room2,"pies z kulawą nogą potrafi otworzyć plac. Masz rodzinę w Rybniku, to po rybnicku : ""Chyć sie roboty i nie ciulej, lebrze zrowerzony ! """,0,0,0,0,"Jun 4, 2025 · 2:05 PM UTC",,,,,,"pies z kulawą nogą potrafi otworzyć plac. Masz rodzinę w Rybniku, to po rybnicku : ""Chyć sie roboty i nie ciulej, lebrze zrowerzony ! ""","pies z kulawą nogą potrafi otworzyć plac. Masz rodzinę w Rybniku, to po rybnicku : ""Chyć sie roboty i nie ciulej, lebrze zrowerzony ! """,,,,0,0,0,135,25,0.0,niski,41,0.6739226866451464
986.0,biaymi1034441,Trzeba dać im mówić i działać. Samozaoranie gwarantowane.,0,0,0,0,"Jun 4, 2025 · 2:05 PM UTC",,,,,,Trzeba dać im mówić i działać. Samozaoranie gwarantowane.,Trzeba dać im mówić i działać. Samozaoranie gwarantowane.,,,,0,0,0,57,8,0.0,niski,41,0.6759434107566792
1.0,ulapanka,"@trzaskowski_ jestem z Panem jak ponad 10 milionów Polek i Polaków. Proszę nie dać sobie wmówić słów niektórych złośliwych, gadających głów.",0,3,3,6,"Jun 4, 2025 · 12:19 PM UTC",,,,,,"jestem z Panem jak ponad 10 milionów Polek i Polaków. Proszę nie dać sobie wmówić słów niektórych złośliwych, gadających głów.","jestem z Panem jak ponad 10 milionów Polek i Polaków. Proszę nie dać sobie wmówić słów niektórych złośliwych, gadających głów.",@trzaskowski_,,,1,0,0,126,20,1.0,wysoki,41,0.575879441417779
11.0,filiksmagdalena,Nawrocki Wam wszystko teraz ochroni.,0,6,20,26,"Jun 4, 2025 · 4:34 AM UTC",,,,,,Nawrocki Wam wszystko teraz ochroni.,Nawrocki Wam wszystko teraz ochroni.,,,,0,0,0,36,5,0.3,wysoki,41,0.8806393909754605
26.0,bamberrek,My nie zasługujemy na dobre rzeczy :),0,0,0,0,"Jun 4, 2025 · 2:59 PM UTC",,,,,,My nie zasługujemy na dobre rzeczy :),My nie zasługujemy na dobre rzeczy :),,,,0,0,0,37,7,0.0,niski,41,0.5734905460394931
64.0,mi84263,"Ta dziewczyna była ""małą gwiazdą"", miła, grzeczna i dowcipna. Wy którzy myślicie inaczej popatrzcie na własne dzieci i co byście zrobili gdyby ktoś próbował powiedzieć o nich coś wrednego.",0,0,0,0,"Jun 4, 2025 · 3:00 PM UTC",,,,,,"Ta dziewczyna była ""małą gwiazdą"", miła, grzeczna i dowcipna. Wy którzy myślicie inaczej popatrzcie na własne dzieci i co byście zrobili gdyby ktoś próbował powiedzieć o nich coś wrednego.","Ta dziewczyna była ""małą gwiazdą"", miła, grzeczna i dowcipna. Wy którzy myślicie inaczej popatrzcie na własne dzieci i co byście zrobili gdyby ktoś próbował powiedzieć o nich coś wrednego.",,,,0,0,0,188,29,0.0,niski,41,0.5521330079966458
316.0,marek05664298,"Proste wskazanie - dlaczego pan się kompromituje pisząc tego typu banialuki Nikt nie wejdzie do przetargu który jest odpowiednio skonstruowany, tylko jeden podmiot może go wygrać",0,0,0,0,"Jun 4, 2025 · 3:03 PM UTC",,,,,,"Proste wskazanie - dlaczego pan się kompromituje pisząc tego typu banialuki Nikt nie wejdzie do przetargu który jest odpowiednio skonstruowany, tylko jeden podmiot może go wygrać","Proste wskazanie - dlaczego pan się kompromituje pisząc tego typu banialuki Nikt nie wejdzie do przetargu który jest odpowiednio skonstruowany, tylko jeden podmiot może go wygrać",,,,0,0,0,178,26,0.0,niski,41,0.5787067179483653
348.0,bitcmar,Po co ci chętni? wypierdalaj sam cwelu :D,0,0,0,0,"Jun 4, 2025 · 3:03 PM UTC",,,,,,Po co ci chętni? wypierdalaj sam cwelu :D,Po co ci chętni? wypierdalaj sam cwelu :D,,,,0,0,0,41,8,0.0,niski,41,0.9727850590876734
380.0,k0109zbyszek,Napisał dowcipas czy skończony jełop ?,0,0,0,0,"Jun 4, 2025 · 3:03 PM UTC",,,,,,Napisał dowcipas czy skończony jełop ?,Napisał dowcipas czy skończony jełop ?,,,,0,0,0,38,6,0.0,niski,41,0.580729938067581
517.0,zwilkiemnasercu,"Panie Piotrze, myślałem, że nie pasuje Pan do Pani Schnepf i Pana Wita. Jakże się myliłem.",0,0,0,0,"Jun 4, 2025 · 3:04 PM UTC",,,,,,"Panie Piotrze, myślałem, że nie pasuje Pan do Pani Schnepf i Pana Wita. Jakże się myliłem.","Panie Piotrze, myślałem, że nie pasuje Pan do Pani Schnepf i Pana Wita. Jakże się myliłem.",,,,0,0,0,90,16,0.0,niski,41,0.8250289839792491
605.0,owumys,@donaldtusk i @trzaskowski_ wy to naprawdę jesteście pojeby 🤦‍ Uwielbiam takie rzeczy,0,0,0,0,"Jun 4, 2025 · 3:05 PM UTC",,,,,,i wy to naprawdę jesteście pojeby 🤦‍ Uwielbiam takie rzeczy,i wy to naprawdę jesteście pojeby 🤦‍ Uwielbiam takie rzeczy,@donaldtusk|@trzaskowski_,,,2,0,0,59,10,0.0,niski,41,0.7545371065723298
662.0,unbornchildrule,Już nie krzyczy jak podczas wieców? U niego krzyk nn ie jest naturalny nie pasuje mu.,0,0,0,0,"Jun 4, 2025 · 3:05 PM UTC",,,,,,Już nie krzyczy jak podczas wieców? U niego krzyk nn ie jest naturalny nie pasuje mu.,Już nie krzyczy jak podczas wieców? U niego krzyk nn ie jest naturalny nie pasuje mu.,,,,0,0,0,85,16,0.0,niski,41,0.61307010612114
831.0,dorota_fortuna,"Trzymaj się, jesteśmy z Tobą",0,1,0,1,"Jun 4, 2025 · 2:52 PM UTC",,,,,,"Trzymaj się, jesteśmy z Tobą","Trzymaj się, jesteśmy z Tobą",,,,0,0,0,28,5,1.0,średni,41,0.6868391966821057
897.0,wolnosctradycja,Jak dobrze że tylko o włos.,0,0,0,0,"Jun 4, 2025 · 3:07 PM UTC",,,,,,Jak dobrze że tylko o włos.,Jak dobrze że tylko o włos.,,,,0,0,0,27,6,0.0,niski,41,0.5821819021625028
972.0,michabaraniak2,"spójrz na siebie dziwko xd całe życie leżałaś na dupie i mężuś na ciebie robił, nigdy nie poznałaś smaku ciężkiej pracy",0,0,0,0,"Jun 4, 2025 · 3:08 PM UTC",,,,,,"spójrz na siebie dziwko xd całe życie leżałaś na dupie i mężuś na ciebie robił, nigdy nie poznałaś smaku ciężkiej pracy","spójrz na siebie dziwko xd całe życie leżałaś na dupie i mężuś na ciebie robił, nigdy nie poznałaś smaku ciężkiej pracy",,,,0,0,0,119,21,0.0,niski,41,0.5817384670609351
3.0,artur1613574677,Typowy lachociag... Odezwała się.. Do budy su..ko,0,0,0,0,"Jun 4, 2025 · 4:02 PM UTC",,,,,,Typowy lachociag... Odezwała się.. Do budy su..ko,Typowy lachociag... Odezwała się.. Do budy su..ko,,,,0,0,0,49,7,0.0,niski,41,0.8536110105886561
5.0,aaczkolwiek,Gdyby liberski miał chooja byłby facetem,0,0,0,0,"Jun 4, 2025 · 4:01 PM UTC",,,,,,Gdyby liberski miał chooja byłby facetem,Gdyby liberski miał chooja byłby facetem,,,,0,0,0,40,6,0.0,niski,41,0.6616409117777678
10.0,piotrremiszews1,Ale jak to już się nie uśmiechają??,0,0,0,0,"Jun 4, 2025 · 4:01 PM UTC",,,,,,Ale jak to już się nie uśmiechają??,Ale jak to już się nie uśmiechają??,,,,0,0,0,35,7,0.0,niski,41,0.8493871212918351
13.0,wiktor17449977,***** was pies w tym tvPO.,0,0,0,0,"Jun 4, 2025 · 4:01 PM UTC",,,,,,***** was pies w tym tvPO.,***** was pies w tym tvPO.,,,,0,0,0,26,6,0.0,niski,41,0.6739226866451464
37.0,morales_tusk,gościu podubka ! posrałeś się ! widać dalej piecze dupa!,0,0,0,0,"Jun 4, 2025 · 4:01 PM UTC",,,,,,gościu podubka ! posrałeś się ! widać dalej piecze dupa!,gościu podubka ! posrałeś się ! widać dalej piecze dupa!,,,,0,0,0,56,10,0.0,niski,41,0.740956813837393
177.0,przepompa,"Wystarczyłoby, żeby tusk i trzaskowski nie byli tak dramatyczni.",0,0,0,0,"Jun 4, 2025 · 4:03 PM UTC",,,,,,"Wystarczyłoby, żeby tusk i trzaskowski nie byli tak dramatyczni.","Wystarczyłoby, żeby tusk i trzaskowski nie byli tak dramatyczni.",,,,0,0,0,64,9,0.0,niski,41,0.5769207262851155
442.0,awr77rados,"Gdyby, bardzo lubiane przez niektórych słowo.",0,0,0,0,"Jun 4, 2025 · 4:05 PM UTC",,,,,,"Gdyby, bardzo lubiane przez niektórych słowo.","Gdyby, bardzo lubiane przez niektórych słowo.",,,,0,0,0,45,6,0.0,niski,41,0.78570885173645
445.0,opiumwave122623,Naszczescie pogoniliśmy tego lewackiego oszołoma już raz na zawsze,0,0,0,0,"Jun 4, 2025 · 4:05 PM UTC",,,,,,Naszczescie pogoniliśmy tego lewackiego oszołoma już raz na zawsze,Naszczescie pogoniliśmy tego lewackiego oszołoma już raz na zawsze,,,,0,0,0,66,9,0.0,niski,41,0.5832246613064666
475.0,domellowaty,"Ale zapytania przetargowe piszą ludzie i często jest tak, że mało się na tym znają więc specyfikację biorą pod produkt który wcześniej im zaoferowano.",0,0,0,0,"Jun 4, 2025 · 4:05 PM UTC",,,,,,"Ale zapytania przetargowe piszą ludzie i często jest tak, że mało się na tym znają więc specyfikację biorą pod produkt który wcześniej im zaoferowano.","Ale zapytania przetargowe piszą ludzie i często jest tak, że mało się na tym znają więc specyfikację biorą pod produkt który wcześniej im zaoferowano.",,,,0,0,0,150,24,0.0,niski,41,0.666693096520264
515.0,mariolapolitows,To tak jaka wasza w sejmie. Zlepek ilu partii?,0,0,0,0,"Jun 4, 2025 · 4:05 PM UTC",,,,,,To tak jaka wasza w sejmie. Zlepek ilu partii?,To tak jaka wasza w sejmie. Zlepek ilu partii?,,,,0,0,0,46,9,0.0,niski,41,0.7908350050288148
611.0,andrzejkoz44420,"Rafałek, kim Ty jesteś chłopino? Trzeci garnitur KO…",0,0,0,0,"Jun 4, 2025 · 4:06 PM UTC",,,,,,"Rafałek, kim Ty jesteś chłopino? Trzeci garnitur KO…","Rafałek, kim Ty jesteś chłopino? Trzeci garnitur KO…",,,,0,0,0,52,8,0.0,niski,41,0.5989876196982511
616.0,figlarzb,Gdyby o czym mowili?! 🤣 Ty żartownisiu ty.....,0,0,0,0,"Jun 4, 2025 · 4:06 PM UTC",,,,,,Gdyby o czym mowili?! 🤣 Ty żartownisiu ty.....,Gdyby o czym mowili?! 🤣 Ty żartownisiu ty.....,,,,0,0,0,46,8,0.0,niski,41,0.751996725804905
643.0,corey7191,"Gdyby, gdyby, gdyby... To nie jest euforia tylko nieustającą beka z was, która sami wywołaliście w Niedzielę o 21:00.",0,0,0,0,"Jun 4, 2025 · 4:06 PM UTC",,,,,,"Gdyby, gdyby, gdyby... To nie jest euforia tylko nieustającą beka z was, która sami wywołaliście w Niedzielę o 21:00.","Gdyby, gdyby, gdyby... To nie jest euforia tylko nieustającą beka z was, która sami wywołaliście w Niedzielę o 21:00.",,,,0,0,0,117,19,0.0,niski,41,0.8796055127292631
677.0,xboxonekim,"Sroga odklejka Krzysztofie, pięknie udowadniasz jakim jesteś tfuskowym cymbałem. Przegraliście, pogódź się z tym",0,0,0,0,"Jun 4, 2025 · 4:06 PM UTC",,,,,,"Sroga odklejka Krzysztofie, pięknie udowadniasz jakim jesteś tfuskowym cymbałem. Przegraliście, pogódź się z tym","Sroga odklejka Krzysztofie, pięknie udowadniasz jakim jesteś tfuskowym cymbałem. Przegraliście, pogódź się z tym",,,,0,0,0,112,14,0.0,niski,41,0.9727850590876734
737.0,erjot859002,Ten taniec radości nad własnym grobem był przedni,0,0,0,0,"Jun 4, 2025 · 4:07 PM UTC",,,,,,Ten taniec radości nad własnym grobem był przedni,Ten taniec radości nad własnym grobem był przedni,,,,0,0,0,49,8,0.0,niski,41,0.6816193244714048
768.0,piotr4nafo,Pocieszę cię to był sztuczny uśmiech,0,0,0,0,"Jun 4, 2025 · 4:07 PM UTC",,,,,,Pocieszę cię to był sztuczny uśmiech,Pocieszę cię to był sztuczny uśmiech,,,,0,0,0,36,6,0.0,niski,41,0.821077641810384
830.0,kejo11131,"Brygada uśmiechnięta, a Pan ?",0,0,0,0,"Jun 4, 2025 · 4:08 PM UTC",,,,,,"Brygada uśmiechnięta, a Pan ?","Brygada uśmiechnięta, a Pan ?",,,,0,0,0,29,5,0.0,niski,41,0.8493871212918351
831.0,kajhxj,Wracaj baranie do zagrody nie dla ciebie górskie przygody,0,0,0,0,"Jun 4, 2025 · 4:08 PM UTC",,,,,,Wracaj baranie do zagrody nie dla ciebie górskie przygody,Wracaj baranie do zagrody nie dla ciebie górskie przygody,,,,0,0,0,57,9,0.0,niski,41,0.7790570244140069
927.0,jacekpiotrowitz,Szukam szmaty do podłogi. Ktoś? Coś?,0,0,0,0,"Jun 4, 2025 · 4:08 PM UTC",,,,,,Szukam szmaty do podłogi. Ktoś? Coś?,Szukam szmaty do podłogi. Ktoś? Coś?,,,,0,0,0,36,6,0.0,niski,41,0.8536110105886561
959.0,_villain___,4 czerwca mija 33 lata jak twój szef liczył głosy z komuchami. Hańba na wieki.,0,0,0,0,"Jun 4, 2025 · 4:09 PM UTC",,,,,,4 czerwca mija 33 lata jak twój szef liczył głosy z komuchami. Hańba na wieki.,4 czerwca mija 33 lata jak twój szef liczył głosy z komuchami. Hańba na wieki.,,,,0,0,0,78,15,0.0,niski,41,0.8767031542851654
995.0,glendanzig68055,"Czekamy na nowe, jeszcze piękniejsze kible.",0,0,0,0,"Jun 4, 2025 · 4:09 PM UTC",,,,,,"Czekamy na nowe, jeszcze piękniejsze kible.","Czekamy na nowe, jeszcze piękniejsze kible.",,,,0,0,0,43,6,0.0,niski,41,0.5620219888592767
20.0,bogusiamorawska,A mnie odrażają takie prymitywy ja ty.,0,0,0,0,"Jun 4, 2025 · 5:02 PM UTC",,,,,,A mnie odrażają takie prymitywy ja ty.,A mnie odrażają takie prymitywy ja ty.,,,,0,0,0,38,7,0.0,niski,41,1.0
32.0,marcinkozinskii,Kibel kolejny postaw albo inny zjebany wybalazek,0,0,0,0,"Jun 4, 2025 · 5:02 PM UTC",,,,,,Kibel kolejny postaw albo inny zjebany wybalazek,Kibel kolejny postaw albo inny zjebany wybalazek,,,,0,0,0,48,7,0.0,niski,41,0.6304168412377638
34.0,mdz73088,PSL. Taka pani co pójdzie z każdym...,0,0,0,0,"Jun 4, 2025 · 5:03 PM UTC",,,,,,PSL. Taka pani co pójdzie z każdym...,PSL. Taka pani co pójdzie z każdym...,,,,0,0,0,37,7,0.0,niski,41,0.9116244306647836
36.0,wojciech890919,Jeszcze się zaskoczysz za kilka godzin ;),0,1,1,2,"Jun 1, 2025 · 7:04 PM UTC",,,,,,Jeszcze się zaskoczysz za kilka godzin ;),Jeszcze się zaskoczysz za kilka godzin ;),,,,0,0,0,41,7,1.0,wysoki,41,0.5257163821274086
72.0,paj21lukasz,"I czar tygryska prysnął!....Pakuj się! Zapomniałem, że plecak masz już gotowy",0,1,0,1,"Jun 2, 2025 · 8:47 AM UTC",,,,,,"I czar tygryska prysnął!....Pakuj się! Zapomniałem, że plecak masz już gotowy","I czar tygryska prysnął!....Pakuj się! Zapomniałem, że plecak masz już gotowy",,,,0,0,0,77,11,1.0,średni,41,0.6610646795388857
74.0,miko_aj36478,"Oczywiście! Cieszyć mogą się tylko ludzie uśmiechnięci. Nawet, jeśli „mocarna” wygrana trwa dwie godziny.",0,0,0,0,"Jun 4, 2025 · 5:03 PM UTC",,,,,,"Oczywiście! Cieszyć mogą się tylko ludzie uśmiechnięci. Nawet, jeśli „mocarna” wygrana trwa dwie godziny.","Oczywiście! Cieszyć mogą się tylko ludzie uśmiechnięci. Nawet, jeśli „mocarna” wygrana trwa dwie godziny.",,,,0,0,0,105,14,0.0,niski,41,0.8221829475302778
103.0,antonisobc90189,A jeden koleś krzyczał na necie „kocham was” i gdzie on jest ?,0,0,0,0,"Jun 4, 2025 · 5:04 PM UTC",,,,,,A jeden koleś krzyczał na necie „kocham was” i gdzie on jest ?,A jeden koleś krzyczał na necie „kocham was” i gdzie on jest ?,,,,0,0,0,62,13,0.0,niski,41,0.563428756462904
104.0,wszawyleon,"Przypomniałeś sobie, że masz jakąś pracę?",0,0,0,0,"Jun 4, 2025 · 5:04 PM UTC",,,,,,"Przypomniałeś sobie, że masz jakąś pracę?","Przypomniałeś sobie, że masz jakąś pracę?",,,,0,0,0,41,6,0.0,niski,41,0.5582322602514158
142.0,tomeksok,"A ""pozostałe"" 50%? 10 300 000? Ludzi którzy brzydzą się oszustwem, kuplerstwem, ustawkami, krętactwem.. co z nimi? Nie istnieją. Wygraliście o 300k .. coś ok 1% Nie 15% nie 30% nie 70% Pamiętajcie o tym. My jesteśmy zazwyczaj grzeczni. Ale to się może zmienić.",0,4,0,4,"Jun 4, 2025 · 4:54 PM UTC",,,,,,"A ""pozostałe"" 50%? 10 300 000? Ludzi którzy brzydzą się oszustwem, kuplerstwem, ustawkami, krętactwem.. co z nimi? Nie istnieją. Wygraliście o 300k .. coś ok 1% Nie 15% nie 30% nie 70% Pamiętajcie o tym. My jesteśmy zazwyczaj grzeczni. Ale to się może zmienić.","A ""pozostałe"" 50%? 10 300 000? Ludzi którzy brzydzą się oszustwem, kuplerstwem, ustawkami, krętactwem.. co z nimi? Nie istnieją. Wygraliście o 300k .. coś ok 1% Nie 15% nie 30% nie 70% Pamiętajcie o tym. My jesteśmy zazwyczaj grzeczni. Ale to się może zmienić.",,,,0,0,0,260,44,4.0,wysoki,41,0.5866075528677241
273.0,voreseunasza,Szkoda że NIC nie rozumiecie…,0,0,0,0,"Jun 4, 2025 · 5:05 PM UTC",,,,,,Szkoda że NIC nie rozumiecie…,Szkoda że NIC nie rozumiecie…,,,,0,0,0,29,5,0.0,niski,41,1.0
302.0,antoniusz67,Noooo my się cieszymy po a nie przed,0,0,0,0,"Jun 4, 2025 · 5:05 PM UTC",,,,,,Noooo my się cieszymy po a nie przed,Noooo my się cieszymy po a nie przed,,,,0,0,0,36,8,0.0,niski,41,0.6757039944873445
410.0,baba_yaga_bummm,No. Bedzie brakowało pajaca hehe,0,0,0,0,"Jun 4, 2025 · 5:06 PM UTC",,,,,,No. Bedzie brakowało pajaca hehe,No. Bedzie brakowało pajaca hehe,,,,0,0,0,32,5,0.0,niski,41,0.6834405223396622
411.0,obiwankenobis24,"Mogłeś Władek pójść drogą chwały. Wybrałeś hańbę. Może Cię Donek przytuli i da miejsce obok Jachiry, czy Hartwich w sejmowej ławie. Bo u chłopów jesteś skończony...",0,4,3,7,"Jun 2, 2025 · 4:21 AM UTC",,,,,,"Mogłeś Władek pójść drogą chwały. Wybrałeś hańbę. Może Cię Donek przytuli i da miejsce obok Jachiry, czy Hartwich w sejmowej ławie. Bo u chłopów jesteś skończony...","Mogłeś Władek pójść drogą chwały. Wybrałeś hańbę. Może Cię Donek przytuli i da miejsce obok Jachiry, czy Hartwich w sejmowej ławie. Bo u chłopów jesteś skończony...",,,,0,0,0,164,26,1.33,wysoki,41,0.8872814162113232
8.0,dorota34788350,"Wipler wam narzuca narrację? USPOKÓJCIE SIĘ TROSZKĘ,BO ZACZYNACIE GWIAZDORZYĆ.",0,0,0,0,"Jun 4, 2025 · 6:00 PM UTC",,,,,,"Wipler wam narzuca narrację? USPOKÓJCIE SIĘ TROSZKĘ,BO ZACZYNACIE GWIAZDORZYĆ.","Wipler wam narzuca narrację? USPOKÓJCIE SIĘ TROSZKĘ,BO ZACZYNACIE GWIAZDORZYĆ.",,,,0,0,0,78,9,0.0,niski,41,0.8298879545697776
9.0,vera_lesna,"No pewnie że nie, będzie dalej kleił rzeczywistość taśmą klejącą...",0,0,0,0,"Jun 4, 2025 · 6:00 PM UTC",,,,,,"No pewnie że nie, będzie dalej kleił rzeczywistość taśmą klejącą...","No pewnie że nie, będzie dalej kleił rzeczywistość taśmą klejącą...",,,,0,0,0,67,10,0.0,niski,41,0.6282976882955028
11.0,michal19161916,Mnie tam go nie żal. Powinien siedzieć.,0,0,0,0,"Jun 4, 2025 · 6:00 PM UTC",,,,,,Mnie tam go nie żal. Powinien siedzieć.,Mnie tam go nie żal. Powinien siedzieć.,,,,0,0,0,39,7,0.0,niski,41,0.5989557854201849
19.0,robertjernas,To my dziękujemy za ogrom pracy szkoda że tak wyszło .,0,0,0,0,"Jun 4, 2025 · 6:00 PM UTC",,,,,,To my dziękujemy za ogrom pracy szkoda że tak wyszło .,To my dziękujemy za ogrom pracy szkoda że tak wyszło .,,,,0,0,0,54,11,0.0,niski,41,0.5628883489915156
31.0,rafalhubert,"Panie @lis_tomasz nie jestem biedny, ani wykluczony w jednym jednak muszę się z panami zgodzić. Pan @trzaskowski_ jest emanacją całego kurewsta i skurwysynstwa którego jesteście psami łańcuchowymi. Ciągłego poniżania i okradania ludzi dzięki którym nic nie robiąc a jedynie siedząc na dupach w swoich gabinetach i robiąc pale komu trzeba pierdolicie trzy po trzy z głębokim przekonaniu że kogokolwiek o zdrowych zmysłach to obchodzi. Te wybory są właśnie o tym, żebyście po 30 latach trafili wreszcie na śmietnik, czyli tam gdzie ludzie tacy jak ja których od tych 30 lat obrażacie, waszym zdaniem powinni zdechnąć. Nie zdechliśmy a z każdym kolejnym rokiem jesteśmy coraz silniejsi.",28,1028,194,1250,"May 30, 2025 · 1:28 PM UTC",,,,,,"Panie nie jestem biedny, ani wykluczony w jednym jednak muszę się z panami zgodzić. Pan jest emanacją całego kurewsta i skurwysynstwa którego jesteście psami łańcuchowymi. Ciągłego poniżania i okradania ludzi dzięki którym nic nie robiąc a jedynie siedząc na dupach w swoich gabinetach i robiąc pale komu trzeba pierdolicie trzy po trzy z głębokim przekonaniu że kogokolwiek o zdrowych zmysłach to obchodzi. Te wybory są właśnie o tym, żebyście po 30 latach trafili wreszcie na śmietnik, czyli tam gdzie ludzie tacy jak ja których od tych 30 lat obrażacie, waszym zdaniem powinni zdechnąć. Nie zdechliśmy a z każdym kolejnym rokiem jesteśmy coraz silniejsi.","Panie nie jestem biedny, ani wykluczony w jednym jednak muszę się z panami zgodzić. Pan jest emanacją całego kurewsta i skurwysynstwa którego jesteście psami łańcuchowymi. Ciągłego poniżania i okradania ludzi dzięki którym nic nie robiąc a jedynie siedząc na dupach w swoich gabinetach i robiąc pale komu trzeba pierdolicie trzy po trzy z głębokim przekonaniu że kogokolwiek o zdrowych zmysłach to obchodzi. Te wybory są właśnie o tym, żebyście po 30 latach trafili wreszcie na śmietnik, czyli tam gdzie ludzie tacy jak ja których od tych 30 lat obrażacie, waszym zdaniem powinni zdechnąć. Nie zdechliśmy a z każdym kolejnym rokiem jesteśmy coraz silniejsi.",@lis_tomasz|@trzaskowski_,,,2,0,0,657,103,5.3,wysoki,41,0.6378135468688386
37.0,kkubekjakubek,A mogłaś nie robić z siebie idiotki....a co tam w tym afd słychać ?,0,0,0,0,"Jun 4, 2025 · 6:01 PM UTC",,,,,,A mogłaś nie robić z siebie idiotki....a co tam w tym afd słychać ?,A mogłaś nie robić z siebie idiotki....a co tam w tym afd słychać ?,,,,0,0,0,67,14,0.0,niski,41,1.0
102.0,mranuszkiewicz,"Proszę się nie ośmieszać, naprawdę …",0,0,0,0,"Jun 4, 2025 · 6:01 PM UTC",,,,,,"Proszę się nie ośmieszać, naprawdę …","Proszę się nie ośmieszać, naprawdę …",,,,0,0,0,36,6,0.0,niski,41,0.849115877259811
206.0,kgrebowicz,Bo chcieli się cię pozbyć z ratusza,0,0,0,0,"Jun 4, 2025 · 6:02 PM UTC",,,,,,Bo chcieli się cię pozbyć z ratusza,Bo chcieli się cię pozbyć z ratusza,,,,0,0,0,35,7,0.0,niski,41,1.0
304.0,ajliczkowski,No szczerze to mam wrażenie że obaj kandydaci wyszli z tego strasznie poobijani.,0,0,0,0,"Jun 4, 2025 · 6:03 PM UTC",,,,,,No szczerze to mam wrażenie że obaj kandydaci wyszli z tego strasznie poobijani.,No szczerze to mam wrażenie że obaj kandydaci wyszli z tego strasznie poobijani.,,,,0,0,0,80,13,0.0,niski,41,0.6270013930445675
372.0,sloneczkus,"Weź się sam podaj do dymisji, nie rób siary",0,0,0,0,"Jun 4, 2025 · 6:03 PM UTC",,,,,,"Weź się sam podaj do dymisji, nie rób siary","Weź się sam podaj do dymisji, nie rób siary",,,,0,0,0,43,9,0.0,niski,41,0.807539938548679
529.0,makumba887,No i na co to wszystko tobie było? Więcej asertywności do donka na przyszły raz i nie trzeba będzie się potem wstydzić bo ktoś coś kazał.,0,0,0,0,"Jun 4, 2025 · 6:04 PM UTC",,,,,,No i na co to wszystko tobie było? Więcej asertywności do donka na przyszły raz i nie trzeba będzie się potem wstydzić bo ktoś coś kazał.,No i na co to wszystko tobie było? Więcej asertywności do donka na przyszły raz i nie trzeba będzie się potem wstydzić bo ktoś coś kazał.,,,,0,0,0,137,26,0.0,niski,41,0.950222097729395
595.0,sebastian135174,Gdyby.. gdyby... gdybyś nie był glupi był byś mądry..,0,0,0,0,"Jun 4, 2025 · 6:05 PM UTC",,,,,,Gdyby.. gdyby... gdybyś nie był glupi był byś mądry..,Gdyby.. gdyby... gdybyś nie był glupi był byś mądry..,,,,0,0,0,53,9,0.0,niski,41,0.6989986103735819
633.0,jolantam8,"Głębiej, głębiej - jeszcze obcasiki widać.",0,0,0,0,"Jun 4, 2025 · 6:05 PM UTC",,,,,,"Głębiej, głębiej - jeszcze obcasiki widać.","Głębiej, głębiej - jeszcze obcasiki widać.",,,,0,0,0,42,6,0.0,niski,41,0.6856341792887222
664.0,awerkowski97609,Czyli dziś pierwszy i ostatni dzień pracy w tym tygodniu. Łyso wam? Usmiechajcie się brygada!!!,0,0,0,0,"Jun 4, 2025 · 6:05 PM UTC",,,,,,Czyli dziś pierwszy i ostatni dzień pracy w tym tygodniu. Łyso wam? Usmiechajcie się brygada!!!,Czyli dziś pierwszy i ostatni dzień pracy w tym tygodniu. Łyso wam? Usmiechajcie się brygada!!!,,,,0,0,0,95,15,0.0,niski,41,0.6215038944078949
694.0,rafarobak,"Ale praca . Cud malina, tylko dla SB ckich dzieci.",0,0,0,0,"Jun 4, 2025 · 6:05 PM UTC",,,,,,"Ale praca . Cud malina, tylko dla SB ckich dzieci.","Ale praca . Cud malina, tylko dla SB ckich dzieci.",,,,0,0,0,50,10,0.0,niski,41,0.5708366130992828
735.0,dprutata,Bo wystarczyło myśleć logicznie i zwrócić uwagę ile osób odmówiło udzielenia odpowiedzi,0,0,0,0,"Jun 4, 2025 · 6:06 PM UTC",,,,,,Bo wystarczyło myśleć logicznie i zwrócić uwagę ile osób odmówiło udzielenia odpowiedzi,Bo wystarczyło myśleć logicznie i zwrócić uwagę ile osób odmówiło udzielenia odpowiedzi,,,,0,0,0,87,12,0.0,niski,41,0.5433354805439934
