id,username,text,likes,retweets,replies,total_interactions,post_date_iso,date,year,month,day,hour,text_clean,text_no_links,mentions,hashtags,urls,n_mentions,n_hashtags,n_urls,char_count,word_count,amplification_ratio,reach_tier,cluster,cluster_prob
8.0,ericldaugh,🚨 WOW! Poland’s right-wing President Karol Nawrocki has just EXEMPTED many parents of two or more children from income tax Nawrocki was endorsed by President Trump and recently WON his election We should follow suit with this kind of policy in America 🔥🇺🇸,8,321,98,427,18-10-25,2025-10-18,2025.0,10.0,18.0,0.0,🚨 WOW! Poland’s right-wing President Karol Nawrocki has just EXEMPTED many parents of two or more children from income tax Nawrocki was endorsed by President Trump and recently WON his election We should follow suit with this kind of policy in America 🔥🇺🇸,🚨 WOW! Poland’s right-wing President Karol Nawrocki has just EXEMPTED many parents of two or more children from income tax Nawrocki was endorsed by President Trump and recently WON his election We should follow suit with this kind of policy in America 🔥🇺🇸,,,,0,0,0,255,43,3.28,wysoki,4,1.0
11.0,yazmirand,"ÚLTIMA HORA: El nuevo presidente de Polonia, Karol Nawrocki, firma un proyecto de ley que exime a los padres con dos o más hijos del pago del impuesto sobre la renta. Polonia lidera desde el frente. 🇵🇱",0,0,0,0,18-10-25,2025-10-18,2025.0,10.0,18.0,0.0,"ÚLTIMA HORA: El nuevo presidente de Polonia, Karol Nawrocki, firma un proyecto de ley que exime a los padres con dos o más hijos del pago del impuesto sobre la renta. Polonia lidera desde el frente. 🇵🇱","ÚLTIMA HORA: El nuevo presidente de Polonia, Karol Nawrocki, firma un proyecto de ley que exime a los padres con dos o más hijos del pago del impuesto sobre la renta. Polonia lidera desde el frente. 🇵🇱",,,,0,0,0,201,37,0.0,niski,4,1.0
15.0,p_zuchowski,"Minister finansów i gospodarki Andrzej Domański @Domanski_Andrz liczy na to, że prezydent Karol Nawrocki @NawrockiKn nie będzie utrudniał wprowadzenia ustaw dobrych dla kraju. W Waszyngtonie mówi o potrzebie wydawania pieniędzy na obronność, które mogą pochodzić z podniesienia podatków dla sektora bankowego. @Radio_RMF24 , @RMF24pl",1,21,10,32,17-10-25,2025-10-17,2025.0,10.0,17.0,0.0,"Minister finansów i gospodarki Andrzej Domański liczy na to, że prezydent Karol Nawrocki nie będzie utrudniał wprowadzenia ustaw dobrych dla kraju. W Waszyngtonie mówi o potrzebie wydawania pieniędzy na obronność, które mogą pochodzić z podniesienia podatków dla sektora bankowego. ,","Minister finansów i gospodarki Andrzej Domański liczy na to, że prezydent Karol Nawrocki nie będzie utrudniał wprowadzenia ustaw dobrych dla kraju. W Waszyngtonie mówi o potrzebie wydawania pieniędzy na obronność, które mogą pochodzić z podniesienia podatków dla sektora bankowego. ,",@Domanski_Andrz|@NawrockiKn|@Radio_RMF24|@RMF24pl,,,4,0,0,283,40,2.1,średni,4,1.0
106.0,gamza61,And who will finance it? It's not President Nawrocki. They'll probably impose higher taxes on others.,0,0,0,0,18-10-25,2025-10-18,2025.0,10.0,18.0,0.0,And who will finance it? It's not President Nawrocki. They'll probably impose higher taxes on others.,And who will finance it? It's not President Nawrocki. They'll probably impose higher taxes on others.,,,,0,0,0,101,16,0.0,niski,4,1.0
8.0,diosakhalinda,"🚨🇵🇱ÚLTIMA HORA: El nuevo presidente de Polonia, Karol Nawrocki, firma un proyecto de ley que exime a los padres con dos o más hijos del pago del impuesto sobre la renta. Así es cómo lucha contra las políticas globalistas de la Agenda 2030 y su Plan Kalergi 👏👏",1,7,0,8,18-10-25,2025-10-18,2025.0,10.0,18.0,0.0,"🚨🇵🇱ÚLTIMA HORA: El nuevo presidente de Polonia, Karol Nawrocki, firma un proyecto de ley que exime a los padres con dos o más hijos del pago del impuesto sobre la renta. Así es cómo lucha contra las políticas globalistas de la Agenda 2030 y su Plan Kalergi 👏👏","🚨🇵🇱ÚLTIMA HORA: El nuevo presidente de Polonia, Karol Nawrocki, firma un proyecto de ley que exime a los padres con dos o más hijos del pago del impuesto sobre la renta. Así es cómo lucha contra las políticas globalistas de la Agenda 2030 y su Plan Kalergi 👏👏",,,,0,0,0,259,48,7.0,średni,4,1.0
10.0,eduardomenoni,"🚨| ÚLTIMA HORA: El presidente derechista de Polonia, Karol Nawrocki, EXIMIÓ del impuesto sobre la renta a familias con dos o más hijos. 🇵🇱 ¿Apoyas está excelente medida?",0,57,5,62,18-10-25,2025-10-18,2025.0,10.0,18.0,0.0,"🚨| ÚLTIMA HORA: El presidente derechista de Polonia, Karol Nawrocki, EXIMIÓ del impuesto sobre la renta a familias con dos o más hijos. 🇵🇱 ¿Apoyas está excelente medida?","🚨| ÚLTIMA HORA: El presidente derechista de Polonia, Karol Nawrocki, EXIMIÓ del impuesto sobre la renta a familias con dos o más hijos. 🇵🇱 ¿Apoyas está excelente medida?",,,,0,0,0,169,28,11.4,wysoki,4,1.0
13.0,grok,"Yes, it's true—Polish President Karol Nawrocki signed the law on October 16, exempting parents of two or more children from personal income tax up to 140,000 zloty (~€33,000) annually. This targets families to combat declining birthrates. The US might benefit from similar incentives, but we'd need to weigh revenue losses against long-term demographic gains.",0,0,0,0,18-10-25,2025-10-18,2025.0,10.0,18.0,0.0,"Yes, it's true—Polish President Karol Nawrocki signed the law on October 16, exempting parents of two or more children from personal income tax up to 140,000 zloty (~€33,000) annually. This targets families to combat declining birthrates. The US might benefit from similar incentives, but we'd need to weigh revenue losses against long-term demographic gains.","Yes, it's true—Polish President Karol Nawrocki signed the law on October 16, exempting parents of two or more children from personal income tax up to 140,000 zloty (~€33,000) annually. This targets families to combat declining birthrates. The US might benefit from similar incentives, but we'd need to weigh revenue losses against long-term demographic gains.",,,,0,0,0,359,54,0.0,niski,4,1.0
12.0,grok,"No, President Nawrocki signed the bill into law on October 16, 2025, introducing zero personal income tax for parents raising at least two children, up to an annual earnings cap of 140,000 zloty. This follows his initial proposal in August, now enacted to support families. Poland's pro-natal policies continue to prioritize demographic growth.",0,0,0,0,18-10-25,2025-10-18,2025.0,10.0,18.0,0.0,"No, President Nawrocki signed the bill into law on October 16, 2025, introducing zero personal income tax for parents raising at least two children, up to an annual earnings cap of 140,000 zloty. This follows his initial proposal in August, now enacted to support families. Poland's pro-natal policies continue to prioritize demographic growth.","No, President Nawrocki signed the bill into law on October 16, 2025, introducing zero personal income tax for parents raising at least two children, up to an annual earnings cap of 140,000 zloty. This follows his initial proposal in August, now enacted to support families. Poland's pro-natal policies continue to prioritize demographic growth.",,,,0,0,0,344,53,0.0,niski,4,1.0
11.0,grok,"Sources confirm President Nawrocki signed the zero PIT law for parents of two or more children into effect on October 16, following parliamentary passage. It applies to incomes up to 140,000 PLN annually to boost family support amid low birth rates. US policymakers could adapt similar incentives, balancing fiscal impacts with demographic needs.",0,0,0,0,18-10-25,2025-10-18,2025.0,10.0,18.0,0.0,"Sources confirm President Nawrocki signed the zero PIT law for parents of two or more children into effect on October 16, following parliamentary passage. It applies to incomes up to 140,000 PLN annually to boost family support amid low birth rates. US policymakers could adapt similar incentives, balancing fiscal impacts with demographic needs.","Sources confirm President Nawrocki signed the zero PIT law for parents of two or more children into effect on October 16, following parliamentary passage. It applies to incomes up to 140,000 PLN annually to boost family support amid low birth rates. US policymakers could adapt similar incentives, balancing fiscal impacts with demographic needs.",,,,0,0,0,346,53,0.0,niski,4,1.0
20.0,grok,"True. Poland's President Karol Nawrocki signed a law on October 16, 2025, exempting parents raising at least two children from personal income tax (PIT) up to 140,000 PLN annually per parent. This reform supports families amid declining birth rates but applies only within the income threshold. The U.S. could consider similar incentives to encourage population growth.",0,0,0,0,18-10-25,2025-10-18,2025.0,10.0,18.0,0.0,"True. Poland's President Karol Nawrocki signed a law on October 16, 2025, exempting parents raising at least two children from personal income tax (PIT) up to 140,000 PLN annually per parent. This reform supports families amid declining birth rates but applies only within the income threshold. The U.S. could consider similar incentives to encourage population growth.","True. Poland's President Karol Nawrocki signed a law on October 16, 2025, exempting parents raising at least two children from personal income tax (PIT) up to 140,000 PLN annually per parent. This reform supports families amid declining birth rates but applies only within the income threshold. The U.S. could consider similar incentives to encourage population growth.",,,,0,0,0,369,56,0.0,niski,4,1.0
2.0,ceciliejilkova,"Polský prezident podepsal nový zákon zavádějící nulovou daň z příjmu fyzických osob (PIT) pro rodiče vychovávající alespoň dvě děti. Návrh zákona, který předložil Karol Nawrocki v srpnu 2025, ruší povinnost platit daň z příjmu pro rodiny vydělávající až 140 000 zlotých (přibližně 33 000 eur) ročně. Daňová úleva je dostupná všem rodičům, kteří mají rodičovskou zodpovědnost za děti, včetně zákonných zástupců a pěstounů. Zákon byl podepsán 16. října 2025 a je účinný zpětně od 1. ledna 2025. Podle výpočtů prezidentského úřadu by průměrná polská rodina měla díky této daňové úlevě ušetřit přibližně 1 000 zlotých (asi 235 eur) měsíčně. Toto opatření je součástí širších snah polské vlády řešit alarmující demografickou situaci. Porodnost v Polsku je jedna z nejnižších na světě a v roce 2024 klesla na rekordních 1,1 dítěte na ženu. Odkazy ve vlákně.",0,4,5,9,18-10-25,2025-10-18,2025.0,10.0,18.0,0.0,"Polský prezident podepsal nový zákon zavádějící nulovou daň z příjmu fyzických osob (PIT) pro rodiče vychovávající alespoň dvě děti. Návrh zákona, který předložil Karol Nawrocki v srpnu 2025, ruší povinnost platit daň z příjmu pro rodiny vydělávající až 140 000 zlotých (přibližně 33 000 eur) ročně. Daňová úleva je dostupná všem rodičům, kteří mají rodičovskou zodpovědnost za děti, včetně zákonných zástupců a pěstounů. Zákon byl podepsán 16. října 2025 a je účinný zpětně od 1. ledna 2025. Podle výpočtů prezidentského úřadu by průměrná polská rodina měla díky této daňové úlevě ušetřit přibližně 1 000 zlotých (asi 235 eur) měsíčně. Toto opatření je součástí širších snah polské vlády řešit alarmující demografickou situaci. Porodnost v Polsku je jedna z nejnižších na světě a v roce 2024 klesla na rekordních 1,1 dítěte na ženu. Odkazy ve vlákně.","Polský prezident podepsal nový zákon zavádějící nulovou daň z příjmu fyzických osob (PIT) pro rodiče vychovávající alespoň dvě děti. Návrh zákona, který předložil Karol Nawrocki v srpnu 2025, ruší povinnost platit daň z příjmu pro rodiny vydělávající až 140 000 zlotých (přibližně 33 000 eur) ročně. Daňová úleva je dostupná všem rodičům, kteří mají rodičovskou zodpovědnost za děti, včetně zákonných zástupců a pěstounů. Zákon byl podepsán 16. října 2025 a je účinný zpětně od 1. ledna 2025. Podle výpočtů prezidentského úřadu by průměrná polská rodina měla díky této daňové úlevě ušetřit přibližně 1 000 zlotých (asi 235 eur) měsíčně. Toto opatření je součástí širších snah polské vlády řešit alarmující demografickou situaci. Porodnost v Polsku je jedna z nejnižších na světě a v roce 2024 klesla na rekordních 1,1 dítěte na ženu. Odkazy ve vlákně.",,,,0,0,0,851,134,0.8,średni,4,1.0
7.0,skmassociatess,"Poland's President Karol Nawrocki has approved a law eliminating personal income tax for parents with at least two children. This initiative aims to boost household income for families earning up to 140,000 zloty annually, though wealthier households may benefit the most.",0,0,0,0,18-10-25,2025-10-18,2025.0,10.0,18.0,0.0,"Poland's President Karol Nawrocki has approved a law eliminating personal income tax for parents with at least two children. This initiative aims to boost household income for families earning up to 140,000 zloty annually, though wealthier households may benefit the most.","Poland's President Karol Nawrocki has approved a law eliminating personal income tax for parents with at least two children. This initiative aims to boost household income for families earning up to 140,000 zloty annually, though wealthier households may benefit the most.",,,,0,0,0,272,41,0.0,niski,4,1.0
14.0,sachinettiyil,"Poland's Catholic president Karol Nawrocki has signed a new law introducing zero personal income tax for parents raising at least two children, a reform which aims to support families Info: Euro News",1,44,4,49,18-10-25,2025-10-18,2025.0,10.0,18.0,0.0,"Poland's Catholic president Karol Nawrocki has signed a new law introducing zero personal income tax for parents raising at least two children, a reform which aims to support families Info: Euro News","Poland's Catholic president Karol Nawrocki has signed a new law introducing zero personal income tax for parents raising at least two children, a reform which aims to support families Info: Euro News",,,,0,0,0,199,32,11.0,wysoki,4,1.0
5.0,grok,"Yes, it's true—Poland's President Karol Nawrocki signed a law on October 16, 2025, exempting parents raising at least two children from personal income tax (PIT), aiming to combat low birth rates. This builds on prior family incentives like child allowances. While pro-natalist, its long-term fiscal impact remains to be seen.",0,0,0,0,18-10-25,2025-10-18,2025.0,10.0,18.0,0.0,"Yes, it's true—Poland's President Karol Nawrocki signed a law on October 16, 2025, exempting parents raising at least two children from personal income tax (PIT), aiming to combat low birth rates. This builds on prior family incentives like child allowances. While pro-natalist, its long-term fiscal impact remains to be seen.","Yes, it's true—Poland's President Karol Nawrocki signed a law on October 16, 2025, exempting parents raising at least two children from personal income tax (PIT), aiming to combat low birth rates. This builds on prior family incentives like child allowances. While pro-natalist, its long-term fiscal impact remains to be seen.",,,,0,0,0,326,50,0.0,niski,4,1.0
17.0,grok,"Prezydent Nawrocki podpisał ustawę po jej uchwaleniu przez parlament 16 października 2025 r., co zwalnia rodziców z PIT do 140 tys. zł rocznie na rodzica. Projekt przeszedł pełną procedurę legislacyjną i jest już prawem, jak podają źródła takie jak Euronews czy polskie media. Słowo ""projekt"" odnosi się do etapu przed uchwaleniem, ale teraz to obowiązująca ustawa prorodzinna.",0,0,1,1,19-10-25,2025-10-19,2025.0,10.0,19.0,0.0,"Prezydent Nawrocki podpisał ustawę po jej uchwaleniu przez parlament 16 października 2025 r., co zwalnia rodziców z PIT do 140 tys. zł rocznie na rodzica. Projekt przeszedł pełną procedurę legislacyjną i jest już prawem, jak podają źródła takie jak Euronews czy polskie media. Słowo ""projekt"" odnosi się do etapu przed uchwaleniem, ale teraz to obowiązująca ustawa prorodzinna.","Prezydent Nawrocki podpisał ustawę po jej uchwaleniu przez parlament 16 października 2025 r., co zwalnia rodziców z PIT do 140 tys. zł rocznie na rodzica. Projekt przeszedł pełną procedurę legislacyjną i jest już prawem, jak podają źródła takie jak Euronews czy polskie media. Słowo ""projekt"" odnosi się do etapu przed uchwaleniem, ale teraz to obowiązująca ustawa prorodzinna.",,,,0,0,0,377,57,0.0,średni,4,1.0
13.0,giovannzibordi,"Il 16 ottobre 2025, il Presidente della Polonia Karol Nawrocki ha firmato una nuova legge che riduce a ZERO l'imposta sul reddito personale (PIT) zero per i genitori con almeno due figli. L'esenzione fiscale si applica alle famiglie che guadagnano fino a 140.000 zloty (circa €33.000 o $35.000 USD) all'anno, e si prevede che farà risparmiare alla famiglia qualificata media circa 1.000 zloty (€235) al mese.",1,4,0,5,19-10-25,2025-10-19,2025.0,10.0,19.0,0.0,"Il 16 ottobre 2025, il Presidente della Polonia Karol Nawrocki ha firmato una nuova legge che riduce a ZERO l'imposta sul reddito personale (PIT) zero per i genitori con almeno due figli. L'esenzione fiscale si applica alle famiglie che guadagnano fino a 140.000 zloty (circa €33.000 o $35.000 USD) all'anno, e si prevede che farà risparmiare alla famiglia qualificata media circa 1.000 zloty (€235) al mese.","Il 16 ottobre 2025, il Presidente della Polonia Karol Nawrocki ha firmato una nuova legge che riduce a ZERO l'imposta sul reddito personale (PIT) zero per i genitori con almeno due figli. L'esenzione fiscale si applica alle famiglie che guadagnano fino a 140.000 zloty (circa €33.000 o $35.000 USD) all'anno, e si prevede che farà risparmiare alla famiglia qualificata media circa 1.000 zloty (€235) al mese.",,,,0,0,0,408,66,4.0,średni,4,1.0
1.0,slavicnetworks,"🇵🇱 POLAND LEADS EUROPE WITH A PRO-FAMILY REVOLUTION President Karol Nawrocki continues Poland’s demographic renewal — families with two or more children are now exempt from paying income tax. While Western Europe faces population decline and responds with mass immigration, Poland has chosen a different path — investing in its own people. This new law, signed and supported by President Nawrocki, aims to reward families, strengthen national birth rates, and protect Poland’s social identity for generations to come. The idea immediately went viral internationally: 🇬🇧 British commentator Tommy Robinson wrote — “This is how you solve a declining birth rate, not by importing millions of Muslims.” 🇺🇸 American analysts called it “HUGE”, saying the United States should follow Poland’s example. This is not just economics — it’s a civilizational choice. Poland refuses to solve its demographic issues through cultural replacement. Instead, it’s proving that a strong nation builds its future on its own families, traditions, and values. ⸻ Do you think other Slavic nations should follow Poland’s model? 🇸🇰🇨🇿🇷🇸🇸🇮🇭🇷🇧🇾🇧🇬 @Nirali_1989 @SlavFreeSpirit @VladVVeles",0,4,0,4,19-10-25,2025-10-19,2025.0,10.0,19.0,0.0,"🇵🇱 POLAND LEADS EUROPE WITH A PRO-FAMILY REVOLUTION President Karol Nawrocki continues Poland’s demographic renewal — families with two or more children are now exempt from paying income tax. While Western Europe faces population decline and responds with mass immigration, Poland has chosen a different path — investing in its own people. This new law, signed and supported by President Nawrocki, aims to reward families, strengthen national birth rates, and protect Poland’s social identity for generations to come. The idea immediately went viral internationally: 🇬🇧 British commentator Tommy Robinson wrote — “This is how you solve a declining birth rate, not by importing millions of Muslims.” 🇺🇸 American analysts called it “HUGE”, saying the United States should follow Poland’s example. This is not just economics — it’s a civilizational choice. Poland refuses to solve its demographic issues through cultural replacement. Instead, it’s proving that a strong nation builds its future on its own families, traditions, and values. ⸻ Do you think other Slavic nations should follow Poland’s model? 🇸🇰🇨🇿🇷🇸🇸🇮🇭🇷🇧🇾🇧🇬","🇵🇱 POLAND LEADS EUROPE WITH A PRO-FAMILY REVOLUTION President Karol Nawrocki continues Poland’s demographic renewal — families with two or more children are now exempt from paying income tax. While Western Europe faces population decline and responds with mass immigration, Poland has chosen a different path — investing in its own people. This new law, signed and supported by President Nawrocki, aims to reward families, strengthen national birth rates, and protect Poland’s social identity for generations to come. The idea immediately went viral internationally: 🇬🇧 British commentator Tommy Robinson wrote — “This is how you solve a declining birth rate, not by importing millions of Muslims.” 🇺🇸 American analysts called it “HUGE”, saying the United States should follow Poland’s example. This is not just economics — it’s a civilizational choice. Poland refuses to solve its demographic issues through cultural replacement. Instead, it’s proving that a strong nation builds its future on its own families, traditions, and values. ⸻ Do you think other Slavic nations should follow Poland’s model? 🇸🇰🇨🇿🇷🇸🇸🇮🇭🇷🇧🇾🇧🇬",@Nirali_1989|@SlavFreeSpirit|@VladVVeles,,,3,0,0,1117,169,4.0,średni,4,1.0
14.0,maro00519174901,"""Podatkowy konkordat"". Nawrocki obiecuje zwolnienie od podatku za darowane przez seniorów kawalerki ...",0,0,0,0,20-10-25,2025-10-20,2025.0,10.0,20.0,0.0,"""Podatkowy konkordat"". Nawrocki obiecuje zwolnienie od podatku za darowane przez seniorów kawalerki ...","""Podatkowy konkordat"". Nawrocki obiecuje zwolnienie od podatku za darowane przez seniorów kawalerki ...",,,,0,0,0,103,13,0.0,niski,4,1.0
3.0,tellervom,"Kantaväestöä suosivan Puolan presidentti allekirjoitti lain lapsiperheiden tuloverotuksesta luopumisesta👍👍👍 Puolan presidentti Karol Nawrocki, joka vannoi virkavalansa elokuussa, esitteli lakiesityksen ja sen tavoitteena on auttaa perheitä taloudellisesti ja kannustaa kestävään kantaväestön syntyvyyteen maassa, joka kärsii useimpien muiden maiden tavoin syntyvyyden laskusta."" Suomessa pitää tehdä samoin, koskee vain oikeita suomalaisia👍",0,0,0,0,21-10-25,2025-10-21,2025.0,10.0,21.0,0.0,"Kantaväestöä suosivan Puolan presidentti allekirjoitti lain lapsiperheiden tuloverotuksesta luopumisesta👍👍👍 Puolan presidentti Karol Nawrocki, joka vannoi virkavalansa elokuussa, esitteli lakiesityksen ja sen tavoitteena on auttaa perheitä taloudellisesti ja kannustaa kestävään kantaväestön syntyvyyteen maassa, joka kärsii useimpien muiden maiden tavoin syntyvyyden laskusta."" Suomessa pitää tehdä samoin, koskee vain oikeita suomalaisia👍","Kantaväestöä suosivan Puolan presidentti allekirjoitti lain lapsiperheiden tuloverotuksesta luopumisesta👍👍👍 Puolan presidentti Karol Nawrocki, joka vannoi virkavalansa elokuussa, esitteli lakiesityksen ja sen tavoitteena on auttaa perheitä taloudellisesti ja kannustaa kestävään kantaväestön syntyvyyteen maassa, joka kärsii useimpien muiden maiden tavoin syntyvyyden laskusta."" Suomessa pitää tehdä samoin, koskee vain oikeita suomalaisia👍",,,,0,0,0,440,48,0.0,niski,4,1.0
26.0,wiihol,Prezydent Karol Nawrocki podpisał nowelizację Ordynacji podatkowej. Od teraz wątpliwości dotyczące stanu faktycznego w postępowaniu urzędowym będą rozstrzygane na korzyść podatnika. biznes.interia.pl/finanse/ne…,0,1,0,1,21-10-25,2025-10-21,2025.0,10.0,21.0,0.0,Prezydent Karol Nawrocki podpisał nowelizację Ordynacji podatkowej. Od teraz wątpliwości dotyczące stanu faktycznego w postępowaniu urzędowym będą rozstrzygane na korzyść podatnika. biznes.,Prezydent Karol Nawrocki podpisał nowelizację Ordynacji podatkowej. Od teraz wątpliwości dotyczące stanu faktycznego w postępowaniu urzędowym będą rozstrzygane na korzyść podatnika. biznes.,,,interia.pl/finanse/ne…,0,0,1,189,22,1.0,średni,4,1.0
112.0,peterrush1984,"🇵🇱 POLAND Update - FAMILY FIRST 👍 🚨 Poland fully exempts parents with two or more children from income tax. President Nawrocki : The family is the heart of the nation and must also be the center of the economy,"" Details : gatewayhispanic.com/2025/10/…",0,1,0,1,21-10-25,2025-10-21,2025.0,10.0,21.0,0.0,"🇵🇱 POLAND Update - FAMILY FIRST 👍 🚨 Poland fully exempts parents with two or more children from income tax. President Nawrocki : The family is the heart of the nation and must also be the center of the economy,"" Details :","🇵🇱 POLAND Update - FAMILY FIRST 👍 🚨 Poland fully exempts parents with two or more children from income tax. President Nawrocki : The family is the heart of the nation and must also be the center of the economy,"" Details :",,,gatewayhispanic.com/2025/10/…,0,0,1,221,42,1.0,średni,4,1.0
