id,username,text,likes,retweets,replies,total_interactions,post_date_iso,date,year,month,day,hour,text_clean,text_no_links,mentions,hashtags,urls,n_mentions,n_hashtags,n_urls,char_count,word_count,amplification_ratio,reach_tier,cluster,cluster_prob
14.0,michalmazur85,Widzicie? Nawrocki dopiero co wygrał i już można bez elgiebetów się komunikować.,0,0,0,0,28-06-25,2025-06-28,2025.0,6.0,28.0,0.0,Widzicie? Nawrocki dopiero co wygrał i już można bez elgiebetów się komunikować.,Widzicie? Nawrocki dopiero co wygrał i już można bez elgiebetów się komunikować.,,,,0,0,0,80,12,0.0,niski,25,1.0
16.0,mgolonko2858,"Widzisz bełkoczący przygłupie, Pan Nawrocki wygrał dzięki takim rzygającym jadem pajacom jak 🫵, nikt tak nie potrafił zochydzić tęczowego Rafałka i jego sekty, dziękujemy że jesteś, i prosimy o więcej 🤝",0,0,0,0,28-06-25,2025-06-28,2025.0,6.0,28.0,0.0,"Widzisz bełkoczący przygłupie, Pan Nawrocki wygrał dzięki takim rzygającym jadem pajacom jak 🫵, nikt tak nie potrafił zochydzić tęczowego Rafałka i jego sekty, dziękujemy że jesteś, i prosimy o więcej 🤝","Widzisz bełkoczący przygłupie, Pan Nawrocki wygrał dzięki takim rzygającym jadem pajacom jak 🫵, nikt tak nie potrafił zochydzić tęczowego Rafałka i jego sekty, dziękujemy że jesteś, i prosimy o więcej 🤝",,,,0,0,0,202,31,0.0,niski,25,0.7770116165276055
20.0,monikakg1014,"nawrocki był dla Sławka patusem, jak walczyli o 2 turę potem petentem w drugiej teraz Sławek się uśmiecha i przymila ale przy całej tragedii takiej koalicji, niech już może ta konfa i razemki wejdą do rządu z pisem, chłopcy z tik toka mogą się rozczarować swoimi wybrańcami",0,0,0,0,28-06-25,2025-06-28,2025.0,6.0,28.0,0.0,"nawrocki był dla Sławka patusem, jak walczyli o 2 turę potem petentem w drugiej teraz Sławek się uśmiecha i przymila ale przy całej tragedii takiej koalicji, niech już może ta konfa i razemki wejdą do rządu z pisem, chłopcy z tik toka mogą się rozczarować swoimi wybrańcami","nawrocki był dla Sławka patusem, jak walczyli o 2 turę potem petentem w drugiej teraz Sławek się uśmiecha i przymila ale przy całej tragedii takiej koalicji, niech już może ta konfa i razemki wejdą do rządu z pisem, chłopcy z tik toka mogą się rozczarować swoimi wybrańcami",,,,0,0,0,273,47,0.0,niski,25,0.4210849892290558
104.0,marek17980882,Dzięki mądrym Polakom wygrał Nawrocki. Teraz trochę poczekaj i wielu będzie siedzieć. Tym razem nie będzie grubej kreski.,0,0,0,0,29-06-25,2025-06-29,2025.0,6.0,29.0,0.0,Dzięki mądrym Polakom wygrał Nawrocki. Teraz trochę poczekaj i wielu będzie siedzieć. Tym razem nie będzie grubej kreski.,Dzięki mądrym Polakom wygrał Nawrocki. Teraz trochę poczekaj i wielu będzie siedzieć. Tym razem nie będzie grubej kreski.,,,,0,0,0,121,18,0.0,niski,25,1.0
23.0,mazojciec,Wygrał Karol Nawrocki. Widać kopnięcie przez konia z udarem w głowę trochę w niej Pani poprzestawiało.,0,0,0,0,29-06-25,2025-06-29,2025.0,6.0,29.0,0.0,Wygrał Karol Nawrocki. Widać kopnięcie przez konia z udarem w głowę trochę w niej Pani poprzestawiało.,Wygrał Karol Nawrocki. Widać kopnięcie przez konia z udarem w głowę trochę w niej Pani poprzestawiało.,,,,0,0,0,102,16,0.0,niski,25,0.348087002277213
26.0,robsob1981,Karol Nawrocki wygrał 🤣 gdybyś nie słyszał to pomogłem,0,0,0,0,29-06-25,2025-06-29,2025.0,6.0,29.0,0.0,Karol Nawrocki wygrał 🤣 gdybyś nie słyszał to pomogłem,Karol Nawrocki wygrał 🤣 gdybyś nie słyszał to pomogłem,,,,0,0,0,54,9,0.0,niski,25,0.8982485251532216
29.0,niebeton,Wygrał Nawrocki! No i juz wiesz 💪,0,0,0,0,30-06-25,2025-06-30,2025.0,6.0,30.0,0.0,Wygrał Nawrocki! No i juz wiesz 💪,Wygrał Nawrocki! No i juz wiesz 💪,,,,0,0,0,33,7,0.0,niski,25,0.8332073746492125
10.0,juliuszcyran1,Wygrał Nawrocki więc nie ma imigrantów,0,0,0,0,30-06-25,2025-06-30,2025.0,6.0,30.0,0.0,Wygrał Nawrocki więc nie ma imigrantów,Wygrał Nawrocki więc nie ma imigrantów,,,,0,0,0,38,6,0.0,niski,25,0.9054490258151694
15.0,belinawojciech,O tym mówiłem od samego początku. Do przeliczenia wszystkie głosy. Jeśli Nawrocki wygrywa to wygrywa i po sprawie.,0,0,0,0,30-06-25,2025-06-30,2025.0,6.0,30.0,0.0,O tym mówiłem od samego początku. Do przeliczenia wszystkie głosy. Jeśli Nawrocki wygrywa to wygrywa i po sprawie.,O tym mówiłem od samego początku. Do przeliczenia wszystkie głosy. Jeśli Nawrocki wygrywa to wygrywa i po sprawie.,,,,0,0,0,114,18,0.0,niski,25,0.3454565906841523
28.0,q3szczawson,"Bo wygrał Nawrocki i jak tusku wróci do siebie do niemiec to znowu firmy się będą otwierać, w tym moją odwiesze.",0,0,0,0,30-06-25,2025-06-30,2025.0,6.0,30.0,0.0,"Bo wygrał Nawrocki i jak tusku wróci do siebie do niemiec to znowu firmy się będą otwierać, w tym moją odwiesze.","Bo wygrał Nawrocki i jak tusku wróci do siebie do niemiec to znowu firmy się będą otwierać, w tym moją odwiesze.",,,,0,0,0,112,21,0.0,niski,25,0.2528115515211121
225.0,zolkaa73,"Tego czy Karol Nawrocki wygrał nie wie nikt. Obawiam się, ze jednak nie wygrał. Tak jak nie wygrał Duda w 2020 r.",0,0,0,0,29-06-25,2025-06-29,2025.0,6.0,29.0,0.0,"Tego czy Karol Nawrocki wygrał nie wie nikt. Obawiam się, ze jednak nie wygrał. Tak jak nie wygrał Duda w 2020 r.","Tego czy Karol Nawrocki wygrał nie wie nikt. Obawiam się, ze jednak nie wygrał. Tak jak nie wygrał Duda w 2020 r.",,,,0,0,0,113,22,0.0,niski,25,0.6153357543643577
86.0,zardah83,Bo sie nic nie stalo. I tak Wygrał Nawrocki,0,0,0,0,01-07-25,2025-07-01,2025.0,7.0,1.0,0.0,Bo sie nic nie stalo. I tak Wygrał Nawrocki,Bo sie nic nie stalo. I tak Wygrał Nawrocki,,,,0,0,0,43,9,0.0,niski,25,0.9351554119926684
394.0,michalm1978,Ale to Nawrocki wygrał a nie dupiarz Sorosa…,0,0,0,0,01-07-25,2025-07-01,2025.0,7.0,1.0,0.0,Ale to Nawrocki wygrał a nie dupiarz Sorosa…,Ale to Nawrocki wygrał a nie dupiarz Sorosa…,,,,0,0,0,44,8,0.0,niski,25,1.0
4.0,marek_kuna_,‼️🔥‼️ - Gdyby w USA wygrała Harris to Nawrocki nie zostałby zaprzysiężony i mógłby trafić do więzienia. - Za co? - Za miłość do Ojczyzny. 🙄,1,35,2,38,02-07-25,2025-07-02,2025.0,7.0,2.0,0.0,‼️🔥‼️ - Gdyby w USA wygrała Harris to Nawrocki nie zostałby zaprzysiężony i mógłby trafić do więzienia. - Za co? - Za miłość do Ojczyzny. 🙄,‼️🔥‼️ - Gdyby w USA wygrała Harris to Nawrocki nie zostałby zaprzysiężony i mógłby trafić do więzienia. - Za co? - Za miłość do Ojczyzny. 🙄,,,,0,0,0,139,26,17.5,wysoki,25,1.0
100.0,nahoris_,"Dane są takie, że Nawrocki wygrał. Koniec tematu. Mam nadzieję, że pomogłem rozwiać wszelkie wątpliwości.",0,0,0,0,02-07-25,2025-07-02,2025.0,7.0,2.0,0.0,"Dane są takie, że Nawrocki wygrał. Koniec tematu. Mam nadzieję, że pomogłem rozwiać wszelkie wątpliwości.","Dane są takie, że Nawrocki wygrał. Koniec tematu. Mam nadzieję, że pomogłem rozwiać wszelkie wątpliwości.",,,,0,0,0,105,15,0.0,niski,25,0.4993939614592723
139.0,paweljalocha,"Normalnie nie mogę uwierzyć: co się stało, kiedy proces ?! Czy to dlatego, że wygrał Nawrocki ?!",0,1,0,1,03-07-25,2025-07-03,2025.0,7.0,3.0,0.0,"Normalnie nie mogę uwierzyć: co się stało, kiedy proces ?! Czy to dlatego, że wygrał Nawrocki ?!","Normalnie nie mogę uwierzyć: co się stało, kiedy proces ?! Czy to dlatego, że wygrał Nawrocki ?!",,,,0,0,0,96,17,1.0,średni,25,1.0
2.0,gorakakasi69623,Dokładnie tak! Dlatego jest takie wycie ponieważ wygrał dr Karol Nawrocki!,0,0,0,0,07-07-25,2025-07-07,2025.0,7.0,7.0,0.0,Dokładnie tak! Dlatego jest takie wycie ponieważ wygrał dr Karol Nawrocki!,Dokładnie tak! Dlatego jest takie wycie ponieważ wygrał dr Karol Nawrocki!,,,,0,0,0,74,11,0.0,niski,25,0.959001566918257
1.0,kontestatorm,"Lucek, na co ci ta wiedza. Pogódź się z faktem, że wygrał K. Nawrocki. 😂",0,0,0,0,07-07-25,2025-07-07,2025.0,7.0,7.0,0.0,"Lucek, na co ci ta wiedza. Pogódź się z faktem, że wygrał K. Nawrocki. 😂","Lucek, na co ci ta wiedza. Pogódź się z faktem, że wygrał K. Nawrocki. 😂",,,,0,0,0,72,15,0.0,niski,25,0.7029012847027654
4.0,brylantpasy,Wygrał Karol Nawrocki. Jebana pizdo na zasiłku.,0,0,0,0,07-07-25,2025-07-07,2025.0,7.0,7.0,0.0,Wygrał Karol Nawrocki. Jebana pizdo na zasiłku.,Wygrał Karol Nawrocki. Jebana pizdo na zasiłku.,,,,0,0,0,47,7,0.0,niski,25,1.0
12.0,erto108,A co. Telewizji nie masz? Nawrocki wygrał jakby co .,0,0,0,0,07-07-25,2025-07-07,2025.0,7.0,7.0,0.0,A co. Telewizji nie masz? Nawrocki wygrał jakby co .,A co. Telewizji nie masz? Nawrocki wygrał jakby co .,,,,0,0,0,52,10,0.0,niski,25,0.6797607268206078
27.0,izab96015388398,Wygrał Karol Nawrocki. Nieprawidłowości były jak za każdym innym razem w przeszłości bez wpływu na wynik. KURTYNA,0,0,0,0,07-07-25,2025-07-07,2025.0,7.0,7.0,0.0,Wygrał Karol Nawrocki. Nieprawidłowości były jak za każdym innym razem w przeszłości bez wpływu na wynik. KURTYNA,Wygrał Karol Nawrocki. Nieprawidłowości były jak za każdym innym razem w przeszłości bez wpływu na wynik. KURTYNA,,,,0,0,0,113,17,0.0,niski,25,1.0
1.0,theza77,Zryw społeczny z 15 X 2023r. Wygrał Nawrocki? Ja 100% pewności nie mam.,0,0,0,0,07-07-25,2025-07-07,2025.0,7.0,7.0,0.0,Zryw społeczny z 15 X 2023r. Wygrał Nawrocki? Ja 100% pewności nie mam.,Zryw społeczny z 15 X 2023r. Wygrał Nawrocki? Ja 100% pewności nie mam.,,,,0,0,0,71,13,0.0,niski,25,0.4276970295779866
12.0,gala346008013,Nie udało się skręcić na zaświadczenia Jagodziński przygłupie a i tak skreciliscje bo Nawrocki wygrał większą przewagę,0,0,0,0,,,,,,,Nie udało się skręcić na zaświadczenia Jagodziński przygłupie a i tak skreciliscje bo Nawrocki wygrał większą przewagę,Nie udało się skręcić na zaświadczenia Jagodziński przygłupie a i tak skreciliscje bo Nawrocki wygrał większą przewagę,,,,0,0,0,118,17,0.0,niski,25,0.5803947464652086
18.0,jakub0878061595,"Bo wyliczyli,że Nawrocki wygrał 🤣",0,0,0,0,,,,,,,"Bo wyliczyli,że Nawrocki wygrał 🤣","Bo wyliczyli,że Nawrocki wygrał 🤣",,,,0,0,0,33,5,0.0,niski,25,1.0
16.0,ren1246767,"Gratuluję i bardzo cieszy mnie ten wybór, będzie super drużyna,bo Pan Karol Nawrocki potrzebuje zaufanych i mądrych ludzi przy swoim boku. Pozdrawiam serdecznie 👍✌️👊💪🇵🇱",0,0,0,0,,,,,,,"Gratuluję i bardzo cieszy mnie ten wybór, będzie super drużyna,bo Pan Karol Nawrocki potrzebuje zaufanych i mądrych ludzi przy swoim boku. Pozdrawiam serdecznie 👍✌️👊💪🇵🇱","Gratuluję i bardzo cieszy mnie ten wybór, będzie super drużyna,bo Pan Karol Nawrocki potrzebuje zaufanych i mądrych ludzi przy swoim boku. Pozdrawiam serdecznie 👍✌️👊💪🇵🇱",,,,0,0,0,168,24,0.0,niski,25,0.254984143996977
31.0,jackob_cycu,"Wygrywa ten co miał więcej głosów nie robi laski Niemcowi, czyli Nawrocki.",0,0,0,0,,,,,,,"Wygrywa ten co miał więcej głosów nie robi laski Niemcowi, czyli Nawrocki.","Wygrywa ten co miał więcej głosów nie robi laski Niemcowi, czyli Nawrocki.",,,,0,0,0,74,12,0.0,niski,25,0.4313089240029968
389.0,panjacy,Ja ci mogę doprecyzować: Nawrocki wygrał ilomaś tam głosami z dokładnością co do jednego. Nie ma za co.,0,0,0,0,29-07-25,2025-07-29,2025.0,7.0,29.0,0.0,Ja ci mogę doprecyzować: Nawrocki wygrał ilomaś tam głosami z dokładnością co do jednego. Nie ma za co.,Ja ci mogę doprecyzować: Nawrocki wygrał ilomaś tam głosami z dokładnością co do jednego. Nie ma za co.,,,,0,0,0,103,18,0.0,niski,25,0.3429149120222726
11.0,michal931418371,"A huj ci w dupę. Specjalnie oddałem głos na Nawrockiego żeby zobaczyć debilu twoja minę xD tak, dzięki tobie,Giertychowi i tuskowi Nawrocki wygrał",0,0,0,0,30-07-25,2025-07-30,2025.0,7.0,30.0,0.0,"A huj ci w dupę. Specjalnie oddałem głos na Nawrockiego żeby zobaczyć debilu twoja minę xD tak, dzięki tobie,Giertychowi i tuskowi Nawrocki wygrał","A huj ci w dupę. Specjalnie oddałem głos na Nawrockiego żeby zobaczyć debilu twoja minę xD tak, dzięki tobie,Giertychowi i tuskowi Nawrocki wygrał",,,,0,0,0,146,23,0.0,niski,25,0.4427748062153623
5.0,polakzpol,Nawrocki nie ma szans wygrać tylko ja mam szanse 🤣🤣🤣,1,7,3,11,30-07-25,2025-07-30,2025.0,7.0,30.0,0.0,Nawrocki nie ma szans wygrać tylko ja mam szanse 🤣🤣🤣,Nawrocki nie ma szans wygrać tylko ja mam szanse 🤣🤣🤣,,,,0,0,0,52,10,2.33,średni,25,1.0
20.0,kmkrynicka,To Nawrocki jednak wygrał? 🤫,0,0,0,0,30-07-25,2025-07-30,2025.0,7.0,30.0,0.0,To Nawrocki jednak wygrał? 🤫,To Nawrocki jednak wygrał? 🤫,,,,0,0,0,28,5,0.0,niski,25,1.0
128.0,macieklewando16,To jednak Nawrocki wygrał? Oj silni razem nie będą zachwyceni.. oni nadal liczą głosy 🤣,0,2,0,2,30-07-25,2025-07-30,2025.0,7.0,30.0,0.0,To jednak Nawrocki wygrał? Oj silni razem nie będą zachwyceni.. oni nadal liczą głosy 🤣,To jednak Nawrocki wygrał? Oj silni razem nie będą zachwyceni.. oni nadal liczą głosy 🤣,,,,0,0,0,87,15,2.0,średni,25,0.6413352684451361
189.0,leon2025338685,"Cóż za zmiana Pan Roman otwarcie pisze, że Karol Nawrocki wygral",0,1,0,1,30-07-25,2025-07-30,2025.0,7.0,30.0,0.0,"Cóż za zmiana Pan Roman otwarcie pisze, że Karol Nawrocki wygral","Cóż za zmiana Pan Roman otwarcie pisze, że Karol Nawrocki wygral",,,,0,0,0,64,11,1.0,średni,25,0.5931700537132594
190.0,59jpiech,Jacy oni wszyscy sa jednoznacznie pewni ze Nawrocki wygral .Pytam sie na jakiej podstawie ta pewność?,0,52,82,134,30-07-25,2025-07-30,2025.0,7.0,30.0,0.0,Jacy oni wszyscy sa jednoznacznie pewni ze Nawrocki wygral .Pytam sie na jakiej podstawie ta pewność?,Jacy oni wszyscy sa jednoznacznie pewni ze Nawrocki wygral .Pytam sie na jakiej podstawie ta pewność?,,,,0,0,0,101,16,0.63,wysoki,25,0.3169075846917545
221.0,rmacierzynski2,"Aha, czyli jednak Nawrocki wygrał 🤣",0,2,0,2,30-07-25,2025-07-30,2025.0,7.0,30.0,0.0,"Aha, czyli jednak Nawrocki wygrał 🤣","Aha, czyli jednak Nawrocki wygrał 🤣",,,,0,0,0,35,6,2.0,średni,25,1.0
11.0,jerichov5,PiS gdyby wiedział że Nawrocki wygrał a nie wygrał na 100 procent nie musiałby męczyć biednego Szymona po nocach.,0,5,0,5,30-07-25,2025-07-30,2025.0,7.0,30.0,0.0,PiS gdyby wiedział że Nawrocki wygrał a nie wygrał na 100 procent nie musiałby męczyć biednego Szymona po nocach.,PiS gdyby wiedział że Nawrocki wygrał a nie wygrał na 100 procent nie musiałby męczyć biednego Szymona po nocach.,,,,0,0,0,113,19,5.0,średni,25,0.9121750674670316
465.0,beatamlynarek,Popukajcie się. Ale nie dziwię się. Obecnie też madrale nie mogą zrozumieć dlaczego wygral Nawrocki.🤦‍♂️🤦‍♂️🤦‍♂️🤦‍♂️🤦‍♂️🤦‍♂️,0,0,0,0,31-07-25,2025-07-31,2025.0,7.0,31.0,0.0,Popukajcie się. Ale nie dziwię się. Obecnie też madrale nie mogą zrozumieć dlaczego wygral Nawrocki.🤦‍♂️🤦‍♂️🤦‍♂️🤦‍♂️🤦‍♂️🤦‍♂️,Popukajcie się. Ale nie dziwię się. Obecnie też madrale nie mogą zrozumieć dlaczego wygral Nawrocki.🤦‍♂️🤦‍♂️🤦‍♂️🤦‍♂️🤦‍♂️🤦‍♂️,,,,0,0,0,124,15,0.0,niski,25,1.0
4.0,damian812167,"Jak liczenie im będzie szło tak samo jak rozliczenia, czyli żaden pisowiec nie siedzi tylko do paki idzie dwóch członków po, to Nawrocki napewno wygrał xd",0,0,0,0,31-07-25,2025-07-31,2025.0,7.0,31.0,0.0,"Jak liczenie im będzie szło tak samo jak rozliczenia, czyli żaden pisowiec nie siedzi tylko do paki idzie dwóch członków po, to Nawrocki napewno wygrał xd","Jak liczenie im będzie szło tak samo jak rozliczenia, czyli żaden pisowiec nie siedzi tylko do paki idzie dwóch członków po, to Nawrocki napewno wygrał xd",,,,0,0,0,154,26,0.0,niski,25,1.0
10.0,arekszera56160,Znam stara ruro na wykopie pisali że wygrał Nawrocki.,0,0,0,0,31-07-25,2025-07-31,2025.0,7.0,31.0,0.0,Znam stara ruro na wykopie pisali że wygrał Nawrocki.,Znam stara ruro na wykopie pisali że wygrał Nawrocki.,,,,0,0,0,53,9,0.0,niski,25,1.0
23.0,dawidadamiak94,Wygrał Nawrocki. Nie dziękuj. 😉,0,0,0,0,31-07-25,2025-07-31,2025.0,7.0,31.0,0.0,Wygrał Nawrocki. Nie dziękuj. 😉,Wygrał Nawrocki. Nie dziękuj. 😉,,,,0,0,0,31,5,0.0,niski,25,1.0
28.0,leszek86506466,Jak było ? W lomisjach obsadzonych przez PO i przystawki Nawrocki też wygrał. Mimo że w wielu oszukiwano,0,0,0,0,31-07-25,2025-07-31,2025.0,7.0,31.0,0.0,Jak było ? W lomisjach obsadzonych przez PO i przystawki Nawrocki też wygrał. Mimo że w wielu oszukiwano,Jak było ? W lomisjach obsadzonych przez PO i przystawki Nawrocki też wygrał. Mimo że w wielu oszukiwano,,,,0,0,0,104,18,0.0,niski,25,1.0
10.0,joasia_1984,"No dzięki komu wygrał Nawrocki?? Mencwelowi, któremu przez gardło nie przeszło ""Karol Nawrocki"". Spadówa do Banasia stolik wywracać!",0,0,0,0,31-07-25,2025-07-31,2025.0,7.0,31.0,0.0,"No dzięki komu wygrał Nawrocki?? Mencwelowi, któremu przez gardło nie przeszło ""Karol Nawrocki"". Spadówa do Banasia stolik wywracać!","No dzięki komu wygrał Nawrocki?? Mencwelowi, któremu przez gardło nie przeszło ""Karol Nawrocki"". Spadówa do Banasia stolik wywracać!",,,,0,0,0,132,18,0.0,niski,25,0.6237927264851958
24.0,jarekpapis,"Mam pytanie do Polaków, którzy deklarowali przed II turą, że wyjadą z kraju, jak wygra Nawrocki. Już pojechaliście?",0,75,61,136,04-08-25,2025-08-04,2025.0,8.0,4.0,0.0,"Mam pytanie do Polaków, którzy deklarowali przed II turą, że wyjadą z kraju, jak wygra Nawrocki. Już pojechaliście?","Mam pytanie do Polaków, którzy deklarowali przed II turą, że wyjadą z kraju, jak wygra Nawrocki. Już pojechaliście?",,,,0,0,0,115,18,1.23,wysoki,25,0.4081459260389387
24.0,sweetbo46859547,"Nie wiemy czy Nawrocki wygrał, więc daruj sobie pisowcu żenujące podśmiechujki.",0,0,0,0,04-08-25,2025-08-04,2025.0,8.0,4.0,0.0,"Nie wiemy czy Nawrocki wygrał, więc daruj sobie pisowcu żenujące podśmiechujki.","Nie wiemy czy Nawrocki wygrał, więc daruj sobie pisowcu żenujące podśmiechujki.",,,,0,0,0,79,11,0.0,niski,25,0.507692544145576
16.0,tomaszgraczyk10,Tak zwyciężył K. Nawrocki więc nie rozumiem skąd te wycie u Platformersow i reszty tych dziwaków.,0,3,1,4,04-08-25,2025-08-04,2025.0,8.0,4.0,0.0,Tak zwyciężył K. Nawrocki więc nie rozumiem skąd te wycie u Platformersow i reszty tych dziwaków.,Tak zwyciężył K. Nawrocki więc nie rozumiem skąd te wycie u Platformersow i reszty tych dziwaków.,,,,0,0,0,97,16,3.0,średni,25,0.647729175108877
20.0,_rafaello81,"Drogie lewaki. Mówicie, że nikt nigdy nie dotrzymuje obietnic. Więc dotrzymajcie swoją, że po tym jak wygra Nawrocki wyjedziecie z kraju. 😉",0,1,0,1,04-08-25,2025-08-04,2025.0,8.0,4.0,0.0,"Drogie lewaki. Mówicie, że nikt nigdy nie dotrzymuje obietnic. Więc dotrzymajcie swoją, że po tym jak wygra Nawrocki wyjedziecie z kraju. 😉","Drogie lewaki. Mówicie, że nikt nigdy nie dotrzymuje obietnic. Więc dotrzymajcie swoją, że po tym jak wygra Nawrocki wyjedziecie z kraju. 😉",,,,0,0,0,139,22,1.0,średni,25,0.35405110936295
26.0,tomasz95749185,"Sam się podpisał pod uchwałą, że wygrał Nawrocki. Z kogo on robi idiotów? Ja się domyślam, ale może inni w końcu to zrozumieją...",0,2,5,7,04-08-25,2025-08-04,2025.0,8.0,4.0,0.0,"Sam się podpisał pod uchwałą, że wygrał Nawrocki. Z kogo on robi idiotów? Ja się domyślam, ale może inni w końcu to zrozumieją...","Sam się podpisał pod uchwałą, że wygrał Nawrocki. Z kogo on robi idiotów? Ja się domyślam, ale może inni w końcu to zrozumieją...",,,,0,0,0,129,23,0.4,średni,25,0.4856686458109929
256.0,jasnygrom83,W których wygrał Karol Nawrocki.,0,0,0,0,06-08-25,2025-08-06,2025.0,8.0,6.0,0.0,W których wygrał Karol Nawrocki.,W których wygrał Karol Nawrocki.,,,,0,0,0,32,5,0.0,niski,25,1.0
2.0,ma_grus,No to iloma głosami wygrał Nawrocki ?,0,1,0,1,10-08-25,2025-08-10,2025.0,8.0,10.0,0.0,No to iloma głosami wygrał Nawrocki ?,No to iloma głosami wygrał Nawrocki ?,,,,0,0,0,37,7,1.0,średni,25,0.8312847427762766
28.0,jwkecaj,"Jak wygral Nawrocki prwna cora UBeka (Holland) tutaj na tt dokonala wpisu ""wygral motloch"". Czy pani wywod rowniez jej dotyczy?",0,1,0,1,11-08-25,2025-08-11,2025.0,8.0,11.0,0.0,"Jak wygral Nawrocki prwna cora UBeka (Holland) tutaj na tt dokonala wpisu ""wygral motloch"". Czy pani wywod rowniez jej dotyczy?","Jak wygral Nawrocki prwna cora UBeka (Holland) tutaj na tt dokonala wpisu ""wygral motloch"". Czy pani wywod rowniez jej dotyczy?",,,,0,0,0,127,20,1.0,średni,25,1.0
297.0,antietam_zibi,"A kto ci powiedział, że wygrał Nawrocki ?",0,0,0,0,11-08-25,2025-08-11,2025.0,8.0,11.0,0.0,"A kto ci powiedział, że wygrał Nawrocki ?","A kto ci powiedział, że wygrał Nawrocki ?",,,,0,0,0,41,8,0.0,niski,25,0.9054490258151694
5.0,niewaznyanonim,"Już wasz udar przestaje być śmieszny a robi się coraz bardziej żałosny, wygrał Nawrocki 😉",0,0,0,0,18-08-25,2025-08-18,2025.0,8.0,18.0,0.0,"Już wasz udar przestaje być śmieszny a robi się coraz bardziej żałosny, wygrał Nawrocki 😉","Już wasz udar przestaje być śmieszny a robi się coraz bardziej żałosny, wygrał Nawrocki 😉",,,,0,0,0,89,15,0.0,niski,25,1.0
193.0,rycynka1952,"Tani prąd,a nawet darmowy Nawrocki będzie miał przez 5 lat.",0,0,0,0,21-08-25,2025-08-21,2025.0,8.0,21.0,0.0,"Tani prąd,a nawet darmowy Nawrocki będzie miał przez 5 lat.","Tani prąd,a nawet darmowy Nawrocki będzie miał przez 5 lat.",,,,0,0,0,59,10,0.0,niski,25,0.3971894412413599
135.0,zielonoszara,"Prokuratura nie przeliczy wszystkich głosów. Nie ma podstaw. A nawet jak przeliczy, to wygrał Nawrocki. Ktoś Wam sprzedał bajkę, uwierzyliście, ale pora wracać do rzeczywistości.",0,0,0,0,22-08-25,2025-08-22,2025.0,8.0,22.0,0.0,"Prokuratura nie przeliczy wszystkich głosów. Nie ma podstaw. A nawet jak przeliczy, to wygrał Nawrocki. Ktoś Wam sprzedał bajkę, uwierzyliście, ale pora wracać do rzeczywistości.","Prokuratura nie przeliczy wszystkich głosów. Nie ma podstaw. A nawet jak przeliczy, to wygrał Nawrocki. Ktoś Wam sprzedał bajkę, uwierzyliście, ale pora wracać do rzeczywistości.",,,,0,0,0,178,25,0.0,niski,25,0.2880985971427378
77.0,ritamarkiewicz,"Oddaliśmy na Niego głos i Bogu dziękujemy, że wygrał właśnie Pan Nawrocki.",0,0,0,0,22-08-25,2025-08-22,2025.0,8.0,22.0,0.0,"Oddaliśmy na Niego głos i Bogu dziękujemy, że wygrał właśnie Pan Nawrocki.","Oddaliśmy na Niego głos i Bogu dziękujemy, że wygrał właśnie Pan Nawrocki.",,,,0,0,0,74,12,0.0,niski,25,0.4291135461699454
74.0,dawid42560490,Może to lepiej że wygrał Nawrocki bo jak by tak tęczowy wetował to chuj by z koalicji było. Jezu jak oni wyją. 😂😂,0,0,0,0,25-08-25,2025-08-25,2025.0,8.0,25.0,0.0,Może to lepiej że wygrał Nawrocki bo jak by tak tęczowy wetował to chuj by z koalicji było. Jezu jak oni wyją. 😂😂,Może to lepiej że wygrał Nawrocki bo jak by tak tęczowy wetował to chuj by z koalicji było. Jezu jak oni wyją. 😂😂,,,,0,0,0,113,23,0.0,niski,25,0.8517844328590672
15.0,tomaszoko1,"Ruda szmata teraz chce się zemścić na rolnikach, że Nawrocki wygrał xDD",0,1,0,1,27-08-25,2025-08-27,2025.0,8.0,27.0,0.0,"Ruda szmata teraz chce się zemścić na rolnikach, że Nawrocki wygrał xDD","Ruda szmata teraz chce się zemścić na rolnikach, że Nawrocki wygrał xDD",,,,0,0,0,71,12,1.0,średni,25,1.0
189.0,stzerko,"Od dwóch miesięcy twierdzę, że Nawrocki wygrał zdecydowanie. Rachunkowo - przewagą niewielką, ale biorąc pod uwagę skalę ataku mediów i aparatu rządowego, zwycięstwo jest imponujące. Nasze zwycięstwo.",0,6,3,9,31-08-25,2025-08-31,2025.0,8.0,31.0,0.0,"Od dwóch miesięcy twierdzę, że Nawrocki wygrał zdecydowanie. Rachunkowo - przewagą niewielką, ale biorąc pod uwagę skalę ataku mediów i aparatu rządowego, zwycięstwo jest imponujące. Nasze zwycięstwo.","Od dwóch miesięcy twierdzę, że Nawrocki wygrał zdecydowanie. Rachunkowo - przewagą niewielką, ale biorąc pod uwagę skalę ataku mediów i aparatu rządowego, zwycięstwo jest imponujące. Nasze zwycięstwo.",,,,0,0,0,200,27,2.0,średni,25,0.2915253200952437
153.0,murzynfrogxxx,Karol Nawrocki konkurencją dla Ksiażula. Ja bym oglądał.,1,38,21,60,01-09-25,2025-09-01,2025.0,9.0,1.0,0.0,Karol Nawrocki konkurencją dla Ksiażula. Ja bym oglądał.,Karol Nawrocki konkurencją dla Ksiażula. Ja bym oglądał.,,,,0,0,0,56,8,1.81,wysoki,25,0.7830753242898276
128.0,arturitos121212,Dzieki takim jak ty i ta druga babcia wygral Nawrocki.Trzaskowski z Tuskiem powinni wam podziękować za to,0,0,0,0,11-09-25,2025-09-11,2025.0,9.0,11.0,0.0,Dzieki takim jak ty i ta druga babcia wygral Nawrocki.Trzaskowski z Tuskiem powinni wam podziękować za to,Dzieki takim jak ty i ta druga babcia wygral Nawrocki.Trzaskowski z Tuskiem powinni wam podziękować za to,,,,0,0,0,105,17,0.0,niski,25,0.3920415424137563
27.0,krasnolud381712,"Kto nie wygrał? Nawrocki, debilu?",0,0,0,0,15-09-25,2025-09-15,2025.0,9.0,15.0,0.0,"Kto nie wygrał? Nawrocki, debilu?","Kto nie wygrał? Nawrocki, debilu?",,,,0,0,0,33,5,0.0,niski,25,0.5307562786626909
96.0,gi3ko,"Abstrahując to przecież ani Duda, ani Nawrocki miał nie wygrać 😉... A jednak!",0,0,0,0,22-09-25,2025-09-22,2025.0,9.0,22.0,0.0,"Abstrahując to przecież ani Duda, ani Nawrocki miał nie wygrać 😉... A jednak!","Abstrahując to przecież ani Duda, ani Nawrocki miał nie wygrać 😉... A jednak!",,,,0,0,0,77,13,0.0,niski,25,0.8473762035132344
30.0,prpiszczatowski,Ale to wiesz dopiero jak wygra Inaczej się nie da bo zły Nawrocki to i tak zawetuję xdd,0,0,1,1,27-09-25,2025-09-27,2025.0,9.0,27.0,0.0,Ale to wiesz dopiero jak wygra Inaczej się nie da bo zły Nawrocki to i tak zawetuję xdd,Ale to wiesz dopiero jak wygra Inaczej się nie da bo zły Nawrocki to i tak zawetuję xdd,,,,0,0,0,87,18,0.0,średni,25,0.3728394826022849
