id,username,text,likes,retweets,replies,total_interactions,post_date_iso,date,year,month,day,hour,text_clean,text_no_links,mentions,hashtags,urls,n_mentions,n_hashtags,n_urls,char_count,word_count,amplification_ratio,reach_tier,cluster,cluster_prob
14.0,odys79712574,I wy chcecie być poważnie traktowani? Was powinno sie przymusowo leczyc psychiatrycznie,0,0,0,0,05-09-25,2025-09-05,2025.0,9.0,5.0,0.0,I wy chcecie być poważnie traktowani? Was powinno sie przymusowo leczyc psychiatrycznie,I wy chcecie być poważnie traktowani? Was powinno sie przymusowo leczyc psychiatrycznie,,,,0,0,0,87,12,0.0,niski,41,0.8414489766205286
17.0,ukaszmartyniak,"Remont drogi w dużym mieście no kto to słyszał... A tak poważnie, to jest Pani albo głupia, albo za pieniądze robi Pani z siebie głupka. Polecam wtedy zawalczyć we Freakach - większy hajs i od razu mam przeciwnika - Panią Shreiber.",0,0,0,0,05-09-25,2025-09-05,2025.0,9.0,5.0,0.0,"Remont drogi w dużym mieście no kto to słyszał... A tak poważnie, to jest Pani albo głupia, albo za pieniądze robi Pani z siebie głupka. Polecam wtedy zawalczyć we Freakach - większy hajs i od razu mam przeciwnika - Panią Shreiber.","Remont drogi w dużym mieście no kto to słyszał... A tak poważnie, to jest Pani albo głupia, albo za pieniądze robi Pani z siebie głupka. Polecam wtedy zawalczyć we Freakach - większy hajs i od razu mam przeciwnika - Panią Shreiber.",,,,0,0,0,231,41,0.0,niski,41,0.5946419449009506
31.0,jacekwalle50033,"Jak się nie podoba, to wyp....",0,0,0,0,05-09-25,2025-09-05,2025.0,9.0,5.0,0.0,"Jak się nie podoba, to wyp....","Jak się nie podoba, to wyp....",,,,0,0,0,30,6,0.0,niski,41,0.8195930755024937
10.0,tobiasz131313,To raczej z cyklu pytań retorycznych,0,0,0,0,05-09-25,2025-09-05,2025.0,9.0,5.0,0.0,To raczej z cyklu pytań retorycznych,To raczej z cyklu pytań retorycznych,,,,0,0,0,36,6,0.0,niski,41,0.6066795277299819
12.0,amk_aga,Ależ Ty jesteś tak zwyczajnie głupia 🤣🤣🤣🤣,0,0,0,0,05-09-25,2025-09-05,2025.0,9.0,5.0,0.0,Ależ Ty jesteś tak zwyczajnie głupia 🤣🤣🤣🤣,Ależ Ty jesteś tak zwyczajnie głupia 🤣🤣🤣🤣,,,,0,0,0,41,7,0.0,niski,41,0.7373943403414784
18.0,halina_czerna,"ja do cioci z zakupami objazdem, chyba na mnie też się zawziął 😇",0,0,0,0,05-09-25,2025-09-05,2025.0,9.0,5.0,0.0,"ja do cioci z zakupami objazdem, chyba na mnie też się zawziął 😇","ja do cioci z zakupami objazdem, chyba na mnie też się zawziął 😇",,,,0,0,0,64,13,0.0,niski,41,0.6153083531098812
24.0,wanda_agnieszka,Powinno się wykopać rów a wiesz po co⁉️,0,0,0,0,05-09-25,2025-09-05,2025.0,9.0,5.0,0.0,Powinno się wykopać rów a wiesz po co⁉️,Powinno się wykopać rów a wiesz po co⁉️,,,,0,0,0,39,8,0.0,niski,41,0.7765885927636103
26.0,robert95069900,"czy ta glupota ciebie boli?pytam sie na powaznie,,tepa dzida jestes",0,0,0,0,05-09-25,2025-09-05,2025.0,9.0,5.0,0.0,"czy ta glupota ciebie boli?pytam sie na powaznie,,tepa dzida jestes","czy ta glupota ciebie boli?pytam sie na powaznie,,tepa dzida jestes",,,,0,0,0,67,10,0.0,niski,41,0.8137809084963424
28.0,thomassobi7680,"No i dobrze. Najlepiej zamknąć tę ""firmę"".",0,0,0,0,05-09-25,2025-09-05,2025.0,9.0,5.0,0.0,"No i dobrze. Najlepiej zamknąć tę ""firmę"".","No i dobrze. Najlepiej zamknąć tę ""firmę"".",,,,0,0,0,42,7,0.0,niski,41,0.9727850590876734
30.0,urszulka14,"Idźcie na urlop. Odpoczniecie, my też.",0,0,0,0,05-09-25,2025-09-05,2025.0,9.0,5.0,0.0,"Idźcie na urlop. Odpoczniecie, my też.","Idźcie na urlop. Odpoczniecie, my też.",,,,0,0,0,38,6,0.0,niski,41,0.6330359409819091
152.0,adam_furmanski,"Czy ta ""zemsta"" jest teraz z Tobą w pokoju?",0,0,0,0,05-09-25,2025-09-05,2025.0,9.0,5.0,0.0,"Czy ta ""zemsta"" jest teraz z Tobą w pokoju?","Czy ta ""zemsta"" jest teraz z Tobą w pokoju?",,,,0,0,0,43,9,0.0,niski,41,0.9267205865791248
5.0,anusiek73,"Bozięciuniu jedyny, jaka ty jesteś babo głupia 🤣 Zdradzę ci pewną tajemnicę. Ulice się czasami remontuje. Nawet te w pobliżu Sejmu. I jeszcze jedną ci zdradzę. Za chwilę będziesz bezrobotna, bo mam nadzieję, ktoś zaorze ten biurowiec i zrówna go z ziemią!",0,0,0,0,06-09-25,2025-09-06,2025.0,9.0,6.0,0.0,"Bozięciuniu jedyny, jaka ty jesteś babo głupia 🤣 Zdradzę ci pewną tajemnicę. Ulice się czasami remontuje. Nawet te w pobliżu Sejmu. I jeszcze jedną ci zdradzę. Za chwilę będziesz bezrobotna, bo mam nadzieję, ktoś zaorze ten biurowiec i zrówna go z ziemią!","Bozięciuniu jedyny, jaka ty jesteś babo głupia 🤣 Zdradzę ci pewną tajemnicę. Ulice się czasami remontuje. Nawet te w pobliżu Sejmu. I jeszcze jedną ci zdradzę. Za chwilę będziesz bezrobotna, bo mam nadzieję, ktoś zaorze ten biurowiec i zrówna go z ziemią!",,,,0,0,0,255,42,0.0,niski,41,0.6105135403148526
26.0,beatawalczykie3,CZEMU KACZYŃSKI JAK MNIE CAŁUJESZ W REKE TO CZUĆ PEDOFILA,0,0,0,0,06-09-25,2025-09-06,2025.0,9.0,6.0,0.0,CZEMU KACZYŃSKI JAK MNIE CAŁUJESZ W REKE TO CZUĆ PEDOFILA,CZEMU KACZYŃSKI JAK MNIE CAŁUJESZ W REKE TO CZUĆ PEDOFILA,,,,0,0,0,57,10,0.0,niski,41,0.7845917541965429
20.0,debetles,"Faktycznie, teraz najbardziej potrzebna jest sala koncertowa. Nic nie mądrzejecie Szczerba...",0,0,0,0,07-09-25,2025-09-07,2025.0,9.0,7.0,0.0,"Faktycznie, teraz najbardziej potrzebna jest sala koncertowa. Nic nie mądrzejecie Szczerba...","Faktycznie, teraz najbardziej potrzebna jest sala koncertowa. Nic nie mądrzejecie Szczerba...",,,,0,0,0,93,11,0.0,niski,41,0.5392016527107393
28.0,winodobre,Jeżeli to wizualizacja to będzie super. Było zacząć od sali koncertowej a później wsiąść na warsztat muzeum Sztuki nowoczesnej🤔,0,0,0,0,07-09-25,2025-09-07,2025.0,9.0,7.0,0.0,Jeżeli to wizualizacja to będzie super. Było zacząć od sali koncertowej a później wsiąść na warsztat muzeum Sztuki nowoczesnej🤔,Jeżeli to wizualizacja to będzie super. Było zacząć od sali koncertowej a później wsiąść na warsztat muzeum Sztuki nowoczesnej🤔,,,,0,0,0,127,19,0.0,niski,41,0.5329260190240024
29.0,wd0brastrone,Byłeś i zostaniesz jako DZIWKA SOROSA,0,0,0,0,07-09-25,2025-09-07,2025.0,9.0,7.0,0.0,Byłeś i zostaniesz jako DZIWKA SOROSA,Byłeś i zostaniesz jako DZIWKA SOROSA,,,,0,0,0,37,6,0.0,niski,41,0.9727850590876734
2.0,waldemarschr,Chyba qurwa sam się uszczypne 🤧,0,0,0,0,07-09-25,2025-09-07,2025.0,9.0,7.0,0.0,Chyba qurwa sam się uszczypne 🤧,Chyba qurwa sam się uszczypne 🤧,,,,0,0,0,31,6,0.0,niski,41,0.736733149784515
11.0,hunc_wot,"Dla mnie Tadek mógłby nic nie robić. Ważne, że nie jest tęczowym, lewackim pokurwieńcem jak @trzaskowski_",0,0,0,0,08-09-25,2025-09-08,2025.0,9.0,8.0,0.0,"Dla mnie Tadek mógłby nic nie robić. Ważne, że nie jest tęczowym, lewackim pokurwieńcem jak","Dla mnie Tadek mógłby nic nie robić. Ważne, że nie jest tęczowym, lewackim pokurwieńcem jak",@trzaskowski_,,,1,0,0,91,15,0.0,niski,41,0.61307010612114
26.0,moto_trikes,Bo u niego nie ma czego łagodzić🤣,0,0,0,0,08-09-25,2025-09-08,2025.0,9.0,8.0,0.0,Bo u niego nie ma czego łagodzić🤣,Bo u niego nie ma czego łagodzić🤣,,,,0,0,0,33,7,0.0,niski,41,0.61307010612114
10.0,sedziad30823,Jak się patrzy na Rafała to można powiedzieć że dupa z tego . hehehe.,0,0,0,0,08-09-25,2025-09-08,2025.0,9.0,8.0,0.0,Jak się patrzy na Rafała to można powiedzieć że dupa z tego . hehehe.,Jak się patrzy na Rafała to można powiedzieć że dupa z tego . hehehe.,,,,0,0,0,69,14,0.0,niski,41,0.6706943383514344
11.0,darusz3,"Utknąć , qoorwa, w korku , patałachu",0,0,0,0,08-09-25,2025-09-08,2025.0,9.0,8.0,0.0,"Utknąć , qoorwa, w korku , patałachu","Utknąć , qoorwa, w korku , patałachu",,,,0,0,0,36,7,0.0,niski,41,0.7667685557111182
20.0,filip_michno,No to się tam doskonale niebawem odnajdziesz :),0,0,0,0,08-09-25,2025-09-08,2025.0,9.0,8.0,0.0,No to się tam doskonale niebawem odnajdziesz :),No to się tam doskonale niebawem odnajdziesz :),,,,0,0,0,47,8,0.0,niski,41,0.8325911422534538
13.0,koordynator77,"No co ty. Byli by skończonymi durniami jak by go ,czyli twarz upadku znowu wystawili. Nie no smiech po pachy😄👊",0,0,0,0,08-09-25,2025-09-08,2025.0,9.0,8.0,0.0,"No co ty. Byli by skończonymi durniami jak by go ,czyli twarz upadku znowu wystawili. Nie no smiech po pachy😄👊","No co ty. Byli by skończonymi durniami jak by go ,czyli twarz upadku znowu wystawili. Nie no smiech po pachy😄👊",,,,0,0,0,110,20,0.0,niski,41,0.6904116684677608
5.0,antypis4ever,Swiat zachwycony projektami @trzaskowski_ - a teraz powyjcie sobie kacapy 😁,0,59,26,85,08-09-25,2025-09-08,2025.0,9.0,8.0,0.0,Swiat zachwycony projektami - a teraz powyjcie sobie kacapy 😁,Swiat zachwycony projektami - a teraz powyjcie sobie kacapy 😁,@trzaskowski_,,,1,0,0,61,10,2.27,wysoki,41,0.7298210328465526
9.0,tytus99779903,"Serio? Draq queen w przedszkolu? Pani nawet nie wie, że to faceci w przebraniu. Nie zapraszam do dyskusji.",0,0,0,0,09-09-25,2025-09-09,2025.0,9.0,9.0,0.0,"Serio? Draq queen w przedszkolu? Pani nawet nie wie, że to faceci w przebraniu. Nie zapraszam do dyskusji.","Serio? Draq queen w przedszkolu? Pani nawet nie wie, że to faceci w przebraniu. Nie zapraszam do dyskusji.",,,,0,0,0,106,18,0.0,niski,41,0.623565532302562
17.0,zrowrobert,"@donaldtusk @trzaskowski_ @ko_klub patrzcie miernoty. Żenada łapie na każdym kroku waszych działań. Dobrze że to już bliżej końca, tego że wierzono w wasze brednie",0,0,0,0,09-09-25,2025-09-09,2025.0,9.0,9.0,0.0,"patrzcie miernoty. Żenada łapie na każdym kroku waszych działań. Dobrze że to już bliżej końca, tego że wierzono w wasze brednie","patrzcie miernoty. Żenada łapie na każdym kroku waszych działań. Dobrze że to już bliżej końca, tego że wierzono w wasze brednie",@donaldtusk|@trzaskowski_|@ko_klub,,,3,0,0,128,21,0.0,niski,41,0.9727850590876734
21.0,charlieblegh,ten wąs nie jedną kamienicą trząsł,0,0,0,0,09-09-25,2025-09-09,2025.0,9.0,9.0,0.0,ten wąs nie jedną kamienicą trząsł,ten wąs nie jedną kamienicą trząsł,,,,0,0,0,34,6,0.0,niski,41,0.7890444240601754
10.0,solarmare,"Mam przeogromną nadzieję, że za wszelkie tego typu bezpodstawne rzucanie w kogoś pro-rosyjskością (lub pro-czymkolwiek negatywnym) będzie realna kara i to taka dotkliwa. Odpowiedzialność za słowa potrzebna na wczoraj.",0,0,0,0,09-09-25,2025-09-09,2025.0,9.0,9.0,0.0,"Mam przeogromną nadzieję, że za wszelkie tego typu bezpodstawne rzucanie w kogoś pro-rosyjskością (lub pro-czymkolwiek negatywnym) będzie realna kara i to taka dotkliwa. Odpowiedzialność za słowa potrzebna na wczoraj.","Mam przeogromną nadzieję, że za wszelkie tego typu bezpodstawne rzucanie w kogoś pro-rosyjskością (lub pro-czymkolwiek negatywnym) będzie realna kara i to taka dotkliwa. Odpowiedzialność za słowa potrzebna na wczoraj.",,,,0,0,0,217,29,0.0,niski,41,0.7441475597531754
23.0,czardam,"Trzeba przyznać, że @trzaskowski_ dobrze wybrał autorkę swojej książki😉",0,0,1,1,09-09-25,2025-09-09,2025.0,9.0,9.0,0.0,"Trzeba przyznać, że dobrze wybrał autorkę swojej książki😉","Trzeba przyznać, że dobrze wybrał autorkę swojej książki😉",@trzaskowski_,,,1,0,0,57,8,0.0,średni,41,0.602443844400959
24.0,szkolaszpiegow,ich jest dwoch - krzysiu fajniejszy morrda - poszukaj na wallu a znajdziesz ;),0,0,0,0,09-09-25,2025-09-09,2025.0,9.0,9.0,0.0,ich jest dwoch - krzysiu fajniejszy morrda - poszukaj na wallu a znajdziesz ;),ich jest dwoch - krzysiu fajniejszy morrda - poszukaj na wallu a znajdziesz ;),,,,0,0,0,78,14,0.0,niski,41,0.8536110105886561
13.0,takasobieja7,"Stara cię wysrała? Przykro mi, ale ni wszyscy tak mieli prawacki debilu",0,0,0,0,10-09-25,2025-09-10,2025.0,9.0,10.0,0.0,"Stara cię wysrała? Przykro mi, ale ni wszyscy tak mieli prawacki debilu","Stara cię wysrała? Przykro mi, ale ni wszyscy tak mieli prawacki debilu",,,,0,0,0,71,12,0.0,niski,41,0.7368795005467498
16.0,cichonalicja,"z FB .@trzaskowski_ 💬""Gośka mówi, że tylko ludzie urodzeni w latach '70 kumają bazę, ale że się nie odważę na taką stylówę. Ja się nie odważę?""",2,3,2,7,09-09-25,2025-09-09,2025.0,9.0,9.0,0.0,"z FB . 💬""Gośka mówi, że tylko ludzie urodzeni w latach '70 kumają bazę, ale że się nie odważę na taką stylówę. Ja się nie odważę?""","z FB . 💬""Gośka mówi, że tylko ludzie urodzeni w latach '70 kumają bazę, ale że się nie odważę na taką stylówę. Ja się nie odważę?""",@trzaskowski_,,,1,0,0,130,26,1.5,wysoki,41,0.6194126426160501
6.0,katarzynka2512,Ta stylizacja nie pasuje Panu.,0,0,0,0,10-09-25,2025-09-10,2025.0,9.0,10.0,0.0,Ta stylizacja nie pasuje Panu.,Ta stylizacja nie pasuje Panu.,,,,0,0,0,30,5,0.0,niski,41,0.6742683547144105
1.0,rutkem,Ile dni pan w tym roku pracował w ratuszu?,0,20,3,23,10-09-25,2025-09-10,2025.0,9.0,10.0,0.0,Ile dni pan w tym roku pracował w ratuszu?,Ile dni pan w tym roku pracował w ratuszu?,,,,0,0,0,42,9,6.67,wysoki,41,0.6850681942693101
7.0,judi781,"Ten wąs, nie jednym poglądem trząsł",0,0,0,0,10-09-25,2025-09-10,2025.0,9.0,10.0,0.0,"Ten wąs, nie jednym poglądem trząsł","Ten wąs, nie jednym poglądem trząsł",,,,0,0,0,35,6,0.0,niski,41,0.7704418767081068
25.0,piotrekjmr,"Wracaj do barbera pajacu, przytnij wąsik na pizdzie",0,0,0,0,10-09-25,2025-09-10,2025.0,9.0,10.0,0.0,"Wracaj do barbera pajacu, przytnij wąsik na pizdzie","Wracaj do barbera pajacu, przytnij wąsik na pizdzie",,,,0,0,0,51,8,0.0,niski,41,0.6547395107409983
28.0,ponury07,Pewnie ten wąs nie jedną pizdą trząsł 🤣,0,0,0,0,10-09-25,2025-09-10,2025.0,9.0,10.0,0.0,Pewnie ten wąs nie jedną pizdą trząsł 🤣,Pewnie ten wąs nie jedną pizdą trząsł 🤣,,,,0,0,0,39,8,0.0,niski,41,0.7360991829533097
7.0,dpcryptobaron,Co ci się stało pod nosem hahahah,0,0,0,0,11-09-25,2025-09-11,2025.0,9.0,11.0,0.0,Co ci się stało pod nosem hahahah,Co ci się stało pod nosem hahahah,,,,0,0,0,33,7,0.0,niski,41,0.923986566238858
8.0,marcinj91714217,Raczej ciebie skomentowałem orle intelektu.,0,0,0,0,11-09-25,2025-09-11,2025.0,9.0,11.0,0.0,Raczej ciebie skomentowałem orle intelektu.,Raczej ciebie skomentowałem orle intelektu.,,,,0,0,0,43,5,0.0,niski,41,0.7035417362001387
13.0,marcinj91714217,"Poziom zrozumienia level brodzik, głębia wniknięcia w problematykę przedszkole. Powtarzanie przekazu propagandowego bardzo dobrze.",0,0,1,1,11-09-25,2025-09-11,2025.0,9.0,11.0,0.0,"Poziom zrozumienia level brodzik, głębia wniknięcia w problematykę przedszkole. Powtarzanie przekazu propagandowego bardzo dobrze.","Poziom zrozumienia level brodzik, głębia wniknięcia w problematykę przedszkole. Powtarzanie przekazu propagandowego bardzo dobrze.",,,,0,0,0,130,14,0.0,średni,41,0.5708366130992828
21.0,safarzynski,Oooooo homosowietikus się obudził 😀,0,0,0,0,11-09-25,2025-09-11,2025.0,9.0,11.0,0.0,Oooooo homosowietikus się obudził 😀,Oooooo homosowietikus się obudził 😀,,,,0,0,0,35,5,0.0,niski,41,0.8012978879525977
25.0,kuwetowy,Prędzej będzie zajezdnia w twojej dupie. Schron też tam się zmieści.,0,0,0,0,11-09-25,2025-09-11,2025.0,9.0,11.0,0.0,Prędzej będzie zajezdnia w twojej dupie. Schron też tam się zmieści.,Prędzej będzie zajezdnia w twojej dupie. Schron też tam się zmieści.,,,,0,0,0,68,11,0.0,niski,41,0.9533169531594946
1.0,btymmmy,Ocho. Wylazł Pan spod kamienia?,0,0,0,0,11-09-25,2025-09-11,2025.0,9.0,11.0,0.0,Ocho. Wylazł Pan spod kamienia?,Ocho. Wylazł Pan spod kamienia?,,,,0,0,0,31,5,0.0,niski,41,0.7258503877731605
14.0,piotr747066,@trzaskowski_ co to jest? O czy debatować z Chrobotą czy obrzydliwą Jadźką? Trzeba było usiąść na widowni…..,0,0,0,0,11-09-25,2025-09-11,2025.0,9.0,11.0,0.0,co to jest? O czy debatować z Chrobotą czy obrzydliwą Jadźką? Trzeba było usiąść na widowni…..,co to jest? O czy debatować z Chrobotą czy obrzydliwą Jadźką? Trzeba było usiąść na widowni…..,@trzaskowski_,,,1,0,0,94,16,0.0,niski,41,0.5809648481391471
19.0,bofedorowicz,"@Chętnie bym cię zastąpił sztuczną inteligencją. Nie kradnie, nie ma rąk więc się nie okaleczy. Wiedzą encyklopedyczną przyćmiewa wszystkich twoich urzędników w ratuszu a języków obcych używa tyle, że sam nie zliczysz. Więc spadaj ze swoimi mądrościami, albo na drzewo.",0,0,0,0,11-09-25,2025-09-11,2025.0,9.0,11.0,0.0,"bym cię zastąpił sztuczną inteligencją. Nie kradnie, nie ma rąk więc się nie okaleczy. Wiedzą encyklopedyczną przyćmiewa wszystkich twoich urzędników w ratuszu a języków obcych używa tyle, że sam nie zliczysz. Więc spadaj ze swoimi mądrościami, albo na drzewo.","bym cię zastąpił sztuczną inteligencją. Nie kradnie, nie ma rąk więc się nie okaleczy. Wiedzą encyklopedyczną przyćmiewa wszystkich twoich urzędników w ratuszu a języków obcych używa tyle, że sam nie zliczysz. Więc spadaj ze swoimi mądrościami, albo na drzewo.",@Chętnie,,,1,0,0,260,39,0.0,niski,41,0.7441475597531754
70.0,berazotti69,Gosciu odlecial. Wasik jak u przedwojennego alfonsa,0,0,0,0,11-09-25,2025-09-11,2025.0,9.0,11.0,0.0,Gosciu odlecial. Wasik jak u przedwojennego alfonsa,Gosciu odlecial. Wasik jak u przedwojennego alfonsa,,,,0,0,0,51,7,0.0,niski,41,0.642752686183049
5.0,adam_abramczyk,Czyli trafiłem w sam środek tarczy w rozmowie z @kowalewski07 😄#AlgorytmyWładzy,0,0,0,0,14-09-25,2025-09-14,2025.0,9.0,14.0,0.0,Czyli trafiłem w sam środek tarczy w rozmowie z 😄AlgorytmyWładzy,Czyli trafiłem w sam środek tarczy w rozmowie z 😄,@kowalewski07,#AlgorytmyWładzy,,1,1,0,64,10,0.0,niski,41,0.6063685123260153
14.0,mit67954488,"A teraz obudź się i wstawaj, bo się zesrałeś.",0,0,0,0,15-09-25,2025-09-15,2025.0,9.0,15.0,0.0,"A teraz obudź się i wstawaj, bo się zesrałeś.","A teraz obudź się i wstawaj, bo się zesrałeś.",,,,0,0,0,45,9,0.0,niski,41,0.8993496152870736
10.0,randoml16138464,"Ja pierdolę, wstaję rano, znowu czytam o tym Dino w Wilanowie, nie dość, że chuj mnie strzela, to jeszcze nie zdążę na pumpkin spice latte, bo jakaś biedota choruje i pierdoli mi nad głową o swojej srace. Ech, jeszcze Trzaskowski przegrał wybory. Nie da się żyć.",0,2,3,5,14-09-25,2025-09-14,2025.0,9.0,14.0,0.0,"Ja pierdolę, wstaję rano, znowu czytam o tym Dino w Wilanowie, nie dość, że chuj mnie strzela, to jeszcze nie zdążę na pumpkin spice latte, bo jakaś biedota choruje i pierdoli mi nad głową o swojej srace. Ech, jeszcze Trzaskowski przegrał wybory. Nie da się żyć.","Ja pierdolę, wstaję rano, znowu czytam o tym Dino w Wilanowie, nie dość, że chuj mnie strzela, to jeszcze nie zdążę na pumpkin spice latte, bo jakaś biedota choruje i pierdoli mi nad głową o swojej srace. Ech, jeszcze Trzaskowski przegrał wybory. Nie da się żyć.",,,,0,0,0,262,46,0.67,wysoki,41,0.5605898655249117
5.0,jacekjustyn,"Halo, halo. Było pite czy było ćpane? #trzaskowski #sikorski",2,187,74,263,27-05-25,2025-05-27,2025.0,5.0,27.0,0.0,"Halo, halo. Było pite czy było ćpane? trzaskowski sikorski","Halo, halo. Było pite czy było ćpane?",,#trzaskowski|#sikorski,,0,2,0,58,9,2.53,wysoki,41,0.6893988112772513
6.0,detonator7474,Dobra masz trzaskowski na banerze tobie chyba kurwa mozg jest zbedny.,0,0,0,0,15-09-25,2025-09-15,2025.0,9.0,15.0,0.0,Dobra masz trzaskowski na banerze tobie chyba kurwa mozg jest zbedny.,Dobra masz trzaskowski na banerze tobie chyba kurwa mozg jest zbedny.,,,,0,0,0,69,11,0.0,niski,41,0.763540355670547
8.0,szomi22,Ty detektyw Ty wlasnie tylko z seniorami powinienes spedzac czas i nie udzielac sie publicznie ! Ty jestes taki glupi ze mi az Ciebie szkoda.,0,0,0,0,15-09-25,2025-09-15,2025.0,9.0,15.0,0.0,Ty detektyw Ty wlasnie tylko z seniorami powinienes spedzac czas i nie udzielac sie publicznie ! Ty jestes taki glupi ze mi az Ciebie szkoda.,Ty detektyw Ty wlasnie tylko z seniorami powinienes spedzac czas i nie udzielac sie publicznie ! Ty jestes taki glupi ze mi az Ciebie szkoda.,,,,0,0,0,141,25,0.0,niski,41,0.562628078872544
8.0,rafalborowski78,"Trzaskowski. Żył krótko, ale intensywnie :D",0,0,0,0,"Jun 2, 2025 · 6:45 PM UTC",,,,,,"Trzaskowski. Żył krótko, ale intensywnie :D","Trzaskowski. Żył krótko, ale intensywnie :D",,,,0,0,0,43,6,0.0,niski,41,0.5771157566937651
69.0,reeva889929,"Taaa... Bo od was wiele nauczyć się nie można. A ty do tych 73,40% należysz czy do 68,30? 🤡",0,0,0,0,"Jun 2, 2025 · 6:45 PM UTC",,,,,,"Taaa... Bo od was wiele nauczyć się nie można. A ty do tych 73,40% należysz czy do 68,30? 🤡","Taaa... Bo od was wiele nauczyć się nie można. A ty do tych 73,40% należysz czy do 68,30? 🤡",,,,0,0,0,91,19,0.0,niski,41,0.7441475597531754
120.0,marioawario,Ja tylko napiszę. Michał walcz z nami dalej,0,1,0,1,"Jun 2, 2025 · 6:43 PM UTC",,,,,,Ja tylko napiszę. Michał walcz z nami dalej,Ja tylko napiszę. Michał walcz z nami dalej,,,,0,0,0,43,8,1.0,średni,41,0.7262185423388529
154.0,macsku_,Po co hejtowac jak to prawda i bym jeszcze parę punktów dopisał. @donaldtusk @trzaskowski_ @GiertychRoman @ko_klub @PORP_Warszawa @Platforma_org @sikorskiradek,0,0,0,0,"Jun 2, 2025 · 6:46 PM UTC",,,,,,Po co hejtowac jak to prawda i bym jeszcze parę punktów dopisał.,Po co hejtowac jak to prawda i bym jeszcze parę punktów dopisał.,@donaldtusk|@trzaskowski_|@GiertychRoman|@ko_klub|@PORP_Warszawa|@Platforma_org|@sikorskiradek,,,7,0,0,64,12,0.0,niski,41,0.6107685903291024
305.0,rexer289044,"Tak ciezko przyznaje sie temu czlowiekowi racje, ale trzeba mu oddac",0,0,0,0,"Jun 2, 2025 · 6:47 PM UTC",,,,,,"Tak ciezko przyznaje sie temu czlowiekowi racje, ale trzeba mu oddac","Tak ciezko przyznaje sie temu czlowiekowi racje, ale trzeba mu oddac",,,,0,0,0,68,11,0.0,niski,41,0.5527047868644142
318.0,piotrpla,Komu przychodzi do głowy coś takiego ?! Brak słów !,0,0,0,0,"Jun 2, 2025 · 6:47 PM UTC",,,,,,Komu przychodzi do głowy coś takiego ?! Brak słów !,Komu przychodzi do głowy coś takiego ?! Brak słów !,,,,0,0,0,51,10,0.0,niski,41,0.8968388003851857
377.0,szpilekk,"Dzięki za wszystko, nadróbcie stracony czas z Gosią, odpocznijcie.",0,8,2,10,"Jun 2, 2025 · 9:28 AM UTC",,,,,,"Dzięki za wszystko, nadróbcie stracony czas z Gosią, odpocznijcie.","Dzięki za wszystko, nadróbcie stracony czas z Gosią, odpocznijcie.",,,,0,0,0,66,9,4.0,wysoki,41,0.5562903009156223
455.0,tobcio183,Niech już odpocznie @trzaskowski_ Widać zmęczenie podczas walki o stolek!,0,0,0,0,"Jun 2, 2025 · 6:49 PM UTC",,,,,,Niech już odpocznie Widać zmęczenie podczas walki o stolek!,Niech już odpocznie Widać zmęczenie podczas walki o stolek!,@trzaskowski_,,,1,0,0,59,9,0.0,niski,41,0.6075198560338968
519.0,nocnaz,Witajcie w nowej bajce.. i to nie będzie przyjemne doświadczenie. Zrobiliśmy co mogliśmy i za bardzo wam dziękuję.,2,108,481,591,"Jun 2, 2025 · 5:37 AM UTC",,,,,,Witajcie w nowej bajce.. i to nie będzie przyjemne doświadczenie. Zrobiliśmy co mogliśmy i za bardzo wam dziękuję.,Witajcie w nowej bajce.. i to nie będzie przyjemne doświadczenie. Zrobiliśmy co mogliśmy i za bardzo wam dziękuję.,,,,0,0,0,114,18,0.22,wysoki,41,0.631528147445825
555.0,kamil6051,To po co kilku z nich wsadzili 🤣🤣 żeby znów ich ulaskawić ? Zrobili z siebie pośmiewisko czego nawet nie doprowadzili do końca 🤣🤣🤣 czy to było tak na próbę 🤓🤓 leżę serio 🤣🤣,0,0,0,0,"Jun 2, 2025 · 6:49 PM UTC",,,,,,To po co kilku z nich wsadzili 🤣🤣 żeby znów ich ulaskawić ? Zrobili z siebie pośmiewisko czego nawet nie doprowadzili do końca 🤣🤣🤣 czy to było tak na próbę 🤓🤓 leżę serio 🤣🤣,To po co kilku z nich wsadzili 🤣🤣 żeby znów ich ulaskawić ? Zrobili z siebie pośmiewisko czego nawet nie doprowadzili do końca 🤣🤣🤣 czy to było tak na próbę 🤓🤓 leżę serio 🤣🤣,,,,0,0,0,172,34,0.0,niski,41,0.7172879328739403
561.0,junasatira,"Kolejny kurwa bezwstydnik, ha tfu",0,0,0,0,"Jun 2, 2025 · 6:49 PM UTC",,,,,,"Kolejny kurwa bezwstydnik, ha tfu","Kolejny kurwa bezwstydnik, ha tfu",,,,0,0,0,33,5,0.0,niski,41,0.6317768429264525
585.0,doktor_kermit,pokazałeś idealnie kto jest z patologii 🤭,0,0,0,0,"Jun 2, 2025 · 6:50 PM UTC",,,,,,pokazałeś idealnie kto jest z patologii 🤭,pokazałeś idealnie kto jest z patologii 🤭,,,,0,0,0,41,7,0.0,niski,41,0.5661366388448048
618.0,sn1persen,No dobra skończ pierdolić i wypierdalaj xD,0,0,0,0,"Jun 2, 2025 · 6:50 PM UTC",,,,,,No dobra skończ pierdolić i wypierdalaj xD,No dobra skończ pierdolić i wypierdalaj xD,,,,0,0,0,42,7,0.0,niski,41,0.759830035389078
655.0,edzio358,Nie ma się czym chwalić wobec tego:) Czyli rozumiem masz podstawowe wykształcenie to by wyjaśniało dlaczego nie rozumiesz o czym piszesz:),0,0,0,0,"Jun 2, 2025 · 6:50 PM UTC",,,,,,Nie ma się czym chwalić wobec tego:) Czyli rozumiem masz podstawowe wykształcenie to by wyjaśniało dlaczego nie rozumiesz o czym piszesz:),Nie ma się czym chwalić wobec tego:) Czyli rozumiem masz podstawowe wykształcenie to by wyjaśniało dlaczego nie rozumiesz o czym piszesz:),,,,0,0,0,138,21,0.0,niski,41,0.699672103613665
686.0,paweljaniga,jak widzisz skończyły się czasy gdy można było tylko obiecać. Gdy można było tylko opowiadać. Sami zapracowaliście na własną porażkę. Gdybyście tylko robili to co mówicie to PiS nie miałby używania. Jeszcze to wsparcie dla deweloperów…,0,0,0,0,"Jun 2, 2025 · 6:50 PM UTC",,,,,,jak widzisz skończyły się czasy gdy można było tylko obiecać. Gdy można było tylko opowiadać. Sami zapracowaliście na własną porażkę. Gdybyście tylko robili to co mówicie to PiS nie miałby używania. Jeszcze to wsparcie dla deweloperów…,jak widzisz skończyły się czasy gdy można było tylko obiecać. Gdy można było tylko opowiadać. Sami zapracowaliście na własną porażkę. Gdybyście tylko robili to co mówicie to PiS nie miałby używania. Jeszcze to wsparcie dla deweloperów…,,,,0,0,0,235,36,0.0,niski,41,0.6169991519531306
