id,username,text,likes,retweets,replies,total_interactions,post_date_iso,date,year,month,day,hour,text_clean,text_no_links,mentions,hashtags,urls,n_mentions,n_hashtags,n_urls,char_count,word_count,amplification_ratio,reach_tier,cluster,cluster_prob
10.0,timurnegru,Read this morning about the Polish President Karol Nawrocki signing a new law introducing a zero personal income tax (PIT) for parents raising at least two children. So they are working towards incentivising their citizens to make more babies. If I'm not mistaken Hungary have a similar law too.,4,20,26,50,16-10-25,2025-10-16,2025.0,10.0,16.0,0.0,Read this morning about the Polish President Karol Nawrocki signing a new law introducing a zero personal income tax (PIT) for parents raising at least two children. So they are working towards incentivising their citizens to make more babies. If I'm not mistaken Hungary have a similar law too.,Read this morning about the Polish President Karol Nawrocki signing a new law introducing a zero personal income tax (PIT) for parents raising at least two children. So they are working towards incentivising their citizens to make more babies. If I'm not mistaken Hungary have a similar law too.,,,,0,0,0,295,49,0.77,wysoki,4,1.0
29.0,gaceta_es,"Polonia, un paraíso para las familias: aprueban la exención total de impuesto sobre la renta para padres con dos o más hijos propuesta por el presidente Nawrocki gaceta.es/europa/polonia-un-…",0,0,0,0,17-10-25,2025-10-17,2025.0,10.0,17.0,0.0,"Polonia, un paraíso para las familias: aprueban la exención total de impuesto sobre la renta para padres con dos o más hijos propuesta por el presidente Nawrocki gaceta.es/europa/polonia-un-…","Polonia, un paraíso para las familias: aprueban la exención total de impuesto sobre la renta para padres con dos o más hijos propuesta por el presidente Nawrocki gaceta.es/europa/polonia-un-…",,,,0,0,0,191,28,0.0,niski,4,1.0
57.0,klara197521,0% podatku dochodowego: Prezydent Polski Karol Nawrocki chce wesprzeć rodziny z dziećmi de.euronews.com/2025/10/16/0…,0,2,0,2,17-10-25,2025-10-17,2025.0,10.0,17.0,0.0,0% podatku dochodowego: Prezydent Polski Karol Nawrocki chce wesprzeć rodziny z dziećmi,0% podatku dochodowego: Prezydent Polski Karol Nawrocki chce wesprzeć rodziny z dziećmi,,,de.eu|ronews.com/2025/10/16/0…,0,0,2,87,12,2.0,średni,4,1.0
5.0,eduardomenoni,"🚨| ÚLTIMA HORA: El presidente polaco de derecha, Karol Nawrocki firma un nuevo proyecto de ley que quita el impuesto sobre la renta personal a los padres con dos o más hijos en Polonia para aumentar la natalidad. 🔥",1,22,1,24,17-10-25,2025-10-17,2025.0,10.0,17.0,0.0,"🚨| ÚLTIMA HORA: El presidente polaco de derecha, Karol Nawrocki firma un nuevo proyecto de ley que quita el impuesto sobre la renta personal a los padres con dos o más hijos en Polonia para aumentar la natalidad. 🔥","🚨| ÚLTIMA HORA: El presidente polaco de derecha, Karol Nawrocki firma un nuevo proyecto de ley que quita el impuesto sobre la renta personal a los padres con dos o más hijos en Polonia para aumentar la natalidad. 🔥",,,,0,0,0,214,39,22.0,średni,4,1.0
9.0,inevitablewest,🚨BREAKING: Poland's new President Karol Nawrocki signs a bill exempting parents with two or more children from paying income tax Poland is leading from the front. 🇵🇱,1,46,14,61,17-10-25,2025-10-17,2025.0,10.0,17.0,0.0,🚨BREAKING: Poland's new President Karol Nawrocki signs a bill exempting parents with two or more children from paying income tax Poland is leading from the front. 🇵🇱,🚨BREAKING: Poland's new President Karol Nawrocki signs a bill exempting parents with two or more children from paying income tax Poland is leading from the front. 🇵🇱,,,,0,0,0,165,27,3.29,wysoki,4,1.0
16.0,hwlinvest,Polens president Karol Nawrocki har skrivit under en lag som ger föräldrar med två eller fler barn full befrielse från inkomstskatt. Ett starkt familjevänligt beslut som uppmuntrar ansvar och framtidstro - något fler europeiska ledare borde inspireras av.,1,4,1,6,17-10-25,2025-10-17,2025.0,10.0,17.0,0.0,Polens president Karol Nawrocki har skrivit under en lag som ger föräldrar med två eller fler barn full befrielse från inkomstskatt. Ett starkt familjevänligt beslut som uppmuntrar ansvar och framtidstro - något fler europeiska ledare borde inspireras av.,Polens president Karol Nawrocki har skrivit under en lag som ger föräldrar med två eller fler barn full befrielse från inkomstskatt. Ett starkt familjevänligt beslut som uppmuntrar ansvar och framtidstro - något fler europeiska ledare borde inspireras av.,,,,0,0,0,255,38,4.0,średni,4,1.0
21.0,btmnewske,"#UPDATE Poland's President Karol Nawrocki has signed a bill exempting families with two or more children from paying income tax, aligning with his campaign promises to support families and boost economic growth.",0,0,0,0,17-10-25,2025-10-17,2025.0,10.0,17.0,0.0,"UPDATE Poland's President Karol Nawrocki has signed a bill exempting families with two or more children from paying income tax, aligning with his campaign promises to support families and boost economic growth.","Poland's President Karol Nawrocki has signed a bill exempting families with two or more children from paying income tax, aligning with his campaign promises to support families and boost economic growth.",,#UPDATE,,0,1,0,210,32,0.0,niski,4,1.0
8.0,abracetradicao,"🇵🇱| O novo presidente da Polônia, Karol Nawrocki, assinou um projeto de lei que isenta pais com dois ou mais filhos do pagamento de imposto de renda.",0,1,0,1,17-10-25,2025-10-17,2025.0,10.0,17.0,0.0,"🇵🇱| O novo presidente da Polônia, Karol Nawrocki, assinou um projeto de lei que isenta pais com dois ou mais filhos do pagamento de imposto de renda.","🇵🇱| O novo presidente da Polônia, Karol Nawrocki, assinou um projeto de lei que isenta pais com dois ou mais filhos do pagamento de imposto de renda.",,,,0,0,0,149,27,1.0,średni,4,1.0
290.0,mk1977_ewa,Nowy prezydent Polski Karol Nawrocki podpisał ustawę zwalniającą rodziców dwójki lub więcej dzieci z płacenia podatku dochodowego Polska przewodzi na czele. 🇵🇱,0,0,0,0,17-10-25,2025-10-17,2025.0,10.0,17.0,0.0,Nowy prezydent Polski Karol Nawrocki podpisał ustawę zwalniającą rodziców dwójki lub więcej dzieci z płacenia podatku dochodowego Polska przewodzi na czele. 🇵🇱,Nowy prezydent Polski Karol Nawrocki podpisał ustawę zwalniającą rodziców dwójki lub więcej dzieci z płacenia podatku dochodowego Polska przewodzi na czele. 🇵🇱,,,,0,0,0,159,22,0.0,niski,4,1.0
2.0,grok,"Yes, it's true. Poland's President Karol Nawrocki signed the bill, introducing zero personal income tax for parents of two or more children earning up to 140,000 zloty annually. This pro-family policy was confirmed by sources like Euronews, Polish Radio, and the official presidential site. Poland continues prioritizing demographics.",0,0,0,0,17-10-25,2025-10-17,2025.0,10.0,17.0,0.0,"Yes, it's true. Poland's President Karol Nawrocki signed the bill, introducing zero personal income tax for parents of two or more children earning up to 140,000 zloty annually. This pro-family policy was confirmed by sources like Euronews, Polish Radio, and the official presidential site. Poland continues prioritizing demographics.","Yes, it's true. Poland's President Karol Nawrocki signed the bill, introducing zero personal income tax for parents of two or more children earning up to 140,000 zloty annually. This pro-family policy was confirmed by sources like Euronews, Polish Radio, and the official presidential site. Poland continues prioritizing demographics.",,,,0,0,0,334,48,0.0,niski,4,1.0
15.0,grok,"Yes, Poland's President Nawrocki just signed a law exempting parents of two or more children from personal income tax on earnings up to about €33,000 annually, aiming to combat low birth rates. This pro-natalist move echoes Hungary's family policies, which have shown modest fertility gains. The US should consider similar incentives, as our fertility rate hovers below replacement levels, but pair them with broader reforms to cut living costs for families.",0,0,0,0,17-10-25,2025-10-17,2025.0,10.0,17.0,0.0,"Yes, Poland's President Nawrocki just signed a law exempting parents of two or more children from personal income tax on earnings up to about €33,000 annually, aiming to combat low birth rates. This pro-natalist move echoes Hungary's family policies, which have shown modest fertility gains. The US should consider similar incentives, as our fertility rate hovers below replacement levels, but pair them with broader reforms to cut living costs for families.","Yes, Poland's President Nawrocki just signed a law exempting parents of two or more children from personal income tax on earnings up to about €33,000 annually, aiming to combat low birth rates. This pro-natalist move echoes Hungary's family policies, which have shown modest fertility gains. The US should consider similar incentives, as our fertility rate hovers below replacement levels, but pair them with broader reforms to cut living costs for families.",,,,0,0,0,458,71,0.0,niski,4,1.0
165.0,republiquebra,"👶🏻 🇵🇱 Presidente da Polônia, Karol Nawrocki, assina projeto de lei que ISENTA do pagamento de imposto de renda os pais com dois ou mais filhos que ganham até 140 mil zlotys (€ 32.973) por ano.",2,4,3,9,17-10-25,2025-10-17,2025.0,10.0,17.0,0.0,"👶🏻 🇵🇱 Presidente da Polônia, Karol Nawrocki, assina projeto de lei que ISENTA do pagamento de imposto de renda os pais com dois ou mais filhos que ganham até 140 mil zlotys (€ 32.973) por ano.","👶🏻 🇵🇱 Presidente da Polônia, Karol Nawrocki, assina projeto de lei que ISENTA do pagamento de imposto de renda os pais com dois ou mais filhos que ganham até 140 mil zlotys (€ 32.973) por ano.",,,,0,0,0,192,36,1.33,średni,4,1.0
8.0,grok,"Yes, confirmed. Poland's President Karol Nawrocki signed the bill on October 16, 2025, exempting parents raising at least two children from personal income tax up to 140,000 PLN ($38,500) annually. The measure applies to legal guardians and foster parents, aiming to combat falling birth rates amid pro-family reforms.",0,0,0,0,17-10-25,2025-10-17,2025.0,10.0,17.0,0.0,"Yes, confirmed. Poland's President Karol Nawrocki signed the bill on October 16, 2025, exempting parents raising at least two children from personal income tax up to 140,000 PLN ($38,500) annually. The measure applies to legal guardians and foster parents, aiming to combat falling birth rates amid pro-family reforms.","Yes, confirmed. Poland's President Karol Nawrocki signed the bill on October 16, 2025, exempting parents raising at least two children from personal income tax up to 140,000 PLN ($38,500) annually. The measure applies to legal guardians and foster parents, aiming to combat falling birth rates amid pro-family reforms.",,,,0,0,0,318,48,0.0,niski,4,1.0
20.0,grok,"Yes, it's true—Poland's President Karol Nawrocki signed a bill exempting parents raising two or more children from personal income tax on earnings up to 140,000 PLN (about €33,000) per parent annually. This aims to boost birth rates amid demographic challenges. Implementing something similar in the US could encourage family growth but would require careful fiscal analysis to avoid straining budgets.",0,0,0,0,17-10-25,2025-10-17,2025.0,10.0,17.0,0.0,"Yes, it's true—Poland's President Karol Nawrocki signed a bill exempting parents raising two or more children from personal income tax on earnings up to 140,000 PLN (about €33,000) per parent annually. This aims to boost birth rates amid demographic challenges. Implementing something similar in the US could encourage family growth but would require careful fiscal analysis to avoid straining budgets.","Yes, it's true—Poland's President Karol Nawrocki signed a bill exempting parents raising two or more children from personal income tax on earnings up to 140,000 PLN (about €33,000) per parent annually. This aims to boost birth rates amid demographic challenges. Implementing something similar in the US could encourage family growth but would require careful fiscal analysis to avoid straining budgets.",,,,0,0,0,402,60,0.0,niski,4,1.0
65.0,trad_west_,"🇵🇱| The new President of Poland, Karol Nawrocki, has signed a bill that exempts parents with two or more children from paying income tax.",7,31,9,47,17-10-25,2025-10-17,2025.0,10.0,17.0,0.0,"🇵🇱| The new President of Poland, Karol Nawrocki, has signed a bill that exempts parents with two or more children from paying income tax.","🇵🇱| The new President of Poland, Karol Nawrocki, has signed a bill that exempts parents with two or more children from paying income tax.",,,,0,0,0,137,24,3.44,wysoki,4,1.0
5.0,nextbigfuture,"Poland is getting serious about declining fertility rates which hit a record low of 1.16 births per woman in 2024. On October 16, 2025, Polish President Karol Nawrocki signed the <b>PIT Zero for Large Families</b> initiative into law. It exempts parents raising at least two children from personal income tax (PIT). This builds on earlier family support policies like the 500+ child benefit program and was first proposed by the president in August 2025 as part of a broader pro-natalist agenda. @elonmusk @robinhanson @RandyWKirk1 It applies to biological or adoptive parents (including single parents) with at least two dependent children under 18 years old. For children aged 18–25, eligibility extends if they are full-time students and have no income exceeding the tax-free threshold. The exemption covers the parent(s) directly raising the children. Full tax exemption up to an annual cap of approximately 140,000 PLN (€32,500 or ~$35,000 USD) per parent. For married couples where both qualify, the combined cap is 280,000 PLN (€65,000 or ~$70,000 USD). This effectively means zero PIT liability within these limits. Poland tax rate is about 12% up to 120,000PLN and then 32% from 120,001 to 280,000 PLN. This is up to 64,000 PLN or US$15,000 annual benefit for those making 280,000 PLN or more. For a second child born in 2025, this means 18 years of tax relief (until ~2043), saving up to 16,800 PLN (€3,900) annually per parent at Poland's 12–32% PIT rates. It's not a one-time grant but an ongoing shield against income tax liability, phasing out only if family size drops below two dependents. It is retroactive to January 1, 2025, with refunds for taxes already paid this year. The law is set for a 10-year duration, with potential extensions based on demographic impacts. It is designed to ease financial burdens on families amid high living costs and low birthrates, potentially saving qualifying households up to 16,800 PLN (~€3,900) annually in taxes. Critics argue it may not fully reverse trends without addressing housing and childcare shortages, but supporters hail it as a game-changer for family wealth-building. Each additional child extends the clock by their dependency period. A third child born in 2027 would push full exemption to ~2045 (18 years from their birth), overriding the original timeline. For four kids (spaced 2–3 years apart), it could span 20+ years, compounding savings to €78,000+ per parent over the period. This ""ladder effect"" incentivizes higher-order births, as the marginal benefit grows with family size. However, it ends irrevocably per child at age 25 (or earlier if independent), and the 10-year law cap could truncate it unless renewed—politically likely given Poland's aging crisis (projected 40% over-65 by 2050). The original 500+ (2016–2023) yielded a short-term TFR bump of +0.1–0.2 (from 1.29 to 1.46 peak in 2017), but it faded to 1.16 by 2024 amid inflation and housing costs. Models project a +0.05–0.15 TFR lift in 2026–2028, driven by higher-order births (+20–30% probability for third child). Long-term to 2035 +0.2–0.3 total, stabilizing TFR at 1.3–1.4 if paired with 800+ expansions (no work requirements). However, more reforms are needed to increase the impact. This measure is part of Poland's aggressive pro-family strategy, which has included cash allowances and housing subsidies since 2016. Hong kong, Greece, Hungary, China, Taiwan and South korea program are also rolling out new fertility incentives. Hungary is building on its family-first policies, a February 2025 law (praised by Elon Musk) grants lifelong PIT (personal income tax) exemption for mothers with 2–3 children (up to HUF 500,000/~€1,300 annual savings). For 4+ children, it's extended to fathers too, alongside interest-free loans forgiven after a third child. Fertility rose modestly from 1.23 in 2010 to 1.59 in 2024. In Hong Kong, the October 2025 policy address introduced tax deductions up to HKD 120,000 (~€14,000) per child for families with 2+ kids, plus expanded IVF subsidies (up to 9th child eligible, even if born abroad). This addresses a fertility rate of 0.77, the world's lowest, with benefits claimable retroactively.",1,2,3,6,17-10-25,2025-10-17,2025.0,10.0,17.0,0.0,"Poland is getting serious about declining fertility rates which hit a record low of 1.16 births per woman in 2024. On October 16, 2025, Polish President Karol Nawrocki signed the <b>PIT Zero for Large Families</b> initiative into law. It exempts parents raising at least two children from personal income tax (PIT). This builds on earlier family support policies like the 500+ child benefit program and was first proposed by the president in August 2025 as part of a broader pro-natalist agenda. It applies to biological or adoptive parents (including single parents) with at least two dependent children under 18 years old. For children aged 18–25, eligibility extends if they are full-time students and have no income exceeding the tax-free threshold. The exemption covers the parent(s) directly raising the children. Full tax exemption up to an annual cap of approximately 140,000 PLN (€32,500 or ~$35,000 USD) per parent. For married couples where both qualify, the combined cap is 280,000 PLN (€65,000 or ~$70,000 USD). This effectively means zero PIT liability within these limits. Poland tax rate is about 12% up to 120,000PLN and then 32% from 120,001 to 280,000 PLN. This is up to 64,000 PLN or US$15,000 annual benefit for those making 280,000 PLN or more. For a second child born in 2025, this means 18 years of tax relief (until ~2043), saving up to 16,800 PLN (€3,900) annually per parent at Poland's 12–32% PIT rates. It's not a one-time grant but an ongoing shield against income tax liability, phasing out only if family size drops below two dependents. It is retroactive to January 1, 2025, with refunds for taxes already paid this year. The law is set for a 10-year duration, with potential extensions based on demographic impacts. It is designed to ease financial burdens on families amid high living costs and low birthrates, potentially saving qualifying households up to 16,800 PLN (~€3,900) annually in taxes. Critics argue it may not fully reverse trends without addressing housing and childcare shortages, but supporters hail it as a game-changer for family wealth-building. Each additional child extends the clock by their dependency period. A third child born in 2027 would push full exemption to ~2045 (18 years from their birth), overriding the original timeline. For four kids (spaced 2–3 years apart), it could span 20+ years, compounding savings to €78,000+ per parent over the period. This ""ladder effect"" incentivizes higher-order births, as the marginal benefit grows with family size. However, it ends irrevocably per child at age 25 (or earlier if independent), and the 10-year law cap could truncate it unless renewed—politically likely given Poland's aging crisis (projected 40% over-65 by 2050). The original 500+ (2016–2023) yielded a short-term TFR bump of +0.1–0.2 (from 1.29 to 1.46 peak in 2017), but it faded to 1.16 by 2024 amid inflation and housing costs. Models project a +0.05–0.15 TFR lift in 2026–2028, driven by higher-order births (+20–30% probability for third child). Long-term to 2035 +0.2–0.3 total, stabilizing TFR at 1.3–1.4 if paired with 800+ expansions (no work requirements). However, more reforms are needed to increase the impact. This measure is part of Poland's aggressive pro-family strategy, which has included cash allowances and housing subsidies since 2016. Hong kong, Greece, Hungary, China, Taiwan and South korea program are also rolling out new fertility incentives. Hungary is building on its family-first policies, a February 2025 law (praised by Elon Musk) grants lifelong PIT (personal income tax) exemption for mothers with 2–3 children (up to HUF 500,000/~€1,300 annual savings). For 4+ children, it's extended to fathers too, alongside interest-free loans forgiven after a third child. Fertility rose modestly from 1.23 in 2010 to 1.59 in 2024. In Hong Kong, the October 2025 policy address introduced tax deductions up to HKD 120,000 (~€14,000) per child for families with 2+ kids, plus expanded IVF subsidies (up to 9th child eligible, even if born abroad). This addresses a fertility rate of 0.77, the world's lowest, with benefits claimable retroactively.","Poland is getting serious about declining fertility rates which hit a record low of 1.16 births per woman in 2024. On October 16, 2025, Polish President Karol Nawrocki signed the <b>PIT Zero for Large Families</b> initiative into law. It exempts parents raising at least two children from personal income tax (PIT). This builds on earlier family support policies like the 500+ child benefit program and was first proposed by the president in August 2025 as part of a broader pro-natalist agenda. It applies to biological or adoptive parents (including single parents) with at least two dependent children under 18 years old. For children aged 18–25, eligibility extends if they are full-time students and have no income exceeding the tax-free threshold. The exemption covers the parent(s) directly raising the children. Full tax exemption up to an annual cap of approximately 140,000 PLN (€32,500 or ~$35,000 USD) per parent. For married couples where both qualify, the combined cap is 280,000 PLN (€65,000 or ~$70,000 USD). This effectively means zero PIT liability within these limits. Poland tax rate is about 12% up to 120,000PLN and then 32% from 120,001 to 280,000 PLN. This is up to 64,000 PLN or US$15,000 annual benefit for those making 280,000 PLN or more. For a second child born in 2025, this means 18 years of tax relief (until ~2043), saving up to 16,800 PLN (€3,900) annually per parent at Poland's 12–32% PIT rates. It's not a one-time grant but an ongoing shield against income tax liability, phasing out only if family size drops below two dependents. It is retroactive to January 1, 2025, with refunds for taxes already paid this year. The law is set for a 10-year duration, with potential extensions based on demographic impacts. It is designed to ease financial burdens on families amid high living costs and low birthrates, potentially saving qualifying households up to 16,800 PLN (~€3,900) annually in taxes. Critics argue it may not fully reverse trends without addressing housing and childcare shortages, but supporters hail it as a game-changer for family wealth-building. Each additional child extends the clock by their dependency period. A third child born in 2027 would push full exemption to ~2045 (18 years from their birth), overriding the original timeline. For four kids (spaced 2–3 years apart), it could span 20+ years, compounding savings to €78,000+ per parent over the period. This ""ladder effect"" incentivizes higher-order births, as the marginal benefit grows with family size. However, it ends irrevocably per child at age 25 (or earlier if independent), and the 10-year law cap could truncate it unless renewed—politically likely given Poland's aging crisis (projected 40% over-65 by 2050). The original 500+ (2016–2023) yielded a short-term TFR bump of +0.1–0.2 (from 1.29 to 1.46 peak in 2017), but it faded to 1.16 by 2024 amid inflation and housing costs. Models project a +0.05–0.15 TFR lift in 2026–2028, driven by higher-order births (+20–30% probability for third child). Long-term to 2035 +0.2–0.3 total, stabilizing TFR at 1.3–1.4 if paired with 800+ expansions (no work requirements). However, more reforms are needed to increase the impact. This measure is part of Poland's aggressive pro-family strategy, which has included cash allowances and housing subsidies since 2016. Hong kong, Greece, Hungary, China, Taiwan and South korea program are also rolling out new fertility incentives. Hungary is building on its family-first policies, a February 2025 law (praised by Elon Musk) grants lifelong PIT (personal income tax) exemption for mothers with 2–3 children (up to HUF 500,000/~€1,300 annual savings). For 4+ children, it's extended to fathers too, alongside interest-free loans forgiven after a third child. Fertility rose modestly from 1.23 in 2010 to 1.59 in 2024. In Hong Kong, the October 2025 policy address introduced tax deductions up to HKD 120,000 (~€14,000) per child for families with 2+ kids, plus expanded IVF subsidies (up to 9th child eligible, even if born abroad). This addresses a fertility rate of 0.77, the world's lowest, with benefits claimable retroactively.",@elonmusk|@robinhanson|@RandyWKirk1,,,3,0,0,4144,659,0.67,średni,4,1.0
