id,username,text,likes,retweets,replies,total_interactions,post_date_iso,date,year,month,day,hour,text_clean,text_no_links,mentions,hashtags,urls,n_mentions,n_hashtags,n_urls,char_count,word_count,amplification_ratio,reach_tier,cluster,cluster_prob
334.0,leskipiotr,"Ciekawe, ile nas będzie kosztować to zdjęcie. Stawiam hipotezę, że Nawrocki obiecał mu weto w sprawie podatku cyfrowego. Opodatkowanie gigantów cyfrowych dałoby nam 4 mld rocznie! Rząd powinien uchwalić ustawę i wtedy zobaczymy, czy KN stanie po stronie Polaków, czy Trumpa i USA",1,12,7,20,09-06-25,2025-06-09,2025.0,6.0,9.0,0.0,"Ciekawe, ile nas będzie kosztować to zdjęcie. Stawiam hipotezę, że Nawrocki obiecał mu weto w sprawie podatku cyfrowego. Opodatkowanie gigantów cyfrowych dałoby nam 4 mld rocznie! Rząd powinien uchwalić ustawę i wtedy zobaczymy, czy KN stanie po stronie Polaków, czy Trumpa i USA","Ciekawe, ile nas będzie kosztować to zdjęcie. Stawiam hipotezę, że Nawrocki obiecał mu weto w sprawie podatku cyfrowego. Opodatkowanie gigantów cyfrowych dałoby nam 4 mld rocznie! Rząd powinien uchwalić ustawę i wtedy zobaczymy, czy KN stanie po stronie Polaków, czy Trumpa i USA",,,,0,0,0,279,43,1.71,średni,4,1.0
1.0,arturkruk2,"Ciekawe, co zrobi rząd gdy Nawrocki złoży projekt wprowadzenia nowej ulgi PIT 0% dla rodzin, które będą posiadały dwoje lub więcej dzieci - zwolnienie z podatku dochodowego do 140 tysięcy zł dochodu rocznie dla każdego rodzica wychowującego co najmniej 2 dzieci.",0,0,0,0,10-06-25,2025-06-10,2025.0,6.0,10.0,0.0,"Ciekawe, co zrobi rząd gdy Nawrocki złoży projekt wprowadzenia nowej ulgi PIT 0% dla rodzin, które będą posiadały dwoje lub więcej dzieci - zwolnienie z podatku dochodowego do 140 tysięcy zł dochodu rocznie dla każdego rodzica wychowującego co najmniej 2 dzieci.","Ciekawe, co zrobi rząd gdy Nawrocki złoży projekt wprowadzenia nowej ulgi PIT 0% dla rodzin, które będą posiadały dwoje lub więcej dzieci - zwolnienie z podatku dochodowego do 140 tysięcy zł dochodu rocznie dla każdego rodzica wychowującego co najmniej 2 dzieci.",,,,0,0,0,262,41,0.0,niski,4,1.0
659.0,uwanyobserwator,Jakby nie patrzeć to nawet Nawrocki teraz gada Korwinem w sprawie podatków.,0,0,0,0,10-06-25,2025-06-10,2025.0,6.0,10.0,0.0,Jakby nie patrzeć to nawet Nawrocki teraz gada Korwinem w sprawie podatków.,Jakby nie patrzeć to nawet Nawrocki teraz gada Korwinem w sprawie podatków.,,,,0,0,0,75,12,0.0,niski,4,1.0
12.0,koneserunii,"❗️PILNE❗️ Pierwszy Wywiad Prasowy Nawrocki: Są sprawy, w których mogę premierowi pomóc. Rząd może liczyć, że podpisze ustawę wprowadzającą kwotę wolną od podatku na poziomie 60 tys. zł) rocznie. Powiem więcej: jeśli takiej ustawy w najbliższym czasie Sejm nie przyjmie, skorzystam z inicjatywy ustawodawczej",1,301,35,337,10-06-25,2025-06-10,2025.0,6.0,10.0,0.0,"❗️PILNE❗️ Pierwszy Wywiad Prasowy Nawrocki: Są sprawy, w których mogę premierowi pomóc. Rząd może liczyć, że podpisze ustawę wprowadzającą kwotę wolną od podatku na poziomie 60 tys. zł) rocznie. Powiem więcej: jeśli takiej ustawy w najbliższym czasie Sejm nie przyjmie, skorzystam z inicjatywy ustawodawczej","❗️PILNE❗️ Pierwszy Wywiad Prasowy Nawrocki: Są sprawy, w których mogę premierowi pomóc. Rząd może liczyć, że podpisze ustawę wprowadzającą kwotę wolną od podatku na poziomie 60 tys. zł) rocznie. Powiem więcej: jeśli takiej ustawy w najbliższym czasie Sejm nie przyjmie, skorzystam z inicjatywy ustawodawczej",,,,0,0,0,307,44,8.6,wysoki,4,1.0
24.0,21lupus,"""Rząd może liczyć, że podpiszę ustawę wprowadzającą kwotę wolną od podatku na poziomie 60 tys zł rocznie""- powiedział w wywiadzie dla ""DGP"" prezydent elekt Karol Nawrocki. zyciestolicy.com.pl/nawrocki…",0,8,0,8,11-06-25,2025-06-11,2025.0,6.0,11.0,0.0,"""Rząd może liczyć, że podpiszę ustawę wprowadzającą kwotę wolną od podatku na poziomie 60 tys zł rocznie""- powiedział w wywiadzie dla ""DGP"" prezydent elekt Karol Nawrocki. .pl/nawrocki…","""Rząd może liczyć, że podpiszę ustawę wprowadzającą kwotę wolną od podatku na poziomie 60 tys zł rocznie""- powiedział w wywiadzie dla ""DGP"" prezydent elekt Karol Nawrocki. .pl/nawrocki…",,,zyciestolicy.com,0,0,1,185,27,8.0,średni,4,1.0
3.0,radekkar,"Jak informuje RMF FM, Karol Nawrocki niedługo po zaprzysiężeniu zamierza złożyć do Sejmu kilka ustaw, które mogą być niewygodne dla rządu. Chodzi o obniżenie podatku VAT do 22 procent, zerowy PIT dla rodzin z co najmniej dwójką dzieci, podwyższenie II progu podatkowego, dziedziczenie bez podatku i likwidację podatku Belki.",49,264,266,579,27-06-25,2025-06-27,2025.0,6.0,27.0,0.0,"Jak informuje RMF FM, Karol Nawrocki niedługo po zaprzysiężeniu zamierza złożyć do Sejmu kilka ustaw, które mogą być niewygodne dla rządu. Chodzi o obniżenie podatku VAT do 22 procent, zerowy PIT dla rodzin z co najmniej dwójką dzieci, podwyższenie II progu podatkowego, dziedziczenie bez podatku i likwidację podatku Belki.","Jak informuje RMF FM, Karol Nawrocki niedługo po zaprzysiężeniu zamierza złożyć do Sejmu kilka ustaw, które mogą być niewygodne dla rządu. Chodzi o obniżenie podatku VAT do 22 procent, zerowy PIT dla rodzin z co najmniej dwójką dzieci, podwyższenie II progu podatkowego, dziedziczenie bez podatku i likwidację podatku Belki.",,,,0,0,0,324,49,0.99,wysoki,4,1.0
284.0,dzienniknarodu,"Jak informuje RMF FM, Karol Nawrocki niedługo po zaprzysiężeniu zamierza złożyć do Sejmu kilka ustaw, które mogą być niewygodne dla rządu. 👉🏼 Chodzi o obniżenie podatku VAT do 22 procent, zerowy PIT dla rodzin z co najmniej dwójką dzieci, podwyższenie II progu podatkowego, dziedziczenie bez podatku i likwidację podatku Belki. #Nawrocki2025",0,1,0,1,27-06-25,2025-06-27,2025.0,6.0,27.0,0.0,"Jak informuje RMF FM, Karol Nawrocki niedługo po zaprzysiężeniu zamierza złożyć do Sejmu kilka ustaw, które mogą być niewygodne dla rządu. 👉🏼 Chodzi o obniżenie podatku VAT do 22 procent, zerowy PIT dla rodzin z co najmniej dwójką dzieci, podwyższenie II progu podatkowego, dziedziczenie bez podatku i likwidację podatku Belki. Nawrocki2025","Jak informuje RMF FM, Karol Nawrocki niedługo po zaprzysiężeniu zamierza złożyć do Sejmu kilka ustaw, które mogą być niewygodne dla rządu. 👉🏼 Chodzi o obniżenie podatku VAT do 22 procent, zerowy PIT dla rodzin z co najmniej dwójką dzieci, podwyższenie II progu podatkowego, dziedziczenie bez podatku i likwidację podatku Belki.",,#Nawrocki2025,,0,1,0,340,51,1.0,średni,4,1.0
14.0,aldehyd10,"Będzie bardzo populistycznie. Rząd powinien szybko przedołożyć Dudzie do podpisu kwotę wolną od podatku 60 tysięcy od 2026. I jechać z tematem po mediach. Dlaczego? Bo Nawrocki i tak wrzuci im ten temat na 100%, jak go poprą w Sejmie to i tak KN przypisze całą zasługę sobie, ⬇️",0,3,5,8,27-06-25,2025-06-27,2025.0,6.0,27.0,0.0,"Będzie bardzo populistycznie. Rząd powinien szybko przedołożyć Dudzie do podpisu kwotę wolną od podatku 60 tysięcy od 2026. I jechać z tematem po mediach. Dlaczego? Bo Nawrocki i tak wrzuci im ten temat na 100%, jak go poprą w Sejmie to i tak KN przypisze całą zasługę sobie, ⬇️","Będzie bardzo populistycznie. Rząd powinien szybko przedołożyć Dudzie do podpisu kwotę wolną od podatku 60 tysięcy od 2026. I jechać z tematem po mediach. Dlaczego? Bo Nawrocki i tak wrzuci im ten temat na 100%, jak go poprą w Sejmie to i tak KN przypisze całą zasługę sobie, ⬇️",,,,0,0,0,278,49,0.6,średni,4,1.0
24.0,aneczkakon69192,"Jak informuje RMF FM, Karol Nawrocki niedługo po zaprzysiężeniu zamierza złożyć do Sejmu kilka ustaw, które mogą być niewygodne dla rządu. Chodzi o obniżenie podatku VAT do 22 procent, zerowy PIT dla rodzin z co najmniej dwójką dzieci, podwyższenie II progu podatkowego,🧵",1,41,5,47,27-06-25,2025-06-27,2025.0,6.0,27.0,0.0,"Jak informuje RMF FM, Karol Nawrocki niedługo po zaprzysiężeniu zamierza złożyć do Sejmu kilka ustaw, które mogą być niewygodne dla rządu. Chodzi o obniżenie podatku VAT do 22 procent, zerowy PIT dla rodzin z co najmniej dwójką dzieci, podwyższenie II progu podatkowego,🧵","Jak informuje RMF FM, Karol Nawrocki niedługo po zaprzysiężeniu zamierza złożyć do Sejmu kilka ustaw, które mogą być niewygodne dla rządu. Chodzi o obniżenie podatku VAT do 22 procent, zerowy PIT dla rodzin z co najmniej dwójką dzieci, podwyższenie II progu podatkowego,🧵",,,,0,0,0,271,42,8.2,wysoki,4,1.0
212.0,alojjola,Prezydent Karol Nawrocki zapowiedział jako jedną z pierwszych inicjatyw podniesienie kwoty wolnej od podatku. I nic szpagaty Szczerby na to nie poradzą,0,14,1,15,04-08-25,2025-08-04,2025.0,8.0,4.0,0.0,Prezydent Karol Nawrocki zapowiedział jako jedną z pierwszych inicjatyw podniesienie kwoty wolnej od podatku. I nic szpagaty Szczerby na to nie poradzą,Prezydent Karol Nawrocki zapowiedział jako jedną z pierwszych inicjatyw podniesienie kwoty wolnej od podatku. I nic szpagaty Szczerby na to nie poradzą,,,,0,0,0,151,22,14.0,średni,4,1.0
1.0,marekbrzeg,"Nie będziemy składać w sejmie projektu tej ustawy, bo nie ma złudzeń, że przyszły prezydent Polski - pan K. Nawrocki - zawetuje naszą ustawę o... podniesieniu kwoty wolnej od podatku z 30 do 60 tys. zł. 😜",0,8,3,11,05-08-25,2025-08-05,2025.0,8.0,5.0,0.0,"Nie będziemy składać w sejmie projektu tej ustawy, bo nie ma złudzeń, że przyszły prezydent Polski - pan K. Nawrocki - zawetuje naszą ustawę o... podniesieniu kwoty wolnej od podatku z 30 do 60 tys. zł. 😜","Nie będziemy składać w sejmie projektu tej ustawy, bo nie ma złudzeń, że przyszły prezydent Polski - pan K. Nawrocki - zawetuje naszą ustawę o... podniesieniu kwoty wolnej od podatku z 30 do 60 tys. zł. 😜",,,,0,0,0,204,37,2.67,średni,4,1.0
18.0,jnizinkiewicz,"Podczas kampanii wyborczej Karol Nawrocki obiecywał, że pierwszego dnia urzędowania, 6 sierpnia 2025 roku złoży projekt ustawy obniżającej podstawową stawkę VAT z 23% do 22%. Czy prezydent, zgodnie z zapowiedzią złożył 6 sierpnia obiecany projekt?",2,35,43,80,07-08-25,2025-08-07,2025.0,8.0,7.0,0.0,"Podczas kampanii wyborczej Karol Nawrocki obiecywał, że pierwszego dnia urzędowania, 6 sierpnia 2025 roku złoży projekt ustawy obniżającej podstawową stawkę VAT z 23% do 22%. Czy prezydent, zgodnie z zapowiedzią złożył 6 sierpnia obiecany projekt?","Podczas kampanii wyborczej Karol Nawrocki obiecywał, że pierwszego dnia urzędowania, 6 sierpnia 2025 roku złoży projekt ustawy obniżającej podstawową stawkę VAT z 23% do 22%. Czy prezydent, zgodnie z zapowiedzią złożył 6 sierpnia obiecany projekt?",,,,0,0,0,247,35,0.81,wysoki,4,1.0
114.0,olejnik_lukasz1,"W kampanii wyborczej Nawrocki obiecywał, że już 6 sierpnia, pierwszego dnia urzędowania, złoży projekt ustawy obniżającej VAT z 23% do 22%. Dziś 7 sierpnia. Projektu brak. Pierwsza doba prezydentury i już złamana obietnica.",0,30,5,35,07-08-25,2025-08-07,2025.0,8.0,7.0,0.0,"W kampanii wyborczej Nawrocki obiecywał, że już 6 sierpnia, pierwszego dnia urzędowania, złoży projekt ustawy obniżającej VAT z 23% do 22%. Dziś 7 sierpnia. Projektu brak. Pierwsza doba prezydentury i już złamana obietnica.","W kampanii wyborczej Nawrocki obiecywał, że już 6 sierpnia, pierwszego dnia urzędowania, złoży projekt ustawy obniżającej VAT z 23% do 22%. Dziś 7 sierpnia. Projektu brak. Pierwsza doba prezydentury i już złamana obietnica.",,,,0,0,0,223,33,6.0,wysoki,4,1.0
62.0,omzri,"KAROL NAWROCKI OSZUKAŁ POLAKÓW JUŻ W PIERWSZYM DNIU SWOJEGO URZĘDOWANIA - ŁADNIE SIĘ ZACZYNA❗🇵🇱 Karol Nawrocki obiecał Polakom, że obniżki VAT z 23% do 22% od pierwszego dnia urzędowania, czyli 6 sierpnia 2025 r., było to częścią programu wyborczego Karola Nawrockiego. Informacje te znalazły się w materiałach kampanijnych, w tym na jego oficjalnej stronie i plakatach. Nawrocki publicznie zobowiązał się, że jeśli wygra wybory to w dniu 6 sierpnia 2025 złoży projekt ustawy obniżającej podatek VAT. Okazuje się jednak, że tego nie zrobił - nie nie złożył obiecanego projektu ❗ Karol Nawrocki okłamał Polaków❗ TAK SAMO OSZUKAŁ PANA JERZEGO, KTÓREGO POZBAWIŁ MIESZKANIA Niestety Karol Nawrocki ma doświadczenie w składaniu pustych obietnic, których później nie realizuje. Przed laty obiecał starszemu mężczyźnie, że w zamian za przepisanie mieszkania zapewni mu opiekę. Gdy mieszkanie zostało przepisane Karol Nawrocki nigdy nie wywiązał się ze swojej obietnicy. Zostawił schorowanego człowieka na pastwę losu. Pan Jerzy stracił mieszkanie i trafił do Domu Pomocy Społecznej. Teraz Karol Nawrocki robi dokładnie to samo tylko na większą skalę. Zamiast okłamywać jednego staruszka, okłamuje miliony Polaków. _______ Wspieraj nasze działania. Skutecznie ścigamy patostreamerów, komunistów, rasistów, homofobów, faszystów, ksenofobów i proputinowskich nacjonalistów. Bez żadnego wsparcia państwa, bez unijnych dotacji. Jedynym źródłem finansowania działań Ośrodka są dobrowolne darowizny naszych zwolenników. Wspieraj nas: PayPal i karta płatnicza: omzrik.pl/wesprzyj-nas zbiórka: zrzutka.pl/omzrik Dane do przelewu: nr konta 19 2490 0005 0000 4520 8435 8540 Ośrodek Monitorowania Zachowań Rasistowskich i Ksenofobicznych Plac Dąbrowskiego 5 00-057 Warszawa tytuł : ""darowizna na działalność statutową"" IBAN : PL19249000050000452084358540 SWIFT: ALBPPLPW Uruchomiliśmy nasz profil na portalu Patronite, będziemy zobowiązani jeśli zdecydujecie się Państwo zostać naszymi patronami: patronite.pl/omzrik",0,9,2,11,07-08-25,2025-08-07,2025.0,8.0,7.0,0.0,"KAROL NAWROCKI OSZUKAŁ POLAKÓW JUŻ W PIERWSZYM DNIU SWOJEGO URZĘDOWANIA - ŁADNIE SIĘ ZACZYNA❗🇵🇱 Karol Nawrocki obiecał Polakom, że obniżki VAT z 23% do 22% od pierwszego dnia urzędowania, czyli 6 sierpnia 2025 r., było to częścią programu wyborczego Karola Nawrockiego. Informacje te znalazły się w materiałach kampanijnych, w tym na jego oficjalnej stronie i plakatach. Nawrocki publicznie zobowiązał się, że jeśli wygra wybory to w dniu 6 sierpnia 2025 złoży projekt ustawy obniżającej podatek VAT. Okazuje się jednak, że tego nie zrobił - nie nie złożył obiecanego projektu ❗ Karol Nawrocki okłamał Polaków❗ TAK SAMO OSZUKAŁ PANA JERZEGO, KTÓREGO POZBAWIŁ MIESZKANIA Niestety Karol Nawrocki ma doświadczenie w składaniu pustych obietnic, których później nie realizuje. Przed laty obiecał starszemu mężczyźnie, że w zamian za przepisanie mieszkania zapewni mu opiekę. Gdy mieszkanie zostało przepisane Karol Nawrocki nigdy nie wywiązał się ze swojej obietnicy. Zostawił schorowanego człowieka na pastwę losu. Pan Jerzy stracił mieszkanie i trafił do Domu Pomocy Społecznej. Teraz Karol Nawrocki robi dokładnie to samo tylko na większą skalę. Zamiast okłamywać jednego staruszka, okłamuje miliony Polaków. _______ Wspieraj nasze działania. Skutecznie ścigamy patostreamerów, komunistów, rasistów, homofobów, faszystów, ksenofobów i proputinowskich nacjonalistów. Bez żadnego wsparcia państwa, bez unijnych dotacji. Jedynym źródłem finansowania działań Ośrodka są dobrowolne darowizny naszych zwolenników. Wspieraj nas: PayPal i karta płatnicza: zbiórka: Dane do przelewu: nr konta 19 2490 0005 0000 4520 8435 8540 Ośrodek Monitorowania Zachowań Rasistowskich i Ksenofobicznych Plac Dąbrowskiego 5 00-057 Warszawa tytuł : ""darowizna na działalność statutową"" IBAN : PL19249000050000452084358540 SWIFT: ALBPPLPW Uruchomiliśmy nasz profil na portalu Patronite, będziemy zobowiązani jeśli zdecydujecie się Państwo zostać naszymi patronami:","KAROL NAWROCKI OSZUKAŁ POLAKÓW JUŻ W PIERWSZYM DNIU SWOJEGO URZĘDOWANIA - ŁADNIE SIĘ ZACZYNA❗🇵🇱 Karol Nawrocki obiecał Polakom, że obniżki VAT z 23% do 22% od pierwszego dnia urzędowania, czyli 6 sierpnia 2025 r., było to częścią programu wyborczego Karola Nawrockiego. Informacje te znalazły się w materiałach kampanijnych, w tym na jego oficjalnej stronie i plakatach. Nawrocki publicznie zobowiązał się, że jeśli wygra wybory to w dniu 6 sierpnia 2025 złoży projekt ustawy obniżającej podatek VAT. Okazuje się jednak, że tego nie zrobił - nie nie złożył obiecanego projektu ❗ Karol Nawrocki okłamał Polaków❗ TAK SAMO OSZUKAŁ PANA JERZEGO, KTÓREGO POZBAWIŁ MIESZKANIA Niestety Karol Nawrocki ma doświadczenie w składaniu pustych obietnic, których później nie realizuje. Przed laty obiecał starszemu mężczyźnie, że w zamian za przepisanie mieszkania zapewni mu opiekę. Gdy mieszkanie zostało przepisane Karol Nawrocki nigdy nie wywiązał się ze swojej obietnicy. Zostawił schorowanego człowieka na pastwę losu. Pan Jerzy stracił mieszkanie i trafił do Domu Pomocy Społecznej. Teraz Karol Nawrocki robi dokładnie to samo tylko na większą skalę. Zamiast okłamywać jednego staruszka, okłamuje miliony Polaków. _______ Wspieraj nasze działania. Skutecznie ścigamy patostreamerów, komunistów, rasistów, homofobów, faszystów, ksenofobów i proputinowskich nacjonalistów. Bez żadnego wsparcia państwa, bez unijnych dotacji. Jedynym źródłem finansowania działań Ośrodka są dobrowolne darowizny naszych zwolenników. Wspieraj nas: PayPal i karta płatnicza: zbiórka: Dane do przelewu: nr konta 19 2490 0005 0000 4520 8435 8540 Ośrodek Monitorowania Zachowań Rasistowskich i Ksenofobicznych Plac Dąbrowskiego 5 00-057 Warszawa tytuł : ""darowizna na działalność statutową"" IBAN : PL19249000050000452084358540 SWIFT: ALBPPLPW Uruchomiliśmy nasz profil na portalu Patronite, będziemy zobowiązani jeśli zdecydujecie się Państwo zostać naszymi patronami:",,,omzrik.pl/wesprzyj-nas|zrzutka.pl/omzrik|patronite.pl/omzrik,0,0,3,1936,264,4.5,średni,4,1.0
27.0,radekkar,"Karol Nawrocki w trakcie swojego orędzia podtrzymał obietnicę zrealizowania założeń „Planu 21” zaprezentowanego w trakcie kampanii wyborczej. Jego pierwszy punkt brzmi: „Pierwszego dnia urzędowania 6 sierpnia 2025 r., złożę projekt ustawy obniżającej podstawową stawkę VAT z 23% do 22%”. Pierwszy dzień za nami – projekt nie został złożony. Prezydent w trakcie swojego orędzia mówił: – 1 czerwca to wyraźny sygnał, że Polacy chcą wypełniania obietnic wyborczych, chcą wybierać swojego Prezydenta w poczuciu wolności i nie ulegną propagandzie politycznej. Paweł Szefernaker został zapytany o tę sprawę przez Michała Wróblewskiego w WP, ale nie był w stanie tego wytłumaczyć i obronić.",7,101,76,184,07-08-25,2025-08-07,2025.0,8.0,7.0,0.0,"Karol Nawrocki w trakcie swojego orędzia podtrzymał obietnicę zrealizowania założeń „Planu 21” zaprezentowanego w trakcie kampanii wyborczej. Jego pierwszy punkt brzmi: „Pierwszego dnia urzędowania 6 sierpnia 2025 r., złożę projekt ustawy obniżającej podstawową stawkę VAT z 23% do 22%”. Pierwszy dzień za nami – projekt nie został złożony. Prezydent w trakcie swojego orędzia mówił: – 1 czerwca to wyraźny sygnał, że Polacy chcą wypełniania obietnic wyborczych, chcą wybierać swojego Prezydenta w poczuciu wolności i nie ulegną propagandzie politycznej. Paweł Szefernaker został zapytany o tę sprawę przez Michała Wróblewskiego w WP, ale nie był w stanie tego wytłumaczyć i obronić.","Karol Nawrocki w trakcie swojego orędzia podtrzymał obietnicę zrealizowania założeń „Planu 21” zaprezentowanego w trakcie kampanii wyborczej. Jego pierwszy punkt brzmi: „Pierwszego dnia urzędowania 6 sierpnia 2025 r., złożę projekt ustawy obniżającej podstawową stawkę VAT z 23% do 22%”. Pierwszy dzień za nami – projekt nie został złożony. Prezydent w trakcie swojego orędzia mówił: – 1 czerwca to wyraźny sygnał, że Polacy chcą wypełniania obietnic wyborczych, chcą wybierać swojego Prezydenta w poczuciu wolności i nie ulegną propagandzie politycznej. Paweł Szefernaker został zapytany o tę sprawę przez Michała Wróblewskiego w WP, ale nie był w stanie tego wytłumaczyć i obronić.",,,,0,0,0,683,99,1.33,wysoki,4,1.0
22.0,ko_klub,".@KLubnauer w #KawaNaŁawę: Nikt nie ma wątpliwości, że ta ustawa podatkowa - którą złożył Pan Nawrocki - służy głównie najbardziej zamożnym, czyli im więcej ktoś zarabia, tym więcej by skorzystał z tego rozwiązania.",0,17,7,24,10-08-25,2025-08-10,2025.0,8.0,10.0,0.0,". w KawaNaŁawę: Nikt nie ma wątpliwości, że ta ustawa podatkowa - którą złożył Pan Nawrocki - służy głównie najbardziej zamożnym, czyli im więcej ktoś zarabia, tym więcej by skorzystał z tego rozwiązania.",". w : Nikt nie ma wątpliwości, że ta ustawa podatkowa - którą złożył Pan Nawrocki - służy głównie najbardziej zamożnym, czyli im więcej ktoś zarabia, tym więcej by skorzystał z tego rozwiązania.",@KLubnauer,#KawaNaŁawę,,1,1,0,204,33,2.43,średni,4,1.0
14.0,nawrocki25,"🇵🇱 Prezydent Karol Nawrocki podpisał projekty ustaw podatkowych! 👉 To nie obietnice – to fakty, które poprawią życie Polaków. Dzięki tym rozwiązaniom więcej pieniędzy zostanie w naszych kieszeniach, a budżet państwa zyska solidną ochronę. #MójPrezydent",19,302,264,585,09-08-25,2025-08-09,2025.0,8.0,9.0,0.0,"🇵🇱 Prezydent Karol Nawrocki podpisał projekty ustaw podatkowych! 👉 To nie obietnice – to fakty, które poprawią życie Polaków. Dzięki tym rozwiązaniom więcej pieniędzy zostanie w naszych kieszeniach, a budżet państwa zyska solidną ochronę. MójPrezydent","🇵🇱 Prezydent Karol Nawrocki podpisał projekty ustaw podatkowych! 👉 To nie obietnice – to fakty, które poprawią życie Polaków. Dzięki tym rozwiązaniom więcej pieniędzy zostanie w naszych kieszeniach, a budżet państwa zyska solidną ochronę.",,#MójPrezydent,,0,1,0,251,35,1.14,wysoki,4,1.0
198.0,aleks_z_gryfa,"Zatem skończyli się imigranci. Teraz mamy nowego wroga - chciwych przedsiębiorców, którzy pragną espresso na jachtach a biedocie tylko ochłapy. Rozumieją skąd Nawrocki chce wziąć fundusze dla rodzin wielodzietnych na zniesienie podatku?",0,24,2,26,11-08-25,2025-08-11,2025.0,8.0,11.0,0.0,"Zatem skończyli się imigranci. Teraz mamy nowego wroga - chciwych przedsiębiorców, którzy pragną espresso na jachtach a biedocie tylko ochłapy. Rozumieją skąd Nawrocki chce wziąć fundusze dla rodzin wielodzietnych na zniesienie podatku?","Zatem skończyli się imigranci. Teraz mamy nowego wroga - chciwych przedsiębiorców, którzy pragną espresso na jachtach a biedocie tylko ochłapy. Rozumieją skąd Nawrocki chce wziąć fundusze dla rodzin wielodzietnych na zniesienie podatku?",,,,0,0,0,236,32,12.0,średni,4,1.0
22.0,cocosplacebora,"Uite asta se întâmpla, dacă ar fi fost lăsați să câștige alegerile Georgescu sau Simion. The new Polish president, Karol Nawrocki, begins his term with a pro-family initiative: tax exemption for parents with two or more children. Nawrocki has signed a bill exempting parents with two or more children from income tax for annual earnings up to 140,000 zlotys ($35,400) per parent. This measure, aimed at supporting families, applies to parents of minor children, disabled children, or students up to 25 years old. It is part of his “Lower Taxes and Pro-Family” program. Additionally, Nawrocki has launched a project to accelerate the construction of an airport and a high-speed train network (CPK), planned for 2032, while ensuring the inclusion of medium-sized cities. These initiatives reflect his priorities: support for families and major infrastructure projects. polskieradio.pl/395/7784/Art…",0,0,0,0,11-08-25,2025-08-11,2025.0,8.0,11.0,0.0,"Uite asta se întâmpla, dacă ar fi fost lăsați să câștige alegerile Georgescu sau Simion. The new Polish president, Karol Nawrocki, begins his term with a pro-family initiative: tax exemption for parents with two or more children. Nawrocki has signed a bill exempting parents with two or more children from income tax for annual earnings up to 140,000 zlotys ($35,400) per parent. This measure, aimed at supporting families, applies to parents of minor children, disabled children, or students up to 25 years old. It is part of his “Lower Taxes and Pro-Family” program. Additionally, Nawrocki has launched a project to accelerate the construction of an airport and a high-speed train network (CPK), planned for 2032, while ensuring the inclusion of medium-sized cities. These initiatives reflect his priorities: support for families and major infrastructure projects.","Uite asta se întâmpla, dacă ar fi fost lăsați să câștige alegerile Georgescu sau Simion. The new Polish president, Karol Nawrocki, begins his term with a pro-family initiative: tax exemption for parents with two or more children. Nawrocki has signed a bill exempting parents with two or more children from income tax for annual earnings up to 140,000 zlotys ($35,400) per parent. This measure, aimed at supporting families, applies to parents of minor children, disabled children, or students up to 25 years old. It is part of his “Lower Taxes and Pro-Family” program. Additionally, Nawrocki has launched a project to accelerate the construction of an airport and a high-speed train network (CPK), planned for 2032, while ensuring the inclusion of medium-sized cities. These initiatives reflect his priorities: support for families and major infrastructure projects.",,,polskieradio.pl/395/7784/Art…,0,0,1,866,134,0.0,niski,4,1.0
