id,username,text,likes,retweets,replies,total_interactions,post_date_iso,date,year,month,day,hour,text_clean,text_no_links,mentions,hashtags,urls,n_mentions,n_hashtags,n_urls,char_count,word_count,amplification_ratio,reach_tier,cluster,cluster_prob
24.0,polamatysiak,"PSL postanowił zamienić poparcie zwykłych obywateli na poparcie wójtów, burmistrzów i prezydentów 😂 To się panie @KosiniakKamysz nie opłaca, nie ma ich aż tylu by tymi głosami wygrać wybory 😉 Przestańcie się wygłupiać z tym projektem ustawy likwidującej dwukadencyjność wójtów, burmistrzów i prezydentów miast.",2,146,62,210,28-06-25,2025-06-28,2025.0,6.0,28.0,0.0,"PSL postanowił zamienić poparcie zwykłych obywateli na poparcie wójtów, burmistrzów i prezydentów 😂 To się panie nie opłaca, nie ma ich aż tylu by tymi głosami wygrać wybory 😉 Przestańcie się wygłupiać z tym projektem ustawy likwidującej dwukadencyjność wójtów, burmistrzów i prezydentów miast.","PSL postanowił zamienić poparcie zwykłych obywateli na poparcie wójtów, burmistrzów i prezydentów 😂 To się panie nie opłaca, nie ma ich aż tylu by tymi głosami wygrać wybory 😉 Przestańcie się wygłupiać z tym projektem ustawy likwidującej dwukadencyjność wójtów, burmistrzów i prezydentów miast.",@KosiniakKamysz,,,1,0,0,294,43,2.35,wysoki,11,0.3339829311401684
3.0,slawek_777,"Przykro mi to pisać, ale wiedziałem, że tworzenie większości w Sejmie z koalicji 4 partii to bagno. Każdy będzie chciał coś ugrać dla siebie. Podczas, gdy koalicjanci się kłócą PiS pięknie was ogrywa. KO to nie walczaki jak PiS, dlatego uważam, że przegracie wybory, a PiS wróci.",0,0,0,0,29-06-25,2025-06-29,2025.0,6.0,29.0,0.0,"Przykro mi to pisać, ale wiedziałem, że tworzenie większości w Sejmie z koalicji 4 partii to bagno. Każdy będzie chciał coś ugrać dla siebie. Podczas, gdy koalicjanci się kłócą PiS pięknie was ogrywa. KO to nie walczaki jak PiS, dlatego uważam, że przegracie wybory, a PiS wróci.","Przykro mi to pisać, ale wiedziałem, że tworzenie większości w Sejmie z koalicji 4 partii to bagno. Każdy będzie chciał coś ugrać dla siebie. Podczas, gdy koalicjanci się kłócą PiS pięknie was ogrywa. KO to nie walczaki jak PiS, dlatego uważam, że przegracie wybory, a PiS wróci.",,,,0,0,0,279,47,0.0,niski,11,0.4711832083223755
4.0,amazgula,"Wybraliśmy @szymon_holownia , aby walczył w ramach Koalicji 15 X w obronie Konstytucji, by rozliczyć bezprawie 8 lat rządów PiS, by reagować na skalę zamachu na wolne wybory, a tym samym na władze w RP, a nie usprawiedliwiać ich antypolskie łajdactwo. Twoim zadaniem jest odkryć prawdę, uszanować każdy głos wyborczy, każdy protest, a nie legalizować PiS-zamach na wybory. Masz doprowadzić do przeliczenia wszystkich głosów wyborczych. Jeśli nie potrafisz lub nie chcesz, brak ci odwagi, przekupił cię PiS, i uważasz wyjaśnianie głosowań za kombinacje, to wynocha draniu z polityki. Przedstawiasz się jako tępy nieodpowiedzialny gówniarz, zdrajca demokracji, oszust, rycerzu kremlowskiego zakonu maltańskiego i pustaku nadmuchany chorym egoizmem. Zdradziliście demokratów i z pewnością ludzie się od was odwrócą. Dla mnie jesteś już dziś tylko śmieciem politycznym.",7,182,94,283,28-06-25,2025-06-28,2025.0,6.0,28.0,0.0,"Wybraliśmy , aby walczył w ramach Koalicji 15 X w obronie Konstytucji, by rozliczyć bezprawie 8 lat rządów PiS, by reagować na skalę zamachu na wolne wybory, a tym samym na władze w RP, a nie usprawiedliwiać ich antypolskie łajdactwo. Twoim zadaniem jest odkryć prawdę, uszanować każdy głos wyborczy, każdy protest, a nie legalizować PiS-zamach na wybory. Masz doprowadzić do przeliczenia wszystkich głosów wyborczych. Jeśli nie potrafisz lub nie chcesz, brak ci odwagi, przekupił cię PiS, i uważasz wyjaśnianie głosowań za kombinacje, to wynocha draniu z polityki. Przedstawiasz się jako tępy nieodpowiedzialny gówniarz, zdrajca demokracji, oszust, rycerzu kremlowskiego zakonu maltańskiego i pustaku nadmuchany chorym egoizmem. Zdradziliście demokratów i z pewnością ludzie się od was odwrócą. Dla mnie jesteś już dziś tylko śmieciem politycznym.","Wybraliśmy , aby walczył w ramach Koalicji 15 X w obronie Konstytucji, by rozliczyć bezprawie 8 lat rządów PiS, by reagować na skalę zamachu na wolne wybory, a tym samym na władze w RP, a nie usprawiedliwiać ich antypolskie łajdactwo. Twoim zadaniem jest odkryć prawdę, uszanować każdy głos wyborczy, każdy protest, a nie legalizować PiS-zamach na wybory. Masz doprowadzić do przeliczenia wszystkich głosów wyborczych. Jeśli nie potrafisz lub nie chcesz, brak ci odwagi, przekupił cię PiS, i uważasz wyjaśnianie głosowań za kombinacje, to wynocha draniu z polityki. Przedstawiasz się jako tępy nieodpowiedzialny gówniarz, zdrajca demokracji, oszust, rycerzu kremlowskiego zakonu maltańskiego i pustaku nadmuchany chorym egoizmem. Zdradziliście demokratów i z pewnością ludzie się od was odwrócą. Dla mnie jesteś już dziś tylko śmieciem politycznym.",@szymon_holownia,,,1,0,0,848,123,1.94,wysoki,11,0.7360563557203368
325.0,jgorzko,Zawsze chodzi o kasę. PiS już wie jak wygrywać wybory (tzn. bezkarnie fałszować ich wyniki) więc wróci do władzy w 2027 i wtedy zastosuje te same metody co wcześniej: skok na kasę państwową. Dla pieniędzy idzie się do polityki. Ale będą też dawali wszystkim. 1000+ ? Na pewno.,0,0,0,0,29-06-25,2025-06-29,2025.0,6.0,29.0,0.0,Zawsze chodzi o kasę. PiS już wie jak wygrywać wybory (tzn. bezkarnie fałszować ich wyniki) więc wróci do władzy w 2027 i wtedy zastosuje te same metody co wcześniej: skok na kasę państwową. Dla pieniędzy idzie się do polityki. Ale będą też dawali wszystkim. 1000+ ? Na pewno.,Zawsze chodzi o kasę. PiS już wie jak wygrywać wybory (tzn. bezkarnie fałszować ich wyniki) więc wróci do władzy w 2027 i wtedy zastosuje te same metody co wcześniej: skok na kasę państwową. Dla pieniędzy idzie się do polityki. Ale będą też dawali wszystkim. 1000+ ? Na pewno.,,,,0,0,0,276,48,0.0,niski,11,1.0
478.0,lukjanrd,"Twarde jądro PiSu niewiele różni się od SilnychRazem, którzy wierzą w skręcone wybory. PiS nigdy nie dojdzie do takiego poparcia, jakie miał jeszcze w pierwszej kadencji, bo 1) wypalił się 2) nie rozliczył swoich błędów.",0,0,0,0,29-06-25,2025-06-29,2025.0,6.0,29.0,0.0,"Twarde jądro PiSu niewiele różni się od SilnychRazem, którzy wierzą w skręcone wybory. PiS nigdy nie dojdzie do takiego poparcia, jakie miał jeszcze w pierwszej kadencji, bo 1) wypalił się 2) nie rozliczył swoich błędów.","Twarde jądro PiSu niewiele różni się od SilnychRazem, którzy wierzą w skręcone wybory. PiS nigdy nie dojdzie do takiego poparcia, jakie miał jeszcze w pierwszej kadencji, bo 1) wypalił się 2) nie rozliczył swoich błędów.",,,,0,0,0,220,35,0.0,niski,11,0.89001336801596
7.0,wiewiorkiibobry,Guzik prawda. Była organizowana przez osoby powiązane z konfederacją i PiS (gdy przegrali wybory w 2023). Kłamstwo to bardzo brzydka cecha.,0,0,0,0,29-06-25,2025-06-29,2025.0,6.0,29.0,0.0,Guzik prawda. Była organizowana przez osoby powiązane z konfederacją i PiS (gdy przegrali wybory w 2023). Kłamstwo to bardzo brzydka cecha.,Guzik prawda. Była organizowana przez osoby powiązane z konfederacją i PiS (gdy przegrali wybory w 2023). Kłamstwo to bardzo brzydka cecha.,,,,0,0,0,139,21,0.0,niski,11,0.3570265292664444
13.0,jacekpiekara,"♦️Czy prezes PiS lubi Konfederację czy nie, musi cały czas pamiętać, że wybory prezydenckie zostały wygrane właśnie dzięki wsparciu Konfederacji. Jej liderów, członków i sympatyków. ♦️Ale czy PiS może się zbliżyć do 40%? A czemu nie? Przecież rząd Tuska będzie się kompromitował i rozsypywał, a ludziom będzie się żyło coraz gorzej. ♦️Na upadku Tuska i jego przystawek pewnie najbardziej zyska Konfederacja, ale i PiS może mocno iść w górę, jeśli tylko będzie się zachowywał mądrze...",0,34,44,78,29-06-25,2025-06-29,2025.0,6.0,29.0,0.0,"♦️Czy prezes PiS lubi Konfederację czy nie, musi cały czas pamiętać, że wybory prezydenckie zostały wygrane właśnie dzięki wsparciu Konfederacji. Jej liderów, członków i sympatyków. ♦️Ale czy PiS może się zbliżyć do 40%? A czemu nie? Przecież rząd Tuska będzie się kompromitował i rozsypywał, a ludziom będzie się żyło coraz gorzej. ♦️Na upadku Tuska i jego przystawek pewnie najbardziej zyska Konfederacja, ale i PiS może mocno iść w górę, jeśli tylko będzie się zachowywał mądrze...","♦️Czy prezes PiS lubi Konfederację czy nie, musi cały czas pamiętać, że wybory prezydenckie zostały wygrane właśnie dzięki wsparciu Konfederacji. Jej liderów, członków i sympatyków. ♦️Ale czy PiS może się zbliżyć do 40%? A czemu nie? Przecież rząd Tuska będzie się kompromitował i rozsypywał, a ludziom będzie się żyło coraz gorzej. ♦️Na upadku Tuska i jego przystawek pewnie najbardziej zyska Konfederacja, ale i PiS może mocno iść w górę, jeśli tylko będzie się zachowywał mądrze...",,,,0,0,0,484,75,0.77,wysoki,11,0.4245716583401286
17.0,janniezbdn88726,Rządzący wtedy PIS był latami szantażowany przez neomarksistów i zdrajców POKOwskich w sprawie KPO (jak marchewką na kiju) idąc naiwnie na ustępstwa tym kłamcom nie uzyskał kompletnie NIC i w dodatku przegrał (choć wygrał) wybory!,0,0,0,0,29-06-25,2025-06-29,2025.0,6.0,29.0,0.0,Rządzący wtedy PIS był latami szantażowany przez neomarksistów i zdrajców POKOwskich w sprawie KPO (jak marchewką na kiju) idąc naiwnie na ustępstwa tym kłamcom nie uzyskał kompletnie NIC i w dodatku przegrał (choć wygrał) wybory!,Rządzący wtedy PIS był latami szantażowany przez neomarksistów i zdrajców POKOwskich w sprawie KPO (jak marchewką na kiju) idąc naiwnie na ustępstwa tym kłamcom nie uzyskał kompletnie NIC i w dodatku przegrał (choć wygrał) wybory!,,,,0,0,0,230,35,0.0,niski,11,0.3137017624175947
22.0,muirin7,"Jak zwykle uważacie się za większość a nią nie jesteście. W 2023 wybory parlamentarne wygrał PiS, nie stworzył jednak większościowego rządu. Wszystkie głosy już zostały policzone, polskie prawo nie przewiduje możliwości ponownego liczenia. Historycznie logika to część filozofii",0,0,0,0,29-06-25,2025-06-29,2025.0,6.0,29.0,0.0,"Jak zwykle uważacie się za większość a nią nie jesteście. W 2023 wybory parlamentarne wygrał PiS, nie stworzył jednak większościowego rządu. Wszystkie głosy już zostały policzone, polskie prawo nie przewiduje możliwości ponownego liczenia. Historycznie logika to część filozofii","Jak zwykle uważacie się za większość a nią nie jesteście. W 2023 wybory parlamentarne wygrał PiS, nie stworzył jednak większościowego rządu. Wszystkie głosy już zostały policzone, polskie prawo nie przewiduje możliwości ponownego liczenia. Historycznie logika to część filozofii",,,,0,0,0,278,38,0.0,niski,11,0.32885186546367
33.0,feliksgrot,"Minister @Adbodnar nie kwapi się do rozliczeń fałszerstw w KW ponieważ wszyscy ""od lewej do prawej"" stwierdzili już że wybory wygrał alfons. Gdyby to PiS byłby w adekwatnej sytuacji to areszty byłyby już zapełnione członkami KW a marszałek Witek nie dopuściłaby do zwołania ZN.",1,12,0,13,29-06-25,2025-06-29,2025.0,6.0,29.0,0.0,"Minister nie kwapi się do rozliczeń fałszerstw w KW ponieważ wszyscy ""od lewej do prawej"" stwierdzili już że wybory wygrał alfons. Gdyby to PiS byłby w adekwatnej sytuacji to areszty byłyby już zapełnione członkami KW a marszałek Witek nie dopuściłaby do zwołania ZN.","Minister nie kwapi się do rozliczeń fałszerstw w KW ponieważ wszyscy ""od lewej do prawej"" stwierdzili już że wybory wygrał alfons. Gdyby to PiS byłby w adekwatnej sytuacji to areszty byłyby już zapełnione członkami KW a marszałek Witek nie dopuściłaby do zwołania ZN.",@Adbodnar,,,1,0,0,267,43,12.0,wysoki,11,0.4330017331349277
16.0,grzegorzzi20964,Jak to jest że PiS nie skręcił wyborów parlamentarnych będąc u władzy i mając całą machinę wyborczą w rękach a skręcił wybory prezydenckie? Wytłumaczy ktoś ?,0,0,0,0,29-06-25,2025-06-29,2025.0,6.0,29.0,0.0,Jak to jest że PiS nie skręcił wyborów parlamentarnych będąc u władzy i mając całą machinę wyborczą w rękach a skręcił wybory prezydenckie? Wytłumaczy ktoś ?,Jak to jest że PiS nie skręcił wyborów parlamentarnych będąc u władzy i mając całą machinę wyborczą w rękach a skręcił wybory prezydenckie? Wytłumaczy ktoś ?,,,,0,0,0,157,26,0.0,niski,11,0.934383714038076
25.0,grzegorzzi20964,Jak to jest że PiS nie skręcił wyborów parlamentarnych będąc u władzy i mając całą machinę wyborczą w rękach a skręcił wybory prezydenckie? Wytłumaczysz ?,0,0,0,0,29-06-25,2025-06-29,2025.0,6.0,29.0,0.0,Jak to jest że PiS nie skręcił wyborów parlamentarnych będąc u władzy i mając całą machinę wyborczą w rękach a skręcił wybory prezydenckie? Wytłumaczysz ?,Jak to jest że PiS nie skręcił wyborów parlamentarnych będąc u władzy i mając całą machinę wyborczą w rękach a skręcił wybory prezydenckie? Wytłumaczysz ?,,,,0,0,0,154,25,0.0,niski,11,0.9980940289688672
34.0,grzegorzzi20964,Jak to jest że PiS nie skręcił wyborów parlamentarnych będąc u władzy i mając całą machinę wyborczą w rękach a skręcił wybory prezydenckie? Wytłumaczy ktoś?,0,0,0,0,29-06-25,2025-06-29,2025.0,6.0,29.0,0.0,Jak to jest że PiS nie skręcił wyborów parlamentarnych będąc u władzy i mając całą machinę wyborczą w rękach a skręcił wybory prezydenckie? Wytłumaczy ktoś?,Jak to jest że PiS nie skręcił wyborów parlamentarnych będąc u władzy i mając całą machinę wyborczą w rękach a skręcił wybory prezydenckie? Wytłumaczy ktoś?,,,,0,0,0,156,25,0.0,niski,11,0.884260905216458
65.0,m_lxxvii,"PiS umie w PR, i niestety dobrze im to wychodzi. A że kłamią i manipulują to wie tylko część, reszta „kupuje” ten ich fałszywy przekaz bo jest tak zrobiony że trafia. Kiedy KO to w końcu zrozumie? Jak Kaczor wróci do władzy bo przegrają wybory!",0,1,1,2,29-06-25,2025-06-29,2025.0,6.0,29.0,0.0,"PiS umie w PR, i niestety dobrze im to wychodzi. A że kłamią i manipulują to wie tylko część, reszta „kupuje” ten ich fałszywy przekaz bo jest tak zrobiony że trafia. Kiedy KO to w końcu zrozumie? Jak Kaczor wróci do władzy bo przegrają wybory!","PiS umie w PR, i niestety dobrze im to wychodzi. A że kłamią i manipulują to wie tylko część, reszta „kupuje” ten ich fałszywy przekaz bo jest tak zrobiony że trafia. Kiedy KO to w końcu zrozumie? Jak Kaczor wróci do władzy bo przegrają wybory!",,,,0,0,0,244,45,1.0,średni,11,0.6614077147000551
296.0,tgtarnogorski,"Dlatego PiS przegrał wybory, dlatego już nigdy nie będzie samodzielnie rządzić?",6,27,32,65,28-06-25,2025-06-28,2025.0,6.0,28.0,0.0,"Dlatego PiS przegrał wybory, dlatego już nigdy nie będzie samodzielnie rządzić?","Dlatego PiS przegrał wybory, dlatego już nigdy nie będzie samodzielnie rządzić?",,,,0,0,0,79,11,0.84,wysoki,11,0.7540263974594309
14.0,grzegorz355,PiS podczas swoich rządów wcisną swoich ludzi do sądu najwyższego i zrobił z nich sędziów jednej z izb którzy mają ogłosić czy wybory były prawidłowe i czy wygrał ich człowiek. A koalicja 15 października prócz PO siedzi jak mysz pod miotłą i drży aby tylko PiS nie tupnął nogą🤦,0,2,0,2,29-06-25,2025-06-29,2025.0,6.0,29.0,0.0,PiS podczas swoich rządów wcisną swoich ludzi do sądu najwyższego i zrobił z nich sędziów jednej z izb którzy mają ogłosić czy wybory były prawidłowe i czy wygrał ich człowiek. A koalicja 15 października prócz PO siedzi jak mysz pod miotłą i drży aby tylko PiS nie tupnął nogą🤦,PiS podczas swoich rządów wcisną swoich ludzi do sądu najwyższego i zrobił z nich sędziów jednej z izb którzy mają ogłosić czy wybory były prawidłowe i czy wygrał ich człowiek. A koalicja 15 października prócz PO siedzi jak mysz pod miotłą i drży aby tylko PiS nie tupnął nogą🤦,,,,0,0,0,277,49,2.0,średni,11,0.3846506812080548
29.0,ten_psycholog,"Pamiętacie jak po jednej z debat w I turze wyborów prezydenckich mówiłem, że PiS będzie grzał temat imigrantów? To było dawno temu jak to pisałem i teraz jesteśmy w momencie kulminacyjnym. To co zostanie w głowach nieświadomych faktów wyborców, ukształtuje ich wybory w 2027 roku.",1,45,18,64,29-06-25,2025-06-29,2025.0,6.0,29.0,0.0,"Pamiętacie jak po jednej z debat w I turze wyborów prezydenckich mówiłem, że PiS będzie grzał temat imigrantów? To było dawno temu jak to pisałem i teraz jesteśmy w momencie kulminacyjnym. To co zostanie w głowach nieświadomych faktów wyborców, ukształtuje ich wybory w 2027 roku.","Pamiętacie jak po jednej z debat w I turze wyborów prezydenckich mówiłem, że PiS będzie grzał temat imigrantów? To było dawno temu jak to pisałem i teraz jesteśmy w momencie kulminacyjnym. To co zostanie w głowach nieświadomych faktów wyborców, ukształtuje ich wybory w 2027 roku.",,,,0,0,0,280,45,2.5,wysoki,11,0.578076556391126
265.0,micha64138297,I co do sprzątani tego bałaganu potrzebujecie ściągać inżynierów? Niestety ale PiS wygra następne wybory bo KO napluło Polakom w twarz. Chodziło tylko o władzę.,0,0,0,0,29-06-25,2025-06-29,2025.0,6.0,29.0,0.0,I co do sprzątani tego bałaganu potrzebujecie ściągać inżynierów? Niestety ale PiS wygra następne wybory bo KO napluło Polakom w twarz. Chodziło tylko o władzę.,I co do sprzątani tego bałaganu potrzebujecie ściągać inżynierów? Niestety ale PiS wygra następne wybory bo KO napluło Polakom w twarz. Chodziło tylko o władzę.,,,,0,0,0,160,25,0.0,niski,11,0.7541223789611183
29.0,lowca_androidow,To że PiS i spółka wygra następne wybory parlamentarne to raczej pewnik biorąc pod uwagę sprawczość koalicji. Sugeruje by do tego czasu rząd spowodował następujące zmiany: - 800+ zwiększyć na 5000+ - VAT na wszystko 1% - pierwszy próg podatkowy na 300k - benzyna po 1 zł - darmowe kluby go-go - akcyza na alkohol i fajki 0% - legalizacja marihuany i całej reszty I niech się PiS i spółka wykaże jak przejmie władzę.,3,15,18,36,29-06-25,2025-06-29,2025.0,6.0,29.0,0.0,To że PiS i spółka wygra następne wybory parlamentarne to raczej pewnik biorąc pod uwagę sprawczość koalicji. Sugeruje by do tego czasu rząd spowodował następujące zmiany: - 800+ zwiększyć na 5000+ - VAT na wszystko 1% - pierwszy próg podatkowy na 300k - benzyna po 1 zł - darmowe kluby go-go - akcyza na alkohol i fajki 0% - legalizacja marihuany i całej reszty I niech się PiS i spółka wykaże jak przejmie władzę.,To że PiS i spółka wygra następne wybory parlamentarne to raczej pewnik biorąc pod uwagę sprawczość koalicji. Sugeruje by do tego czasu rząd spowodował następujące zmiany: - 800+ zwiększyć na 5000+ - VAT na wszystko 1% - pierwszy próg podatkowy na 300k - benzyna po 1 zł - darmowe kluby go-go - akcyza na alkohol i fajki 0% - legalizacja marihuany i całej reszty I niech się PiS i spółka wykaże jak przejmie władzę.,,,,0,0,0,415,74,0.83,wysoki,11,0.7741774749928342
57.0,piotr_bradecki,"Kiedy weźmiecie się za realizowanie programu ? Bo ciągle gadacie tylko o PiSie a nawet nie potraficie rozliczyć ich złodziejstwa. Jak tak dalej pójdzie to przegracie z kretesem najbliższe wybory, być może przedterminowe.",0,0,0,0,30-06-25,2025-06-30,2025.0,6.0,30.0,0.0,"Kiedy weźmiecie się za realizowanie programu ? Bo ciągle gadacie tylko o PiSie a nawet nie potraficie rozliczyć ich złodziejstwa. Jak tak dalej pójdzie to przegracie z kretesem najbliższe wybory, być może przedterminowe.","Kiedy weźmiecie się za realizowanie programu ? Bo ciągle gadacie tylko o PiSie a nawet nie potraficie rozliczyć ich złodziejstwa. Jak tak dalej pójdzie to przegracie z kretesem najbliższe wybory, być może przedterminowe.",,,,0,0,0,220,33,0.0,niski,11,0.3512216067844841
180.0,tomaszstrehl,"Wybory pokazały jedno - żyjemy w kraju, w którym PiSowski ogon kręci państwowym psem. Smutne, bo oczekiwalem, że po latach upartyjnienia państwo zostanie zwrócone obywatelom. Tymczasem, mam poczucie, że K15X bardziej troszczy się o dobrostan PiSowskich nominatów, niż o wyborców.",0,78,7,85,30-06-25,2025-06-30,2025.0,6.0,30.0,0.0,"Wybory pokazały jedno - żyjemy w kraju, w którym PiSowski ogon kręci państwowym psem. Smutne, bo oczekiwalem, że po latach upartyjnienia państwo zostanie zwrócone obywatelom. Tymczasem, mam poczucie, że K15X bardziej troszczy się o dobrostan PiSowskich nominatów, niż o wyborców.","Wybory pokazały jedno - żyjemy w kraju, w którym PiSowski ogon kręci państwowym psem. Smutne, bo oczekiwalem, że po latach upartyjnienia państwo zostanie zwrócone obywatelom. Tymczasem, mam poczucie, że K15X bardziej troszczy się o dobrostan PiSowskich nominatów, niż o wyborców.",,,,0,0,0,279,40,11.14,wysoki,11,0.6406070800771687
138.0,lucatonioff,"Co to w ogóle za zarzut ? Przecież kolacja wygrała wybory z hasłami na ustach, że wszytko co robił PiS to złe i oni to naprawią, a teraz wywracanie kota ogonem. Jest nawet języku polskim odpowiednie słowo, które to odzwierciedla - hipokryzja.",0,0,0,0,30-06-25,2025-06-30,2025.0,6.0,30.0,0.0,"Co to w ogóle za zarzut ? Przecież kolacja wygrała wybory z hasłami na ustach, że wszytko co robił PiS to złe i oni to naprawią, a teraz wywracanie kota ogonem. Jest nawet języku polskim odpowiednie słowo, które to odzwierciedla - hipokryzja.","Co to w ogóle za zarzut ? Przecież kolacja wygrała wybory z hasłami na ustach, że wszytko co robił PiS to złe i oni to naprawią, a teraz wywracanie kota ogonem. Jest nawet języku polskim odpowiednie słowo, które to odzwierciedla - hipokryzja.",,,,0,0,0,242,42,0.0,niski,11,0.6901030564375956
243.0,miroszak,"Jak protestem można sfałszować wybory? Nabijasz się ptysiu ze starszej osoby, która nie ogarnia formalnych zagadnień skargi, a jest zaniepokojona błędami, więc chciała by ktoś to sprawdził? Jakże łatwo staliście się w PiS podobni do PO, które wg was gardzi prostymi ludźmi...",0,0,0,0,30-06-25,2025-06-30,2025.0,6.0,30.0,0.0,"Jak protestem można sfałszować wybory? Nabijasz się ptysiu ze starszej osoby, która nie ogarnia formalnych zagadnień skargi, a jest zaniepokojona błędami, więc chciała by ktoś to sprawdził? Jakże łatwo staliście się w PiS podobni do PO, które wg was gardzi prostymi ludźmi...","Jak protestem można sfałszować wybory? Nabijasz się ptysiu ze starszej osoby, która nie ogarnia formalnych zagadnień skargi, a jest zaniepokojona błędami, więc chciała by ktoś to sprawdził? Jakże łatwo staliście się w PiS podobni do PO, które wg was gardzi prostymi ludźmi...",,,,0,0,0,275,42,0.0,niski,11,0.5018136201275367
6.0,groblklaud55667,Jak PiS wygra wybory to już będzie definitywny koniec. Tusk i jego ekipa zaniedbują sporo spraw.,0,0,0,0,30-06-25,2025-06-30,2025.0,6.0,30.0,0.0,Jak PiS wygra wybory to już będzie definitywny koniec. Tusk i jego ekipa zaniedbują sporo spraw.,Jak PiS wygra wybory to już będzie definitywny koniec. Tusk i jego ekipa zaniedbują sporo spraw.,,,,0,0,0,96,16,0.0,niski,11,0.7090587746256737
9.0,marioawario,"PiS owska izba nie udostępniła prokuratorowi generalnemu akt ws protestów wyborczych Bawcie się dalej… To na pewno były uczciwe wybory..,@szymon_holownia",0,13,0,13,30-06-25,2025-06-30,2025.0,6.0,30.0,0.0,"PiS owska izba nie udostępniła prokuratorowi generalnemu akt ws protestów wyborczych Bawcie się dalej… To na pewno były uczciwe wybory..,","PiS owska izba nie udostępniła prokuratorowi generalnemu akt ws protestów wyborczych Bawcie się dalej… To na pewno były uczciwe wybory..,",@szymon_holownia,,,1,0,0,137,20,13.0,wysoki,11,1.0
23.0,bd3art,"Niestety mało kto o tym mówi. A teraz na chwilę przyjmijmy wersję taką że faktycznie PiS zmanipulował wybory... Gdzie postawimy kreskę temu gdzie kończy się rozmiar manipulacji. Co np. z wpływem państw (czyt. Rosja) obcych. Czy nie widzimy zagrożenia, że na bazie...",0,0,0,0,30-06-25,2025-06-30,2025.0,6.0,30.0,0.0,"Niestety mało kto o tym mówi. A teraz na chwilę przyjmijmy wersję taką że faktycznie PiS zmanipulował wybory... Gdzie postawimy kreskę temu gdzie kończy się rozmiar manipulacji. Co np. z wpływem państw (czyt. Rosja) obcych. Czy nie widzimy zagrożenia, że na bazie...","Niestety mało kto o tym mówi. A teraz na chwilę przyjmijmy wersję taką że faktycznie PiS zmanipulował wybory... Gdzie postawimy kreskę temu gdzie kończy się rozmiar manipulacji. Co np. z wpływem państw (czyt. Rosja) obcych. Czy nie widzimy zagrożenia, że na bazie...",,,,0,0,0,266,42,0.0,niski,11,0.8260385513324787
352.0,przemekwis4140,Skoro PiS w opozycji bez finansowania skręcił wybory organizowane przez was wśród waszych przedstawicieli którzy w dużej mierze byli przewodniczącymi tych komisji to chyba jesteście skończonymi FAJTŁAPAMI,0,0,0,0,30-06-25,2025-06-30,2025.0,6.0,30.0,0.0,Skoro PiS w opozycji bez finansowania skręcił wybory organizowane przez was wśród waszych przedstawicieli którzy w dużej mierze byli przewodniczącymi tych komisji to chyba jesteście skończonymi FAJTŁAPAMI,Skoro PiS w opozycji bez finansowania skręcił wybory organizowane przez was wśród waszych przedstawicieli którzy w dużej mierze byli przewodniczącymi tych komisji to chyba jesteście skończonymi FAJTŁAPAMI,,,,0,0,0,204,27,0.0,niski,11,0.9174076257547236
