id,username,text,likes,retweets,replies,total_interactions,post_date_iso,date,year,month,day,hour,text_clean,text_no_links,mentions,hashtags,urls,n_mentions,n_hashtags,n_urls,char_count,word_count,amplification_ratio,reach_tier,cluster,cluster_prob
6.0,mattjarospl,"🚨 Prezydent Nawrocki właśnie otworzył Polskę NA OŚCIEŻ dla obcych wojsk. Jeszcze wczoraj gadali, że „bronimy granic”, a dziś tajnym podpisem – pach! – obce kontyngenty mogą wchodzić, rozlokowywać się i robić co chcą. I to nie jest teoria. To jest FAKT z komunikatu BBN. A równolegle? – Syreny wyją w 3 województwach. Ludzi straszą bunkrami, których NIE MA. – Na forum ONZ kompromitacja: pokazują zdjęcie rozwalonego budynku i bajają, że to Rosja. A potem wychodzi, że mogli strzelić nasi „sojusznicy”. – Blokują szlak do Chin, dokładnie dzień po uruchomieniu. To byłby złoty interes, 40 pociągów dziennie, kasa dla Polski. Zamiast tego: zero, bo tak każe Waszyngton. – I na dokładkę pojawia się w Warszawie Wang Yi – chiński minister spraw zagranicznych, który przyjeżdża w krytycznym momencie. A kogo witają? „Zdradka” Sikorskiego – symbol atlantyckiej lojalności wobec obcych. I teraz powiedzcie mi: to jest obrona Polski czy wciąganie Polski w cudzą wojnę? 🇷🇺 Po drugiej stronie stoi Rosja z rakietami Sarmat, które w 30 minut mogą zmieść centra NATO. 🇨🇳 Po drugiej stronie stoi blok BRICS i Chiny – które zamiast prowokować, budują infrastrukturę i próbują powstrzymać eskalację. 🇵🇱 A my? My mamy być poligonem, mięsem armatnim i chłopcem na posyłki. 💥 To nie jest czas na złudzenia. To nie są „ćwiczenia”. To jest rozstawianie pionków do konfrontacji. 👉 Obejrzyj cały materiał, bo to się dzieje TERAZ, a nie za rok. 👉 I odpowiedz sobie sam: czy Twoje dzieci mają iść w cudzą wojnę, żeby Niemiec, Amerykanin czy Soros miał „spokój”? Bo jeśli tego nie zatrzymamy – to nie pytanie „czy”, tylko „kiedy” zadzwoni telefon z kartą mobilizacyjną. 🚨 OBEJRZYJ I UDOSTĘPNIJ. NIECH LUDZIE ZOBACZĄ, CO IM SZYKUJĄ ZA PLECAMI.",0,21,6,27,15-09-25,2025-09-15,2025.0,9.0,15.0,0.0,"🚨 Prezydent Nawrocki właśnie otworzył Polskę NA OŚCIEŻ dla obcych wojsk. Jeszcze wczoraj gadali, że „bronimy granic”, a dziś tajnym podpisem – pach! – obce kontyngenty mogą wchodzić, rozlokowywać się i robić co chcą. I to nie jest teoria. To jest FAKT z komunikatu BBN. A równolegle? – Syreny wyją w 3 województwach. Ludzi straszą bunkrami, których NIE MA. – Na forum ONZ kompromitacja: pokazują zdjęcie rozwalonego budynku i bajają, że to Rosja. A potem wychodzi, że mogli strzelić nasi „sojusznicy”. – Blokują szlak do Chin, dokładnie dzień po uruchomieniu. To byłby złoty interes, 40 pociągów dziennie, kasa dla Polski. Zamiast tego: zero, bo tak każe Waszyngton. – I na dokładkę pojawia się w Warszawie Wang Yi – chiński minister spraw zagranicznych, który przyjeżdża w krytycznym momencie. A kogo witają? „Zdradka” Sikorskiego – symbol atlantyckiej lojalności wobec obcych. I teraz powiedzcie mi: to jest obrona Polski czy wciąganie Polski w cudzą wojnę? 🇷🇺 Po drugiej stronie stoi Rosja z rakietami Sarmat, które w 30 minut mogą zmieść centra NATO. 🇨🇳 Po drugiej stronie stoi blok BRICS i Chiny – które zamiast prowokować, budują infrastrukturę i próbują powstrzymać eskalację. 🇵🇱 A my? My mamy być poligonem, mięsem armatnim i chłopcem na posyłki. 💥 To nie jest czas na złudzenia. To nie są „ćwiczenia”. To jest rozstawianie pionków do konfrontacji. 👉 Obejrzyj cały materiał, bo to się dzieje TERAZ, a nie za rok. 👉 I odpowiedz sobie sam: czy Twoje dzieci mają iść w cudzą wojnę, żeby Niemiec, Amerykanin czy Soros miał „spokój”? Bo jeśli tego nie zatrzymamy – to nie pytanie „czy”, tylko „kiedy” zadzwoni telefon z kartą mobilizacyjną. 🚨 OBEJRZYJ I UDOSTĘPNIJ. NIECH LUDZIE ZOBACZĄ, CO IM SZYKUJĄ ZA PLECAMI.","🚨 Prezydent Nawrocki właśnie otworzył Polskę NA OŚCIEŻ dla obcych wojsk. Jeszcze wczoraj gadali, że „bronimy granic”, a dziś tajnym podpisem – pach! – obce kontyngenty mogą wchodzić, rozlokowywać się i robić co chcą. I to nie jest teoria. To jest FAKT z komunikatu BBN. A równolegle? – Syreny wyją w 3 województwach. Ludzi straszą bunkrami, których NIE MA. – Na forum ONZ kompromitacja: pokazują zdjęcie rozwalonego budynku i bajają, że to Rosja. A potem wychodzi, że mogli strzelić nasi „sojusznicy”. – Blokują szlak do Chin, dokładnie dzień po uruchomieniu. To byłby złoty interes, 40 pociągów dziennie, kasa dla Polski. Zamiast tego: zero, bo tak każe Waszyngton. – I na dokładkę pojawia się w Warszawie Wang Yi – chiński minister spraw zagranicznych, który przyjeżdża w krytycznym momencie. A kogo witają? „Zdradka” Sikorskiego – symbol atlantyckiej lojalności wobec obcych. I teraz powiedzcie mi: to jest obrona Polski czy wciąganie Polski w cudzą wojnę? 🇷🇺 Po drugiej stronie stoi Rosja z rakietami Sarmat, które w 30 minut mogą zmieść centra NATO. 🇨🇳 Po drugiej stronie stoi blok BRICS i Chiny – które zamiast prowokować, budują infrastrukturę i próbują powstrzymać eskalację. 🇵🇱 A my? My mamy być poligonem, mięsem armatnim i chłopcem na posyłki. 💥 To nie jest czas na złudzenia. To nie są „ćwiczenia”. To jest rozstawianie pionków do konfrontacji. 👉 Obejrzyj cały materiał, bo to się dzieje TERAZ, a nie za rok. 👉 I odpowiedz sobie sam: czy Twoje dzieci mają iść w cudzą wojnę, żeby Niemiec, Amerykanin czy Soros miał „spokój”? Bo jeśli tego nie zatrzymamy – to nie pytanie „czy”, tylko „kiedy” zadzwoni telefon z kartą mobilizacyjną. 🚨 OBEJRZYJ I UDOSTĘPNIJ. NIECH LUDZIE ZOBACZĄ, CO IM SZYKUJĄ ZA PLECAMI.",,,,0,0,0,1716,280,3.5,średni,24,0.7706443611955507
129.0,karolpopieramy,"🚨 Prezydent Karol Nawrocki w Berlinie 🇩🇪 w wywiadzie dla BILD: „Niemcy popełniły błędy w swojej polityce migracyjnej, których Polska uniknęła.”",2,86,15,103,16-09-25,2025-09-16,2025.0,9.0,16.0,0.0,"🚨 Prezydent Karol Nawrocki w Berlinie 🇩🇪 w wywiadzie dla BILD: „Niemcy popełniły błędy w swojej polityce migracyjnej, których Polska uniknęła.”","🚨 Prezydent Karol Nawrocki w Berlinie 🇩🇪 w wywiadzie dla BILD: „Niemcy popełniły błędy w swojej polityce migracyjnej, których Polska uniknęła.”",,,,0,0,0,143,21,5.73,wysoki,24,0.8129623142240661
179.0,f_desouche,"Karol Nawrocki (Pdt Polonais) : ""Nous devons avant tout contrôler l’immigration illégale qui menace nos frontières... Nous réclamons à ce qu'on respecte notre culture et que l'ordre et la sécurité règnent dans notre maison""",6,300,20,326,16-09-25,2025-09-16,2025.0,9.0,16.0,0.0,"Karol Nawrocki (Pdt Polonais) : ""Nous devons avant tout contrôler l’immigration illégale qui menace nos frontières... Nous réclamons à ce qu'on respecte notre culture et que l'ordre et la sécurité règnent dans notre maison""","Karol Nawrocki (Pdt Polonais) : ""Nous devons avant tout contrôler l’immigration illégale qui menace nos frontières... Nous réclamons à ce qu'on respecte notre culture et que l'ordre et la sécurité règnent dans notre maison""",,,,0,0,0,223,34,15.0,wysoki,24,1.0
14.0,vigilantfox,"Poland’s conservative President Karol Nawrocki tells Maria Bartiromo that Poland is thriving. Not just because of economic growth, but because they REFUSED to make the same two mistakes as all of the other countries in Western Europe. “This economic growth of Poland, which is noticed by all the countries, not only in Europe, but all over the world, is very radical.” “Poland also safe and secure, which is important. We did not make the mistakes about illegal migration, which affected west European countries.” “And we’re not going to repeat these mistakes.” “We do not want to make mistakes of Green Deal, which also has an impact on the economic life.”",1,140,18,159,23-09-25,2025-09-23,2025.0,9.0,23.0,0.0,"Poland’s conservative President Karol Nawrocki tells Maria Bartiromo that Poland is thriving. Not just because of economic growth, but because they REFUSED to make the same two mistakes as all of the other countries in Western Europe. “This economic growth of Poland, which is noticed by all the countries, not only in Europe, but all over the world, is very radical.” “Poland also safe and secure, which is important. We did not make the mistakes about illegal migration, which affected west European countries.” “And we’re not going to repeat these mistakes.” “We do not want to make mistakes of Green Deal, which also has an impact on the economic life.”","Poland’s conservative President Karol Nawrocki tells Maria Bartiromo that Poland is thriving. Not just because of economic growth, but because they REFUSED to make the same two mistakes as all of the other countries in Western Europe. “This economic growth of Poland, which is noticed by all the countries, not only in Europe, but all over the world, is very radical.” “Poland also safe and secure, which is important. We did not make the mistakes about illegal migration, which affected west European countries.” “And we’re not going to repeat these mistakes.” “We do not want to make mistakes of Green Deal, which also has an impact on the economic life.”",,,,0,0,0,657,110,7.78,wysoki,24,1.0
14.0,adammoczar,"⚡🇵🇱 President of Poland, Karol Nawrocki: ""My Poland is a Poland without illegal migrants. It is a Poland where instead of integration centers, there are deportation centers for those who want to destroy our safety."" MEGA 🇪🇺🇪🇺",5,178,23,206,01-10-25,2025-10-01,2025.0,10.0,1.0,0.0,"⚡🇵🇱 President of Poland, Karol Nawrocki: ""My Poland is a Poland without illegal migrants. It is a Poland where instead of integration centers, there are deportation centers for those who want to destroy our safety."" MEGA 🇪🇺🇪🇺","⚡🇵🇱 President of Poland, Karol Nawrocki: ""My Poland is a Poland without illegal migrants. It is a Poland where instead of integration centers, there are deportation centers for those who want to destroy our safety."" MEGA 🇪🇺🇪🇺",,,,0,0,0,225,37,7.74,wysoki,24,1.0
2.0,mkierwinski,"Błaszczak pisze, że kwestia zablokowania Paktu Migracyjnego to zasługa jednego listu prezydenta. To dobrze ż K. Nawrocki wsparł rząd na ostatniej prostej, ale to były miesiące długich, trudnych negocjacji. Nie widziałem tam nikogo z PiS czy Kancelarii Prezydenta. I tyle.",3,143,63,209,12-10-25,2025-10-12,2025.0,10.0,12.0,0.0,"Błaszczak pisze, że kwestia zablokowania Paktu Migracyjnego to zasługa jednego listu prezydenta. To dobrze ż K. Nawrocki wsparł rząd na ostatniej prostej, ale to były miesiące długich, trudnych negocjacji. Nie widziałem tam nikogo z PiS czy Kancelarii Prezydenta. I tyle.","Błaszczak pisze, że kwestia zablokowania Paktu Migracyjnego to zasługa jednego listu prezydenta. To dobrze ż K. Nawrocki wsparł rząd na ostatniej prostej, ale to były miesiące długich, trudnych negocjacji. Nie widziałem tam nikogo z PiS czy Kancelarii Prezydenta. I tyle.",,,,0,0,0,271,40,2.27,wysoki,24,0.7719475166756293
5.0,20jaskulski,"Już w lutym premier @donaldtusk zapowiadał: „Polska nie wdroży paktu migracyjnego”!💪🇵🇱 Dziś PiS wciska, że to Nawrocki go wstrzymał. To dobra okazja, żeby przypomnieć Polakom, że jedyne, co PiS potrafi wstrzymać w UE, to środki dla Polski.",4,92,70,166,12-10-25,2025-10-12,2025.0,10.0,12.0,0.0,"Już w lutym premier zapowiadał: „Polska nie wdroży paktu migracyjnego”!💪🇵🇱 Dziś PiS wciska, że to Nawrocki go wstrzymał. To dobra okazja, żeby przypomnieć Polakom, że jedyne, co PiS potrafi wstrzymać w UE, to środki dla Polski.","Już w lutym premier zapowiadał: „Polska nie wdroży paktu migracyjnego”!💪🇵🇱 Dziś PiS wciska, że to Nawrocki go wstrzymał. To dobra okazja, żeby przypomnieć Polakom, że jedyne, co PiS potrafi wstrzymać w UE, to środki dla Polski.",@donaldtusk,,,1,0,0,227,36,1.31,wysoki,24,0.92016164568931
6.0,tomaszjanusz,"Zjawiskowa seria pana @JaroslawSellin z PiS w Radiu ZET: 1. Nie potrafił wytłumaczyć jak prezydent @NawrockiKn miałby skutecznie zablokować pakt migracyjny 2. Wymyślił, że Nawrocki zmieni rząd. Drobne przypomnienie: W Polsce Prezydent RP nie zmienia rządu, czyli może pan Sellin proponuje zamach stanu? 3. Stwierdził, że te wszystkie lewe wizy pana Wawrzyka to była legalna migracja, bo był wystawiony dokument 🤡. Piękne combo, nie zmieniajcie się.",2,137,31,170,12-10-25,2025-10-12,2025.0,10.0,12.0,0.0,"Zjawiskowa seria pana z PiS w Radiu ZET: 1. Nie potrafił wytłumaczyć jak prezydent miałby skutecznie zablokować pakt migracyjny 2. Wymyślił, że Nawrocki zmieni rząd. Drobne przypomnienie: W Polsce Prezydent RP nie zmienia rządu, czyli może pan Sellin proponuje zamach stanu? 3. Stwierdził, że te wszystkie lewe wizy pana Wawrzyka to była legalna migracja, bo był wystawiony dokument 🤡. Piękne combo, nie zmieniajcie się.","Zjawiskowa seria pana z PiS w Radiu ZET: 1. Nie potrafił wytłumaczyć jak prezydent miałby skutecznie zablokować pakt migracyjny 2. Wymyślił, że Nawrocki zmieni rząd. Drobne przypomnienie: W Polsce Prezydent RP nie zmienia rządu, czyli może pan Sellin proponuje zamach stanu? 3. Stwierdził, że te wszystkie lewe wizy pana Wawrzyka to była legalna migracja, bo był wystawiony dokument 🤡. Piękne combo, nie zmieniajcie się.",@JaroslawSellin|@NawrockiKn,,,2,0,0,420,64,4.42,wysoki,24,0.7719475166756293
13.0,la_france_sur_x,"La Pologne rejette fermement le pacte européen sur la migration et l’asile, choisissant de s’aligner sur la position de Budapest. Le président polonais Karol Nawrocki a déclaré qu’il « n’accepterait aucune mesure susceptible de menacer la sécurité intérieure » de son pays. De son côté, le Premier ministre hongrois Viktor Orbán a salué cette prise de position : « L’Europe est en train de basculer… Nous sommes désormais deux à refuser ce pacte migratoire ; si un troisième nous rejoint, ce sera déjà une rébellion. » La France devrait-elle également refuser le pacte européen sur la migration ? A. Oui B. Non",39,893,311,1243,11-10-25,2025-10-11,2025.0,10.0,11.0,0.0,"La Pologne rejette fermement le pacte européen sur la migration et l’asile, choisissant de s’aligner sur la position de Budapest. Le président polonais Karol Nawrocki a déclaré qu’il « n’accepterait aucune mesure susceptible de menacer la sécurité intérieure » de son pays. De son côté, le Premier ministre hongrois Viktor Orbán a salué cette prise de position : « L’Europe est en train de basculer… Nous sommes désormais deux à refuser ce pacte migratoire ; si un troisième nous rejoint, ce sera déjà une rébellion. » La France devrait-elle également refuser le pacte européen sur la migration ? A. Oui B. Non","La Pologne rejette fermement le pacte européen sur la migration et l’asile, choisissant de s’aligner sur la position de Budapest. Le président polonais Karol Nawrocki a déclaré qu’il « n’accepterait aucune mesure susceptible de menacer la sécurité intérieure » de son pays. De son côté, le Premier ministre hongrois Viktor Orbán a salué cette prise de position : « L’Europe est en train de basculer… Nous sommes désormais deux à refuser ce pacte migratoire ; si un troisième nous rejoint, ce sera déjà une rébellion. » La France devrait-elle également refuser le pacte européen sur la migration ? A. Oui B. Non",,,,0,0,0,610,102,2.87,wysoki,24,0.92016164568931
20.0,marcinbosacki,"Prez. Nawrocki, pisząc list, próbował w ostatniej chwili podczepić się/zawłaszczyć sukces rządu w sprawie Paktu Migracyjnego, gdy już decyzja, że nie wejdzie u nas w życie, zapadła… #MigracjaPiS Dobry fragment @7DzienTygodnia:",3,107,75,185,12-10-25,2025-10-12,2025.0,10.0,12.0,0.0,"Prez. Nawrocki, pisząc list, próbował w ostatniej chwili podczepić się/zawłaszczyć sukces rządu w sprawie Paktu Migracyjnego, gdy już decyzja, że nie wejdzie u nas w życie, zapadła… MigracjaPiS Dobry fragment :","Prez. Nawrocki, pisząc list, próbował w ostatniej chwili podczepić się/zawłaszczyć sukces rządu w sprawie Paktu Migracyjnego, gdy już decyzja, że nie wejdzie u nas w życie, zapadła… Dobry fragment :",@7DzienTygodnia,#MigracjaPiS,,1,1,0,210,31,1.43,wysoki,24,0.7719475166756293
48.0,smutnahistoria,Karol Nawrocki kończący pisanie listu po którym Polska zostaje zwolniona z relokacji migrantów…..,6,202,8,216,12-10-25,2025-10-12,2025.0,10.0,12.0,0.0,Karol Nawrocki kończący pisanie listu po którym Polska zostaje zwolniona z relokacji migrantów…..,Karol Nawrocki kończący pisanie listu po którym Polska zostaje zwolniona z relokacji migrantów…..,,,,0,0,0,97,13,25.25,wysoki,24,0.835797260613298
49.0,radiomaryja,"Premier Węgier V. Orban: Podobnie jak prezydent K. Nawrocki, my także odrzucamy pakt migracyjny radiomaryja.pl/informacje/pr…",3,411,40,454,10-10-25,2025-10-10,2025.0,10.0,10.0,0.0,"Premier Węgier V. Orban: Podobnie jak prezydent K. Nawrocki, my także odrzucamy pakt migracyjny","Premier Węgier V. Orban: Podobnie jak prezydent K. Nawrocki, my także odrzucamy pakt migracyjny",,,radiomaryja.pl/informacje/pr…,0,0,1,95,14,10.28,wysoki,24,0.92016164568931
148.0,andrzejzmiasta,Co może Nawrocki w sprawie paktu migracyjnego? Może tylko listy pisać‼️,1,62,12,75,12-10-25,2025-10-12,2025.0,10.0,12.0,0.0,Co może Nawrocki w sprawie paktu migracyjnego? Może tylko listy pisać‼️,Co może Nawrocki w sprawie paktu migracyjnego? Może tylko listy pisać‼️,,,,0,0,0,71,11,5.17,wysoki,24,0.7719475166756293
255.0,silvano_trotta,La Pologne reste intransigeante et ne souhaite pas devenir un « paradis » multiculturel où règne une criminalité de haut niveau. Il n'y aura pas de relocalisation forcée d'immigrés illégaux avec Varsovie. Le président Nawrocki l'a clairement indiqué à Ursula von der Leyen.,0,0,0,0,12-10-25,2025-10-12,2025.0,10.0,12.0,0.0,La Pologne reste intransigeante et ne souhaite pas devenir un « paradis » multiculturel où règne une criminalité de haut niveau. Il n'y aura pas de relocalisation forcée d'immigrés illégaux avec Varsovie. Le président Nawrocki l'a clairement indiqué à Ursula von der Leyen.,La Pologne reste intransigeante et ne souhaite pas devenir un « paradis » multiculturel où règne une criminalité de haut niveau. Il n'y aura pas de relocalisation forcée d'immigrés illégaux avec Varsovie. Le président Nawrocki l'a clairement indiqué à Ursula von der Leyen.,,,,0,0,0,273,43,0.0,niski,24,1.0
532.0,georg_pazderski,"BRAVO POLEN❗️ Polen wird sich weigern, die von der EU vorgeschriebenen Quoten-Migranten aufzunehmen. Karol Nawrocki hat in einem Brief an vdL angekündigt den EU-Migrationspakt 2026 nicht zu akzeptieren.",21,643,141,805,09-10-25,2025-10-09,2025.0,10.0,9.0,0.0,"BRAVO POLEN❗️ Polen wird sich weigern, die von der EU vorgeschriebenen Quoten-Migranten aufzunehmen. Karol Nawrocki hat in einem Brief an vdL angekündigt den EU-Migrationspakt 2026 nicht zu akzeptieren.","BRAVO POLEN❗️ Polen wird sich weigern, die von der EU vorgeschriebenen Quoten-Migranten aufzunehmen. Karol Nawrocki hat in einem Brief an vdL angekündigt den EU-Migrationspakt 2026 nicht zu akzeptieren.",,,,0,0,0,202,28,4.56,wysoki,24,0.92016164568931
10.0,slavicnetworks,"🚨 BREAKING: Visegrád Leaders Reject EU Migration Pact 🇸🇰🇭🇺🇨🇿🇵🇱 The leaders of Slovakia, Hungary, Czech Republic and Poland — Robert Fico, Viktor Orbán, Andrej Babiš, and Karol Nawrocki — have spoken out together against Brussels’ new EU Migration Pact, calling it a “dictate, not solidarity.” Under the pact, EU countries would be forced to either accept relocated migrants or pay €20,000 per rejected migrant — a plan that critics say punishes nations for defending their own borders. Fico declared: “You cannot force a country to pay for every migrant. That’s not solidarity — that’s coercion.” Their message resonates across Central Europe — yet the debate remains complex. While illegal migration threatens sovereignty and security, the reality of legal migration, demographic decline, and labor shortages also challenge many Slavic nations. ❓Should the Visegrád countries completely reject Brussels’ plan — or propose their own Slavic solution to manage migration on their terms? If you like what we are doing — like, share, subscribe, and invite your friends for more. Follow us also on Facebook: Slavic Networks @SlavFreeSpirit @VladVVeles @Nirali_1989",0,12,2,14,13-10-25,2025-10-13,2025.0,10.0,13.0,0.0,"🚨 BREAKING: Visegrád Leaders Reject EU Migration Pact 🇸🇰🇭🇺🇨🇿🇵🇱 The leaders of Slovakia, Hungary, Czech Republic and Poland — Robert Fico, Viktor Orbán, Andrej Babiš, and Karol Nawrocki — have spoken out together against Brussels’ new EU Migration Pact, calling it a “dictate, not solidarity.” Under the pact, EU countries would be forced to either accept relocated migrants or pay €20,000 per rejected migrant — a plan that critics say punishes nations for defending their own borders. Fico declared: “You cannot force a country to pay for every migrant. That’s not solidarity — that’s coercion.” Their message resonates across Central Europe — yet the debate remains complex. While illegal migration threatens sovereignty and security, the reality of legal migration, demographic decline, and labor shortages also challenge many Slavic nations. ❓Should the Visegrád countries completely reject Brussels’ plan — or propose their own Slavic solution to manage migration on their terms? If you like what we are doing — like, share, subscribe, and invite your friends for more. Follow us also on Facebook: Slavic Networks","🚨 BREAKING: Visegrád Leaders Reject EU Migration Pact 🇸🇰🇭🇺🇨🇿🇵🇱 The leaders of Slovakia, Hungary, Czech Republic and Poland — Robert Fico, Viktor Orbán, Andrej Babiš, and Karol Nawrocki — have spoken out together against Brussels’ new EU Migration Pact, calling it a “dictate, not solidarity.” Under the pact, EU countries would be forced to either accept relocated migrants or pay €20,000 per rejected migrant — a plan that critics say punishes nations for defending their own borders. Fico declared: “You cannot force a country to pay for every migrant. That’s not solidarity — that’s coercion.” Their message resonates across Central Europe — yet the debate remains complex. While illegal migration threatens sovereignty and security, the reality of legal migration, demographic decline, and labor shortages also challenge many Slavic nations. ❓Should the Visegrád countries completely reject Brussels’ plan — or propose their own Slavic solution to manage migration on their terms? If you like what we are doing — like, share, subscribe, and invite your friends for more. Follow us also on Facebook: Slavic Networks",@SlavFreeSpirit|@VladVVeles|@Nirali_1989,,,3,0,0,1118,174,6.0,średni,24,0.92016164568931
