id,username,text,likes,retweets,replies,total_interactions,post_date_iso,date,year,month,day,hour,text_clean,text_no_links,mentions,hashtags,urls,n_mentions,n_hashtags,n_urls,char_count,word_count,amplification_ratio,reach_tier,cluster,cluster_prob
15.0,vito82488734,"Przypominam, że nie ma żadnej #RocznicaVictoriiTuska, Tusk październikowe wybory parlamentarne przepierdolił z PiS koncertowo, ogromną jak na polskie warunki różnicą niemal 5%. Zatem jego mandat do rządzenia jest wysoce wątpliwy, nie wspominając o prawnym i gospodarczym rozboju.",18,454,136,608,15-10-24,2024-10-15,2024.0,10.0,15.0,0.0,"Przypominam, że nie ma żadnej RocznicaVictoriiTuska, Tusk październikowe wybory parlamentarne przepierdolił z PiS koncertowo, ogromną jak na polskie warunki różnicą niemal 5%. Zatem jego mandat do rządzenia jest wysoce wątpliwy, nie wspominając o prawnym i gospodarczym rozboju.","Przypominam, że nie ma żadnej , Tusk październikowe wybory parlamentarne przepierdolił z PiS koncertowo, ogromną jak na polskie warunki różnicą niemal 5%. Zatem jego mandat do rządzenia jest wysoce wątpliwy, nie wspominając o prawnym i gospodarczym rozboju.",,#RocznicaVictoriiTuska,,0,1,0,278,37,3.34,wysoki,11,0.2794264900462387
18.0,orfinjakub86060,"Pani Ewa w kilku zdaniach powiedziała to czego PiS nie umiał przez 8 lat. Dlatego , niestety, przegrali wybory.",0,0,0,0,31-08-25,2025-08-31,2025.0,8.0,31.0,0.0,"Pani Ewa w kilku zdaniach powiedziała to czego PiS nie umiał przez 8 lat. Dlatego , niestety, przegrali wybory.","Pani Ewa w kilku zdaniach powiedziała to czego PiS nie umiał przez 8 lat. Dlatego , niestety, przegrali wybory.",,,,0,0,0,111,19,0.0,niski,11,0.6131359052979861
23.0,ambasadaiiirp,"A potem będzie płacz, że partie demokratyczne przejebały wybory i PiS bierze media za mordę. Zero wyobraźni 🤦🏻‍♂️",0,0,1,1,31-08-25,2025-08-31,2025.0,8.0,31.0,0.0,"A potem będzie płacz, że partie demokratyczne przejebały wybory i PiS bierze media za mordę. Zero wyobraźni 🤦🏻‍♂️","A potem będzie płacz, że partie demokratyczne przejebały wybory i PiS bierze media za mordę. Zero wyobraźni 🤦🏻‍♂️",,,,0,0,0,113,18,0.0,średni,11,0.9481005014602608
131.0,antyduopolista,"I tak skończy się konserwatyzm PSL-u - na jednej liście z Nowacką, Jońskim i Święcickim. A z tą Konfederacją to pyszny kawał. Partia antysystemowa która buduje poparcie na niechęci do rządu i do Tuska stworzy na wybory koalicję z lojalnym koalicjantem Tuska i partią władzy.",0,0,0,0,31-08-25,2025-08-31,2025.0,8.0,31.0,0.0,"I tak skończy się konserwatyzm PSL-u - na jednej liście z Nowacką, Jońskim i Święcickim. A z tą Konfederacją to pyszny kawał. Partia antysystemowa która buduje poparcie na niechęci do rządu i do Tuska stworzy na wybory koalicję z lojalnym koalicjantem Tuska i partią władzy.","I tak skończy się konserwatyzm PSL-u - na jednej liście z Nowacką, Jońskim i Święcickim. A z tą Konfederacją to pyszny kawał. Partia antysystemowa która buduje poparcie na niechęci do rządu i do Tuska stworzy na wybory koalicję z lojalnym koalicjantem Tuska i partią władzy.",,,,0,0,0,274,45,0.0,niski,11,0.2820281533350788
18.0,panciosuperstar,"Pytanie mam, jeżeli następne wybory wygra PiS to znów będziecie biegać z reklamówkami i mówić, że wojsko pilnujące granicy to przestępcy?",0,0,0,0,31-08-25,2025-08-31,2025.0,8.0,31.0,0.0,"Pytanie mam, jeżeli następne wybory wygra PiS to znów będziecie biegać z reklamówkami i mówić, że wojsko pilnujące granicy to przestępcy?","Pytanie mam, jeżeli następne wybory wygra PiS to znów będziecie biegać z reklamówkami i mówić, że wojsko pilnujące granicy to przestępcy?",,,,0,0,0,137,21,0.0,niski,11,1.0
28.0,maciej_2828,jak na razie PIS wygrywa wszystkie wybory,0,0,0,0,31-08-25,2025-08-31,2025.0,8.0,31.0,0.0,jak na razie PIS wygrywa wszystkie wybory,jak na razie PIS wygrywa wszystkie wybory,,,,0,0,0,41,7,0.0,niski,11,0.7201142880306947
3.0,magorza92952192,"🎯 👏 Przypomnijmy: po pół roku odbyły się wybory parlamentarne, które wygrało PiS. I co? I mieliśmy, mamy i będziemy mieć POPiS.",0,3,1,4,12-11-24,2024-11-12,2024.0,11.0,12.0,0.0,"🎯 👏 Przypomnijmy: po pół roku odbyły się wybory parlamentarne, które wygrało PiS. I co? I mieliśmy, mamy i będziemy mieć POPiS.","🎯 👏 Przypomnijmy: po pół roku odbyły się wybory parlamentarne, które wygrało PiS. I co? I mieliśmy, mamy i będziemy mieć POPiS.",,,,0,0,0,127,22,3.0,średni,11,0.8684851521982442
3.0,debowskijustin,Namawiasz @krzysztofbosak do podjęcia jakichś konfliktowych działań co może tylko być na rękę PiSowi ale sumarycznie ze szkodą dla całej prawicy. Ostatecznie będą wybory i to wybory rozstrzygną ilu posłów będzie miał @RuchNarodowy a ilu @Nowa_Nadzieja_ .,0,0,0,0,01-09-25,2025-09-01,2025.0,9.0,1.0,0.0,Namawiasz do podjęcia jakichś konfliktowych działań co może tylko być na rękę PiSowi ale sumarycznie ze szkodą dla całej prawicy. Ostatecznie będą wybory i to wybory rozstrzygną ilu posłów będzie miał a ilu .,Namawiasz do podjęcia jakichś konfliktowych działań co może tylko być na rękę PiSowi ale sumarycznie ze szkodą dla całej prawicy. Ostatecznie będą wybory i to wybory rozstrzygną ilu posłów będzie miał a ilu .,@krzysztofbosak|@RuchNarodowy|@Nowa_Nadzieja_,,,3,0,0,208,34,0.0,niski,11,1.0
4.0,tapinzmetra,Gdy PiS wygra wybory to stanowski powie że zakańcza eksperyment zero żeby odpocząć. Przecież on nie przeżyje gdyby musiał krytykować pisowski rzad,0,0,0,0,01-09-25,2025-09-01,2025.0,9.0,1.0,0.0,Gdy PiS wygra wybory to stanowski powie że zakańcza eksperyment zero żeby odpocząć. Przecież on nie przeżyje gdyby musiał krytykować pisowski rzad,Gdy PiS wygra wybory to stanowski powie że zakańcza eksperyment zero żeby odpocząć. Przecież on nie przeżyje gdyby musiał krytykować pisowski rzad,,,,0,0,0,146,22,0.0,niski,11,0.840896741655174
58.0,tadeuszzdr14898,"Podobnie to właśnie chcieliście zrobić w wyborach prezydenckich kombinując że PiS sfałszował wybory aby na nowo przeliczać głosy wyborców ,a może przy liczeniu uda się coś podmienić ,A teraz mówicie że niby kto miałby wybory sfałszować .Za szybko liczyliście te głosy ostatnio .",0,0,0,0,01-09-25,2025-09-01,2025.0,9.0,1.0,0.0,"Podobnie to właśnie chcieliście zrobić w wyborach prezydenckich kombinując że PiS sfałszował wybory aby na nowo przeliczać głosy wyborców ,a może przy liczeniu uda się coś podmienić ,A teraz mówicie że niby kto miałby wybory sfałszować .Za szybko liczyliście te głosy ostatnio .","Podobnie to właśnie chcieliście zrobić w wyborach prezydenckich kombinując że PiS sfałszował wybory aby na nowo przeliczać głosy wyborców ,a może przy liczeniu uda się coś podmienić ,A teraz mówicie że niby kto miałby wybory sfałszować .Za szybko liczyliście te głosy ostatnio .",,,,0,0,0,278,43,0.0,niski,11,0.9743344556201166
6.0,gamexpinvin,Teraz krytyka PiSu byłaby najlepsza taktykę dla Konfederacji. I tak PO przegra następne wybory,0,0,0,0,01-09-25,2025-09-01,2025.0,9.0,1.0,0.0,Teraz krytyka PiSu byłaby najlepsza taktykę dla Konfederacji. I tak PO przegra następne wybory,Teraz krytyka PiSu byłaby najlepsza taktykę dla Konfederacji. I tak PO przegra następne wybory,,,,0,0,0,94,14,0.0,niski,11,0.4245716583401286
1.0,kadlub2023,"To najbardziej udane pojebane rp w historii rp gazetowych Koalicja PO-PiS (2005-2009), system semiprezydencki, koalicje PiSu z PPP i SRP, dwa wybory przedterminowe pod rząd, kordonowy rząd SLD XD",0,0,0,0,01-09-25,2025-09-01,2025.0,9.0,1.0,0.0,"To najbardziej udane pojebane rp w historii rp gazetowych Koalicja PO-PiS (2005-2009), system semiprezydencki, koalicje PiSu z PPP i SRP, dwa wybory przedterminowe pod rząd, kordonowy rząd SLD XD","To najbardziej udane pojebane rp w historii rp gazetowych Koalicja PO-PiS (2005-2009), system semiprezydencki, koalicje PiSu z PPP i SRP, dwa wybory przedterminowe pod rząd, kordonowy rząd SLD XD",,,,0,0,0,195,29,0.0,niski,11,0.9998610240620432
17.0,edwin3319429306,"Nikt się na to nie zgodzi, to byłby koniec konfederacji. Po prostu przeczekają aż rozpiszą się następne wybory i będą pruć tak długo aż któryś się ugnie. Jedyne słuszne rozwiązanie",0,0,0,0,01-09-25,2025-09-01,2025.0,9.0,1.0,0.0,"Nikt się na to nie zgodzi, to byłby koniec konfederacji. Po prostu przeczekają aż rozpiszą się następne wybory i będą pruć tak długo aż któryś się ugnie. Jedyne słuszne rozwiązanie","Nikt się na to nie zgodzi, to byłby koniec konfederacji. Po prostu przeczekają aż rozpiszą się następne wybory i będą pruć tak długo aż któryś się ugnie. Jedyne słuszne rozwiązanie",,,,0,0,0,180,30,0.0,niski,11,0.3430897702679072
14.0,costooh,"Koalicja 13 Grudnia rządzi 18 miesięcy i PiS fałszuje wybory. Jakim debilem trzeba być żeby coś takiego napisać? Bo w to, że szury z sekty Giertycha w to uwierzą, nie wątpimy.",0,0,0,0,01-09-25,2025-09-01,2025.0,9.0,1.0,0.0,"Koalicja 13 Grudnia rządzi 18 miesięcy i PiS fałszuje wybory. Jakim debilem trzeba być żeby coś takiego napisać? Bo w to, że szury z sekty Giertycha w to uwierzą, nie wątpimy.","Koalicja 13 Grudnia rządzi 18 miesięcy i PiS fałszuje wybory. Jakim debilem trzeba być żeby coś takiego napisać? Bo w to, że szury z sekty Giertycha w to uwierzą, nie wątpimy.",,,,0,0,0,175,31,0.0,niski,11,0.7141697803880624
17.0,calineczka505,"Podsrywajcie PiS i gadajcie ludziom,że nie wykluczacie koalicji z PO a sukces gwarantowany. Zapomnieliscie że gros waszego elektoratu to byli wyborcy PiSu i to jest świadomy elektorat, wybory prezydenckie niczego was nie nauczyły. Ludzie nie czekali na łaskawe poparcie lidera",0,0,0,0,01-09-25,2025-09-01,2025.0,9.0,1.0,0.0,"Podsrywajcie PiS i gadajcie ludziom,że nie wykluczacie koalicji z PO a sukces gwarantowany. Zapomnieliscie że gros waszego elektoratu to byli wyborcy PiSu i to jest świadomy elektorat, wybory prezydenckie niczego was nie nauczyły. Ludzie nie czekali na łaskawe poparcie lidera","Podsrywajcie PiS i gadajcie ludziom,że nie wykluczacie koalicji z PO a sukces gwarantowany. Zapomnieliscie że gros waszego elektoratu to byli wyborcy PiSu i to jest świadomy elektorat, wybory prezydenckie niczego was nie nauczyły. Ludzie nie czekali na łaskawe poparcie lidera",,,,0,0,0,276,40,0.0,niski,11,1.0
18.0,swiety6195,"Ta jak były wybory na prezydenta do Beaun i Konfederacja super brawo popierają nas. A teraz jak zwykle tylko PiS , jedyna patriotyczna partia i dalsze bzdury.",0,0,0,0,02-09-25,2025-09-02,2025.0,9.0,2.0,0.0,"Ta jak były wybory na prezydenta do Beaun i Konfederacja super brawo popierają nas. A teraz jak zwykle tylko PiS , jedyna patriotyczna partia i dalsze bzdury.","Ta jak były wybory na prezydenta do Beaun i Konfederacja super brawo popierają nas. A teraz jak zwykle tylko PiS , jedyna patriotyczna partia i dalsze bzdury.",,,,0,0,0,158,27,0.0,niski,11,0.4245716583401286
124.0,yahzirou,"Tak! Oczywiście!😂😂😂hasło PiS, KPO PiS, budżet PiS, wybory PiS 😂😂😂po co jeszcze rządzicie volksdojcze!?😂😂😂",0,0,0,0,02-09-25,2025-09-02,2025.0,9.0,2.0,0.0,"Tak! Oczywiście!😂😂😂hasło PiS, KPO PiS, budżet PiS, wybory PiS 😂😂😂po co jeszcze rządzicie volksdojcze!?😂😂😂","Tak! Oczywiście!😂😂😂hasło PiS, KPO PiS, budżet PiS, wybory PiS 😂😂😂po co jeszcze rządzicie volksdojcze!?😂😂😂",,,,0,0,0,105,14,0.0,niski,11,0.2526411202316678
13.0,tucholski_marek,"PiS - partia, która wygrywa wybory, ale nie rządzi, bo nikt nie chce wejść z nimi w koalicję, robi wszystko, aby dalej nikt nie chciał wejść z nimi w koalicję. Geniusze",1,6,6,13,02-09-25,2025-09-02,2025.0,9.0,2.0,0.0,"PiS - partia, która wygrywa wybory, ale nie rządzi, bo nikt nie chce wejść z nimi w koalicję, robi wszystko, aby dalej nikt nie chciał wejść z nimi w koalicję. Geniusze","PiS - partia, która wygrywa wybory, ale nie rządzi, bo nikt nie chce wejść z nimi w koalicję, robi wszystko, aby dalej nikt nie chciał wejść z nimi w koalicję. Geniusze",,,,0,0,0,168,31,1.0,wysoki,11,0.4451281600485452
26.0,monika45597924,Jak Giertych weźmie się za tworzenie strategii politycznej na najbliższe wybory to PiS będzie miał samodzielną większość.,0,0,0,0,02-09-25,2025-09-02,2025.0,9.0,2.0,0.0,Jak Giertych weźmie się za tworzenie strategii politycznej na najbliższe wybory to PiS będzie miał samodzielną większość.,Jak Giertych weźmie się za tworzenie strategii politycznej na najbliższe wybory to PiS będzie miał samodzielną większość.,,,,0,0,0,121,17,0.0,niski,11,0.9998610240620432
4.0,szmaragdowyl,Delegalizacja PiS za te wybory będzie chyba prezentem przed wyborami w 2027 roku.,0,0,0,0,02-09-25,2025-09-02,2025.0,9.0,2.0,0.0,Delegalizacja PiS za te wybory będzie chyba prezentem przed wyborami w 2027 roku.,Delegalizacja PiS za te wybory będzie chyba prezentem przed wyborami w 2027 roku.,,,,0,0,0,81,13,0.0,niski,11,0.6549157355182149
9.0,pasjonatam,"W 2007 roku PiS stosował strategię rywalizacji z SLD a nie z PO i byłby na tym wygrał przedterminowe wybory, ale w ostatniej chwili Kaczyński dal się namowić na debatę z Tuskiem. PiS dziś robi podobny model, ustawia linię walki na tej z Konfą praktycznie odbierając tlen reszcie.",0,2,4,6,01-09-25,2025-09-01,2025.0,9.0,1.0,0.0,"W 2007 roku PiS stosował strategię rywalizacji z SLD a nie z PO i byłby na tym wygrał przedterminowe wybory, ale w ostatniej chwili Kaczyński dal się namowić na debatę z Tuskiem. PiS dziś robi podobny model, ustawia linię walki na tej z Konfą praktycznie odbierając tlen reszcie.","W 2007 roku PiS stosował strategię rywalizacji z SLD a nie z PO i byłby na tym wygrał przedterminowe wybory, ale w ostatniej chwili Kaczyński dal się namowić na debatę z Tuskiem. PiS dziś robi podobny model, ustawia linię walki na tej z Konfą praktycznie odbierając tlen reszcie.",,,,0,0,0,279,48,0.5,wysoki,11,0.5153025209576324
18.0,yoghurt_sothoth,"@ZandbergRAZEM - chodzą słuchy, że ten hultaj co wybory pomaga wygrać PiSowi i sika do mleka.",0,0,0,0,02-09-25,2025-09-02,2025.0,9.0,2.0,0.0,"- chodzą słuchy, że ten hultaj co wybory pomaga wygrać PiSowi i sika do mleka.","- chodzą słuchy, że ten hultaj co wybory pomaga wygrać PiSowi i sika do mleka.",@ZandbergRAZEM,,,1,0,0,78,15,0.0,niski,11,0.4021391952903915
4.0,pikus_pol,"Co Państwo na to???👇👇 Barbara Nowacka: - ... PiS nie wygra wyborów, ponieważ to my wygramy wybory... ludziom żyje się lepiej i widzą, że rządzimy państwem sprawnie i uczciwie🤭",52,302,809,1163,03-09-25,2025-09-03,2025.0,9.0,3.0,0.0,"Co Państwo na to???👇👇 Barbara Nowacka: - ... PiS nie wygra wyborów, ponieważ to my wygramy wybory... ludziom żyje się lepiej i widzą, że rządzimy państwem sprawnie i uczciwie🤭","Co Państwo na to???👇👇 Barbara Nowacka: - ... PiS nie wygra wyborów, ponieważ to my wygramy wybory... ludziom żyje się lepiej i widzą, że rządzimy państwem sprawnie i uczciwie🤭",,,,0,0,0,175,29,0.37,wysoki,11,0.9998610240620432
7.0,wolnosctv,"🔴 Barbara Nowacka: ""PiS nie wygra wyborów, ponieważ to my wygramy wybory i ludziom żyje się lepiej i widzą też, że rządzimy państwem sprawnie i uczciwie."" 😁",7,20,218,245,03-09-25,2025-09-03,2025.0,9.0,3.0,0.0,"🔴 Barbara Nowacka: ""PiS nie wygra wyborów, ponieważ to my wygramy wybory i ludziom żyje się lepiej i widzą też, że rządzimy państwem sprawnie i uczciwie."" 😁","🔴 Barbara Nowacka: ""PiS nie wygra wyborów, ponieważ to my wygramy wybory i ludziom żyje się lepiej i widzą też, że rządzimy państwem sprawnie i uczciwie."" 😁",,,,0,0,0,156,27,0.09,wysoki,11,0.9998610240620432
11.0,rjhillsarlin,Ta. PiS się nie zniżał i przerżnął wybory,0,0,0,0,03-09-25,2025-09-03,2025.0,9.0,3.0,0.0,Ta. PiS się nie zniżał i przerżnął wybory,Ta. PiS się nie zniżał i przerżnął wybory,,,,0,0,0,41,8,0.0,niski,11,0.9998610240620432
6.0,dorzeczy_pl,"PiS wygrałby wybory parlamentarne – wynika z najnowszego sondażu. Drugie miejsce zajęłaby KO, a trzecie – Konfederacja ⬇️ dorzeczy.pl/kraj/774048/sond…",0,14,8,22,03-09-25,2025-09-03,2025.0,9.0,3.0,0.0,"PiS wygrałby wybory parlamentarne – wynika z najnowszego sondażu. Drugie miejsce zajęłaby KO, a trzecie – Konfederacja ⬇️","PiS wygrałby wybory parlamentarne – wynika z najnowszego sondażu. Drugie miejsce zajęłaby KO, a trzecie – Konfederacja ⬇️",,,dorzeczy.pl/kraj/774048/sond…,0,0,1,121,18,1.75,wysoki,11,0.9998610240620432
104.0,derby830,"PiS wygrał wszystkie wybory w tym kraju od 10 lat. To wy jebana komusza patologio musieliście stworzyć koalicje z gównopartyjek, żeby pokonać jedną. A i tak przegraliście🤣🤣🤣Widać, ze cie stara w betoniarce z gównem kołysała",0,0,0,0,03-09-25,2025-09-03,2025.0,9.0,3.0,0.0,"PiS wygrał wszystkie wybory w tym kraju od 10 lat. To wy jebana komusza patologio musieliście stworzyć koalicje z gównopartyjek, żeby pokonać jedną. A i tak przegraliście🤣🤣🤣Widać, ze cie stara w betoniarce z gównem kołysała","PiS wygrał wszystkie wybory w tym kraju od 10 lat. To wy jebana komusza patologio musieliście stworzyć koalicje z gównopartyjek, żeby pokonać jedną. A i tak przegraliście🤣🤣🤣Widać, ze cie stara w betoniarce z gównem kołysała",,,,0,0,0,223,35,0.0,niski,11,0.9255391272431696
13.0,tuskvisionnet,"Barbara Nowacka: ""PiS nie wygra wyborów, ponieważ to my wygramy wybory i ludziom żyje się lepiej i widzą też, że rządzimy państwem sprawnie i uczciwie"" 🤡🙃 XD 🤣🤦‍♂️",3,21,134,158,03-09-25,2025-09-03,2025.0,9.0,3.0,0.0,"Barbara Nowacka: ""PiS nie wygra wyborów, ponieważ to my wygramy wybory i ludziom żyje się lepiej i widzą też, że rządzimy państwem sprawnie i uczciwie"" 🤡🙃 XD 🤣🤦‍♂️","Barbara Nowacka: ""PiS nie wygra wyborów, ponieważ to my wygramy wybory i ludziom żyje się lepiej i widzą też, że rządzimy państwem sprawnie i uczciwie"" 🤡🙃 XD 🤣🤦‍♂️",,,,0,0,0,163,28,0.16,wysoki,11,0.7598719802141175
18.0,michal_doron_45,Oczywiście że nie jest! Prezydentem jest (drugą kadencję) @trzaskowski_ PiS sfałszował trzy kolejne wybory prezydenckie rzędu. Trochę mnie zastanawia dlaczego nie sfałszował wyborów do sejmu i ostatecznie stracił władzę ale od myślenia strasznie się męczę więc już nie myślę...,0,0,0,0,04-09-25,2025-09-04,2025.0,9.0,4.0,0.0,Oczywiście że nie jest! Prezydentem jest (drugą kadencję) PiS sfałszował trzy kolejne wybory prezydenckie rzędu. Trochę mnie zastanawia dlaczego nie sfałszował wyborów do sejmu i ostatecznie stracił władzę ale od myślenia strasznie się męczę więc już nie myślę...,Oczywiście że nie jest! Prezydentem jest (drugą kadencję) PiS sfałszował trzy kolejne wybory prezydenckie rzędu. Trochę mnie zastanawia dlaczego nie sfałszował wyborów do sejmu i ostatecznie stracił władzę ale od myślenia strasznie się męczę więc już nie myślę...,@trzaskowski_,,,1,0,0,263,38,0.0,niski,11,0.7155343776650966
23.0,gmwojak57,"To że rząd ""nic nie robi"" to jego największy atut, legislacja i gospodarka może ochłonąć po bardzo dużych zmianach za PiS. Obecnie dużo poparcia im odpadło przez przegrane wybory, ale w ostatnich sondażach trochę się ruszyło w górę, co może oznaczać że ten sentyment przechodzi.",0,0,0,0,04-09-25,2025-09-04,2025.0,9.0,4.0,0.0,"To że rząd ""nic nie robi"" to jego największy atut, legislacja i gospodarka może ochłonąć po bardzo dużych zmianach za PiS. Obecnie dużo poparcia im odpadło przez przegrane wybory, ale w ostatnich sondażach trochę się ruszyło w górę, co może oznaczać że ten sentyment przechodzi.","To że rząd ""nic nie robi"" to jego największy atut, legislacja i gospodarka może ochłonąć po bardzo dużych zmianach za PiS. Obecnie dużo poparcia im odpadło przez przegrane wybory, ale w ostatnich sondażach trochę się ruszyło w górę, co może oznaczać że ten sentyment przechodzi.",,,,0,0,0,278,45,0.0,niski,11,0.5520680336942217
10.0,pawelzapas68058,#jprd PiS na pewno wygra wybory i będzie rządził 🖕 pch24.pl/filip-obara-pis-chc…,0,0,0,0,05-09-25,2025-09-05,2025.0,9.0,5.0,0.0,jprd PiS na pewno wygra wybory i będzie rządził 🖕,PiS na pewno wygra wybory i będzie rządził 🖕,,#jprd,pch24.pl/filip-obara-pis-chc…,0,1,1,49,10,0.0,niski,11,0.9998610240620432
1.0,ma_rysia_pa,"Właśnie przez takie metody przegracie kolejne wybory. Jesteście niereformowalni. Sami ten syf przyklepujecie. O ile Hołownię rozumiem, bo spłaca dług PiSowi i dogadany jest z nimi od dawna (tylko dureń tego nie widzi) ale czemu MKB bierze udział w tej PiSiej szopce ?",0,0,0,0,08-09-25,2025-09-08,2025.0,9.0,8.0,0.0,"Właśnie przez takie metody przegracie kolejne wybory. Jesteście niereformowalni. Sami ten syf przyklepujecie. O ile Hołownię rozumiem, bo spłaca dług PiSowi i dogadany jest z nimi od dawna (tylko dureń tego nie widzi) ale czemu MKB bierze udział w tej PiSiej szopce ?","Właśnie przez takie metody przegracie kolejne wybory. Jesteście niereformowalni. Sami ten syf przyklepujecie. O ile Hołownię rozumiem, bo spłaca dług PiSowi i dogadany jest z nimi od dawna (tylko dureń tego nie widzi) ale czemu MKB bierze udział w tej PiSiej szopce ?",,,,0,0,0,267,43,0.0,niski,11,0.3500056759439425
3.0,agnes51235072,"Jeśli ma dojść do rozliczeń to współpraca Żurka i Banasia będzie owocna. Dwóch twardych facetów, którzy się nie boją PiS. A jeśli wymienicie na kandydata Hołowni, to nigdy do tych rozliczeń nie dojdzie, a co zatem przegracie następne wybory.",0,18,7,25,09-09-25,2025-09-09,2025.0,9.0,9.0,0.0,"Jeśli ma dojść do rozliczeń to współpraca Żurka i Banasia będzie owocna. Dwóch twardych facetów, którzy się nie boją PiS. A jeśli wymienicie na kandydata Hołowni, to nigdy do tych rozliczeń nie dojdzie, a co zatem przegracie następne wybory.","Jeśli ma dojść do rozliczeń to współpraca Żurka i Banasia będzie owocna. Dwóch twardych facetów, którzy się nie boją PiS. A jeśli wymienicie na kandydata Hołowni, to nigdy do tych rozliczeń nie dojdzie, a co zatem przegracie następne wybory.",,,,0,0,0,241,39,2.57,wysoki,11,0.5225807007511314
22.0,djabols,Widocznie premier postanowił przegrać wybory parlamentarne w 2027 r. Człowiek PiS-u na szefa NIK jako kandydat PO? Nie wierzę. I to jeszcze o niejasnych powiązaniach z Rosją i Białorusią.,0,0,0,0,09-09-25,2025-09-09,2025.0,9.0,9.0,0.0,Widocznie premier postanowił przegrać wybory parlamentarne w 2027 r. Człowiek PiS-u na szefa NIK jako kandydat PO? Nie wierzę. I to jeszcze o niejasnych powiązaniach z Rosją i Białorusią.,Widocznie premier postanowił przegrać wybory parlamentarne w 2027 r. Człowiek PiS-u na szefa NIK jako kandydat PO? Nie wierzę. I to jeszcze o niejasnych powiązaniach z Rosją i Białorusią.,,,,0,0,0,187,29,0.0,niski,11,0.321424883623344
27.0,jeicam70,"Czy dogadany politycznie kandydat PiS na prezesa NiK, po przyklepaniu fałszerstwa wyborczego, wystarczy? Czy to są dalej te szachy 5D Tuska? Kiedy wy ludzie przyjmiecie do wiadomości, że oni wszyscy robią nas w ch***? Nikt nie odpowie za 8 lat PiS, ani za sfałszowane wybory ani za Get bank czy inne afery.",0,1,0,1,09-09-25,2025-09-09,2025.0,9.0,9.0,0.0,"Czy dogadany politycznie kandydat PiS na prezesa NiK, po przyklepaniu fałszerstwa wyborczego, wystarczy? Czy to są dalej te szachy 5D Tuska? Kiedy wy ludzie przyjmiecie do wiadomości, że oni wszyscy robią nas w ch***? Nikt nie odpowie za 8 lat PiS, ani za sfałszowane wybory ani za Get bank czy inne afery.","Czy dogadany politycznie kandydat PiS na prezesa NiK, po przyklepaniu fałszerstwa wyborczego, wystarczy? Czy to są dalej te szachy 5D Tuska? Kiedy wy ludzie przyjmiecie do wiadomości, że oni wszyscy robią nas w ch***? Nikt nie odpowie za 8 lat PiS, ani za sfałszowane wybory ani za Get bank czy inne afery.",,,,0,0,0,306,52,1.0,średni,11,0.828902366355671
29.0,bot_web7465,"Rządzą prokuratorzy PiS, Bielan, Matecki, Kaczyński i Morawiecki. Tusk tylko trwa i stara się dotrwać do wyczerpania pieniędzy z KPO jak się skończą będą wybory. Do tego czasu nikt z PiS nie zostanie rozliczony w ramach układu międzypartyjnego o nietykalności wzajemnej",0,0,0,0,09-09-25,2025-09-09,2025.0,9.0,9.0,0.0,"Rządzą prokuratorzy PiS, Bielan, Matecki, Kaczyński i Morawiecki. Tusk tylko trwa i stara się dotrwać do wyczerpania pieniędzy z KPO jak się skończą będą wybory. Do tego czasu nikt z PiS nie zostanie rozliczony w ramach układu międzypartyjnego o nietykalności wzajemnej","Rządzą prokuratorzy PiS, Bielan, Matecki, Kaczyński i Morawiecki. Tusk tylko trwa i stara się dotrwać do wyczerpania pieniędzy z KPO jak się skończą będą wybory. Do tego czasu nikt z PiS nie zostanie rozliczony w ramach układu międzypartyjnego o nietykalności wzajemnej",,,,0,0,0,269,41,0.0,niski,11,0.5418679971477577
12.0,vvalhalla777,"Plują nam w twarz, ludzie szli na wybory po to by PiS dalej rządził?",0,1,2,3,09-09-25,2025-09-09,2025.0,9.0,9.0,0.0,"Plują nam w twarz, ludzie szli na wybory po to by PiS dalej rządził?","Plują nam w twarz, ludzie szli na wybory po to by PiS dalej rządził?",,,,0,0,0,68,14,0.5,średni,11,0.4917747728502285
