id,username,text,likes,retweets,replies,total_interactions,post_date_iso,date,year,month,day,hour,text_clean,text_no_links,mentions,hashtags,urls,n_mentions,n_hashtags,n_urls,char_count,word_count,amplification_ratio,reach_tier,cluster,cluster_prob
12.0,adamchyla58,"Pisowcy przymilali się do Konfy i Mentzena, gdy ich potrzebowali podczas wyborów prezydenckich. Nawrocki kajał się, kłaniał i podpisywał wszystko jak leci podczas rozmowy na youtube. PIS dostał to, co chciał i teraz przeprowadza atak. Mentzen jest mu zbędny, więc ma być wrogiem",1,4,20,25,30-07-25,2025-07-30,2025.0,7.0,30.0,0.0,"Pisowcy przymilali się do Konfy i Mentzena, gdy ich potrzebowali podczas wyborów prezydenckich. Nawrocki kajał się, kłaniał i podpisywał wszystko jak leci podczas rozmowy na youtube. PIS dostał to, co chciał i teraz przeprowadza atak. Mentzen jest mu zbędny, więc ma być wrogiem","Pisowcy przymilali się do Konfy i Mentzena, gdy ich potrzebowali podczas wyborów prezydenckich. Nawrocki kajał się, kłaniał i podpisywał wszystko jak leci podczas rozmowy na youtube. PIS dostał to, co chciał i teraz przeprowadza atak. Mentzen jest mu zbędny, więc ma być wrogiem",,,,0,0,0,278,43,0.2,średni,14,1.0
1.0,marekomiej,No i jeszcze nie zapominajmy o wyborcach Brauna. Różnica około 360 tysięcy głosów spowodowała że gdyby wyborcy Brauna zostali całkowicie w domach to Nawrocki by to przegrał a gdyby wyborcy Mentzena również zostali w domach to Nawrocki przegrałby sromotnie.,0,0,2,2,31-07-25,2025-07-31,2025.0,7.0,31.0,0.0,No i jeszcze nie zapominajmy o wyborcach Brauna. Różnica około 360 tysięcy głosów spowodowała że gdyby wyborcy Brauna zostali całkowicie w domach to Nawrocki by to przegrał a gdyby wyborcy Mentzena również zostali w domach to Nawrocki przegrałby sromotnie.,No i jeszcze nie zapominajmy o wyborcach Brauna. Różnica około 360 tysięcy głosów spowodowała że gdyby wyborcy Brauna zostali całkowicie w domach to Nawrocki by to przegrał a gdyby wyborcy Mentzena również zostali w domach to Nawrocki przegrałby sromotnie.,,,,0,0,0,256,39,0.0,średni,14,0.9735572868574728
10.0,sembosso,"Rację ma Nawrocki, odeśle Kaczyńskiego na zasłużoną emeryturę, a Mentzena na zasłużony, boczny tor.",0,2,0,2,31-07-25,2025-07-31,2025.0,7.0,31.0,0.0,"Rację ma Nawrocki, odeśle Kaczyńskiego na zasłużoną emeryturę, a Mentzena na zasłużony, boczny tor.","Rację ma Nawrocki, odeśle Kaczyńskiego na zasłużoną emeryturę, a Mentzena na zasłużony, boczny tor.",,,,0,0,0,99,14,2.0,średni,14,1.0
238.0,pawe1577460,"Sekciarzu, gdyby nie Mentzen to Nawrocki cieszyłby się drugim miejscem więc utkaj pizde.",0,0,0,0,31-07-25,2025-07-31,2025.0,7.0,31.0,0.0,"Sekciarzu, gdyby nie Mentzen to Nawrocki cieszyłby się drugim miejscem więc utkaj pizde.","Sekciarzu, gdyby nie Mentzen to Nawrocki cieszyłby się drugim miejscem więc utkaj pizde.",,,,0,0,0,88,13,0.0,niski,14,1.0
23.0,justyuripolish,"Ale co ludziom przeszkadza Sławosz i jego żona? xD On dosłownie poleciał w kosmos jako drugi Polak w historii, ona jest bardzo entuzjastycznie na to reaguje. Meanwhile nie przeszkadza wam Braun niszczący wszystko dookoła czy Nawrocki, który okradł dziadka i bił się w ustawkach.",0,0,1,1,02-08-25,2025-08-02,2025.0,8.0,2.0,0.0,"Ale co ludziom przeszkadza Sławosz i jego żona? xD On dosłownie poleciał w kosmos jako drugi Polak w historii, ona jest bardzo entuzjastycznie na to reaguje. Meanwhile nie przeszkadza wam Braun niszczący wszystko dookoła czy Nawrocki, który okradł dziadka i bił się w ustawkach.","Ale co ludziom przeszkadza Sławosz i jego żona? xD On dosłownie poleciał w kosmos jako drugi Polak w historii, ona jest bardzo entuzjastycznie na to reaguje. Meanwhile nie przeszkadza wam Braun niszczący wszystko dookoła czy Nawrocki, który okradł dziadka i bił się w ustawkach.",,,,0,0,0,278,44,0.0,średni,14,0.9735572868574728
88.0,annaolchawa,E tam. W tym specjalizuje się Kaczyński. Cytuję pytanie Mentzena „czy w kręgach PiS -u nie było jednego uczciwego kandydata na prezydenta? Najuczciwszy to Nawrocki od chatki pana Jerzego i koleżanek na tel. z Grand hotelu ? Gratulacje.,0,0,0,0,02-08-25,2025-08-02,2025.0,8.0,2.0,0.0,E tam. W tym specjalizuje się Kaczyński. Cytuję pytanie Mentzena „czy w kręgach PiS -u nie było jednego uczciwego kandydata na prezydenta? Najuczciwszy to Nawrocki od chatki pana Jerzego i koleżanek na tel. z Grand hotelu ? Gratulacje.,E tam. W tym specjalizuje się Kaczyński. Cytuję pytanie Mentzena „czy w kręgach PiS -u nie było jednego uczciwego kandydata na prezydenta? Najuczciwszy to Nawrocki od chatki pana Jerzego i koleżanek na tel. z Grand hotelu ? Gratulacje.,,,,0,0,0,235,38,0.0,niski,14,1.0
82.0,dixixylo,"Umieszczanie na tej liście Brauna to chyba dowcip. Myślę, że będzie rządził Nawrocki z Czarneckim, obydwaj są akceptowalni dla narodowców, korwinowscy liberałowie to piąta kolumna. Bosakowi też nie ufam, ale tego stać czasem na powagę i rozwagę, choć... podejrzewam, że to ""onuca""",0,0,0,0,03-08-25,2025-08-03,2025.0,8.0,3.0,0.0,"Umieszczanie na tej liście Brauna to chyba dowcip. Myślę, że będzie rządził Nawrocki z Czarneckim, obydwaj są akceptowalni dla narodowców, korwinowscy liberałowie to piąta kolumna. Bosakowi też nie ufam, ale tego stać czasem na powagę i rozwagę, choć... podejrzewam, że to ""onuca""","Umieszczanie na tej liście Brauna to chyba dowcip. Myślę, że będzie rządził Nawrocki z Czarneckim, obydwaj są akceptowalni dla narodowców, korwinowscy liberałowie to piąta kolumna. Bosakowi też nie ufam, ale tego stać czasem na powagę i rozwagę, choć... podejrzewam, że to ""onuca""",,,,0,0,0,280,42,0.0,niski,14,1.0
10.0,marian_konarski,"Moje przesłanie do Karola Nawrockiego, od jutra Prezydenta Rzeczpospolitej Polskiej. Panie Prezydencie Rzeczpospolitej Polskiej, Karolu Nawrocki. Mam nadzieję że nie zapomni Pan że to dzięki głosom wyborców Grzegorza Brauna wygrał Pan wybory. Grzegorz Braun oficjalnie zarekomendował swoim wyborcom głosowanie na Pana i ponad MILION z nich tak zrobiło. Ja osobiście wstrzymałem się od głosu w II turze wyborów TYLKO dlatego że był Pan pomazańcem znienawidzonego przez ze mnie polakożercy i obłąkanego rusofoba, kaczyńskiego, choć w czasie kampanii broniłem Pana przed kretyńskimi atakami Pana przeciwników, zwłaszcza tymi dotyczącymi Pana przeszłości. Życzę Panu powodzenia w pracy dla Polaków i suwerennej Polski która możliwa jest TYLKO we współpracy z Białorusią i Rosją jako gwarantami naszej obecnej granicy zachodniej przy nienaruszalności wschodniej. Kto z moich Sz. Obserwujących, ale nie tylko, zgadza się ze mną to podaje dalej. Tylko podania dalej tworzą zasięgi.",0,3,0,3,05-08-25,2025-08-05,2025.0,8.0,5.0,0.0,"Moje przesłanie do Karola Nawrockiego, od jutra Prezydenta Rzeczpospolitej Polskiej. Panie Prezydencie Rzeczpospolitej Polskiej, Karolu Nawrocki. Mam nadzieję że nie zapomni Pan że to dzięki głosom wyborców Grzegorza Brauna wygrał Pan wybory. Grzegorz Braun oficjalnie zarekomendował swoim wyborcom głosowanie na Pana i ponad MILION z nich tak zrobiło. Ja osobiście wstrzymałem się od głosu w II turze wyborów TYLKO dlatego że był Pan pomazańcem znienawidzonego przez ze mnie polakożercy i obłąkanego rusofoba, kaczyńskiego, choć w czasie kampanii broniłem Pana przed kretyńskimi atakami Pana przeciwników, zwłaszcza tymi dotyczącymi Pana przeszłości. Życzę Panu powodzenia w pracy dla Polaków i suwerennej Polski która możliwa jest TYLKO we współpracy z Białorusią i Rosją jako gwarantami naszej obecnej granicy zachodniej przy nienaruszalności wschodniej. Kto z moich Sz. Obserwujących, ale nie tylko, zgadza się ze mną to podaje dalej. Tylko podania dalej tworzą zasięgi.","Moje przesłanie do Karola Nawrockiego, od jutra Prezydenta Rzeczpospolitej Polskiej. Panie Prezydencie Rzeczpospolitej Polskiej, Karolu Nawrocki. Mam nadzieję że nie zapomni Pan że to dzięki głosom wyborców Grzegorza Brauna wygrał Pan wybory. Grzegorz Braun oficjalnie zarekomendował swoim wyborcom głosowanie na Pana i ponad MILION z nich tak zrobiło. Ja osobiście wstrzymałem się od głosu w II turze wyborów TYLKO dlatego że był Pan pomazańcem znienawidzonego przez ze mnie polakożercy i obłąkanego rusofoba, kaczyńskiego, choć w czasie kampanii broniłem Pana przed kretyńskimi atakami Pana przeciwników, zwłaszcza tymi dotyczącymi Pana przeszłości. Życzę Panu powodzenia w pracy dla Polaków i suwerennej Polski która możliwa jest TYLKO we współpracy z Białorusią i Rosją jako gwarantami naszej obecnej granicy zachodniej przy nienaruszalności wschodniej. Kto z moich Sz. Obserwujących, ale nie tylko, zgadza się ze mną to podaje dalej. Tylko podania dalej tworzą zasięgi.",,,,0,0,0,974,138,3.0,średni,14,0.9735572868574728
284.0,leon2025338685,Patriota Mentzen jak mowil w kanale zero nie wiedział kim byl Karol Nawrocki,0,0,0,0,05-08-25,2025-08-05,2025.0,8.0,5.0,0.0,Patriota Mentzen jak mowil w kanale zero nie wiedział kim byl Karol Nawrocki,Patriota Mentzen jak mowil w kanale zero nie wiedział kim byl Karol Nawrocki,,,,0,0,0,76,13,0.0,niski,14,1.0
5.0,konserwator800,No. More than 90% of Braun's voters voted for Nawrocki in second turn. Braun's voters are mostly disappointed conservative PiS voters.,0,0,0,0,05-08-25,2025-08-05,2025.0,8.0,5.0,0.0,No. More than 90% of Braun's voters voted for Nawrocki in second turn. Braun's voters are mostly disappointed conservative PiS voters.,No. More than 90% of Braun's voters voted for Nawrocki in second turn. Braun's voters are mostly disappointed conservative PiS voters.,,,,0,0,0,134,21,0.0,niski,14,0.9735572868574728
87.0,d_bania,"Twój psychiatra: Połączenie Korwina i Brauna nie istnieje, nie może zrobić ci krzywdy. Tymczasem połączenie Korwina i Brauna: #AEKLEG #Nawrocki2025 #Nawrocki",0,0,0,0,07-08-25,2025-08-07,2025.0,8.0,7.0,0.0,"Twój psychiatra: Połączenie Korwina i Brauna nie istnieje, nie może zrobić ci krzywdy. Tymczasem połączenie Korwina i Brauna: AEKLEG Nawrocki2025 Nawrocki","Twój psychiatra: Połączenie Korwina i Brauna nie istnieje, nie może zrobić ci krzywdy. Tymczasem połączenie Korwina i Brauna:",,#AEKLEG|#Nawrocki2025|#Nawrocki,,0,3,0,154,21,0.0,niski,14,0.9735572868574728
111.0,rudolfpaliwoda,"Nie rozumiem. Przecież Prezydent Nawrocki jedynie wprowadził w życie propozycję Trzaskowskiego, która w kampanii wyborczej była popierana przez Tuska. Nigdy nie uwierzę, że to co wtedy proponowaliście było tylko po to, żeby pozyskać głosy Mentzena.",0,3,0,3,25-08-25,2025-08-25,2025.0,8.0,25.0,0.0,"Nie rozumiem. Przecież Prezydent Nawrocki jedynie wprowadził w życie propozycję Trzaskowskiego, która w kampanii wyborczej była popierana przez Tuska. Nigdy nie uwierzę, że to co wtedy proponowaliście było tylko po to, żeby pozyskać głosy Mentzena.","Nie rozumiem. Przecież Prezydent Nawrocki jedynie wprowadził w życie propozycję Trzaskowskiego, która w kampanii wyborczej była popierana przez Tuska. Nigdy nie uwierzę, że to co wtedy proponowaliście było tylko po to, żeby pozyskać głosy Mentzena.",,,,0,0,0,248,35,3.0,średni,14,0.970528043244224
2.0,andrzejchrapie,"Niby prawicowiec, ale taki fałszywy narcyzm, z zawiści że to nasz Karol Nawrocki wygrał wybory jest wstanie z tuskiem się dogadać. prędzej bym w Pana Brauna zainwestował, ale Najpewniejszy dla mnie jest pan Prezes J Kaczyński i prawie cały PIS",0,1,0,1,28-08-25,2025-08-28,2025.0,8.0,28.0,0.0,"Niby prawicowiec, ale taki fałszywy narcyzm, z zawiści że to nasz Karol Nawrocki wygrał wybory jest wstanie z tuskiem się dogadać. prędzej bym w Pana Brauna zainwestował, ale Najpewniejszy dla mnie jest pan Prezes J Kaczyński i prawie cały PIS","Niby prawicowiec, ale taki fałszywy narcyzm, z zawiści że to nasz Karol Nawrocki wygrał wybory jest wstanie z tuskiem się dogadać. prędzej bym w Pana Brauna zainwestował, ale Najpewniejszy dla mnie jest pan Prezes J Kaczyński i prawie cały PIS",,,,0,0,0,243,40,1.0,średni,14,1.0
72.0,kazimierzleszc3,"Szanowny Panie @MarekWoch2 Mastalerek i Mentzen opowiadają bzdury że Mentzen wygrałby wyraźniej niż Karol Nawrocki w drugiej turze. Do tego dopowiadają że to dzięki Konfederacji, a Mentzen poparcia nie dał nikomu. Najbardziej i najwyraźniej Pan poparcie przekazał z całą rodziną.",0,0,0,0,05-09-25,2025-09-05,2025.0,9.0,5.0,0.0,"Szanowny Panie Mastalerek i Mentzen opowiadają bzdury że Mentzen wygrałby wyraźniej niż Karol Nawrocki w drugiej turze. Do tego dopowiadają że to dzięki Konfederacji, a Mentzen poparcia nie dał nikomu. Najbardziej i najwyraźniej Pan poparcie przekazał z całą rodziną.","Szanowny Panie Mastalerek i Mentzen opowiadają bzdury że Mentzen wygrałby wyraźniej niż Karol Nawrocki w drugiej turze. Do tego dopowiadają że to dzięki Konfederacji, a Mentzen poparcia nie dał nikomu. Najbardziej i najwyraźniej Pan poparcie przekazał z całą rodziną.",@MarekWoch2,,,1,0,0,267,39,0.0,niski,14,1.0
10.0,magdazwarmii,"Braun piszczy, że Nawrocki go oszukał. Gaśniczaki krzyczą, że Karol to zdrajca, ale sami go wybrali. Stano nie chce dać czasu antenowego Braunowi. Niesamowite uniwersum. A miało być tak pięknie.",1,33,11,45,26-09-25,2025-09-26,2025.0,9.0,26.0,0.0,"Braun piszczy, że Nawrocki go oszukał. Gaśniczaki krzyczą, że Karol to zdrajca, ale sami go wybrali. Stano nie chce dać czasu antenowego Braunowi. Niesamowite uniwersum. A miało być tak pięknie.","Braun piszczy, że Nawrocki go oszukał. Gaśniczaki krzyczą, że Karol to zdrajca, ale sami go wybrali. Stano nie chce dać czasu antenowego Braunowi. Niesamowite uniwersum. A miało być tak pięknie.",,,,0,0,0,194,30,3.0,wysoki,14,0.9735572868574728
22.0,barneybel,"Co gorsza, nie stało się to po tym, jak Braun wysłał listę życzeń, co Nawrocki ma obiecać za udzielenie poparcia. W zamian Karol po prostu go olał, a Grzesiu Gaśnica go wziął i poparł - mistrz konsekwencji i żelaznych zasad xD",0,0,0,0,26-09-25,2025-09-26,2025.0,9.0,26.0,0.0,"Co gorsza, nie stało się to po tym, jak Braun wysłał listę życzeń, co Nawrocki ma obiecać za udzielenie poparcia. W zamian Karol po prostu go olał, a Grzesiu Gaśnica go wziął i poparł - mistrz konsekwencji i żelaznych zasad xD","Co gorsza, nie stało się to po tym, jak Braun wysłał listę życzeń, co Nawrocki ma obiecać za udzielenie poparcia. W zamian Karol po prostu go olał, a Grzesiu Gaśnica go wziął i poparł - mistrz konsekwencji i żelaznych zasad xD",,,,0,0,0,226,41,0.0,niski,14,0.9735572868574728
177.0,martaxpo_prostu,Mentzen i Nawrocki są siebie warci. Jedyny normalny to Braun. Mentzen nie poparł karania za banderyzm xD więc fest mi autorytet xD,0,0,0,0,26-09-25,2025-09-26,2025.0,9.0,26.0,0.0,Mentzen i Nawrocki są siebie warci. Jedyny normalny to Braun. Mentzen nie poparł karania za banderyzm xD więc fest mi autorytet xD,Mentzen i Nawrocki są siebie warci. Jedyny normalny to Braun. Mentzen nie poparł karania za banderyzm xD więc fest mi autorytet xD,,,,0,0,0,130,22,0.0,niski,14,1.0
187.0,ryszardcyb37146,"Lewaki są wszystkie w sejmie ,oprócz Pana Brauna ,na Nawrockiego zagłosowali Braunowcy z powodu braku wyboru i tego że ten lewacki syjonista i ciul Nawrocki był ze środowiska sportowego ,czekajmy jeszcze może serwie się z Szydowskiego wrogiego łańcucha,narazie psy się zerwały.",0,0,0,0,27-09-25,2025-09-27,2025.0,9.0,27.0,0.0,"Lewaki są wszystkie w sejmie ,oprócz Pana Brauna ,na Nawrockiego zagłosowali Braunowcy z powodu braku wyboru i tego że ten lewacki syjonista i ciul Nawrocki był ze środowiska sportowego ,czekajmy jeszcze może serwie się z Szydowskiego wrogiego łańcucha,narazie psy się zerwały.","Lewaki są wszystkie w sejmie ,oprócz Pana Brauna ,na Nawrockiego zagłosowali Braunowcy z powodu braku wyboru i tego że ten lewacki syjonista i ciul Nawrocki był ze środowiska sportowego ,czekajmy jeszcze może serwie się z Szydowskiego wrogiego łańcucha,narazie psy się zerwały.",,,,0,0,0,277,41,0.0,niski,14,0.9735572868574728
27.0,propagator_ryku,"Oj musi być bardzo źle skoro nawet ukryta opcja propagandowa musiała się zaangażować, wygląda na to że właśnie Kaczyński pozbył się samodzielnych rządów, antyykraindki nastroje będą rosły, Braun będzie rósł, nie widzę wad, no może oprócz t go że Nawrocki zezwolił na dalsze okradanie mojej rodziny",0,1,0,1,28-09-25,2025-09-28,2025.0,9.0,28.0,0.0,"Oj musi być bardzo źle skoro nawet ukryta opcja propagandowa musiała się zaangażować, wygląda na to że właśnie Kaczyński pozbył się samodzielnych rządów, antyykraindki nastroje będą rosły, Braun będzie rósł, nie widzę wad, no może oprócz t go że Nawrocki zezwolił na dalsze okradanie mojej rodziny","Oj musi być bardzo źle skoro nawet ukryta opcja propagandowa musiała się zaangażować, wygląda na to że właśnie Kaczyński pozbył się samodzielnych rządów, antyykraindki nastroje będą rosły, Braun będzie rósł, nie widzę wad, no może oprócz t go że Nawrocki zezwolił na dalsze okradanie mojej rodziny",,,,0,0,0,297,46,1.0,średni,14,1.0
24.0,yaceek,"Mentzen: Produkuje jakiś gówno papierek do podpisu dla Prezydenta Nawrockiego Nawrocki: Negocjuje Kaczyński: Produkuje jakiś gówno papierek do negocjacji Mentzen: Wyzywa Kaczyńskiego od gangusów i narzeka Kaczyński: No to się nie dogadamy, jeśli nie chcesz Mentzen:",0,1,1,2,08-10-25,2025-10-08,2025.0,10.0,8.0,0.0,"Mentzen: Produkuje jakiś gówno papierek do podpisu dla Prezydenta Nawrockiego Nawrocki: Negocjuje Kaczyński: Produkuje jakiś gówno papierek do negocjacji Mentzen: Wyzywa Kaczyńskiego od gangusów i narzeka Kaczyński: No to się nie dogadamy, jeśli nie chcesz Mentzen:","Mentzen: Produkuje jakiś gówno papierek do podpisu dla Prezydenta Nawrockiego Nawrocki: Negocjuje Kaczyński: Produkuje jakiś gówno papierek do negocjacji Mentzen: Wyzywa Kaczyńskiego od gangusów i narzeka Kaczyński: No to się nie dogadamy, jeśli nie chcesz Mentzen:",,,,0,0,0,265,36,1.0,średni,14,1.0
6.0,wojsaw5,"Konfederacja jako całość, politycy oraz wyborcy zachowali się dojrzale i odpowiedzialnie. Gdy Nawrocki wszedł do drugiej tury wyborów prezydenckich, politycy Konfy praktycznie go nie atakowali, a wyborcy Mentzena w 90% oddali na niego swój głos. To PiS zaczął jakąś bzdurną",0,0,1,1,08-10-25,2025-10-08,2025.0,10.0,8.0,0.0,"Konfederacja jako całość, politycy oraz wyborcy zachowali się dojrzale i odpowiedzialnie. Gdy Nawrocki wszedł do drugiej tury wyborów prezydenckich, politycy Konfy praktycznie go nie atakowali, a wyborcy Mentzena w 90% oddali na niego swój głos. To PiS zaczął jakąś bzdurną","Konfederacja jako całość, politycy oraz wyborcy zachowali się dojrzale i odpowiedzialnie. Gdy Nawrocki wszedł do drugiej tury wyborów prezydenckich, politycy Konfy praktycznie go nie atakowali, a wyborcy Mentzena w 90% oddali na niego swój głos. To PiS zaczął jakąś bzdurną",,,,0,0,0,273,40,0.0,średni,14,1.0
31.0,pasjonatam,Zarazem dał opcję by zorganizował to Nawrocki. Oto chodzi. Punkt wspólny. Bo Kaczyński z Mentzenem na pewno się nie dogadają.,0,0,1,1,08-10-25,2025-10-08,2025.0,10.0,8.0,0.0,Zarazem dał opcję by zorganizował to Nawrocki. Oto chodzi. Punkt wspólny. Bo Kaczyński z Mentzenem na pewno się nie dogadają.,Zarazem dał opcję by zorganizował to Nawrocki. Oto chodzi. Punkt wspólny. Bo Kaczyński z Mentzenem na pewno się nie dogadają.,,,,0,0,0,125,20,0.0,średni,14,1.0
65.0,daleborl,"pisowski elektorat lubi takich...patrz: Bakiewicz, czy nawet Nawrocki...",0,0,0,0,14-10-25,2025-10-14,2025.0,10.0,14.0,0.0,"pisowski elektorat lubi takich...patrz: Bakiewicz, czy nawet Nawrocki...","pisowski elektorat lubi takich...patrz: Bakiewicz, czy nawet Nawrocki...",,,,0,0,0,72,8,0.0,niski,14,1.0
84.0,bunktrek,"Dla Schreiberowej Sigmą był Braun, chwilę potem Nawrocki, była za LGBT, jest przeciwko, była za aborcją, jest przeciwko. Czy Korczar jest na tyle głupi, że nie zdaje sobie sprawy, że jest Korczar a za chwilę będzie następny?",0,0,0,0,19-10-25,2025-10-19,2025.0,10.0,19.0,0.0,"Dla Schreiberowej Sigmą był Braun, chwilę potem Nawrocki, była za LGBT, jest przeciwko, była za aborcją, jest przeciwko. Czy Korczar jest na tyle głupi, że nie zdaje sobie sprawy, że jest Korczar a za chwilę będzie następny?","Dla Schreiberowej Sigmą był Braun, chwilę potem Nawrocki, była za LGBT, jest przeciwko, była za aborcją, jest przeciwko. Czy Korczar jest na tyle głupi, że nie zdaje sobie sprawy, że jest Korczar a za chwilę będzie następny?",,,,0,0,0,224,37,0.0,niski,14,0.9735572868574728
8.0,tvn24rozmowa,"- Gdybyśmy dostali kosza, to Sławomir Mentzen nie mówiłby publicznie, że rozmawiał o pakcie (senackim) z prezydentem Karolem Nawrockim - powiedział poseł Konfederacji @Wipler1978 w #RozmowaPiaseckiego, komentując rozmowę Mentzena i Nawrockiego. tvn24.pl/polska/zblizenie-pr…",0,2,1,3,20-10-25,2025-10-20,2025.0,10.0,20.0,0.0,"- Gdybyśmy dostali kosza, to Sławomir Mentzen nie mówiłby publicznie, że rozmawiał o pakcie (senackim) z prezydentem Karolem Nawrockim - powiedział poseł Konfederacji w RozmowaPiaseckiego, komentując rozmowę Mentzena i Nawrockiego.","- Gdybyśmy dostali kosza, to Sławomir Mentzen nie mówiłby publicznie, że rozmawiał o pakcie (senackim) z prezydentem Karolem Nawrockim - powiedział poseł Konfederacji w , komentując rozmowę Mentzena i Nawrockiego.",@Wipler1978,#RozmowaPiaseckiego,tvn24.pl/polska/zblizenie-pr…,1,1,1,231,30,2.0,średni,14,1.0
141.0,anek1123,"Sondaż z lutego, kiedy mentzen zbierał po 20% w sondażach 1 tury, gdzie mógł minąć nawrockiego. Wygrana nawrockiego wzięła się z ogromnych wyników mentzena i brauna i tego, że Nawrocki każdemu wszystko naobiecywał",0,0,0,0,21-10-25,2025-10-21,2025.0,10.0,21.0,0.0,"Sondaż z lutego, kiedy mentzen zbierał po 20% w sondażach 1 tury, gdzie mógł minąć nawrockiego. Wygrana nawrockiego wzięła się z ogromnych wyników mentzena i brauna i tego, że Nawrocki każdemu wszystko naobiecywał","Sondaż z lutego, kiedy mentzen zbierał po 20% w sondażach 1 tury, gdzie mógł minąć nawrockiego. Wygrana nawrockiego wzięła się z ogromnych wyników mentzena i brauna i tego, że Nawrocki każdemu wszystko naobiecywał",,,,0,0,0,213,33,0.0,niski,14,1.0
27.0,mementomcarped,"Cóż, nie jestem żadnym autorytetem, po prostu mam swoje zdanie. Uważam, że nie ma sensu dywagować, dlaczego żyd-performer Braun poparł PiSdopojca Navroky. Braun to typowy shill, Nawrocki to PiS! Nie ma tu jakichkolwiek ""niuansów"", ani innego dna. Wszystko jest proste (dla mnie).",0,0,0,0,23-10-25,2025-10-23,2025.0,10.0,23.0,0.0,"Cóż, nie jestem żadnym autorytetem, po prostu mam swoje zdanie. Uważam, że nie ma sensu dywagować, dlaczego żyd-performer Braun poparł PiSdopojca Navroky. Braun to typowy shill, Nawrocki to PiS! Nie ma tu jakichkolwiek ""niuansów"", ani innego dna. Wszystko jest proste (dla mnie).","Cóż, nie jestem żadnym autorytetem, po prostu mam swoje zdanie. Uważam, że nie ma sensu dywagować, dlaczego żyd-performer Braun poparł PiSdopojca Navroky. Braun to typowy shill, Nawrocki to PiS! Nie ma tu jakichkolwiek ""niuansów"", ani innego dna. Wszystko jest proste (dla mnie).",,,,0,0,0,279,42,0.0,niski,14,0.9735572868574728
13.0,alicjak1169079,"Braun doskonale wiedział kim jest Nawrocki. Co robił, albo czego nie robił, choć miał prawo jako szef IPN ws Wizny, ks Popiełuszki czy Jedwabnego. Każdy kto się tematem interesował, to miał wiedzę. GB nawet w debatach to wypominał KN.",0,0,0,0,25-10-25,2025-10-25,2025.0,10.0,25.0,0.0,"Braun doskonale wiedział kim jest Nawrocki. Co robił, albo czego nie robił, choć miał prawo jako szef IPN ws Wizny, ks Popiełuszki czy Jedwabnego. Każdy kto się tematem interesował, to miał wiedzę. GB nawet w debatach to wypominał KN.","Braun doskonale wiedział kim jest Nawrocki. Co robił, albo czego nie robił, choć miał prawo jako szef IPN ws Wizny, ks Popiełuszki czy Jedwabnego. Każdy kto się tematem interesował, to miał wiedzę. GB nawet w debatach to wypominał KN.",,,,0,0,0,234,39,0.0,niski,14,0.9735572868574728
24.0,omegapanic,"Konfederacja's stance was less conciliatory. Who would believe that PiS had changed if they wanted to destroy Konf? Isn't this just a pragmatic change? The ceasefire continued up to presidential elections, where Mentzen unofficially supported Nawrocki.",0,0,1,1,25-10-25,2025-10-25,2025.0,10.0,25.0,0.0,"Konfederacja's stance was less conciliatory. Who would believe that PiS had changed if they wanted to destroy Konf? Isn't this just a pragmatic change? The ceasefire continued up to presidential elections, where Mentzen unofficially supported Nawrocki.","Konfederacja's stance was less conciliatory. Who would believe that PiS had changed if they wanted to destroy Konf? Isn't this just a pragmatic change? The ceasefire continued up to presidential elections, where Mentzen unofficially supported Nawrocki.",,,,0,0,0,252,36,0.0,średni,14,1.0
