id,username,text,likes,retweets,replies,total_interactions,post_date_iso,date,year,month,day,hour,text_clean,text_no_links,mentions,hashtags,urls,n_mentions,n_hashtags,n_urls,char_count,word_count,amplification_ratio,reach_tier,cluster,cluster_prob
16.0,varcislavz,"Z czwórki: Braun, JKM, Bosak, Mentzen, w czasie wyborów 2025 najpodlej w drugiej turze zachował się Braun, który do ostatniej chwili nie chciał ""poprzeć"" Nawrockiego. I na dwa dni przed ciszą wyborczą wyskoczył z żądaniem aby Nawrocki ... zaczął kopać w Jedwabnem. Moim zdaniem tym samym Braun pokazał, że w głębokie d00pie ma polską rację stanu, los Polaków i ich Rodzin i gra wyłącznie na siebie. Sprawia wrażenie, jakby on rzeczywiście tym królem Polski planował zostać, a swojego syna uczynić następcą tronu.",0,1,2,3,25-10-25,2025-10-25,2025.0,10.0,25.0,0.0,"Z czwórki: Braun, JKM, Bosak, Mentzen, w czasie wyborów 2025 najpodlej w drugiej turze zachował się Braun, który do ostatniej chwili nie chciał ""poprzeć"" Nawrockiego. I na dwa dni przed ciszą wyborczą wyskoczył z żądaniem aby Nawrocki ... zaczął kopać w Jedwabnem. Moim zdaniem tym samym Braun pokazał, że w głębokie d00pie ma polską rację stanu, los Polaków i ich Rodzin i gra wyłącznie na siebie. Sprawia wrażenie, jakby on rzeczywiście tym królem Polski planował zostać, a swojego syna uczynić następcą tronu.","Z czwórki: Braun, JKM, Bosak, Mentzen, w czasie wyborów 2025 najpodlej w drugiej turze zachował się Braun, który do ostatniej chwili nie chciał ""poprzeć"" Nawrockiego. I na dwa dni przed ciszą wyborczą wyskoczył z żądaniem aby Nawrocki ... zaczął kopać w Jedwabnem. Moim zdaniem tym samym Braun pokazał, że w głębokie d00pie ma polską rację stanu, los Polaków i ich Rodzin i gra wyłącznie na siebie. Sprawia wrażenie, jakby on rzeczywiście tym królem Polski planował zostać, a swojego syna uczynić następcą tronu.",,,,0,0,0,512,82,0.5,średni,14,0.9735572868574728
17.0,pigwa22,"Teraz tak się mówi, bo wygrał Nawrocki. Ale Mentzen ustawiał się tak, żeby nikogo wyraźnie nie poprzeć. Z Trzaskowskim poszedł na piwo, tak na wszelki wypadek. Gdyby wygrał, można by mówić, że to był czytelny sygnał do wyborców 😎",0,0,0,0,26-10-25,2025-10-26,2025.0,10.0,26.0,0.0,"Teraz tak się mówi, bo wygrał Nawrocki. Ale Mentzen ustawiał się tak, żeby nikogo wyraźnie nie poprzeć. Z Trzaskowskim poszedł na piwo, tak na wszelki wypadek. Gdyby wygrał, można by mówić, że to był czytelny sygnał do wyborców 😎","Teraz tak się mówi, bo wygrał Nawrocki. Ale Mentzen ustawiał się tak, żeby nikogo wyraźnie nie poprzeć. Z Trzaskowskim poszedł na piwo, tak na wszelki wypadek. Gdyby wygrał, można by mówić, że to był czytelny sygnał do wyborców 😎",,,,0,0,0,229,39,0.0,niski,14,1.0
13.0,bob_shakalaka,"A za cóż to, o ciekawości, Sławomir Mentzen miałby siedzieć razem z bratem? Zakładając oczywiście że brat w ogóle miałby siedzieć? Prezydent Nawrocki sporo zawdzięcza zarówno Mentzenowi jak i Braunowi. To jest fakt.",0,0,0,0,26-10-25,2025-10-26,2025.0,10.0,26.0,0.0,"A za cóż to, o ciekawości, Sławomir Mentzen miałby siedzieć razem z bratem? Zakładając oczywiście że brat w ogóle miałby siedzieć? Prezydent Nawrocki sporo zawdzięcza zarówno Mentzenowi jak i Braunowi. To jest fakt.","A za cóż to, o ciekawości, Sławomir Mentzen miałby siedzieć razem z bratem? Zakładając oczywiście że brat w ogóle miałby siedzieć? Prezydent Nawrocki sporo zawdzięcza zarówno Mentzenowi jak i Braunowi. To jest fakt.",,,,0,0,0,215,33,0.0,niski,14,1.0
9.0,aletieleti,Wypraszam sobie . Ja w I turze głosowałam na Grzegorza Brauna. W drugiej turze po mniejsze zło - Nawrocki . Mamy Prezydenta i trzeba to uszanować 🇵🇱❤️,0,0,1,1,26-10-25,2025-10-26,2025.0,10.0,26.0,0.0,Wypraszam sobie . Ja w I turze głosowałam na Grzegorza Brauna. W drugiej turze po mniejsze zło - Nawrocki . Mamy Prezydenta i trzeba to uszanować 🇵🇱❤️,Wypraszam sobie . Ja w I turze głosowałam na Grzegorza Brauna. W drugiej turze po mniejsze zło - Nawrocki . Mamy Prezydenta i trzeba to uszanować 🇵🇱❤️,,,,0,0,0,150,27,0.0,średni,14,0.9735572868574728
263.0,ccinekk,"Zandberg wygrał w cuglach prawybory w krakowskich liceach, im bardziej elitarne tym wynik wyższy. Gdzieś na Hucie jedynie przebił się Mentzen z Braunem. Nawrocki regularnie na samym końcu.",0,0,0,0,"Jun 3, 2025 · 7:03 AM UTC",,,,,,"Zandberg wygrał w cuglach prawybory w krakowskich liceach, im bardziej elitarne tym wynik wyższy. Gdzieś na Hucie jedynie przebił się Mentzen z Braunem. Nawrocki regularnie na samym końcu.","Zandberg wygrał w cuglach prawybory w krakowskich liceach, im bardziej elitarne tym wynik wyższy. Gdzieś na Hucie jedynie przebił się Mentzen z Braunem. Nawrocki regularnie na samym końcu.",,,,0,0,0,188,28,0.0,niski,14,1.0
694.0,szymonckiw,Nawrocki będzie gwałcił Mentzena i jego deklarację Toruńską... Popcorn i kanapa...,0,0,0,0,"Jun 3, 2025 · 9:07 AM UTC",,,,,,Nawrocki będzie gwałcił Mentzena i jego deklarację Toruńską... Popcorn i kanapa...,Nawrocki będzie gwałcił Mentzena i jego deklarację Toruńską... Popcorn i kanapa...,,,,0,0,0,82,11,0.0,niski,14,0.8880738045754912
420.0,lysy_z_marvela,"Hahahahahaha, dlatego między innymi wygrał Nawrocki, a nic już nie mówię o dużym poparciu dla Mentzena czy Brauna.",0,0,0,0,"Jun 3, 2025 · 12:03 PM UTC",,,,,,"Hahahahahaha, dlatego między innymi wygrał Nawrocki, a nic już nie mówię o dużym poparciu dla Mentzena czy Brauna.","Hahahahahaha, dlatego między innymi wygrał Nawrocki, a nic już nie mówię o dużym poparciu dla Mentzena czy Brauna.",,,,0,0,0,114,18,0.0,niski,14,1.0
457.0,wwwagent,"Zrozum, brukselska onuco, neo-stalinistko! 1/5 wyborców (Mentzen+Braun) nie poszła na Nawrockiego, ale przeciwko Rafałszowi. A poszło głównie o ustawę kagańcową, którą Twój Rafałsz obiecał podpisać, zaś Nawrocki zadeklarował jej odrzucenie. Czyli nie uda się Wam nas ocenzurować.",0,0,0,0,"Jun 3, 2025 · 12:04 PM UTC",,,,,,"Zrozum, brukselska onuco, neo-stalinistko! 1/5 wyborców (Mentzen+Braun) nie poszła na Nawrockiego, ale przeciwko Rafałszowi. A poszło głównie o ustawę kagańcową, którą Twój Rafałsz obiecał podpisać, zaś Nawrocki zadeklarował jej odrzucenie. Czyli nie uda się Wam nas ocenzurować.","Zrozum, brukselska onuco, neo-stalinistko! 1/5 wyborców (Mentzen+Braun) nie poszła na Nawrockiego, ale przeciwko Rafałszowi. A poszło głównie o ustawę kagańcową, którą Twój Rafałsz obiecał podpisać, zaś Nawrocki zadeklarował jej odrzucenie. Czyli nie uda się Wam nas ocenzurować.",,,,0,0,0,279,37,0.0,niski,14,1.0
582.0,gregparis75017,"Muszę przyznać ze nie rozumiem kroku prokuratury z wnioskiem do PE/UE o uchylenie immunitetu Grzegorzowi Braunowi? To prokuratura nie wie że dwa dni temu były wybory w których wygrał Karol Nawrocki, i że Grzegorz Braun zostanie Ułaskawiony?",0,0,0,0,"Jun 3, 2025 · 12:04 PM UTC",,,,,,"Muszę przyznać ze nie rozumiem kroku prokuratury z wnioskiem do PE/UE o uchylenie immunitetu Grzegorzowi Braunowi? To prokuratura nie wie że dwa dni temu były wybory w których wygrał Karol Nawrocki, i że Grzegorz Braun zostanie Ułaskawiony?","Muszę przyznać ze nie rozumiem kroku prokuratury z wnioskiem do PE/UE o uchylenie immunitetu Grzegorzowi Braunowi? To prokuratura nie wie że dwa dni temu były wybory w których wygrał Karol Nawrocki, i że Grzegorz Braun zostanie Ułaskawiony?",,,,0,0,0,240,37,0.0,niski,14,0.9735572868574728
812.0,mrjohnbingham,"Ale Pan kompletnie nie zrozumiał tego, co napisał @RafalBochenek. Przecież wyraźnie zakomunikował ""wchodzimy w to, Mentzen też chce, potrzebujemy więcej, chłopaki z PSL piszcie na priv"". Tak się robi politykę.",2,48,12,62,"Jun 3, 2025 · 11:30 AM UTC",,,,,,"Ale Pan kompletnie nie zrozumiał tego, co napisał . Przecież wyraźnie zakomunikował ""wchodzimy w to, Mentzen też chce, potrzebujemy więcej, chłopaki z PSL piszcie na priv"". Tak się robi politykę.","Ale Pan kompletnie nie zrozumiał tego, co napisał . Przecież wyraźnie zakomunikował ""wchodzimy w to, Mentzen też chce, potrzebujemy więcej, chłopaki z PSL piszcie na priv"". Tak się robi politykę.",@RafalBochenek,,,1,0,0,195,30,4.0,wysoki,14,1.0
905.0,koneserunii,PILNE Marszałek Sejmu obraża wyborców Mentzena i Brauna,10,125,53,188,"Jun 3, 2025 · 11:17 AM UTC",,,,,,PILNE Marszałek Sejmu obraża wyborców Mentzena i Brauna,PILNE Marszałek Sejmu obraża wyborców Mentzena i Brauna,,,,0,0,0,55,8,2.36,wysoki,14,1.0
461.0,doscbzdur,"Braun powiedział jasno, że zagłosuje na Nawrockiego. Z resztą Nawrocki całościowo ma poglądy bliższe tym Brauna, a jednak 7% braunistow zagłosowało na Trzaska. Wytłumacz to.",0,0,0,0,"Jun 3, 2025 · 1:03 PM UTC",,,,,,"Braun powiedział jasno, że zagłosuje na Nawrockiego. Z resztą Nawrocki całościowo ma poglądy bliższe tym Brauna, a jednak 7% braunistow zagłosowało na Trzaska. Wytłumacz to.","Braun powiedział jasno, że zagłosuje na Nawrockiego. Z resztą Nawrocki całościowo ma poglądy bliższe tym Brauna, a jednak 7% braunistow zagłosowało na Trzaska. Wytłumacz to.",,,,0,0,0,173,25,0.0,niski,14,0.9735572868574728
846.0,sekretarzxxl,"Nawrocki właśnie wygrał wybory po najniższym w historii wyniku prezydenta w I turze, dzięki poparciu wyborców Konfederacji i niedwuznacznemu poparciu Mentzena, Bosaka i Brauna. Tymczasem Kaczyński ostentacyjnie olewa chęć spotkania Mentzena, mówiąc 'jestem starej daty, nie wypada mi się spotykać z małym klubem'. Jak już opadną memy o geniuszu strategicznym dziadka Kaczyńskiego, to sporo osób przypomni sobie, dlaczego chowano go w szafie w czasie kampanii. W jego umyśle PIS jest wciąż monopolistą na prawicy, więc będzie grał na upokarzanie Konfy, choćby miało to zmniejszyć wspólną pulę głosów w 2027.",0,0,0,0,"Jun 3, 2025 · 1:06 PM UTC",,,,,,"Nawrocki właśnie wygrał wybory po najniższym w historii wyniku prezydenta w I turze, dzięki poparciu wyborców Konfederacji i niedwuznacznemu poparciu Mentzena, Bosaka i Brauna. Tymczasem Kaczyński ostentacyjnie olewa chęć spotkania Mentzena, mówiąc 'jestem starej daty, nie wypada mi się spotykać z małym klubem'. Jak już opadną memy o geniuszu strategicznym dziadka Kaczyńskiego, to sporo osób przypomni sobie, dlaczego chowano go w szafie w czasie kampanii. W jego umyśle PIS jest wciąż monopolistą na prawicy, więc będzie grał na upokarzanie Konfy, choćby miało to zmniejszyć wspólną pulę głosów w 2027.","Nawrocki właśnie wygrał wybory po najniższym w historii wyniku prezydenta w I turze, dzięki poparciu wyborców Konfederacji i niedwuznacznemu poparciu Mentzena, Bosaka i Brauna. Tymczasem Kaczyński ostentacyjnie olewa chęć spotkania Mentzena, mówiąc 'jestem starej daty, nie wypada mi się spotykać z małym klubem'. Jak już opadną memy o geniuszu strategicznym dziadka Kaczyńskiego, to sporo osób przypomni sobie, dlaczego chowano go w szafie w czasie kampanii. W jego umyśle PIS jest wciąż monopolistą na prawicy, więc będzie grał na upokarzanie Konfy, choćby miało to zmniejszyć wspólną pulę głosów w 2027.",,,,0,0,0,606,89,0.0,niski,14,1.0
56.0,aleks_z_gryfa,"Trochę się ubawiłam dzisiejszą ""twardą postawą"" prokuratury w stosunku do Brauna. Po pierwsze, to że gość robi co chce - wiemy od dawna. Po drugie - już był zapowiedział, że za współpracę Nawrocki go ułaskawi. Po trzecie - ja Was proszę - Brauna nam rzucają na pocieszenie a Matecki biega uśmiechnięty po kraju? ... że o Łajzie nie wspomnę...",0,7,3,10,"Jun 3, 2025 · 1:23 PM UTC",,,,,,"Trochę się ubawiłam dzisiejszą ""twardą postawą"" prokuratury w stosunku do Brauna. Po pierwsze, to że gość robi co chce - wiemy od dawna. Po drugie - już był zapowiedział, że za współpracę Nawrocki go ułaskawi. Po trzecie - ja Was proszę - Brauna nam rzucają na pocieszenie a Matecki biega uśmiechnięty po kraju? ... że o Łajzie nie wspomnę...","Trochę się ubawiłam dzisiejszą ""twardą postawą"" prokuratury w stosunku do Brauna. Po pierwsze, to że gość robi co chce - wiemy od dawna. Po drugie - już był zapowiedział, że za współpracę Nawrocki go ułaskawi. Po trzecie - ja Was proszę - Brauna nam rzucają na pocieszenie a Matecki biega uśmiechnięty po kraju? ... że o Łajzie nie wspomnę...",,,,0,0,0,342,59,2.33,średni,14,0.9735572868574728
394.0,arosenpl,"Pomyślcie, że temu przygłupowi, który teraz zagłosował na Nawrockiego, bo mu Nawrocki podpisał postulaty Mentzena, kiedyś życie uratował sprzęt zakupiony przez WOŚP, za który wy zapłaciliście. Miłego myślenia.",0,3,8,11,"Jun 3, 2025 · 1:28 PM UTC",,,,,,"Pomyślcie, że temu przygłupowi, który teraz zagłosował na Nawrockiego, bo mu Nawrocki podpisał postulaty Mentzena, kiedyś życie uratował sprzęt zakupiony przez WOŚP, za który wy zapłaciliście. Miłego myślenia.","Pomyślcie, że temu przygłupowi, który teraz zagłosował na Nawrockiego, bo mu Nawrocki podpisał postulaty Mentzena, kiedyś życie uratował sprzęt zakupiony przez WOŚP, za który wy zapłaciliście. Miłego myślenia.",,,,0,0,0,209,28,0.38,średni,14,1.0
718.0,byrcza,"Akcja Brauna miała wydźwięk wyłącznie medialny, show nic więcej, a do tego zagrożenie zdrowia pacjentek na oddziale położniczym, bo sterroryzował cały oddział na prawie 2h. Po tym akcie terroru Braun u mnie znaczy tyle samo co gangster Nawrocki, zresztą Braun go poparł.",0,0,0,0,"Jun 3, 2025 · 3:05 PM UTC",,,,,,"Akcja Brauna miała wydźwięk wyłącznie medialny, show nic więcej, a do tego zagrożenie zdrowia pacjentek na oddziale położniczym, bo sterroryzował cały oddział na prawie 2h. Po tym akcie terroru Braun u mnie znaczy tyle samo co gangster Nawrocki, zresztą Braun go poparł.","Akcja Brauna miała wydźwięk wyłącznie medialny, show nic więcej, a do tego zagrożenie zdrowia pacjentek na oddziale położniczym, bo sterroryzował cały oddział na prawie 2h. Po tym akcie terroru Braun u mnie znaczy tyle samo co gangster Nawrocki, zresztą Braun go poparł.",,,,0,0,0,270,42,0.0,niski,14,0.9735572868574728
450.0,swiderski_jan,"Wygląda, że #Mentzen pomógł #Nawrocki.emu wygrać wybory. Dziś za to Kaczyński... pokazał mu środkowy palec @Eksperci_WSB",0,1,0,1,"Jun 3, 2025 · 3:22 PM UTC",,,,,,"Wygląda, że Mentzen pomógł Nawrocki.emu wygrać wybory. Dziś za to Kaczyński... pokazał mu środkowy palec","Wygląda, że pomógł .emu wygrać wybory. Dziś za to Kaczyński... pokazał mu środkowy palec",@Eksperci_WSB,#Mentzen|#Nawrocki,,1,2,0,104,15,1.0,średni,14,1.0
533.0,marcin642893,"Ty nawet nie zrozumiałeś co Mentzen mówił wprost o osiłku.. tam nie było metafor, a i tak sobie nie poradziłeś. Każdy wie, że Nawrocki kwestionował dokonania PIS, bo po to był wybrany z poza partii. PiS to lewica, a nie prawica.",0,0,0,0,"Jun 3, 2025 · 6:02 PM UTC",,,,,,"Ty nawet nie zrozumiałeś co Mentzen mówił wprost o osiłku.. tam nie było metafor, a i tak sobie nie poradziłeś. Każdy wie, że Nawrocki kwestionował dokonania PIS, bo po to był wybrany z poza partii. PiS to lewica, a nie prawica.","Ty nawet nie zrozumiałeś co Mentzen mówił wprost o osiłku.. tam nie było metafor, a i tak sobie nie poradziłeś. Każdy wie, że Nawrocki kwestionował dokonania PIS, bo po to był wybrany z poza partii. PiS to lewica, a nie prawica.",,,,0,0,0,228,41,0.0,niski,14,1.0
318.0,johnsmiths74,"Mentzen z 18 głosami w Sejmie zaraz powie, że to spotkanie ma się odbyć u niego.",0,8,16,24,"Jun 3, 2025 · 5:09 PM UTC",,,,,,"Mentzen z 18 głosami w Sejmie zaraz powie, że to spotkanie ma się odbyć u niego.","Mentzen z 18 głosami w Sejmie zaraz powie, że to spotkanie ma się odbyć u niego.",,,,0,0,0,80,16,0.5,średni,14,1.0
883.0,smariuszs,Wybory Karol Nawrocki wybór jest prosty przeciwko Trzaskowskiemu.,0,6,1,7,"May 30, 2025 · 8:20 PM UTC",,,,,,Wybory Karol Nawrocki wybór jest prosty przeciwko Trzaskowskiemu.,Wybory Karol Nawrocki wybór jest prosty przeciwko Trzaskowskiemu.,,,,0,0,0,65,8,6.0,średni,14,0.8591278906949283
65.0,zimny19202988,"Wcz to mały bu pokazał że mentzen może spadać olał go ciepłym moczem , Ale to było pewne że się nie ufa pisiorom , teraz Nawrocki powie jakie ustawy nic nie podpisywałem to tylko kartka ,, wykręcili mentzen a razem z nim jego wyborców 🤣",0,0,0,0,"Jun 4, 2025 · 8:05 AM UTC",,,,,,"Wcz to mały bu pokazał że mentzen może spadać olał go ciepłym moczem , Ale to było pewne że się nie ufa pisiorom , teraz Nawrocki powie jakie ustawy nic nie podpisywałem to tylko kartka ,, wykręcili mentzen a razem z nim jego wyborców 🤣","Wcz to mały bu pokazał że mentzen może spadać olał go ciepłym moczem , Ale to było pewne że się nie ufa pisiorom , teraz Nawrocki powie jakie ustawy nic nie podpisywałem to tylko kartka ,, wykręcili mentzen a razem z nim jego wyborców 🤣",,,,0,0,0,236,45,0.0,niski,14,1.0
624.0,gabi19950414,"Bo to jest jedyna partia, która jest rzeczywiście opozycyjna. Braun - nie nie a po kilku dniach popieram Nawrockiego (ułaskawienie jednak weszło na pełnej), Mentzen ja wam nie mówię na kogo głosować ale Nawrocki z wazeliną wszystko mi podpisał a z Trzaskowskim piwo po znajomości.",0,0,0,0,"Jun 4, 2025 · 8:10 AM UTC",,,,,,"Bo to jest jedyna partia, która jest rzeczywiście opozycyjna. Braun - nie nie a po kilku dniach popieram Nawrockiego (ułaskawienie jednak weszło na pełnej), Mentzen ja wam nie mówię na kogo głosować ale Nawrocki z wazeliną wszystko mi podpisał a z Trzaskowskim piwo po znajomości.","Bo to jest jedyna partia, która jest rzeczywiście opozycyjna. Braun - nie nie a po kilku dniach popieram Nawrockiego (ułaskawienie jednak weszło na pełnej), Mentzen ja wam nie mówię na kogo głosować ale Nawrocki z wazeliną wszystko mi podpisał a z Trzaskowskim piwo po znajomości.",,,,0,0,0,280,45,0.0,niski,14,1.0
504.0,fanenduro,"Jarek niereformowalny, żyje w swoim świecie nienawiści. Nic nowego. I dobrze, niech zgnije on i jego przydupasy z pisu. Konfa, Braun będzie wtedy mieć większe szanse. Bez Konfy i Brauna, Nawrocki by nie wygrał. Dziwie się że wcześniej poparli dudenke jak rządził pis. To był błąd",0,0,0,0,"Jun 4, 2025 · 9:10 AM UTC",,,,,,"Jarek niereformowalny, żyje w swoim świecie nienawiści. Nic nowego. I dobrze, niech zgnije on i jego przydupasy z pisu. Konfa, Braun będzie wtedy mieć większe szanse. Bez Konfy i Brauna, Nawrocki by nie wygrał. Dziwie się że wcześniej poparli dudenke jak rządził pis. To był błąd","Jarek niereformowalny, żyje w swoim świecie nienawiści. Nic nowego. I dobrze, niech zgnije on i jego przydupasy z pisu. Konfa, Braun będzie wtedy mieć większe szanse. Bez Konfy i Brauna, Nawrocki by nie wygrał. Dziwie się że wcześniej poparli dudenke jak rządził pis. To był błąd",,,,0,0,0,279,46,0.0,niski,14,0.9735572868574728
631.0,sebasti58552845,A jak pani myśli w jakim przypadku są większe szanse że Nawrocki by ułaskawił Brauna?Kiedy 98% wyborców Brauna poszło na Nawrockiego czy może 70% np?,0,0,0,0,"Jun 4, 2025 · 9:10 AM UTC",,,,,,A jak pani myśli w jakim przypadku są większe szanse że Nawrocki by ułaskawił Brauna?Kiedy 98% wyborców Brauna poszło na Nawrockiego czy może 70% np?,A jak pani myśli w jakim przypadku są większe szanse że Nawrocki by ułaskawił Brauna?Kiedy 98% wyborców Brauna poszło na Nawrockiego czy może 70% np?,,,,0,0,0,149,25,0.0,niski,14,0.9735572868574728
238.0,operdox_,Hello Shadow Mario Thoughts on Nawrocki? Would Braun have been a better candidate?,0,0,0,0,"Jun 4, 2025 · 10:10 AM UTC",,,,,,Hello Shadow Mario Thoughts on Nawrocki? Would Braun have been a better candidate?,Hello Shadow Mario Thoughts on Nawrocki? Would Braun have been a better candidate?,,,,0,0,0,82,13,0.0,niski,14,0.9735572868574728
30.0,mareks98837118,"Mogą mi Państwo powiedzieć, ilu wyborców w II turze miałby doktor Nawrocki, bez (deklarowanych wszakże), wyborców Mentzena?",1,5,1,7,"Jun 4, 2025 · 2:09 PM UTC",,,,,,"Mogą mi Państwo powiedzieć, ilu wyborców w II turze miałby doktor Nawrocki, bez (deklarowanych wszakże), wyborców Mentzena?","Mogą mi Państwo powiedzieć, ilu wyborców w II turze miałby doktor Nawrocki, bez (deklarowanych wszakże), wyborców Mentzena?",,,,0,0,0,123,17,5.0,średni,14,1.0
258.0,george98803193,"Dokładnie!Poza tym to Kaczyńskiemu na czymś zależy,to powinien do Mentzena tak samo jak Nawrocki na kolanach iść tak jak już mają te dz.... w swojej naturze",0,0,0,0,"Jun 4, 2025 · 3:56 PM UTC",,,,,,"Dokładnie!Poza tym to Kaczyńskiemu na czymś zależy,to powinien do Mentzena tak samo jak Nawrocki na kolanach iść tak jak już mają te dz.... w swojej naturze","Dokładnie!Poza tym to Kaczyńskiemu na czymś zależy,to powinien do Mentzena tak samo jak Nawrocki na kolanach iść tak jak już mają te dz.... w swojej naturze",,,,0,0,0,156,26,0.0,niski,14,1.0
773.0,sipyor,"Kulą w płot. Konfederatów będzie podbierał Nawrocki, będzie podbierał Kaczyński i Braun. Czy uważa Pan że Mentzen sobie z nimi poradzi? Do tego mając wewnętrzną opozycję? Zakiwa się jak z tym piwem. Mentzen nie wszedł do drugiej tury. Pamiętajmy o tym.",0,0,0,0,"Jun 4, 2025 · 3:59 PM UTC",,,,,,"Kulą w płot. Konfederatów będzie podbierał Nawrocki, będzie podbierał Kaczyński i Braun. Czy uważa Pan że Mentzen sobie z nimi poradzi? Do tego mając wewnętrzną opozycję? Zakiwa się jak z tym piwem. Mentzen nie wszedł do drugiej tury. Pamiętajmy o tym.","Kulą w płot. Konfederatów będzie podbierał Nawrocki, będzie podbierał Kaczyński i Braun. Czy uważa Pan że Mentzen sobie z nimi poradzi? Do tego mając wewnętrzną opozycję? Zakiwa się jak z tym piwem. Mentzen nie wszedł do drugiej tury. Pamiętajmy o tym.",,,,0,0,0,252,41,0.0,niski,14,1.0
727.0,dariuszmatecki,"Dziś pojawiły się sugestie, że to ja miałem być posłem, który miał dołączyć do koła Korony Grzegorza Brauna. Ja posła Brauna ale też posła Fritza bardzo szanuję, ale dla mnie w polityce - i w życiu - najważniejsza jest lojalność, a ja jestem lojalny wobec człowieka, który jest dla mnie politycznym autorytetem - @ZiobroPL i jako dawna @Suwerenna_POL jesteśmy politykami @pisorgpl. I jako PiS idziemy po zwycięstwo w wyborach parlamentarnych i wszystkich wyborców prawicy będę zachęcać do głosowania na Prawo i Sprawiedliwość",0,126,25,151,"Jun 4, 2025 · 2:16 PM UTC",,,,,,"Dziś pojawiły się sugestie, że to ja miałem być posłem, który miał dołączyć do koła Korony Grzegorza Brauna. Ja posła Brauna ale też posła Fritza bardzo szanuję, ale dla mnie w polityce - i w życiu - najważniejsza jest lojalność, a ja jestem lojalny wobec człowieka, który jest dla mnie politycznym autorytetem - i jako dawna jesteśmy politykami . I jako PiS idziemy po zwycięstwo w wyborach parlamentarnych i wszystkich wyborców prawicy będę zachęcać do głosowania na Prawo i Sprawiedliwość","Dziś pojawiły się sugestie, że to ja miałem być posłem, który miał dołączyć do koła Korony Grzegorza Brauna. Ja posła Brauna ale też posła Fritza bardzo szanuję, ale dla mnie w polityce - i w życiu - najważniejsza jest lojalność, a ja jestem lojalny wobec człowieka, który jest dla mnie politycznym autorytetem - i jako dawna jesteśmy politykami . I jako PiS idziemy po zwycięstwo w wyborach parlamentarnych i wszystkich wyborców prawicy będę zachęcać do głosowania na Prawo i Sprawiedliwość",@ZiobroPL|@Suwerenna_POL|@pisorgpl,,,3,0,0,491,80,5.04,wysoki,14,0.9735572868574728
414.0,papciachmiel,"On? Chyba cała prawica, bo jego kandydat nawet 30% nie zdobył i przegrał z trzaskiem w 1 turze i gdyby Mentzen, czy nawet Braun mu nie pomogli to Nawrocki nie byłby prezydentem.",0,0,0,0,"Jun 4, 2025 · 5:56 PM UTC",,,,,,"On? Chyba cała prawica, bo jego kandydat nawet 30% nie zdobył i przegrał z trzaskiem w 1 turze i gdyby Mentzen, czy nawet Braun mu nie pomogli to Nawrocki nie byłby prezydentem.","On? Chyba cała prawica, bo jego kandydat nawet 30% nie zdobył i przegrał z trzaskiem w 1 turze i gdyby Mentzen, czy nawet Braun mu nie pomogli to Nawrocki nie byłby prezydentem.",,,,0,0,0,177,32,0.0,niski,14,1.0
694.0,jcobkant,They gave us Nawrocki and that Jew Mentzen. Braun was the real candidate,0,0,0,0,"Jun 4, 2025 · 5:58 PM UTC",,,,,,They gave us Nawrocki and that Jew Mentzen. Braun was the real candidate,They gave us Nawrocki and that Jew Mentzen. Braun was the real candidate,,,,0,0,0,72,13,0.0,niski,14,1.0
765.0,aleeex2422,"Czyli faktyczny program kandytdata nie ma znaczenia? Przecież Nawrocki w tej kampanii właśnie jechał na libkowych postulatach. Wyparł się ""socjalnego PiS-u"" i na kolanach podpisał Mentzenowi wszystko, czego tamten chciał. Nawet Zandberg to powiedział.",0,0,0,0,"Jun 4, 2025 · 5:59 PM UTC",,,,,,"Czyli faktyczny program kandytdata nie ma znaczenia? Przecież Nawrocki w tej kampanii właśnie jechał na libkowych postulatach. Wyparł się ""socjalnego PiS-u"" i na kolanach podpisał Mentzenowi wszystko, czego tamten chciał. Nawet Zandberg to powiedział.","Czyli faktyczny program kandytdata nie ma znaczenia? Przecież Nawrocki w tej kampanii właśnie jechał na libkowych postulatach. Wyparł się ""socjalnego PiS-u"" i na kolanach podpisał Mentzenowi wszystko, czego tamten chciał. Nawet Zandberg to powiedział.",,,,0,0,0,251,34,0.0,niski,14,1.0
