id,username,text,likes,retweets,replies,total_interactions,post_date_iso,date,year,month,day,hour,text_clean,text_no_links,mentions,hashtags,urls,n_mentions,n_hashtags,n_urls,char_count,word_count,amplification_ratio,reach_tier,cluster,cluster_prob
236.0,gosiaxd4,"Ciekawe skad pis wiedzial, ze akurat w tych🤭🤭🤭",0,0,0,0,25-06-25,2025-06-25,2025.0,6.0,25.0,0.0,"Ciekawe skad pis wiedzial, ze akurat w tych🤭🤭🤭","Ciekawe skad pis wiedzial, ze akurat w tych🤭🤭🤭",,,,0,0,0,46,8,0.0,niski,41,0.8232918175962636
295.0,galaknowotko,Jeśli pan tego nie ogarnia to podać się do dymisji.,0,0,0,0,25-06-25,2025-06-25,2025.0,6.0,25.0,0.0,Jeśli pan tego nie ogarnia to podać się do dymisji.,Jeśli pan tego nie ogarnia to podać się do dymisji.,,,,0,0,0,51,10,0.0,niski,41,0.7075198175498061
500.0,grac98637,"Panie @trzaskowski_ jeśli ma pan odrobinę honoru, to proś pan @GiertychRoman żeby powstrzymał tę hucpę, bo już na zawsze przylgnie do pana bardzo brzydka łatka i choć nie będzie to pańska wina, to już zawsze z panem zostanie....",0,1,0,1,25-06-25,2025-06-25,2025.0,6.0,25.0,0.0,"Panie jeśli ma pan odrobinę honoru, to proś pan żeby powstrzymał tę hucpę, bo już na zawsze przylgnie do pana bardzo brzydka łatka i choć nie będzie to pańska wina, to już zawsze z panem zostanie....","Panie jeśli ma pan odrobinę honoru, to proś pan żeby powstrzymał tę hucpę, bo już na zawsze przylgnie do pana bardzo brzydka łatka i choć nie będzie to pańska wina, to już zawsze z panem zostanie....",@trzaskowski_|@GiertychRoman,,,2,0,0,199,36,1.0,średni,41,1.0
28.0,dyrkrzysztofiak,"Myślę jednak, że jest jeszcze nadzieja i to jest właśnie ten czas, kiedy powinna pani zrobić odważny krok do przodu!",0,0,0,0,25-06-25,2025-06-25,2025.0,6.0,25.0,0.0,"Myślę jednak, że jest jeszcze nadzieja i to jest właśnie ten czas, kiedy powinna pani zrobić odważny krok do przodu!","Myślę jednak, że jest jeszcze nadzieja i to jest właśnie ten czas, kiedy powinna pani zrobić odważny krok do przodu!",,,,0,0,0,116,20,0.0,niski,41,0.6073690670169222
32.0,przemek65171163,Daje pińcset i czekam na Twoje wyliczenia 🧐,0,0,0,0,25-06-25,2025-06-25,2025.0,6.0,25.0,0.0,Daje pińcset i czekam na Twoje wyliczenia 🧐,Daje pińcset i czekam na Twoje wyliczenia 🧐,,,,0,0,0,43,8,0.0,niski,41,0.8421948162038716
295.0,21727ba4f43742b,"Przygotujcie go za ten jego łańcuch do ściany , żeby nie chodził i nie pierdolił głupot w telewizji...",0,0,0,0,25-06-25,2025-06-25,2025.0,6.0,25.0,0.0,"Przygotujcie go za ten jego łańcuch do ściany , żeby nie chodził i nie pierdolił głupot w telewizji...","Przygotujcie go za ten jego łańcuch do ściany , żeby nie chodził i nie pierdolił głupot w telewizji...",,,,0,0,0,102,18,0.0,niski,41,0.5434091127077458
488.0,dmumim,"TAK ❗ Cieszę się, że pisowska dziennikarka to ZROZUMIAŁA . Możesz się dalej śmiać.",0,0,0,0,25-06-25,2025-06-25,2025.0,6.0,25.0,0.0,"TAK ❗ Cieszę się, że pisowska dziennikarka to ZROZUMIAŁA . Możesz się dalej śmiać.","TAK ❗ Cieszę się, że pisowska dziennikarka to ZROZUMIAŁA . Możesz się dalej śmiać.",,,,0,0,0,82,14,0.0,niski,41,0.8493871212918351
415.0,sgorzkulla,Powodzenia. Też mam dziś sesję absolutoryjną.,0,0,0,0,26-06-25,2025-06-26,2025.0,6.0,26.0,0.0,Powodzenia. Też mam dziś sesję absolutoryjną.,Powodzenia. Też mam dziś sesję absolutoryjną.,,,,0,0,0,45,6,0.0,niski,41,0.5508590015970858
4.0,ciociabasia2,Że się kąpie to wiemy.,0,0,0,0,26-06-25,2025-06-26,2025.0,6.0,26.0,0.0,Że się kąpie to wiemy.,Że się kąpie to wiemy.,,,,0,0,0,22,5,0.0,niski,41,0.6844349138332053
13.0,kubulatko,W życiu nie sądziłem że Pani napisze coś mądrego.,0,0,0,0,26-06-25,2025-06-26,2025.0,6.0,26.0,0.0,W życiu nie sądziłem że Pani napisze coś mądrego.,W życiu nie sądziłem że Pani napisze coś mądrego.,,,,0,0,0,49,9,0.0,niski,41,0.7096713126657647
14.0,gosiaxd4,Twoje tlumaczenie jest na poziomie pani manowskiej dlaczego nie chce zeby wygral trzaskowski🤭🤭🤭,0,0,0,0,26-06-25,2025-06-26,2025.0,6.0,26.0,0.0,Twoje tlumaczenie jest na poziomie pani manowskiej dlaczego nie chce zeby wygral trzaskowski🤭🤭🤭,Twoje tlumaczenie jest na poziomie pani manowskiej dlaczego nie chce zeby wygral trzaskowski🤭🤭🤭,,,,0,0,0,95,13,0.0,niski,41,0.7436607856229409
22.0,warlock_shine,To Pani jest szalona albo mają na Panią jakieś haki obyczajowe. Na szczęście w nowym sejmie już Was nie będzie sprzedajne ….. #LiczymyGłosyPonownie,0,4,0,4,26-06-25,2025-06-26,2025.0,6.0,26.0,0.0,To Pani jest szalona albo mają na Panią jakieś haki obyczajowe. Na szczęście w nowym sejmie już Was nie będzie sprzedajne ….. LiczymyGłosyPonownie,To Pani jest szalona albo mają na Panią jakieś haki obyczajowe. Na szczęście w nowym sejmie już Was nie będzie sprzedajne …..,,#LiczymyGłosyPonownie,,0,1,0,146,23,4.0,wysoki,41,0.584455251577594
97.0,ciociabasia2,A dlaczego Czarzasty pozwala Pani na mówienie głupot?,0,0,0,0,26-06-25,2025-06-26,2025.0,6.0,26.0,0.0,A dlaczego Czarzasty pozwala Pani na mówienie głupot?,A dlaczego Czarzasty pozwala Pani na mówienie głupot?,,,,0,0,0,53,8,0.0,niski,41,1.0
100.0,beatanoremberc1,"A Pani gdzie tak spieszno ,pomału poczekajmy na Dalsze wyniki",0,0,0,0,26-06-25,2025-06-26,2025.0,6.0,26.0,0.0,"A Pani gdzie tak spieszno ,pomału poczekajmy na Dalsze wyniki","A Pani gdzie tak spieszno ,pomału poczekajmy na Dalsze wyniki",,,,0,0,0,61,10,0.0,niski,41,0.6152978354694804
224.0,kastanormalsow,"No nie, co się naprezydentował, to jego.",0,0,0,0,26-06-25,2025-06-26,2025.0,6.0,26.0,0.0,"No nie, co się naprezydentował, to jego.","No nie, co się naprezydentował, to jego.",,,,0,0,0,40,7,0.0,niski,41,0.61307010612114
326.0,frostxcrypto,Wy wszyscy lewusy jestescie ciezko JEBNIECI. Pozdrawiam,0,0,0,0,26-06-25,2025-06-26,2025.0,6.0,26.0,0.0,Wy wszyscy lewusy jestescie ciezko JEBNIECI. Pozdrawiam,Wy wszyscy lewusy jestescie ciezko JEBNIECI. Pozdrawiam,,,,0,0,0,55,7,0.0,niski,41,1.0
460.0,danieltrzaska0,"Szczerze to nie wiem co dzisiejsze zadania na maturze podstawowej z matematyki (sam zdawałem również rozszerzoną) mają do logicznego myślenia i umiejętności liczenia. Matura z matematyki? Tak, ale totalnie zreformowana i oparta o nauczenie ludzi podstaw, które są potrzebne.",0,0,0,0,26-06-25,2025-06-26,2025.0,6.0,26.0,0.0,"Szczerze to nie wiem co dzisiejsze zadania na maturze podstawowej z matematyki (sam zdawałem również rozszerzoną) mają do logicznego myślenia i umiejętności liczenia. Matura z matematyki? Tak, ale totalnie zreformowana i oparta o nauczenie ludzi podstaw, które są potrzebne.","Szczerze to nie wiem co dzisiejsze zadania na maturze podstawowej z matematyki (sam zdawałem również rozszerzoną) mają do logicznego myślenia i umiejętności liczenia. Matura z matematyki? Tak, ale totalnie zreformowana i oparta o nauczenie ludzi podstaw, które są potrzebne.",,,,0,0,0,274,39,0.0,niski,41,0.5484933436469631
150.0,kinga8293128676,Tuskom i kotuli do domu,0,0,0,0,26-06-25,2025-06-26,2025.0,6.0,26.0,0.0,Tuskom i kotuli do domu,Tuskom i kotuli do domu,,,,0,0,0,23,5,0.0,niski,41,0.6727538815206288
272.0,midime4,Niezła odklejka Dla was każdy kto ma inne zdanie niż Doniu to od razu pisowiec. Przecież to jest chore.,0,0,0,0,26-06-25,2025-06-26,2025.0,6.0,26.0,0.0,Niezła odklejka Dla was każdy kto ma inne zdanie niż Doniu to od razu pisowiec. Przecież to jest chore.,Niezła odklejka Dla was każdy kto ma inne zdanie niż Doniu to od razu pisowiec. Przecież to jest chore.,,,,0,0,0,103,19,0.0,niski,41,0.9363511353525832
149.0,kilerzespecnazu,"To teraz hipotetycznie-ktoś włamuje się do pani, kradnie kasę, wybija okna, sra na środku pokoju a na koniec gwalci kota. Sąsiad ma monitoring i można łatwo ustalić kto to. Rozumiem że pani odpuszcza bo po co tyle zachodu, w końcu kot jest już stary a dywan i tak był do wymiany?",0,0,0,0,26-06-25,2025-06-26,2025.0,6.0,26.0,0.0,"To teraz hipotetycznie-ktoś włamuje się do pani, kradnie kasę, wybija okna, sra na środku pokoju a na koniec gwalci kota. Sąsiad ma monitoring i można łatwo ustalić kto to. Rozumiem że pani odpuszcza bo po co tyle zachodu, w końcu kot jest już stary a dywan i tak był do wymiany?","To teraz hipotetycznie-ktoś włamuje się do pani, kradnie kasę, wybija okna, sra na środku pokoju a na koniec gwalci kota. Sąsiad ma monitoring i można łatwo ustalić kto to. Rozumiem że pani odpuszcza bo po co tyle zachodu, w końcu kot jest już stary a dywan i tak był do wymiany?",,,,0,0,0,279,51,0.0,niski,41,0.6114290673231775
203.0,kuba39612122,A @prezydentpl coś zrobi w tej sprawie? Bo prócz słów nic się nie dzieje...,0,0,0,0,26-06-25,2025-06-26,2025.0,6.0,26.0,0.0,A coś zrobi w tej sprawie? Bo prócz słów nic się nie dzieje...,A coś zrobi w tej sprawie? Bo prócz słów nic się nie dzieje...,@prezydentpl,,,1,0,0,62,13,0.0,niski,41,0.5773548787906853
21.0,lidiarobbie,Na co się gapisz żałosny grubasie. Wypierdalaj z mojego domu,0,0,0,0,26-06-25,2025-06-26,2025.0,6.0,26.0,0.0,Na co się gapisz żałosny grubasie. Wypierdalaj z mojego domu,Na co się gapisz żałosny grubasie. Wypierdalaj z mojego domu,,,,0,0,0,60,10,0.0,niski,41,0.8536110105886561
11.0,emmilm,"Czyli co, zaczęliście się już urządzać w dudzie kaczyńskiego? Rozumiem, że tam umościło się całkiem sporo waszych kumpli z dawnych czasów, którzy was nie zaprosili, no ale trochę godności... Lewica... 🤦‍♂️",0,0,0,0,27-06-25,2025-06-27,2025.0,6.0,27.0,0.0,"Czyli co, zaczęliście się już urządzać w dudzie kaczyńskiego? Rozumiem, że tam umościło się całkiem sporo waszych kumpli z dawnych czasów, którzy was nie zaprosili, no ale trochę godności... Lewica... 🤦‍♂️","Czyli co, zaczęliście się już urządzać w dudzie kaczyńskiego? Rozumiem, że tam umościło się całkiem sporo waszych kumpli z dawnych czasów, którzy was nie zaprosili, no ale trochę godności... Lewica... 🤦‍♂️",,,,0,0,0,205,31,0.0,niski,41,0.6973614848387256
300.0,ormuzd_1,Szczerbaty ty to chyba kazdemu byś wylizał,0,0,0,0,27-06-25,2025-06-27,2025.0,6.0,27.0,0.0,Szczerbaty ty to chyba kazdemu byś wylizał,Szczerbaty ty to chyba kazdemu byś wylizał,,,,0,0,0,42,7,0.0,niski,41,1.0
386.0,zardah83,"Wszystko przed nim. Tusk tez na początku miał dystans, pózniej mówil jak Giertych.... Nie mów hop..",0,0,0,0,27-06-25,2025-06-27,2025.0,6.0,27.0,0.0,"Wszystko przed nim. Tusk tez na początku miał dystans, pózniej mówil jak Giertych.... Nie mów hop..","Wszystko przed nim. Tusk tez na początku miał dystans, pózniej mówil jak Giertych.... Nie mów hop..",,,,0,0,0,99,16,0.0,niski,41,0.6023842599639003
414.0,krzysztofkorbel,"To przygotowana wcześniej ustawka, ale chyba wszystko się posypało 🤷‍♂️",0,0,0,0,27-06-25,2025-06-27,2025.0,6.0,27.0,0.0,"To przygotowana wcześniej ustawka, ale chyba wszystko się posypało 🤷‍♂️","To przygotowana wcześniej ustawka, ale chyba wszystko się posypało 🤷‍♂️",,,,0,0,0,71,10,0.0,niski,41,0.5576745313695326
441.0,furmanpiotr,Podstawowy dowód metodologiczny: analiza to analiza a synteza to synteza a ich wzajemna relacja ma charakter przeciwieństwa. Do rzeczywistości/ wyborów zastosowanie ma tylko synteza. Ponadto: każda analiza(bogata w arytmetykę) jest niezupełna - Godel.,0,0,0,0,27-06-25,2025-06-27,2025.0,6.0,27.0,0.0,Podstawowy dowód metodologiczny: analiza to analiza a synteza to synteza a ich wzajemna relacja ma charakter przeciwieństwa. Do rzeczywistości/ wyborów zastosowanie ma tylko synteza. Ponadto: każda analiza(bogata w arytmetykę) jest niezupełna - Godel.,Podstawowy dowód metodologiczny: analiza to analiza a synteza to synteza a ich wzajemna relacja ma charakter przeciwieństwa. Do rzeczywistości/ wyborów zastosowanie ma tylko synteza. Ponadto: każda analiza(bogata w arytmetykę) jest niezupełna - Godel.,,,,0,0,0,251,33,0.0,niski,41,0.5587937520861539
6.0,rsuligowski,"Znam takich, co ani 1), ani 2).",0,0,0,0,27-06-25,2025-06-27,2025.0,6.0,27.0,0.0,"Znam takich, co ani 1), ani 2).","Znam takich, co ani 1), ani 2).",,,,0,0,0,31,7,0.0,niski,41,0.998262452983964
394.0,krewetka02,Ola jak mogło być inaczej jak się się w gównie swoim to inaczej nie może być,0,0,0,0,27-06-25,2025-06-27,2025.0,6.0,27.0,0.0,Ola jak mogło być inaczej jak się się w gównie swoim to inaczej nie może być,Ola jak mogło być inaczej jak się się w gównie swoim to inaczej nie może być,,,,0,0,0,76,16,0.0,niski,41,0.7536128218976682
5.0,vb_tag_yello,Jak Tusk od platformy w sejmie. Brawo!,0,0,0,0,27-06-25,2025-06-27,2025.0,6.0,27.0,0.0,Jak Tusk od platformy w sejmie. Brawo!,Jak Tusk od platformy w sejmie. Brawo!,,,,0,0,0,38,7,0.0,niski,41,0.8536110105886561
10.0,ixaaa04,Bo jest w tym kraju dużo takich cwelow jak ty,0,0,0,0,27-06-25,2025-06-27,2025.0,6.0,27.0,0.0,Bo jest w tym kraju dużo takich cwelow jak ty,Bo jest w tym kraju dużo takich cwelow jak ty,,,,0,0,0,45,10,0.0,niski,41,0.5878534875545538
36.0,marcin1380361,Lol. Kto by pomyślał że w 21.wieku wciąż jeszcze istnieją mentalni plaskoziemcy,0,0,0,0,27-06-25,2025-06-27,2025.0,6.0,27.0,0.0,Lol. Kto by pomyślał że w 21.wieku wciąż jeszcze istnieją mentalni plaskoziemcy,Lol. Kto by pomyślał że w 21.wieku wciąż jeszcze istnieją mentalni plaskoziemcy,,,,0,0,0,79,12,0.0,niski,41,0.7020462681028501
216.0,markd_pl,"Nie. Błędna jest Twoja diagnoza. Uzasadnienie, jeśli cię interesuje, napiszę.",0,0,0,0,27-06-25,2025-06-27,2025.0,6.0,27.0,0.0,"Nie. Błędna jest Twoja diagnoza. Uzasadnienie, jeśli cię interesuje, napiszę.","Nie. Błędna jest Twoja diagnoza. Uzasadnienie, jeśli cię interesuje, napiszę.",,,,0,0,0,77,10,0.0,niski,41,0.524971676800772
18.0,lidiarobbie,Gluchy jesteś grubasie? Wypierdalaj z mojego domu,0,0,0,0,27-06-25,2025-06-27,2025.0,6.0,27.0,0.0,Gluchy jesteś grubasie? Wypierdalaj z mojego domu,Gluchy jesteś grubasie? Wypierdalaj z mojego domu,,,,0,0,0,49,7,0.0,niski,41,0.9500557271674718
19.0,frank_rubel,"Wstyd i hańba. Gdzie 3,4, a nawet 5 -ta linia metra, którą ten leser obiecywał. Pani tego dopilnuje, Pani Renato.",0,0,0,0,27-06-25,2025-06-27,2025.0,6.0,27.0,0.0,"Wstyd i hańba. Gdzie 3,4, a nawet 5 -ta linia metra, którą ten leser obiecywał. Pani tego dopilnuje, Pani Renato.","Wstyd i hańba. Gdzie 3,4, a nawet 5 -ta linia metra, którą ten leser obiecywał. Pani tego dopilnuje, Pani Renato.",,,,0,0,0,113,20,0.0,niski,41,0.7362122875693917
21.0,random_dude2050,Wygląda jakby już było za późno.,0,0,0,0,27-06-25,2025-06-27,2025.0,6.0,27.0,0.0,Wygląda jakby już było za późno.,Wygląda jakby już było za późno.,,,,0,0,0,32,6,0.0,niski,41,0.6058340589265144
6.0,arkaszka_k,Nie rozumiem po co Beanie zawraca sobie panem głowę.,0,0,0,0,27-06-25,2025-06-27,2025.0,6.0,27.0,0.0,Nie rozumiem po co Beanie zawraca sobie panem głowę.,Nie rozumiem po co Beanie zawraca sobie panem głowę.,,,,0,0,0,52,9,0.0,niski,41,0.7227472958167093
13.0,izabela12671885,Żaby i ślimaki.. specjalnie dla ciebie 🤣🤣,0,0,0,0,27-06-25,2025-06-27,2025.0,6.0,27.0,0.0,Żaby i ślimaki.. specjalnie dla ciebie 🤣🤣,Żaby i ślimaki.. specjalnie dla ciebie 🤣🤣,,,,0,0,0,41,7,0.0,niski,41,0.751996725804905
27.0,dorota18725593,Czy panu każą wysyłać te bzdury?,0,0,0,0,27-06-25,2025-06-27,2025.0,6.0,27.0,0.0,Czy panu każą wysyłać te bzdury?,Czy panu każą wysyłać te bzdury?,,,,0,0,0,32,6,0.0,niski,41,0.7978612495156194
88.0,robertstankows5,Coś Ci się kompetencje pomyliły ☝️🙄,0,0,0,0,27-06-25,2025-06-27,2025.0,6.0,27.0,0.0,Coś Ci się kompetencje pomyliły ☝️🙄,Coś Ci się kompetencje pomyliły ☝️🙄,,,,0,0,0,35,6,0.0,niski,41,0.6252975059901679
9.0,kbbr2023,"Kapitalnie, już pora. Pisałem dzisiaj o tym",0,2,0,2,27-06-25,2025-06-27,2025.0,6.0,27.0,0.0,"Kapitalnie, już pora. Pisałem dzisiaj o tym","Kapitalnie, już pora. Pisałem dzisiaj o tym",,,,0,0,0,43,7,2.0,wysoki,41,0.6058340589265144
31.0,kroldeszczu,po tych przegranych wyborach Pana wizerunek się jakiś taki...fajniejszy zrobił,0,0,0,0,28-06-25,2025-06-28,2025.0,6.0,28.0,0.0,po tych przegranych wyborach Pana wizerunek się jakiś taki...fajniejszy zrobił,po tych przegranych wyborach Pana wizerunek się jakiś taki...fajniejszy zrobił,,,,0,0,0,78,10,0.0,niski,41,1.0
179.0,adam56023718,Warszawiaki naiwniaki i co tam można by jeszcze oCzajkować🤮,0,0,0,0,28-06-25,2025-06-28,2025.0,6.0,28.0,0.0,Warszawiaki naiwniaki i co tam można by jeszcze oCzajkować🤮,Warszawiaki naiwniaki i co tam można by jeszcze oCzajkować🤮,,,,0,0,0,59,9,0.0,niski,41,0.6265365888769425
255.0,giornongiovanna,Bilet aldın mı doğru söyle,0,0,0,0,28-06-25,2025-06-28,2025.0,6.0,28.0,0.0,Bilet aldın mı doğru söyle,Bilet aldın mı doğru söyle,,,,0,0,0,26,5,0.0,niski,41,0.5887787785471881
258.0,runaurufu,"raczej ktoś mu tak powiedział ""bo lepiej wygląda""...",0,0,0,0,28-06-25,2025-06-28,2025.0,6.0,28.0,0.0,"raczej ktoś mu tak powiedział ""bo lepiej wygląda""...","raczej ktoś mu tak powiedział ""bo lepiej wygląda""...",,,,0,0,0,52,8,0.0,niski,41,0.6402633616025373
282.0,rumpel_stilskn,"No, Kubuś Kocjanek... Koniec z miodkiem. Szykuj się do dziupli 🫤",0,0,0,0,28-06-25,2025-06-28,2025.0,6.0,28.0,0.0,"No, Kubuś Kocjanek... Koniec z miodkiem. Szykuj się do dziupli 🫤","No, Kubuś Kocjanek... Koniec z miodkiem. Szykuj się do dziupli 🫤",,,,0,0,0,64,11,0.0,niski,41,0.8493871212918351
13.0,real_walo,Ani lekarz ani farmaceuta tu nie pomoże. Nie współczuję.,0,0,0,0,28-06-25,2025-06-28,2025.0,6.0,28.0,0.0,Ani lekarz ani farmaceuta tu nie pomoże. Nie współczuję.,Ani lekarz ani farmaceuta tu nie pomoże. Nie współczuję.,,,,0,0,0,56,9,0.0,niski,41,0.5299982379516782
18.0,grzesiekpobanie,"Przecież tu masz przepisane tak naprawdę przepisy, a nie jakieś gówno. To nie jest tak jak niektórzy, że wzięli analizę pijanego wykopka na poważnie XD",0,0,0,0,28-06-25,2025-06-28,2025.0,6.0,28.0,0.0,"Przecież tu masz przepisane tak naprawdę przepisy, a nie jakieś gówno. To nie jest tak jak niektórzy, że wzięli analizę pijanego wykopka na poważnie XD","Przecież tu masz przepisane tak naprawdę przepisy, a nie jakieś gówno. To nie jest tak jak niektórzy, że wzięli analizę pijanego wykopka na poważnie XD",,,,0,0,0,151,25,0.0,niski,41,0.580303477251767
27.0,baehelpfuny,to się nazywa sranie na wycieraczke w tramwaju mądralo!,0,0,1,1,28-06-25,2025-06-28,2025.0,6.0,28.0,0.0,to się nazywa sranie na wycieraczke w tramwaju mądralo!,to się nazywa sranie na wycieraczke w tramwaju mądralo!,,,,0,0,0,55,9,0.0,średni,41,0.6252559050940569
28.0,baehelpfuny,i w sumie dzięki Bogu,0,0,0,0,28-06-25,2025-06-28,2025.0,6.0,28.0,0.0,i w sumie dzięki Bogu,i w sumie dzięki Bogu,,,,0,0,0,21,5,0.0,niski,41,0.5628883489915156
6.0,jacek53532928,"Dorotka jak tam, boli jeszcze dupa ? 😂",0,0,0,0,28-06-25,2025-06-28,2025.0,6.0,28.0,0.0,"Dorotka jak tam, boli jeszcze dupa ? 😂","Dorotka jak tam, boli jeszcze dupa ? 😂",,,,0,0,0,38,8,0.0,niski,41,0.7802320062315911
12.0,chrupens,"Ta kurwa, kanalizację od razu",0,0,0,0,28-06-25,2025-06-28,2025.0,6.0,28.0,0.0,"Ta kurwa, kanalizację od razu","Ta kurwa, kanalizację od razu",,,,0,0,0,29,5,0.0,niski,41,0.8536110105886561
26.0,zmijaczarna,"Dzień dobry, ja ze screenem",0,1,0,1,28-06-25,2025-06-28,2025.0,6.0,28.0,0.0,"Dzień dobry, ja ze screenem","Dzień dobry, ja ze screenem",,,,0,0,0,27,5,1.0,średni,41,0.8493871212918351
30.0,mortaltasakpl,"Do czego to doszło, że dają lajka nie za pokazanie bobra, tylko skrina.😏",0,0,0,0,28-06-25,2025-06-28,2025.0,6.0,28.0,0.0,"Do czego to doszło, że dają lajka nie za pokazanie bobra, tylko skrina.😏","Do czego to doszło, że dają lajka nie za pokazanie bobra, tylko skrina.😏",,,,0,0,0,72,13,0.0,niski,41,0.7126288438604215
31.0,80reginar,"TY, PROSTACZKO Z PROLETARIATU NIGDY NIE SŁYSZAŁAS O BRUDERSZAFCIE? ZROBIMY CI AUDYT SKARBOWY. COŚ CI NIE STYKA W FINANSACH. PEWNIE NIE ZDOŁAŁAŚ SIE NAUCZYĆ MATEMATYKI, JAK TO SIEROTA STALINOWSKA, CÓRKA KOMUCHA I KOMUCHY.",0,0,0,0,28-06-25,2025-06-28,2025.0,6.0,28.0,0.0,"TY, PROSTACZKO Z PROLETARIATU NIGDY NIE SŁYSZAŁAS O BRUDERSZAFCIE? ZROBIMY CI AUDYT SKARBOWY. COŚ CI NIE STYKA W FINANSACH. PEWNIE NIE ZDOŁAŁAŚ SIE NAUCZYĆ MATEMATYKI, JAK TO SIEROTA STALINOWSKA, CÓRKA KOMUCHA I KOMUCHY.","TY, PROSTACZKO Z PROLETARIATU NIGDY NIE SŁYSZAŁAS O BRUDERSZAFCIE? ZROBIMY CI AUDYT SKARBOWY. COŚ CI NIE STYKA W FINANSACH. PEWNIE NIE ZDOŁAŁAŚ SIE NAUCZYĆ MATEMATYKI, JAK TO SIEROTA STALINOWSKA, CÓRKA KOMUCHA I KOMUCHY.",,,,0,0,0,220,33,0.0,niski,41,0.6364493111083075
14.0,lidiarobbie,"Trochę się upociłeś i usapałeś w taką piękną, letnią pogodę. Twoja pokraczna trans- koleżanka z nieslubym bachorem w M2 zassała kilka słomek na darmo🤣Wypierdalajcie teczowe syfy z mojego domu",0,0,0,0,29-06-25,2025-06-29,2025.0,6.0,29.0,0.0,"Trochę się upociłeś i usapałeś w taką piękną, letnią pogodę. Twoja pokraczna trans- koleżanka z nieslubym bachorem w M2 zassała kilka słomek na darmo🤣Wypierdalajcie teczowe syfy z mojego domu","Trochę się upociłeś i usapałeś w taką piękną, letnią pogodę. Twoja pokraczna trans- koleżanka z nieslubym bachorem w M2 zassała kilka słomek na darmo🤣Wypierdalajcie teczowe syfy z mojego domu",,,,0,0,0,191,29,0.0,niski,41,0.8122350584056761
8.0,zbignlzzbigniew,No to się pięknie POrobiło,0,0,0,0,29-06-25,2025-06-29,2025.0,6.0,29.0,0.0,No to się pięknie POrobiło,No to się pięknie POrobiło,,,,0,0,0,26,5,0.0,niski,41,0.5970168135801251
21.0,adam_adam72,Mogliśmy nie wiedzieć. Ale jedno pamietamy:,0,0,0,0,29-06-25,2025-06-29,2025.0,6.0,29.0,0.0,Mogliśmy nie wiedzieć. Ale jedno pamietamy:,Mogliśmy nie wiedzieć. Ale jedno pamietamy:,,,,0,0,0,43,6,0.0,niski,41,0.7076808159567671
28.0,jolanabp,"Taki dziwny wygląd, i te oczy?",0,0,0,0,29-06-25,2025-06-29,2025.0,6.0,29.0,0.0,"Taki dziwny wygląd, i te oczy?","Taki dziwny wygląd, i te oczy?",,,,0,0,0,30,6,0.0,niski,41,0.8536110105886561
2.0,lascarlos_,Mogli mu chociaż na tym plakacie rozum dorysować 😇,0,2,0,2,29-06-25,2025-06-29,2025.0,6.0,29.0,0.0,Mogli mu chociaż na tym plakacie rozum dorysować 😇,Mogli mu chociaż na tym plakacie rozum dorysować 😇,,,,0,0,0,50,9,2.0,wysoki,41,0.6116756722922064
1.0,wiolettabyczys2,JAK NIC WYGRAŁ. I POPRZEDNIE Z DEBILEM TEŻ WYGRAŁ.❤️🇵🇱,0,0,0,0,29-06-25,2025-06-29,2025.0,6.0,29.0,0.0,JAK NIC WYGRAŁ. I POPRZEDNIE Z DEBILEM TEŻ WYGRAŁ.❤️🇵🇱,JAK NIC WYGRAŁ. I POPRZEDNIE Z DEBILEM TEŻ WYGRAŁ.❤️🇵🇱,,,,0,0,0,54,9,0.0,niski,41,0.61307010612114
19.0,romanaprusik,"Jasne,biore cie✌️choc nie wiem,czy jestem mila 🤔",0,0,0,0,30-06-25,2025-06-30,2025.0,6.0,30.0,0.0,"Jasne,biore cie✌️choc nie wiem,czy jestem mila 🤔","Jasne,biore cie✌️choc nie wiem,czy jestem mila 🤔",,,,0,0,0,48,7,0.0,niski,41,0.8493871212918351
7.0,krishostx,Oni mają Mózgi skręcone. 😂 na czele z koniem.,0,0,0,0,30-06-25,2025-06-30,2025.0,6.0,30.0,0.0,Oni mają Mózgi skręcone. 😂 na czele z koniem.,Oni mają Mózgi skręcone. 😂 na czele z koniem.,,,,0,0,0,45,9,0.0,niski,41,0.6045868049727726
11.0,gps65,"Poniższe postulaty popiera @NawrockiKn tak samo, jak @sikorskiradek i @trzaskowski_. Więc należy z nimi o tym rozmawiać nawet przy piwie, by rozstrzygnąć, jak je w praktyce rozumieją i jak zamierzają je wdrażać. Bo diabeł tkwi w szczegółach!",0,0,0,0,30-06-25,2025-06-30,2025.0,6.0,30.0,0.0,"Poniższe postulaty popiera tak samo, jak i . Więc należy z nimi o tym rozmawiać nawet przy piwie, by rozstrzygnąć, jak je w praktyce rozumieją i jak zamierzają je wdrażać. Bo diabeł tkwi w szczegółach!","Poniższe postulaty popiera tak samo, jak i . Więc należy z nimi o tym rozmawiać nawet przy piwie, by rozstrzygnąć, jak je w praktyce rozumieją i jak zamierzają je wdrażać. Bo diabeł tkwi w szczegółach!",@NawrockiKn|@sikorskiradek|@trzaskowski_,,,3,0,0,201,35,0.0,niski,41,0.5841409765573197
13.0,ulencja96,"Ej ale kto ci powiedział, że jestem niewierząca? ;P Miał złe informacje, od razu mówię. Chyba, że ty tak lubisz oceniać/osądzać z góry",0,0,0,0,30-06-25,2025-06-30,2025.0,6.0,30.0,0.0,"Ej ale kto ci powiedział, że jestem niewierząca? ;P Miał złe informacje, od razu mówię. Chyba, że ty tak lubisz oceniać/osądzać z góry","Ej ale kto ci powiedział, że jestem niewierząca? ;P Miał złe informacje, od razu mówię. Chyba, że ty tak lubisz oceniać/osądzać z góry",,,,0,0,0,134,23,0.0,niski,41,0.7493154873661162
28.0,dzenjay,Cmoknę Cię z miłością jak przelicza i się okaże że jeszcze bardziej przejebał.,0,0,0,0,30-06-25,2025-06-30,2025.0,6.0,30.0,0.0,Cmoknę Cię z miłością jak przelicza i się okaże że jeszcze bardziej przejebał.,Cmoknę Cię z miłością jak przelicza i się okaże że jeszcze bardziej przejebał.,,,,0,0,0,78,13,0.0,niski,41,0.6203923715431838
451.0,piotreknowaak82,Będziesz siedzieć. Już w tym roku. Koniec waszej Mafii.,0,2,0,2,30-05-25,2025-05-30,2025.0,5.0,30.0,0.0,Będziesz siedzieć. Już w tym roku. Koniec waszej Mafii.,Będziesz siedzieć. Już w tym roku. Koniec waszej Mafii.,,,,0,0,0,55,9,2.0,wysoki,41,0.682489423428491
15.0,ten_psycholog,A mógłbyś mi nakreślić kontekst? Cos mnie chyba ominęło 😉,0,0,0,0,01-07-25,2025-07-01,2025.0,7.0,1.0,0.0,A mógłbyś mi nakreślić kontekst? Cos mnie chyba ominęło 😉,A mógłbyś mi nakreślić kontekst? Cos mnie chyba ominęło 😉,,,,0,0,0,57,10,0.0,niski,41,0.8607514156609377
14.0,gt__h2,"W tym wypadku tak, a ty nie ?",0,0,0,0,01-07-25,2025-07-01,2025.0,7.0,1.0,0.0,"W tym wypadku tak, a ty nie ?","W tym wypadku tak, a ty nie ?",,,,0,0,0,29,8,0.0,niski,41,1.0
