id,username,text,likes,retweets,replies,total_interactions,post_date_iso,date,year,month,day,hour,text_clean,text_no_links,mentions,hashtags,urls,n_mentions,n_hashtags,n_urls,char_count,word_count,amplification_ratio,reach_tier,cluster,cluster_prob
37.0,bapanbkv,"“My Poland is a Poland where instead of immigrant (Muslim) integration centers, there are deportation centers for those who want to destroy our country!” -- Karol Nawroki, President, Poland 🇵🇱 The Muslim population in Poland is very small, less than 0.1% of the total population. There has not been a single terrorist attack in the European country of Poland, while there have been many in countries such as France, Germany, England, Italy, Belgium, Switzerland, etc.",0,0,0,0,,,,,,,"“My Poland is a Poland where instead of immigrant (Muslim) integration centers, there are deportation centers for those who want to destroy our country!” -- Karol Nawroki, President, Poland 🇵🇱 The Muslim population in Poland is very small, less than 0.1% of the total population. There has not been a single terrorist attack in the European country of Poland, while there have been many in countries such as France, Germany, England, Italy, Belgium, Switzerland, etc.","“My Poland is a Poland where instead of immigrant (Muslim) integration centers, there are deportation centers for those who want to destroy our country!” -- Karol Nawroki, President, Poland 🇵🇱 The Muslim population in Poland is very small, less than 0.1% of the total population. There has not been a single terrorist attack in the European country of Poland, while there have been many in countries such as France, Germany, England, Italy, Belgium, Switzerland, etc.",,,,0,0,0,467,75,0.0,niski,24,1.0
1.0,hwlinvest,Polens nya president Nawrocki sätter tonen: ”I Polen skyddar man landet - inte de som vill förstöra det. Integrationscenter byts mot utvisningscenter.” Ett exempel på hur det ser ut när ett land leds av någon som faktiskt älskar sitt folk.,0,8,2,10,"Jun 2, 2025 · 6:41 PM UTC",,,,,,Polens nya president Nawrocki sätter tonen: ”I Polen skyddar man landet - inte de som vill förstöra det. Integrationscenter byts mot utvisningscenter.” Ett exempel på hur det ser ut när ett land leds av någon som faktiskt älskar sitt folk.,Polens nya president Nawrocki sätter tonen: ”I Polen skyddar man landet - inte de som vill förstöra det. Integrationscenter byts mot utvisningscenter.” Ett exempel på hur det ser ut när ett land leds av någon som faktiskt älskar sitt folk.,,,,0,0,0,239,40,4.0,średni,24,1.0
2.0,updatenews724,"Poland’s new President Karol Nawrocki: ""My Poland is a Poland without illegal migrants! A Poland with deportation centers for those who want to destroy our safety!""",51,955,111,1117,"Jun 2, 2025 · 2:43 PM UTC",,,,,,"Poland’s new President Karol Nawrocki: ""My Poland is a Poland without illegal migrants! A Poland with deportation centers for those who want to destroy our safety!""","Poland’s new President Karol Nawrocki: ""My Poland is a Poland without illegal migrants! A Poland with deportation centers for those who want to destroy our safety!""",,,,0,0,0,164,26,8.6,wysoki,24,1.0
7.0,trump_fact_news,"Le président polonais Nawrocki : « Ma Pologne est une Pologne où, au lieu de centres d’intégration pour migrants, il y a des centres de déportation pour ceux qui veulent détruire notre pays ! » La Pologne est entre de bonnes mains.",6,171,7,184,"Jun 2, 2025 · 5:33 PM UTC",,,,,,"Le président polonais Nawrocki : « Ma Pologne est une Pologne où, au lieu de centres d’intégration pour migrants, il y a des centres de déportation pour ceux qui veulent détruire notre pays ! » La Pologne est entre de bonnes mains.","Le président polonais Nawrocki : « Ma Pologne est une Pologne où, au lieu de centres d’intégration pour migrants, il y a des centres de déportation pour ceux qui veulent détruire notre pays ! » La Pologne est entre de bonnes mains.",,,,0,0,0,231,42,24.43,wysoki,24,1.0
11.0,eduardomenoni,"| El presidente electo de Polonia, Karol Nawrocki, dice: “Mi Polonia es una Polonia sin inmigrantes ilegales. Es una Polonia donde en lugar de centros de integración hay centros de deportación para aquellos que quieren destruir nuestra seguridad”.",52,2048,102,2202,"Jun 2, 2025 · 12:48 AM UTC",,,,,,"| El presidente electo de Polonia, Karol Nawrocki, dice: “Mi Polonia es una Polonia sin inmigrantes ilegales. Es una Polonia donde en lugar de centros de integración hay centros de deportación para aquellos que quieren destruir nuestra seguridad”.","| El presidente electo de Polonia, Karol Nawrocki, dice: “Mi Polonia es una Polonia sin inmigrantes ilegales. Es una Polonia donde en lugar de centros de integración hay centros de deportación para aquellos que quieren destruir nuestra seguridad”.",,,,0,0,0,247,38,20.08,wysoki,24,1.0
26.0,jimfergusonuk,"BREAKING: President Nawrocki: “In my Poland, we don’t build migrant integration centres — we build deportation centres for those who threaten our nation.” Poland has chosen strength. Poland is in safe hands. @NawrockiKn",11,263,26,300,"Jun 2, 2025 · 5:17 PM UTC",,,,,,"BREAKING: President Nawrocki: “In my Poland, we don’t build migrant integration centres — we build deportation centres for those who threaten our nation.” Poland has chosen strength. Poland is in safe hands.","BREAKING: President Nawrocki: “In my Poland, we don’t build migrant integration centres — we build deportation centres for those who threaten our nation.” Poland has chosen strength. Poland is in safe hands.",@NawrockiKn,,,1,0,0,207,32,10.12,wysoki,24,1.0
29.0,inevitablewest,"Polish President Nawrocki: ""My Poland is a Poland where instead of migrant integration centres, there’s deportation centres for those who want to destroy our country!"" Poland is in safe hands.",83,2199,213,2495,"Jun 2, 2025 · 5:05 PM UTC",,,,,,"Polish President Nawrocki: ""My Poland is a Poland where instead of migrant integration centres, there’s deportation centres for those who want to destroy our country!"" Poland is in safe hands.","Polish President Nawrocki: ""My Poland is a Poland where instead of migrant integration centres, there’s deportation centres for those who want to destroy our country!"" Poland is in safe hands.",,,,0,0,0,192,30,10.32,wysoki,24,1.0
37.0,trad_west_,"“We cannot remove crosses from Polish offices.” - Karol Nawrocki, Poland’s new president",4,221,19,244,"Jun 2, 2025 · 12:15 PM UTC",,,,,,"“We cannot remove crosses from Polish offices.” - Karol Nawrocki, Poland’s new president","“We cannot remove crosses from Polish offices.” - Karol Nawrocki, Poland’s new president",,,,0,0,0,88,13,11.63,wysoki,24,1.0
23.0,rafaelfontana,"O presidente eleito da Polônia, Karol Nawrocki, aliado de Trump, se comprometeu a deportar os imigrantes ilegais do país. A população o apoiou. Os poloneses avaliam que as deportações trarão mais segurança às cidades.",14,903,20,937,"Jun 2, 2025 · 1:40 PM UTC",,,,,,"O presidente eleito da Polônia, Karol Nawrocki, aliado de Trump, se comprometeu a deportar os imigrantes ilegais do país. A população o apoiou. Os poloneses avaliam que as deportações trarão mais segurança às cidades.","O presidente eleito da Polônia, Karol Nawrocki, aliado de Trump, se comprometeu a deportar os imigrantes ilegais do país. A população o apoiou. Os poloneses avaliam que as deportações trarão mais segurança às cidades.",,,,0,0,0,217,34,45.15,wysoki,24,0.8798364153362666
72.0,psyguy007,"Karol Nawrocki a déclaré : « Ma Pologne est une Pologne sans migrants illégaux. C'est une Pologne où, au lieu de centres d'intégration, il y a des centres de déportation pour ceux qui veulent détruire notre sécurité. » Êtes-vous d’accord avec lui ? A. OUI B. NON",40,595,535,1170,"Jun 2, 2025 · 2:32 PM UTC",,,,,,"Karol Nawrocki a déclaré : « Ma Pologne est une Pologne sans migrants illégaux. C'est une Pologne où, au lieu de centres d'intégration, il y a des centres de déportation pour ceux qui veulent détruire notre sécurité. » Êtes-vous d’accord avec lui ? A. OUI B. NON","Karol Nawrocki a déclaré : « Ma Pologne est une Pologne sans migrants illégaux. C'est une Pologne où, au lieu de centres d'intégration, il y a des centres de déportation pour ceux qui veulent détruire notre sécurité. » Êtes-vous d’accord avec lui ? A. OUI B. NON",,,,0,0,0,262,47,1.11,wysoki,24,1.0
74.0,visegrad24,"My Poland is a Poland without illegal migrants. It is a Poland where instead of integration centers, there are deportation centers for those who want to destroy our safety, President-elect Karol Nawrocki",154,3758,434,4346,"Jun 1, 2025 · 10:57 PM UTC",,,,,,"My Poland is a Poland without illegal migrants. It is a Poland where instead of integration centers, there are deportation centers for those who want to destroy our safety, President-elect Karol Nawrocki","My Poland is a Poland without illegal migrants. It is a Poland where instead of integration centers, there are deportation centers for those who want to destroy our safety, President-elect Karol Nawrocki",,,,0,0,0,203,32,8.66,wysoki,24,1.0
31.0,daboooomb,"I Polen finns det män med pungkulor. Mitt Polen är ett Polen utan illegala migranter. Det är ett Polen där det, istället för integrationscenter, finns deportationscenter för dem som vill förstöra vår trygghet. President-elect Karol Nawrocki",3,25,4,32,"Jun 2, 2025 · 5:09 PM UTC",,,,,,"I Polen finns det män med pungkulor. Mitt Polen är ett Polen utan illegala migranter. Det är ett Polen där det, istället för integrationscenter, finns deportationscenter för dem som vill förstöra vår trygghet. President-elect Karol Nawrocki","I Polen finns det män med pungkulor. Mitt Polen är ett Polen utan illegala migranter. Det är ett Polen där det, istället för integrationscenter, finns deportationscenter för dem som vill förstöra vår trygghet. President-elect Karol Nawrocki",,,,0,0,0,240,36,6.25,średni,24,1.0
73.0,sachinettiyil,"“We cannot remove crosses from Polish offices.” Karol Nawrocki, Poland’s new president",36,1311,109,1456,"Jun 2, 2025 · 1:49 AM UTC",,,,,,"“We cannot remove crosses from Polish offices.” Karol Nawrocki, Poland’s new president","“We cannot remove crosses from Polish offices.” Karol Nawrocki, Poland’s new president",,,,0,0,0,86,12,12.03,wysoki,24,1.0
88.0,tgtarnogorski,"Karol Nawrocki: Moja Polska to Polska bez nielegalnych migrantów. To Polska, w której zamiast ośrodków integracji są ośrodki deportacji dla tych, którzy chcą zniszczyć nasze bezpieczeństwo.",4,177,25,206,"Jun 2, 2025 · 3:10 PM UTC",,,,,,"Karol Nawrocki: Moja Polska to Polska bez nielegalnych migrantów. To Polska, w której zamiast ośrodków integracji są ośrodki deportacji dla tych, którzy chcą zniszczyć nasze bezpieczeństwo.","Karol Nawrocki: Moja Polska to Polska bez nielegalnych migrantów. To Polska, w której zamiast ośrodków integracji są ośrodki deportacji dla tych, którzy chcą zniszczyć nasze bezpieczeństwo.",,,,0,0,0,189,26,7.08,wysoki,24,1.0
94.0,nikitheblogger,"Mega-Statement des neuen Präsidenten von Polen Nawrocki: Mein Polen ist ein Polen ohne illegale Migranten! Es ist ein Polen, in dem es statt Integrationszentren Abschiebezentren für diejenigen gibt, die unsere Sicherheit zerstören wollen! Nun: Ich würde sagen da hat der richtige Mann gewonnen, oder?",11,407,65,483,"Jun 2, 2025 · 11:03 AM UTC",,,,,,"Mega-Statement des neuen Präsidenten von Polen Nawrocki: Mein Polen ist ein Polen ohne illegale Migranten! Es ist ein Polen, in dem es statt Integrationszentren Abschiebezentren für diejenigen gibt, die unsere Sicherheit zerstören wollen! Nun: Ich würde sagen da hat der richtige Mann gewonnen, oder?","Mega-Statement des neuen Präsidenten von Polen Nawrocki: Mein Polen ist ein Polen ohne illegale Migranten! Es ist ein Polen, in dem es statt Integrationszentren Abschiebezentren für diejenigen gibt, die unsere Sicherheit zerstören wollen! Nun: Ich würde sagen da hat der richtige Mann gewonnen, oder?",,,,0,0,0,300,44,6.26,wysoki,24,1.0
150.0,adammoczar,"Karol Nawrocki: ""My Poland is a Poland where instead of migrant integration centres, there’s deportation centres for those who want to destroy our country!""",0,3,0,3,"Jun 2, 2025 · 7:13 PM UTC",,,,,,"Karol Nawrocki: ""My Poland is a Poland where instead of migrant integration centres, there’s deportation centres for those who want to destroy our country!""","Karol Nawrocki: ""My Poland is a Poland where instead of migrant integration centres, there’s deportation centres for those who want to destroy our country!""",,,,0,0,0,156,24,3.0,średni,24,1.0
515.0,thebritlad,"Poland’s new President Karol Nawrocki: ""My Poland is a Poland without illegal migrants! A Poland with deportation centers for those who want to destroy our safety!"" Polands new president has just officially said FAFO.",7,134,29,170,"Jun 2, 2025 · 4:32 PM UTC",,,,,,"Poland’s new President Karol Nawrocki: ""My Poland is a Poland without illegal migrants! A Poland with deportation centers for those who want to destroy our safety!"" Polands new president has just officially said FAFO.","Poland’s new President Karol Nawrocki: ""My Poland is a Poland without illegal migrants! A Poland with deportation centers for those who want to destroy our safety!"" Polands new president has just officially said FAFO.",,,,0,0,0,217,34,4.62,wysoki,24,1.0
620.0,brankogrimsx1,"""Moja Poljska je Poljska brez ilegalnih migrantov. Je Poljska kjer so namesto centrov za integracijo centri za deportacijo vseh, ki želijo uničiti našo varnost!"" ""Ne bomo odstranili križev iz uradov Republike Poljske."" Karol Nawrocki Danes se stvari v Evropi spreminjajo v najbolj pozitivni možni smeri. Make Europe Great Again! Iskrene čestitke Predsedniku Republike Poljske Karolu Nawrockemu in Republiki Poljski! @NawrockiKn @pisorgpl Bog Vas živi!",2,52,4,58,"Jun 2, 2025 · 12:16 PM UTC",,,,,,"""Moja Poljska je Poljska brez ilegalnih migrantov. Je Poljska kjer so namesto centrov za integracijo centri za deportacijo vseh, ki želijo uničiti našo varnost!"" ""Ne bomo odstranili križev iz uradov Republike Poljske."" Karol Nawrocki Danes se stvari v Evropi spreminjajo v najbolj pozitivni možni smeri. Make Europe Great Again! Iskrene čestitke Predsedniku Republike Poljske Karolu Nawrockemu in Republiki Poljski! Bog Vas živi!","""Moja Poljska je Poljska brez ilegalnih migrantov. Je Poljska kjer so namesto centrov za integracijo centri za deportacijo vseh, ki želijo uničiti našo varnost!"" ""Ne bomo odstranili križev iz uradov Republike Poljske."" Karol Nawrocki Danes se stvari v Evropi spreminjajo v najbolj pozitivni možni smeri. Make Europe Great Again! Iskrene čestitke Predsedniku Republike Poljske Karolu Nawrockemu in Republiki Poljski! Bog Vas živi!",@NawrockiKn|@pisorgpl,,,2,0,0,429,62,13.0,wysoki,24,1.0
736.0,jackposobiec,"Karol Nawrocki: ""My Poland is a Poland without illegal migrants. It is a Poland where instead of integration centers, there are deportation centers for those who want to destroy our safety”",49,1284,98,1431,"Apr 28, 2025 · 12:07 PM UTC",,,,,,"Karol Nawrocki: ""My Poland is a Poland without illegal migrants. It is a Poland where instead of integration centers, there are deportation centers for those who want to destroy our safety”","Karol Nawrocki: ""My Poland is a Poland without illegal migrants. It is a Poland where instead of integration centers, there are deportation centers for those who want to destroy our safety”",,,,0,0,0,189,31,13.1,wysoki,24,1.0
770.0,jcm62mjc,"Le président polonais Nawrocki : « Ma Pologne est une Pologne où, au lieu de centres d’intégration pour migrants, il y a des centres d’expulsion pour ceux qui veulent détruire notre pays ! » La Pologne est entre de bonnes mains.",0,0,0,0,"Jun 2, 2025 · 7:29 PM UTC",,,,,,"Le président polonais Nawrocki : « Ma Pologne est une Pologne où, au lieu de centres d’intégration pour migrants, il y a des centres d’expulsion pour ceux qui veulent détruire notre pays ! » La Pologne est entre de bonnes mains.","Le président polonais Nawrocki : « Ma Pologne est une Pologne où, au lieu de centres d’intégration pour migrants, il y a des centres d’expulsion pour ceux qui veulent détruire notre pays ! » La Pologne est entre de bonnes mains.",,,,0,0,0,228,41,0.0,niski,24,1.0
24.0,camille_moscow,"Le président polonais Nawrocki : « Ma Pologne est une Pologne où, au lieu de centres d’intégration pour migrants, il y aura des centres d’expulsion pour ceux qui veulent détruire notre pays ! » Le nouveau président polonais Nawrocki parle clair. Pendant que l’UE impose ses quotas migratoires et ses leçons de morale, la Pologne trace sa propre route : une nation, un peuple, une sécurité. Varsovie a choisi la souveraineté.",10,343,22,375,"Jun 2, 2025 · 9:29 PM UTC",,,,,,"Le président polonais Nawrocki : « Ma Pologne est une Pologne où, au lieu de centres d’intégration pour migrants, il y aura des centres d’expulsion pour ceux qui veulent détruire notre pays ! » Le nouveau président polonais Nawrocki parle clair. Pendant que l’UE impose ses quotas migratoires et ses leçons de morale, la Pologne trace sa propre route : une nation, un peuple, une sécurité. Varsovie a choisi la souveraineté.","Le président polonais Nawrocki : « Ma Pologne est une Pologne où, au lieu de centres d’intégration pour migrants, il y aura des centres d’expulsion pour ceux qui veulent détruire notre pays ! » Le nouveau président polonais Nawrocki parle clair. Pendant que l’UE impose ses quotas migratoires et ses leçons de morale, la Pologne trace sa propre route : une nation, un peuple, une sécurité. Varsovie a choisi la souveraineté.",,,,0,0,0,424,71,15.59,wysoki,24,1.0
42.0,deutscherschfe3,"Der polnische Präsident Nawrocki: „Mein Polen ist ein Polen, in dem es statt Integrationszentren für Migranten Abschiebezentren für diejenigen gibt, die unser Land zerstören wollen!"" Karol ist ein Schatz.",0,11,3,14,"Jun 3, 2025 · 6:35 AM UTC",,,,,,"Der polnische Präsident Nawrocki: „Mein Polen ist ein Polen, in dem es statt Integrationszentren für Migranten Abschiebezentren für diejenigen gibt, die unser Land zerstören wollen!"" Karol ist ein Schatz.","Der polnische Präsident Nawrocki: „Mein Polen ist ein Polen, in dem es statt Integrationszentren für Migranten Abschiebezentren für diejenigen gibt, die unser Land zerstören wollen!"" Karol ist ein Schatz.",,,,0,0,0,204,29,3.67,średni,24,1.0
80.0,georg_pazderski,"Der polnische Präsident Karol Nawrocki gibt die Richtung vor: „Mein Polen ist ein Polen ohne illegale Einwanderer. Es ist ein Polen, in dem es statt Integrationszentren Abschiebezentren für diejenigen gibt, die unsere Sicherheit zerstören wollen.“",12,461,79,552,"Jun 2, 2025 · 7:56 PM UTC",,,,,,"Der polnische Präsident Karol Nawrocki gibt die Richtung vor: „Mein Polen ist ein Polen ohne illegale Einwanderer. Es ist ein Polen, in dem es statt Integrationszentren Abschiebezentren für diejenigen gibt, die unsere Sicherheit zerstören wollen.“","Der polnische Präsident Karol Nawrocki gibt die Richtung vor: „Mein Polen ist ein Polen ohne illegale Einwanderer. Es ist ein Polen, in dem es statt Integrationszentren Abschiebezentren für diejenigen gibt, die unsere Sicherheit zerstören wollen.“",,,,0,0,0,247,35,5.84,wysoki,24,1.0
140.0,jcharrasqueado_,"“No podemos retirar las cruces de las oficinas polacas”. - Karol Nawrocki, nuevo presidente de Polonia",0,23,0,23,"Jun 2, 2025 · 11:46 PM UTC",,,,,,"“No podemos retirar las cruces de las oficinas polacas”. - Karol Nawrocki, nuevo presidente de Polonia","“No podemos retirar las cruces de las oficinas polacas”. - Karol Nawrocki, nuevo presidente de Polonia",,,,0,0,0,102,16,23.0,średni,24,1.0
454.0,anneke172351868,"Polen staat op het punt om zich terug te trekken uit het EU-migratiepact en terecht. Dit is niet zomaar een impulsieve zet, maar een logische stap na de overwinning van nationalist Karol Nawrocki. Het migratiebeleid van de EU faalt compleet: het dwingt landen als Polen om migranten te accepteren waar ze dat niet willen, en dat leidt tot chaos en verdeeldheid. En Polen staat hierin niet alleen. Hongarije, Tsjechië en Slowakije staan al jarenlang pal tegen deze verplichte migratiequota. Zij kiezen voor nationale soevereiniteit en strengere grenscontroles. Het wordt tijd dat de EU dit ook erkent. Dit is een signaal: landen pakken hun eigen belangen weer serieus en zeggen ‘nee’ tegen de EU bemoeienis die niet werkt. Europa staat op een keerpunt en Polen laat zien hoe het moet.",4,158,28,190,"Jun 2, 2025 · 9:03 AM UTC",,,,,,"Polen staat op het punt om zich terug te trekken uit het EU-migratiepact en terecht. Dit is niet zomaar een impulsieve zet, maar een logische stap na de overwinning van nationalist Karol Nawrocki. Het migratiebeleid van de EU faalt compleet: het dwingt landen als Polen om migranten te accepteren waar ze dat niet willen, en dat leidt tot chaos en verdeeldheid. En Polen staat hierin niet alleen. Hongarije, Tsjechië en Slowakije staan al jarenlang pal tegen deze verplichte migratiequota. Zij kiezen voor nationale soevereiniteit en strengere grenscontroles. Het wordt tijd dat de EU dit ook erkent. Dit is een signaal: landen pakken hun eigen belangen weer serieus en zeggen ‘nee’ tegen de EU bemoeienis die niet werkt. Europa staat op een keerpunt en Polen laat zien hoe het moet.","Polen staat op het punt om zich terug te trekken uit het EU-migratiepact en terecht. Dit is niet zomaar een impulsieve zet, maar een logische stap na de overwinning van nationalist Karol Nawrocki. Het migratiebeleid van de EU faalt compleet: het dwingt landen als Polen om migranten te accepteren waar ze dat niet willen, en dat leidt tot chaos en verdeeldheid. En Polen staat hierin niet alleen. Hongarije, Tsjechië en Slowakije staan al jarenlang pal tegen deze verplichte migratiequota. Zij kiezen voor nationale soevereiniteit en strengere grenscontroles. Het wordt tijd dat de EU dit ook erkent. Dit is een signaal: landen pakken hun eigen belangen weer serieus en zeggen ‘nee’ tegen de EU bemoeienis die niet werkt. Europa staat op een keerpunt en Polen laat zien hoe het moet.",,,,0,0,0,783,129,5.64,wysoki,24,0.92016164568931
517.0,lereveildatlas,"FLASH : La Pologne va désormais se retirer du pacte migratoire de l'UE suite à l'élection du nouveau président nationaliste Karol Nawrocki. C'était le fer de lance de sa campagne. Cette élection marque un tournant eurosceptique majeur, suscitant des inquiétudes sur l'unité de l'UE.",3,122,4,129,"Jun 2, 2025 · 5:57 PM UTC",,,,,,"FLASH : La Pologne va désormais se retirer du pacte migratoire de l'UE suite à l'élection du nouveau président nationaliste Karol Nawrocki. C'était le fer de lance de sa campagne. Cette élection marque un tournant eurosceptique majeur, suscitant des inquiétudes sur l'unité de l'UE.","FLASH : La Pologne va désormais se retirer du pacte migratoire de l'UE suite à l'élection du nouveau président nationaliste Karol Nawrocki. C'était le fer de lance de sa campagne. Cette élection marque un tournant eurosceptique majeur, suscitant des inquiétudes sur l'unité de l'UE.",,,,0,0,0,282,44,30.5,wysoki,24,0.8455636860386345
762.0,ad_vitam44_,"« Ma Pologne, c’est une Pologne sans immigration illégale. Ce n’est pas de centres d’intégration que nous avons besoin, mais de centres de déportation pour ceux qui menacent notre sécurité. » Karol Nawrocki Nous devons faire la même chose en France, partout en Europe , et maintenant……….. 🤍",2,45,8,55,"Jun 3, 2025 · 5:17 AM UTC",,,,,,"« Ma Pologne, c’est une Pologne sans immigration illégale. Ce n’est pas de centres d’intégration que nous avons besoin, mais de centres de déportation pour ceux qui menacent notre sécurité. » Karol Nawrocki Nous devons faire la même chose en France, partout en Europe , et maintenant……….. 🤍","« Ma Pologne, c’est une Pologne sans immigration illégale. Ce n’est pas de centres d’intégration que nous avons besoin, mais de centres de déportation pour ceux qui menacent notre sécurité. » Karol Nawrocki Nous devons faire la même chose en France, partout en Europe , et maintenant……….. 🤍",,,,0,0,0,290,48,5.62,wysoki,24,1.0
906.0,rudibernik,"""Moja Poljska je Poljska brez ilegalnih migrantov. "" Novoizvoljeni predsednik Karol Nawrocki",2,35,5,42,"Jun 2, 2025 · 7:21 AM UTC",,,,,,"""Moja Poljska je Poljska brez ilegalnih migrantov. "" Novoizvoljeni predsednik Karol Nawrocki","""Moja Poljska je Poljska brez ilegalnih migrantov. "" Novoizvoljeni predsednik Karol Nawrocki",,,,0,0,0,92,12,7.0,wysoki,24,1.0
24.0,forzanimes1203,"Selon le nouveau président Karol Nawrocki de la Pologne : Zéro migration illégale équivaut à zéro attaque terroriste. Simple comme ""bonjour"" sauf macron qui ne l'a toujours pas compris #PolandElection",0,0,0,0,"Jun 3, 2025 · 8:01 AM UTC",,,,,,"Selon le nouveau président Karol Nawrocki de la Pologne : Zéro migration illégale équivaut à zéro attaque terroriste. Simple comme ""bonjour"" sauf macron qui ne l'a toujours pas compris PolandElection","Selon le nouveau président Karol Nawrocki de la Pologne : Zéro migration illégale équivaut à zéro attaque terroriste. Simple comme ""bonjour"" sauf macron qui ne l'a toujours pas compris",,#PolandElection,,0,1,0,199,30,0.0,niski,24,1.0
