id,username,text,likes,retweets,replies,total_interactions,post_date_iso,date,year,month,day,hour,text_clean,text_no_links,mentions,hashtags,urls,n_mentions,n_hashtags,n_urls,char_count,word_count,amplification_ratio,reach_tier,cluster,cluster_prob
245.0,eckleben,"Der neue, konservative Präsident Karol Nawrocki in Polen will Familien stärker entlasten. Am Donnerstag unterzeichnete er einen Gesetzentwurf, der Eltern mit zwei oder mehr Kindern von der Einkommensteuer auf Jahreseinkommen von bis zu 140.000 Złoty (rund 33.000 US-Euro) pro Elternteil befreien soll. Die Regelung soll für Eltern gelten, die minderjährige Kinder, Kinder mit Behinderungen oder Studierende bis zum Alter von 25 Jahren versorgen. Link in der ersten Antwort",3,33,9,45,11-08-25,2025-08-11,2025.0,8.0,11.0,0.0,"Der neue, konservative Präsident Karol Nawrocki in Polen will Familien stärker entlasten. Am Donnerstag unterzeichnete er einen Gesetzentwurf, der Eltern mit zwei oder mehr Kindern von der Einkommensteuer auf Jahreseinkommen von bis zu 140.000 Złoty (rund 33.000 US-Euro) pro Elternteil befreien soll. Die Regelung soll für Eltern gelten, die minderjährige Kinder, Kinder mit Behinderungen oder Studierende bis zum Alter von 25 Jahren versorgen. Link in der ersten Antwort","Der neue, konservative Präsident Karol Nawrocki in Polen will Familien stärker entlasten. Am Donnerstag unterzeichnete er einen Gesetzentwurf, der Eltern mit zwei oder mehr Kindern von der Einkommensteuer auf Jahreseinkommen von bis zu 140.000 Złoty (rund 33.000 US-Euro) pro Elternteil befreien soll. Die Regelung soll für Eltern gelten, die minderjährige Kinder, Kinder mit Behinderungen oder Studierende bis zum Alter von 25 Jahren versorgen. Link in der ersten Antwort",,,,0,0,0,472,68,3.67,wysoki,4,1.0
158.0,kresypl,Prezydent Karol Nawrocki proponuje podniesienie progu podatkowego i wprowadzenie zerowego PIT-u dla rodziców z dwójką dzieci. Projekt nowelizacji ustawy o PIT przewiduje także zmiany w CIT i VAT. kresy.pl/wydarzenia/zerowy-p…,0,0,0,0,12-08-25,2025-08-12,2025.0,8.0,12.0,0.0,Prezydent Karol Nawrocki proponuje podniesienie progu podatkowego i wprowadzenie zerowego PIT-u dla rodziców z dwójką dzieci. Projekt nowelizacji ustawy o PIT przewiduje także zmiany w CIT i VAT.,Prezydent Karol Nawrocki proponuje podniesienie progu podatkowego i wprowadzenie zerowego PIT-u dla rodziców z dwójką dzieci. Projekt nowelizacji ustawy o PIT przewiduje także zmiany w CIT i VAT.,,,kresy.pl/wydarzenia/zerowy-p…,0,0,1,195,28,0.0,niski,4,1.0
9.0,rpasnicki,"Widzę ekscytację projektem tzw. podatku kościelnego. Nie ma co bić piany, ponieważ nie jest to w interesie KK, więc Nawrocki takiej ustawy nie podpisze. A może nawet odeśle ją do tzw. TK, aby ten orzekł, iż taki podatek jest absolutnie niezgodny z Konstytucją i nawet konkordatem.",1,21,11,33,13-08-25,2025-08-13,2025.0,8.0,13.0,0.0,"Widzę ekscytację projektem tzw. podatku kościelnego. Nie ma co bić piany, ponieważ nie jest to w interesie KK, więc Nawrocki takiej ustawy nie podpisze. A może nawet odeśle ją do tzw. TK, aby ten orzekł, iż taki podatek jest absolutnie niezgodny z Konstytucją i nawet konkordatem.","Widzę ekscytację projektem tzw. podatku kościelnego. Nie ma co bić piany, ponieważ nie jest to w interesie KK, więc Nawrocki takiej ustawy nie podpisze. A może nawet odeśle ją do tzw. TK, aby ten orzekł, iż taki podatek jest absolutnie niezgodny z Konstytucją i nawet konkordatem.",,,,0,0,0,280,46,1.91,średni,4,1.0
12.0,laszloan,"President Nawrocki of 🇵🇱Poland has just announced that he would like to exempt the first €66,000 earned by a married couple from income tax if they have at least two children. More countries should follow the lead of 🇭🇺Hungary in promoting pro-family policies. We do not need to import migrants to deal with the issue of birth rates in Europe. We simply need to incentivize parenthood. Having children should not be a financial disadvantage compared to couples without children!",2,21,3,26,11-08-25,2025-08-11,2025.0,8.0,11.0,0.0,"President Nawrocki of 🇵🇱Poland has just announced that he would like to exempt the first €66,000 earned by a married couple from income tax if they have at least two children. More countries should follow the lead of 🇭🇺Hungary in promoting pro-family policies. We do not need to import migrants to deal with the issue of birth rates in Europe. We simply need to incentivize parenthood. Having children should not be a financial disadvantage compared to couples without children!","President Nawrocki of 🇵🇱Poland has just announced that he would like to exempt the first €66,000 earned by a married couple from income tax if they have at least two children. More countries should follow the lead of 🇭🇺Hungary in promoting pro-family policies. We do not need to import migrants to deal with the issue of birth rates in Europe. We simply need to incentivize parenthood. Having children should not be a financial disadvantage compared to couples without children!",,,,0,0,0,478,79,7.0,średni,4,1.0
157.0,axaroman,Zawetuje Nawrocki CIT dla banków jeśli Domański wprowadzi to USTAWĄ. A jeśli rozporządzeniem MF? Jaki jest proces legislacji dla tego rodzaju podatku?,0,0,0,0,22-08-25,2025-08-22,2025.0,8.0,22.0,0.0,Zawetuje Nawrocki CIT dla banków jeśli Domański wprowadzi to USTAWĄ. A jeśli rozporządzeniem MF? Jaki jest proces legislacji dla tego rodzaju podatku?,Zawetuje Nawrocki CIT dla banków jeśli Domański wprowadzi to USTAWĄ. A jeśli rozporządzeniem MF? Jaki jest proces legislacji dla tego rodzaju podatku?,,,,0,0,0,150,22,0.0,niski,4,1.0
19.0,konfederacja_,"Szef kancelarii Prezydenta Nawrockiego zapowiedział, że ten ZAWETUJE proponowane przez rząd Tuska podwyżki podatku cukrowego oraz akcyzy na alkohol! To efekt zobowiązania, jakie Karol Nawrocki podpisał w tzw. deklaracji toruńskiej w rozmowie ze Sławomirem Mentzenem! „Nie podpiszę żadnej ustawy, która podnosi Polakom istniejące podatki, składki i opłaty lub wprowadza nowe obciążenia fiskalne dla Polaków” - tak brzmiał pierwszy punkt deklaracji. Dzięki @SlawomirMentzen i tej deklaracji po raz pierwszy w historii III RP jest szansa, by któryś z prezydentów zablokował próby podnoszenia Polakom podatków. Będziemy trzymać prezydenta za słowo!",3,35,74,112,24-08-25,2025-08-24,2025.0,8.0,24.0,0.0,"Szef kancelarii Prezydenta Nawrockiego zapowiedział, że ten ZAWETUJE proponowane przez rząd Tuska podwyżki podatku cukrowego oraz akcyzy na alkohol! To efekt zobowiązania, jakie Karol Nawrocki podpisał w tzw. deklaracji toruńskiej w rozmowie ze Sławomirem Mentzenem! „Nie podpiszę żadnej ustawy, która podnosi Polakom istniejące podatki, składki i opłaty lub wprowadza nowe obciążenia fiskalne dla Polaków” - tak brzmiał pierwszy punkt deklaracji. Dzięki i tej deklaracji po raz pierwszy w historii III RP jest szansa, by któryś z prezydentów zablokował próby podnoszenia Polakom podatków. Będziemy trzymać prezydenta za słowo!","Szef kancelarii Prezydenta Nawrockiego zapowiedział, że ten ZAWETUJE proponowane przez rząd Tuska podwyżki podatku cukrowego oraz akcyzy na alkohol! To efekt zobowiązania, jakie Karol Nawrocki podpisał w tzw. deklaracji toruńskiej w rozmowie ze Sławomirem Mentzenem! „Nie podpiszę żadnej ustawy, która podnosi Polakom istniejące podatki, składki i opłaty lub wprowadza nowe obciążenia fiskalne dla Polaków” - tak brzmiał pierwszy punkt deklaracji. Dzięki i tej deklaracji po raz pierwszy w historii III RP jest szansa, by któryś z prezydentów zablokował próby podnoszenia Polakom podatków. Będziemy trzymać prezydenta za słowo!",@SlawomirMentzen,,,1,0,0,627,87,0.47,wysoki,4,1.0
102.0,piotr_kublicki,"Znamy to - nowe podatki ""dla naszego dobra"". Nawrocki szedł do wyborów pod hasłem sprzeciwienia się nowym obciążeniom podatkowym i tego się trzyma. Jeśli rząd jest tak zdesperowany na podatki od cukru i alkoholu to niech jednocześnie obniży ceny innych produktów.",0,0,0,0,25-08-25,2025-08-25,2025.0,8.0,25.0,0.0,"Znamy to - nowe podatki ""dla naszego dobra"". Nawrocki szedł do wyborów pod hasłem sprzeciwienia się nowym obciążeniom podatkowym i tego się trzyma. Jeśli rząd jest tak zdesperowany na podatki od cukru i alkoholu to niech jednocześnie obniży ceny innych produktów.","Znamy to - nowe podatki ""dla naszego dobra"". Nawrocki szedł do wyborów pod hasłem sprzeciwienia się nowym obciążeniom podatkowym i tego się trzyma. Jeśli rząd jest tak zdesperowany na podatki od cukru i alkoholu to niech jednocześnie obniży ceny innych produktów.",,,,0,0,0,263,41,0.0,niski,4,1.0
100.0,dorotagth,"Nawrocki chce zerowego PIT dla rodzin z dziećmi od dwójki wzwyż. Idiotyzm. Czyim koszyem? Jeszcze trochę a jedynymi, którzy będą płacili podatki będą emeryci i renciści bo przecież posłowie uchwalili sobie znacznie korzystniejsze warunki opodatkowania niż zwykłym obywatelom.",0,43,6,49,25-08-25,2025-08-25,2025.0,8.0,25.0,0.0,"Nawrocki chce zerowego PIT dla rodzin z dziećmi od dwójki wzwyż. Idiotyzm. Czyim koszyem? Jeszcze trochę a jedynymi, którzy będą płacili podatki będą emeryci i renciści bo przecież posłowie uchwalili sobie znacznie korzystniejsze warunki opodatkowania niż zwykłym obywatelom.","Nawrocki chce zerowego PIT dla rodzin z dziećmi od dwójki wzwyż. Idiotyzm. Czyim koszyem? Jeszcze trochę a jedynymi, którzy będą płacili podatki będą emeryci i renciści bo przecież posłowie uchwalili sobie znacznie korzystniejsze warunki opodatkowania niż zwykłym obywatelom.",,,,0,0,0,275,38,7.17,wysoki,4,0.9404989782620844
166.0,dorzeczy_pl,".@NawrockiKn wskazał Tuskowi jasno: Podwyższanie podatków jest rzeczą, której nie zamierzam akceptować ⬇️ dorzeczy.pl/770871",2,26,7,35,27-08-25,2025-08-27,2025.0,8.0,27.0,0.0,". wskazał Tuskowi jasno: Podwyższanie podatków jest rzeczą, której nie zamierzam akceptować ⬇️",". wskazał Tuskowi jasno: Podwyższanie podatków jest rzeczą, której nie zamierzam akceptować ⬇️",@NawrockiKn,,dorzeczy.pl/770871,1,0,1,94,13,3.71,wysoki,4,1.0
33.0,gaston1t,Nawrocki ciśnie rudego o dotrzymywanie zobowiązań wyborczych. Mnie najbardziej interesuje 60 tysięcy wolne od podatku i paliwo po pinćdziewietnaście.,0,45,8,53,27-08-25,2025-08-27,2025.0,8.0,27.0,0.0,Nawrocki ciśnie rudego o dotrzymywanie zobowiązań wyborczych. Mnie najbardziej interesuje 60 tysięcy wolne od podatku i paliwo po pinćdziewietnaście.,Nawrocki ciśnie rudego o dotrzymywanie zobowiązań wyborczych. Mnie najbardziej interesuje 60 tysięcy wolne od podatku i paliwo po pinćdziewietnaście.,,,,0,0,0,149,19,5.62,wysoki,4,0.878730883837254
140.0,nawrocki25,"Prezydent K Nawrocki do D. Tuska: Nie zgodzę się na podwyższanie podatków Polakom. Rządzący muszą pozyskać środki z uszczelnień systemu podatkowego, a nie nakładania kolejnych obciążeń na obywateli!",0,82,47,129,27-08-25,2025-08-27,2025.0,8.0,27.0,0.0,"Prezydent K Nawrocki do D. Tuska: Nie zgodzę się na podwyższanie podatków Polakom. Rządzący muszą pozyskać środki z uszczelnień systemu podatkowego, a nie nakładania kolejnych obciążeń na obywateli!","Prezydent K Nawrocki do D. Tuska: Nie zgodzę się na podwyższanie podatków Polakom. Rządzący muszą pozyskać środki z uszczelnień systemu podatkowego, a nie nakładania kolejnych obciążeń na obywateli!",,,,0,0,0,198,28,1.74,wysoki,4,1.0
1.0,kostrubieczuza1,"Chwała Tobie Prezydencie za obronę zwykłych Polaków. Prezydent Nawrocki do Tuska: Nie zgodzę się na podwyższanie podatków Polakom. Rządzący muszą pozyskać środki z uszczelnień systemu podatkowego, a nie nakładania kolejnych obciążeń na obywateli! #DrużynaNawrockiego",0,5,0,5,27-08-25,2025-08-27,2025.0,8.0,27.0,0.0,"Chwała Tobie Prezydencie za obronę zwykłych Polaków. Prezydent Nawrocki do Tuska: Nie zgodzę się na podwyższanie podatków Polakom. Rządzący muszą pozyskać środki z uszczelnień systemu podatkowego, a nie nakładania kolejnych obciążeń na obywateli! DrużynaNawrockiego","Chwała Tobie Prezydencie za obronę zwykłych Polaków. Prezydent Nawrocki do Tuska: Nie zgodzę się na podwyższanie podatków Polakom. Rządzący muszą pozyskać środki z uszczelnień systemu podatkowego, a nie nakładania kolejnych obciążeń na obywateli!",,#DrużynaNawrockiego,,0,1,0,265,34,5.0,średni,4,1.0
167.0,robertkwit5,Robert Mazurek: - Czy Pan prezydent Karol Nawrocki zawetuje każdą próbę podniesienia podatków? Minister Bogucki: - Tak. Prezydent Karol Nawrocki zawetuje każdą próbę podniesienia podatków. 😁,2,41,2,45,27-08-25,2025-08-27,2025.0,8.0,27.0,0.0,Robert Mazurek: - Czy Pan prezydent Karol Nawrocki zawetuje każdą próbę podniesienia podatków? Minister Bogucki: - Tak. Prezydent Karol Nawrocki zawetuje każdą próbę podniesienia podatków. 😁,Robert Mazurek: - Czy Pan prezydent Karol Nawrocki zawetuje każdą próbę podniesienia podatków? Minister Bogucki: - Tak. Prezydent Karol Nawrocki zawetuje każdą próbę podniesienia podatków. 😁,,,,0,0,0,190,26,20.5,wysoki,4,1.0
162.0,czcigodnapolka,"Nawrocki nie chce obciążać podatkami grupy bankowców, z których można by było finansować potrzeby społeczne, mimo że premier Tusk poinformował go o gigantycznych zyskach sektora bankowego. Komu służy Nawrocki? Dlaczego hamuje rozwój Polski?",0,26,0,26,27-08-25,2025-08-27,2025.0,8.0,27.0,0.0,"Nawrocki nie chce obciążać podatkami grupy bankowców, z których można by było finansować potrzeby społeczne, mimo że premier Tusk poinformował go o gigantycznych zyskach sektora bankowego. Komu służy Nawrocki? Dlaczego hamuje rozwój Polski?","Nawrocki nie chce obciążać podatkami grupy bankowców, z których można by było finansować potrzeby społeczne, mimo że premier Tusk poinformował go o gigantycznych zyskach sektora bankowego. Komu służy Nawrocki? Dlaczego hamuje rozwój Polski?",,,,0,0,0,240,33,26.0,średni,4,1.0
185.0,lkwarzecha,"Dla pokazania, jak inaczej działa pan prezydent Nawrocki od pana Dudy. Styczeń tego roku - pan Duda bez mrugnięcia okiem podpisuje nowelizację ustawy o podatku akcyzowym, wysadzającą w powietrze wcześniejsze ustalenia rządu PiS co do wzrostu stawek tego podatku do 2027 r.",1,22,13,36,28-08-25,2025-08-28,2025.0,8.0,28.0,0.0,"Dla pokazania, jak inaczej działa pan prezydent Nawrocki od pana Dudy. Styczeń tego roku - pan Duda bez mrugnięcia okiem podpisuje nowelizację ustawy o podatku akcyzowym, wysadzającą w powietrze wcześniejsze ustalenia rządu PiS co do wzrostu stawek tego podatku do 2027 r.","Dla pokazania, jak inaczej działa pan prezydent Nawrocki od pana Dudy. Styczeń tego roku - pan Duda bez mrugnięcia okiem podpisuje nowelizację ustawy o podatku akcyzowym, wysadzającą w powietrze wcześniejsze ustalenia rządu PiS co do wzrostu stawek tego podatku do 2027 r.",,,,0,0,0,272,42,1.69,wysoki,4,1.0
1.0,koneserunii,"❗️PILNE❗️ BRAWO Karol Nawrocki Prezydent podpisał ustawę wprowadzającą obowiązkowy Krajowy System E-Faktur! Od 1 lutego 2026 r. obejmie firmy z przychodem powyżej 200 mln zł rocznie, a od 1 kwietnia 2026 r. te z przychodem ponad 120 tys. zł. Mikrofirmy dołączą do systemu w 2027 r. Dodatkowo, termin zwrotu VAT zostanie skrócony z 60 do 40 dni!",3,104,21,128,30-08-25,2025-08-30,2025.0,8.0,30.0,0.0,"❗️PILNE❗️ BRAWO Karol Nawrocki Prezydent podpisał ustawę wprowadzającą obowiązkowy Krajowy System E-Faktur! Od 1 lutego 2026 r. obejmie firmy z przychodem powyżej 200 mln zł rocznie, a od 1 kwietnia 2026 r. te z przychodem ponad 120 tys. zł. Mikrofirmy dołączą do systemu w 2027 r. Dodatkowo, termin zwrotu VAT zostanie skrócony z 60 do 40 dni!","❗️PILNE❗️ BRAWO Karol Nawrocki Prezydent podpisał ustawę wprowadzającą obowiązkowy Krajowy System E-Faktur! Od 1 lutego 2026 r. obejmie firmy z przychodem powyżej 200 mln zł rocznie, a od 1 kwietnia 2026 r. te z przychodem ponad 120 tys. zł. Mikrofirmy dołączą do systemu w 2027 r. Dodatkowo, termin zwrotu VAT zostanie skrócony z 60 do 40 dni!",,,,0,0,0,344,57,4.95,wysoki,4,1.0
19.0,salon24pl,"Akurat tę ustawę prezydent Nawrocki podpisał. Czy polscy przedsiębiorcy są gotowi na największą od 25 lat rewolucję w fakturowaniu? #KSeF #podatki #faktura #VAT salon24.pl/newsroom/1460624,…",0,1,0,1,29-08-25,2025-08-29,2025.0,8.0,29.0,0.0,Akurat tę ustawę prezydent Nawrocki podpisał. Czy polscy przedsiębiorcy są gotowi na największą od 25 lat rewolucję w fakturowaniu? KSeF podatki faktura VAT,Akurat tę ustawę prezydent Nawrocki podpisał. Czy polscy przedsiębiorcy są gotowi na największą od 25 lat rewolucję w fakturowaniu?,,#KSeF|#podatki|#faktura|#VAT,"salon24.pl/newsroom/1460624,…",0,4,1,156,23,1.0,średni,4,1.0
113.0,mariak244927220,"Za co i na co mu tyle kasy ?za dużo rząd mu daje , a emeryci z głodu umierają , a Nawrocki z rodziną tracą nasze pieniądze z naszych podatków WSTYDU TO ONI NIE MAJĄ .Koryto im pasuje darmozjady.",0,0,0,0,09-09-25,2025-09-09,2025.0,9.0,9.0,0.0,"Za co i na co mu tyle kasy ?za dużo rząd mu daje , a emeryci z głodu umierają , a Nawrocki z rodziną tracą nasze pieniądze z naszych podatków WSTYDU TO ONI NIE MAJĄ .Koryto im pasuje darmozjady.","Za co i na co mu tyle kasy ?za dużo rząd mu daje , a emeryci z głodu umierają , a Nawrocki z rodziną tracą nasze pieniądze z naszych podatków WSTYDU TO ONI NIE MAJĄ .Koryto im pasuje darmozjady.",,,,0,0,0,194,39,0.0,niski,4,1.0
3.0,chrzanikx,"Domański mówi, że w 2026 rząd podniesie 3 podatki - bankowy, akcyzę na alkohol i opłatę cukrową i mówi, że ma nadzieję, że Nawrocki tego nie zawetuje, a no i, że podatek bankowy nie dotknie obywateli.",2,6,15,23,06-10-25,2025-10-06,2025.0,10.0,6.0,0.0,"Domański mówi, że w 2026 rząd podniesie 3 podatki - bankowy, akcyzę na alkohol i opłatę cukrową i mówi, że ma nadzieję, że Nawrocki tego nie zawetuje, a no i, że podatek bankowy nie dotknie obywateli.","Domański mówi, że w 2026 rząd podniesie 3 podatki - bankowy, akcyzę na alkohol i opłatę cukrową i mówi, że ma nadzieję, że Nawrocki tego nie zawetuje, a no i, że podatek bankowy nie dotknie obywateli.",,,,0,0,0,200,36,0.4,średni,4,1.0
16.0,wyborysamorzad1,Po pierwsze to naganiasz dla Pełczyńskiej a ona pozostanie szeregowym posłem. Domański nie zapowiedział takiego podatku. Tusk nie strzeli sobie w łeb (choć tu różnie może być bo on to wszystko słabo ogarnia). Posłowie też mają po kilka chat Nawrocki nie podpisze wzrostu podatków.,0,0,0,0,07-10-25,2025-10-07,2025.0,10.0,7.0,0.0,Po pierwsze to naganiasz dla Pełczyńskiej a ona pozostanie szeregowym posłem. Domański nie zapowiedział takiego podatku. Tusk nie strzeli sobie w łeb (choć tu różnie może być bo on to wszystko słabo ogarnia). Posłowie też mają po kilka chat Nawrocki nie podpisze wzrostu podatków.,Po pierwsze to naganiasz dla Pełczyńskiej a ona pozostanie szeregowym posłem. Domański nie zapowiedział takiego podatku. Tusk nie strzeli sobie w łeb (choć tu różnie może być bo on to wszystko słabo ogarnia). Posłowie też mają po kilka chat Nawrocki nie podpisze wzrostu podatków.,,,,0,0,0,280,44,0.0,niski,4,1.0
19.0,kazismolinski,"Ale wzburzenie po stronie silniczków tym, że Prezydent Nawrocki nie godzi się podpisać jakiejkolwiek podwyżki podatków. Gdyby rząd Tuska walczył z korupcją, mafiami VAT oraz luką VAT tak jak walczył rząd PiS to dziś nie mówili byśmy o katastrofie finansowej Polski.",0,14,6,20,07-10-25,2025-10-07,2025.0,10.0,7.0,0.0,"Ale wzburzenie po stronie silniczków tym, że Prezydent Nawrocki nie godzi się podpisać jakiejkolwiek podwyżki podatków. Gdyby rząd Tuska walczył z korupcją, mafiami VAT oraz luką VAT tak jak walczył rząd PiS to dziś nie mówili byśmy o katastrofie finansowej Polski.","Ale wzburzenie po stronie silniczków tym, że Prezydent Nawrocki nie godzi się podpisać jakiejkolwiek podwyżki podatków. Gdyby rząd Tuska walczył z korupcją, mafiami VAT oraz luką VAT tak jak walczył rząd PiS to dziś nie mówili byśmy o katastrofie finansowej Polski.",,,,0,0,0,265,41,2.33,średni,4,1.0
2.0,grok,"Nawrocki odnosi się do swoich obietnic wyborczych z kampanii prezydenckiej 2025. Kluczowe to obniżenie VAT do 22%, likwidacja podatku Belki, podniesienie drugiego progu podatkowego do 140 tys. zł, wzmocnienie armii (5% PKB), rozwój infrastruktury jak CPK i elektrownia atomowa, oraz sprzeciw wobec Zielonego Ładu i Paktu Migracyjnego. Jako prezydent zamierza je realizować, by budować dobrobyt i bezpieczeństwo dla Polaków. Szczegóły w programie na karolnawrocki2025.pl.",0,0,0,0,15-10-25,2025-10-15,2025.0,10.0,15.0,0.0,"Nawrocki odnosi się do swoich obietnic wyborczych z kampanii prezydenckiej 2025. Kluczowe to obniżenie VAT do 22%, likwidacja podatku Belki, podniesienie drugiego progu podatkowego do 140 tys. zł, wzmocnienie armii (5% PKB), rozwój infrastruktury jak CPK i elektrownia atomowa, oraz sprzeciw wobec Zielonego Ładu i Paktu Migracyjnego. Jako prezydent zamierza je realizować, by budować dobrobyt i bezpieczeństwo dla Polaków. Szczegóły w programie na .","Nawrocki odnosi się do swoich obietnic wyborczych z kampanii prezydenckiej 2025. Kluczowe to obniżenie VAT do 22%, likwidacja podatku Belki, podniesienie drugiego progu podatkowego do 140 tys. zł, wzmocnienie armii (5% PKB), rozwój infrastruktury jak CPK i elektrownia atomowa, oraz sprzeciw wobec Zielonego Ładu i Paktu Migracyjnego. Jako prezydent zamierza je realizować, by budować dobrobyt i bezpieczeństwo dla Polaków. Szczegóły w programie na .",,,karolnawrocki2025.pl,0,0,1,450,64,0.0,niski,4,1.0
18.0,artemisinfos,🇵🇱 Le président polonais Karol Nawrocki vient d’approuver une exonération totale d’impôt sur le revenu pour les parents ayant deux enfants ou plus. 👉 Une mesure destinée à soutenir la natalité et à alléger la charge fiscale des familles. (Just in Poland),13,175,23,211,16-10-25,2025-10-16,2025.0,10.0,16.0,0.0,🇵🇱 Le président polonais Karol Nawrocki vient d’approuver une exonération totale d’impôt sur le revenu pour les parents ayant deux enfants ou plus. 👉 Une mesure destinée à soutenir la natalité et à alléger la charge fiscale des familles. (Just in Poland),🇵🇱 Le président polonais Karol Nawrocki vient d’approuver une exonération totale d’impôt sur le revenu pour les parents ayant deux enfants ou plus. 👉 Une mesure destinée à soutenir la natalité et à alléger la charge fiscale des familles. (Just in Poland),,,,0,0,0,254,42,7.61,wysoki,4,1.0
26.0,sparbuchfeinde,"Polens Präsident Karol Nawrocki hat ein Gesetz unterzeichnet, dass die Einkommenssteuer für Paare mit mindestens zwei Kindern auf 0 setzt. Es gilt grundsätzlich für alle minderjährigen Kinder und bei Studenten bis 25 Jahren. Das Gesetz soll explizit polnische Familien unterstützen. Währenddessen erhöht man in Deutschland jedes Jahr die Abgabenlast.",6,268,59,333,16-10-25,2025-10-16,2025.0,10.0,16.0,0.0,"Polens Präsident Karol Nawrocki hat ein Gesetz unterzeichnet, dass die Einkommenssteuer für Paare mit mindestens zwei Kindern auf 0 setzt. Es gilt grundsätzlich für alle minderjährigen Kinder und bei Studenten bis 25 Jahren. Das Gesetz soll explizit polnische Familien unterstützen. Währenddessen erhöht man in Deutschland jedes Jahr die Abgabenlast.","Polens Präsident Karol Nawrocki hat ein Gesetz unterzeichnet, dass die Einkommenssteuer für Paare mit mindestens zwei Kindern auf 0 setzt. Es gilt grundsätzlich für alle minderjährigen Kinder und bei Studenten bis 25 Jahren. Das Gesetz soll explizit polnische Familien unterstützen. Währenddessen erhöht man in Deutschland jedes Jahr die Abgabenlast.",,,,0,0,0,350,49,4.54,wysoki,4,1.0
230.0,ilar1958,"Nawrocki?! Pańscy mocodawcy przez 8 lat swoich rządów wprowadzili 22 nowe podatki, opłaty i daniny — m.in. podatek handlowy, cukrowy, bankowy, od budynków, daninę solidarnościową, składkę zdrowotną, opłatę paliwową czy deszczową. Do tego doszedł Polski Ład, po którym nikt nie wiedział, jakie właściwie ma płacić podatki. A teraz żądasz 5% na zbrojenia i realizacje dalszych wydatków socjalnych, ale bez podnoszenia akcyzy na alkohol czy opodatkowania banków. Przyznaj, że masz niszczyć rząd, nawet kosztem Polski i Polaków",0,1,0,1,17-10-25,2025-10-17,2025.0,10.0,17.0,0.0,"Nawrocki?! Pańscy mocodawcy przez 8 lat swoich rządów wprowadzili 22 nowe podatki, opłaty i daniny — m.in. podatek handlowy, cukrowy, bankowy, od budynków, daninę solidarnościową, składkę zdrowotną, opłatę paliwową czy deszczową. Do tego doszedł Polski Ład, po którym nikt nie wiedział, jakie właściwie ma płacić podatki. A teraz żądasz 5% na zbrojenia i realizacje dalszych wydatków socjalnych, ale bez podnoszenia akcyzy na alkohol czy opodatkowania banków. Przyznaj, że masz niszczyć rząd, nawet kosztem Polski i Polaków","Nawrocki?! Pańscy mocodawcy przez 8 lat swoich rządów wprowadzili 22 nowe podatki, opłaty i daniny — m.in. podatek handlowy, cukrowy, bankowy, od budynków, daninę solidarnościową, składkę zdrowotną, opłatę paliwową czy deszczową. Do tego doszedł Polski Ład, po którym nikt nie wiedział, jakie właściwie ma płacić podatki. A teraz żądasz 5% na zbrojenia i realizacje dalszych wydatków socjalnych, ale bez podnoszenia akcyzy na alkohol czy opodatkowania banków. Przyznaj, że masz niszczyć rząd, nawet kosztem Polski i Polaków",,,,0,0,0,523,76,1.0,średni,4,1.0
