id,username,text,likes,retweets,replies,total_interactions,post_date_iso,date,year,month,day,hour,text_clean,text_no_links,mentions,hashtags,urls,n_mentions,n_hashtags,n_urls,char_count,word_count,amplification_ratio,reach_tier,cluster,cluster_prob
26.0,kate_p45,"nitter.net/WojPawelczyk/status/19… ""My Poland is a Poland without illegal migrants. It is a Poland where instead of integration centers, there are deportation centers for those who want to destroy our safety”-Karol Nawrocki Every leader should prioritize their own citizens this way.",0,35,7,42,"Jun 2, 2025 · 12:42 PM UTC",,,,,,"""My Poland is a Poland without illegal migrants. It is a Poland where instead of integration centers, there are deportation centers for those who want to destroy our safety”-Karol Nawrocki Every leader should prioritize their own citizens this way.","""My Poland is a Poland without illegal migrants. It is a Poland where instead of integration centers, there are deportation centers for those who want to destroy our safety”-Karol Nawrocki Every leader should prioritize their own citizens this way.",,,nitter.net/WojPawelczyk/status/19…,0,0,1,248,39,5.0,wysoki,24,1.0
629.0,fredgaulois,"Le nouveau Président nationaliste polonais Karol Nawrocki a tout compris : ""Nous avons réussi à réunifier l'ensemble du camp patriotique en Pologne, des personnes qui veulent une personne normale sans migrants illégaux, une Pologne sûre"". L'union des droites est impérative pour que le France reste la France mais nos responsables politiques vont ils comprendre la définition de l'intérêt supérieur? Pas sûr!!!",0,72,5,77,"Jun 2, 2025 · 7:40 PM UTC",,,,,,"Le nouveau Président nationaliste polonais Karol Nawrocki a tout compris : ""Nous avons réussi à réunifier l'ensemble du camp patriotique en Pologne, des personnes qui veulent une personne normale sans migrants illégaux, une Pologne sûre"". L'union des droites est impérative pour que le France reste la France mais nos responsables politiques vont ils comprendre la définition de l'intérêt supérieur? Pas sûr!!!","Le nouveau Président nationaliste polonais Karol Nawrocki a tout compris : ""Nous avons réussi à réunifier l'ensemble du camp patriotique en Pologne, des personnes qui veulent une personne normale sans migrants illégaux, une Pologne sûre"". L'union des droites est impérative pour que le France reste la France mais nos responsables politiques vont ils comprendre la définition de l'intérêt supérieur? Pas sûr!!!",,,,0,0,0,410,61,14.4,wysoki,24,0.7592140772554565
549.0,tysol,Mieszkańcy Piotrkowa Trybunalskiego żądają dymisji władz miasta. Bąkiewicz: Polacy nie zgadzają się na masową migrację tysol.pl/a141578-mieszkancy-…,0,42,7,49,"Jun 4, 2025 · 12:08 PM UTC",,,,,,Mieszkańcy Piotrkowa Trybunalskiego żądają dymisji władz miasta. Bąkiewicz: Polacy nie zgadzają się na masową migrację,Mieszkańcy Piotrkowa Trybunalskiego żądają dymisji władz miasta. Bąkiewicz: Polacy nie zgadzają się na masową migrację,,,tysol.pl/a141578-mieszkancy-…,0,0,1,118,15,6.0,wysoki,24,0.92016164568931
230.0,kripp_m,"POLENS PRÄSIDENT SETZT KLARE LINIE GEGEN ILLEGALE MIGRATION Der neue polnische Präsident Karol Nawrocki stellt klar: > „Mein Polen ist ein Polen ohne illegale Einwanderer. > Es ist ein Polen, in dem es statt Integrationszentren Abschiebezentren gibt – für diejenigen, die unsere Sicherheit zerstören wollen.“ Keine Beschwichtigung. Keine Ausreden. Klare Priorität: Schutz der nationalen Sicherheit vor ideologischer Kapitulation. Polen setzt auf Grenzen statt Chaos – Ordnung statt Unterwerfung. t.me/uncut_news",0,12,4,16,"Jun 4, 2025 · 7:44 AM UTC",,,,,,"POLENS PRÄSIDENT SETZT KLARE LINIE GEGEN ILLEGALE MIGRATION Der neue polnische Präsident Karol Nawrocki stellt klar: > „Mein Polen ist ein Polen ohne illegale Einwanderer. > Es ist ein Polen, in dem es statt Integrationszentren Abschiebezentren gibt – für diejenigen, die unsere Sicherheit zerstören wollen.“ Keine Beschwichtigung. Keine Ausreden. Klare Priorität: Schutz der nationalen Sicherheit vor ideologischer Kapitulation. Polen setzt auf Grenzen statt Chaos – Ordnung statt Unterwerfung. t.me/uncut_news","POLENS PRÄSIDENT SETZT KLARE LINIE GEGEN ILLEGALE MIGRATION Der neue polnische Präsident Karol Nawrocki stellt klar: > „Mein Polen ist ein Polen ohne illegale Einwanderer. > Es ist ein Polen, in dem es statt Integrationszentren Abschiebezentren gibt – für diejenigen, die unsere Sicherheit zerstören wollen.“ Keine Beschwichtigung. Keine Ausreden. Klare Priorität: Schutz der nationalen Sicherheit vor ideologischer Kapitulation. Polen setzt auf Grenzen statt Chaos – Ordnung statt Unterwerfung. t.me/uncut_news",,,,0,0,0,511,69,3.0,średni,24,0.9181707231003036
988.0,dariuszmatecki,"Masowa migracja stanowi zagrożenie dla kultury Zachodu. Dla władz Wielkiej Brytanii właśnie zostałem terrorystą. 🤷‍♂️ Chory świat, który o mały włos byśmy mieli u siebie, gdyby Trzaskowski wygrał i podpisał ustawę kagańcową Bodnara.",2,120,6,128,08-06-25,2025-06-08,2025.0,6.0,8.0,0.0,"Masowa migracja stanowi zagrożenie dla kultury Zachodu. Dla władz Wielkiej Brytanii właśnie zostałem terrorystą. 🤷‍♂️ Chory świat, który o mały włos byśmy mieli u siebie, gdyby Trzaskowski wygrał i podpisał ustawę kagańcową Bodnara.","Masowa migracja stanowi zagrożenie dla kultury Zachodu. Dla władz Wielkiej Brytanii właśnie zostałem terrorystą. 🤷‍♂️ Chory świat, który o mały włos byśmy mieli u siebie, gdyby Trzaskowski wygrał i podpisał ustawę kagańcową Bodnara.",,,,0,0,0,232,33,20.0,wysoki,24,0.7719475166756293
14.0,tomek525,W Ameryce zaczęło się to co już trwa w Europie Zachodniej od dawna... Niedługo zacznie się u nas jeżeli natychmiast nie przerwiemy trwania antypolskiego rządu Tuska 🤬 Przerwać NATYCHMIAST sprowadzanie obcych kulturowo najeźdźców do Polski i do Europy❗️,1,56,0,57,09-06-25,2025-06-09,2025.0,6.0,9.0,0.0,W Ameryce zaczęło się to co już trwa w Europie Zachodniej od dawna... Niedługo zacznie się u nas jeżeli natychmiast nie przerwiemy trwania antypolskiego rządu Tuska 🤬 Przerwać NATYCHMIAST sprowadzanie obcych kulturowo najeźdźców do Polski i do Europy❗️,W Ameryce zaczęło się to co już trwa w Europie Zachodniej od dawna... Niedługo zacznie się u nas jeżeli natychmiast nie przerwiemy trwania antypolskiego rządu Tuska 🤬 Przerwać NATYCHMIAST sprowadzanie obcych kulturowo najeźdźców do Polski i do Europy❗️,,,,0,0,0,252,38,56.0,wysoki,24,0.92016164568931
153.0,sbalcerac,"Ruch obrony granic po holendersku! Obywatele wzięli się za kontrolowanie pojazdów wjeżdżających ze strony Niemiec, by upewnić się, że nie są w nich podrzucani przez Niemców nielegalni migranci. nos.nl/artikel/2570415-groep…",1,40,2,43,09-06-25,2025-06-09,2025.0,6.0,9.0,0.0,"Ruch obrony granic po holendersku! Obywatele wzięli się za kontrolowanie pojazdów wjeżdżających ze strony Niemiec, by upewnić się, że nie są w nich podrzucani przez Niemców nielegalni migranci. nos.nl/artikel/2570415-groep…","Ruch obrony granic po holendersku! Obywatele wzięli się za kontrolowanie pojazdów wjeżdżających ze strony Niemiec, by upewnić się, że nie są w nich podrzucani przez Niemców nielegalni migranci. nos.nl/artikel/2570415-groep…",,,,0,0,0,223,29,20.0,wysoki,24,0.6533201166414855
437.0,koronawarszawa,"❌Trump nie ustępuje z deportacjami. W proteście przeciwko deportacjom, w Kalifornii na ulicę wyszli…meksykańscy imigranci z…flagami Meksyku. ❌Polsko - tak wyglądają skutki imigracji. Nie popełnij tego samego błędu❗️",0,108,11,119,09-06-25,2025-06-09,2025.0,6.0,9.0,0.0,"❌Trump nie ustępuje z deportacjami. W proteście przeciwko deportacjom, w Kalifornii na ulicę wyszli…meksykańscy imigranci z…flagami Meksyku. ❌Polsko - tak wyglądają skutki imigracji. Nie popełnij tego samego błędu❗️","❌Trump nie ustępuje z deportacjami. W proteście przeciwko deportacjom, w Kalifornii na ulicę wyszli…meksykańscy imigranci z…flagami Meksyku. ❌Polsko - tak wyglądają skutki imigracji. Nie popełnij tego samego błędu❗️",,,,0,0,0,215,28,9.82,wysoki,24,0.6717943111169127
103.0,mgordziewicz,"Bardzo ciekawy tekst ⬇️ ""Już się zaczęło"". Straszenie małych społeczności migrantami to przemyślana gra tvn24.pl/polska/dezinformacj…",0,43,5,48,09-06-25,2025-06-09,2025.0,6.0,9.0,0.0,"Bardzo ciekawy tekst ⬇️ ""Już się zaczęło"". Straszenie małych społeczności migrantami to przemyślana gra","Bardzo ciekawy tekst ⬇️ ""Już się zaczęło"". Straszenie małych społeczności migrantami to przemyślana gra",,,tvn24.pl/polska/dezinformacj…,0,0,1,103,14,8.6,wysoki,24,0.7719475166756293
374.0,wojciec09709353,@grok uspokój Panią Ewę bo przecież Trzaskowski w debatach prezydenckich 2025 twierdził że wpisał do unijnych dokumentów w 2015 że polska nie musi przyjmować migrantów z bliskiego wschodu jeśli przyjmie Ukraińców więc @donaldtusk na pewno skorzysta?,0,0,0,0,09-06-25,2025-06-09,2025.0,6.0,9.0,0.0,uspokój Panią Ewę bo przecież Trzaskowski w debatach prezydenckich 2025 twierdził że wpisał do unijnych dokumentów w 2015 że polska nie musi przyjmować migrantów z bliskiego wschodu jeśli przyjmie Ukraińców więc na pewno skorzysta?,uspokój Panią Ewę bo przecież Trzaskowski w debatach prezydenckich 2025 twierdził że wpisał do unijnych dokumentów w 2015 że polska nie musi przyjmować migrantów z bliskiego wschodu jeśli przyjmie Ukraińców więc na pewno skorzysta?,@grok|@donaldtusk,,,2,0,0,231,34,0.0,niski,24,0.92016164568931
8.0,karasekus,George Soros: #UE musi przyjmować milion azylantów rocznie. St. Michalkiewicz: Pan Trzaskowski to właśnie z synem Sorosa i z Ronaldem Lauderem - z tymi dwoma Żydami wpływowymi - uzgadniał swoją kandydaturę na prezydenta mniej wartościowego narodu tubylczego.,0,11,0,11,10-06-25,2025-06-10,2025.0,6.0,10.0,0.0,George Soros: UE musi przyjmować milion azylantów rocznie. St. Michalkiewicz: Pan Trzaskowski to właśnie z synem Sorosa i z Ronaldem Lauderem - z tymi dwoma Żydami wpływowymi - uzgadniał swoją kandydaturę na prezydenta mniej wartościowego narodu tubylczego.,George Soros: musi przyjmować milion azylantów rocznie. St. Michalkiewicz: Pan Trzaskowski to właśnie z synem Sorosa i z Ronaldem Lauderem - z tymi dwoma Żydami wpływowymi - uzgadniał swoją kandydaturę na prezydenta mniej wartościowego narodu tubylczego.,,#UE,,0,1,0,257,37,11.0,wysoki,24,0.6767451137806704
309.0,frestyletrap,"Przekonanie w społeczeństwie jest takie że trzaskowski zaczną realizować pakt migracyjny bez żadnego oporu,nawrocki mówi że nie wpuści i ludzie mają nadzieję że tak będzie,wiem że pis wpuszczał migrantow ale pakt migracyjny to trochę inna sprawa bo trzeba ich lokowac i dawac...",0,0,1,1,10-06-25,2025-06-10,2025.0,6.0,10.0,0.0,"Przekonanie w społeczeństwie jest takie że trzaskowski zaczną realizować pakt migracyjny bez żadnego oporu,nawrocki mówi że nie wpuści i ludzie mają nadzieję że tak będzie,wiem że pis wpuszczał migrantow ale pakt migracyjny to trochę inna sprawa bo trzeba ich lokowac i dawac...","Przekonanie w społeczeństwie jest takie że trzaskowski zaczną realizować pakt migracyjny bez żadnego oporu,nawrocki mówi że nie wpuści i ludzie mają nadzieję że tak będzie,wiem że pis wpuszczał migrantow ale pakt migracyjny to trochę inna sprawa bo trzeba ich lokowac i dawac...",,,,0,0,0,278,42,0.0,średni,24,0.7719475166756293
30.0,wojtekwlkp,"Myślę, że gdyby @Platforma_org być może nie miała mediów po swojej stronie, to @trzaskowski_ uzyskałby w drugiej turze może z 20%, a może druga tura nie byłaby w ogóle potrzebna. #imigranci #paktmigracyjny #StrategiaNowejRównowagi radiomaryja.pl/informacje/me…",0,0,0,0,11-06-25,2025-06-11,2025.0,6.0,11.0,0.0,"Myślę, że gdyby być może nie miała mediów po swojej stronie, to uzyskałby w drugiej turze może z 20%, a może druga tura nie byłaby w ogóle potrzebna. imigranci paktmigracyjny StrategiaNowejRównowagi","Myślę, że gdyby być może nie miała mediów po swojej stronie, to uzyskałby w drugiej turze może z 20%, a może druga tura nie byłaby w ogóle potrzebna.",@Platforma_org|@trzaskowski_,#imigranci|#paktmigracyjny|#StrategiaNowejRównowagi,radiomaryja.pl/informacje/me…,2,3,1,198,31,0.0,niski,24,0.7719475166756293
12.0,placzekgrzegorz,"Czy ktoś może mi wytłumaczyć, jak to wszystko ma działać w tym kraju??? Bo sytuacja ociera się o farsę. W trakcie niedawnej debaty prezydenckiej kandydat na urząd Prezydenta RP, Pan Rafał Trzaskowski, stwierdził publicznie: „Pakt Migracyjny nigdy nie wejdzie w życie, bo to ja wpisałem w unijne dokumenty, że jeżeli pomożemy Ukraińcom – to nikogo nie będziemy więcej przyjmowali”, po czym doprecyzował, że chodziło mu o rozporządzenie unijne z 2015 roku. W związku z powyższym, zwróciłem się do MSZ w trybie interpelacji poselskiej, między innymi z następującymi pytaniami: - czy w dokumentach unijnych z 2015 roku istnieje jakikolwiek oficjalny zapis, który – jak twierdzi Pan Rafał Trzaskowski – miałby „zwolnić Polskę z obowiązku przyjmowania migrantów” lub z implementacji przyszłych regulacji takich, jak Pakt Migracyjny? - czy Ministerstwo Spraw Zagranicznych posiada wiedzę na temat jakichkolwiek formalnych działań dyplomatycznych lub negocjacyjnych prowadzonych przez wiceprzewodniczącego Platformy Obywatelskiej, Pana Rafała Trzaskowskiego w 2015 roku, których skutkiem byłoby wprowadzenie takiego zapisu? I teraz uwaga… Już po tygodniu na stronach Sejmu RP pojawiła się informacja, iż złożona przeze mnie interpelacja otrzymała status: SPRAWA ZAMKNIĘTA - bez faktycznego udzielenia mi odpowiedzi na moje pytania. Nieudzielenie odpowiedzi posłowi na interpelację, mimo formalnego „zamknięcia sprawy”, może być naruszeniem prawa i obowiązków urzędniczych, o czym ministerstwo wie. No to jak – jesteśmy jako kraj zwolnieni z Paktu Migracyjnego, czy nie, Panie ministrze? Odpowiedź wydaje się oczywista, jednak rząd jak widać robi wszystko, żeby chronić swoich. Ze swojej strony złożę oczywiście interpelację uzupełniającą - nie pozwolę, aby sprawę zamieciono pod dywan, łamiąc Regulamin Sejmu. Polacy mają prawo znać prawdę. Ta cała sieć politycznych powiązań jest patologiczna.",10,630,57,697,15-06-25,2025-06-15,2025.0,6.0,15.0,0.0,"Czy ktoś może mi wytłumaczyć, jak to wszystko ma działać w tym kraju??? Bo sytuacja ociera się o farsę. W trakcie niedawnej debaty prezydenckiej kandydat na urząd Prezydenta RP, Pan Rafał Trzaskowski, stwierdził publicznie: „Pakt Migracyjny nigdy nie wejdzie w życie, bo to ja wpisałem w unijne dokumenty, że jeżeli pomożemy Ukraińcom – to nikogo nie będziemy więcej przyjmowali”, po czym doprecyzował, że chodziło mu o rozporządzenie unijne z 2015 roku. W związku z powyższym, zwróciłem się do MSZ w trybie interpelacji poselskiej, między innymi z następującymi pytaniami: - czy w dokumentach unijnych z 2015 roku istnieje jakikolwiek oficjalny zapis, który – jak twierdzi Pan Rafał Trzaskowski – miałby „zwolnić Polskę z obowiązku przyjmowania migrantów” lub z implementacji przyszłych regulacji takich, jak Pakt Migracyjny? - czy Ministerstwo Spraw Zagranicznych posiada wiedzę na temat jakichkolwiek formalnych działań dyplomatycznych lub negocjacyjnych prowadzonych przez wiceprzewodniczącego Platformy Obywatelskiej, Pana Rafała Trzaskowskiego w 2015 roku, których skutkiem byłoby wprowadzenie takiego zapisu? I teraz uwaga… Już po tygodniu na stronach Sejmu RP pojawiła się informacja, iż złożona przeze mnie interpelacja otrzymała status: SPRAWA ZAMKNIĘTA - bez faktycznego udzielenia mi odpowiedzi na moje pytania. Nieudzielenie odpowiedzi posłowi na interpelację, mimo formalnego „zamknięcia sprawy”, może być naruszeniem prawa i obowiązków urzędniczych, o czym ministerstwo wie. No to jak – jesteśmy jako kraj zwolnieni z Paktu Migracyjnego, czy nie, Panie ministrze? Odpowiedź wydaje się oczywista, jednak rząd jak widać robi wszystko, żeby chronić swoich. Ze swojej strony złożę oczywiście interpelację uzupełniającą - nie pozwolę, aby sprawę zamieciono pod dywan, łamiąc Regulamin Sejmu. Polacy mają prawo znać prawdę. Ta cała sieć politycznych powiązań jest patologiczna.","Czy ktoś może mi wytłumaczyć, jak to wszystko ma działać w tym kraju??? Bo sytuacja ociera się o farsę. W trakcie niedawnej debaty prezydenckiej kandydat na urząd Prezydenta RP, Pan Rafał Trzaskowski, stwierdził publicznie: „Pakt Migracyjny nigdy nie wejdzie w życie, bo to ja wpisałem w unijne dokumenty, że jeżeli pomożemy Ukraińcom – to nikogo nie będziemy więcej przyjmowali”, po czym doprecyzował, że chodziło mu o rozporządzenie unijne z 2015 roku. W związku z powyższym, zwróciłem się do MSZ w trybie interpelacji poselskiej, między innymi z następującymi pytaniami: - czy w dokumentach unijnych z 2015 roku istnieje jakikolwiek oficjalny zapis, który – jak twierdzi Pan Rafał Trzaskowski – miałby „zwolnić Polskę z obowiązku przyjmowania migrantów” lub z implementacji przyszłych regulacji takich, jak Pakt Migracyjny? - czy Ministerstwo Spraw Zagranicznych posiada wiedzę na temat jakichkolwiek formalnych działań dyplomatycznych lub negocjacyjnych prowadzonych przez wiceprzewodniczącego Platformy Obywatelskiej, Pana Rafała Trzaskowskiego w 2015 roku, których skutkiem byłoby wprowadzenie takiego zapisu? I teraz uwaga… Już po tygodniu na stronach Sejmu RP pojawiła się informacja, iż złożona przeze mnie interpelacja otrzymała status: SPRAWA ZAMKNIĘTA - bez faktycznego udzielenia mi odpowiedzi na moje pytania. Nieudzielenie odpowiedzi posłowi na interpelację, mimo formalnego „zamknięcia sprawy”, może być naruszeniem prawa i obowiązków urzędniczych, o czym ministerstwo wie. No to jak – jesteśmy jako kraj zwolnieni z Paktu Migracyjnego, czy nie, Panie ministrze? Odpowiedź wydaje się oczywista, jednak rząd jak widać robi wszystko, żeby chronić swoich. Ze swojej strony złożę oczywiście interpelację uzupełniającą - nie pozwolę, aby sprawę zamieciono pod dywan, łamiąc Regulamin Sejmu. Polacy mają prawo znać prawdę. Ta cała sieć politycznych powiązań jest patologiczna.",,,,0,0,0,1886,265,11.05,wysoki,24,0.7719475166756293
9.0,cdzwoni,"Poznań jest otwarty na uchodźców, mówi zastępca prezydenta miasta.",1,93,22,116,20-06-25,2025-06-20,2025.0,6.0,20.0,0.0,"Poznań jest otwarty na uchodźców, mówi zastępca prezydenta miasta.","Poznań jest otwarty na uchodźców, mówi zastępca prezydenta miasta.",,,,0,0,0,66,9,4.23,wysoki,24,1.0
264.0,misia68442473,"On wtedy wyraźnie powiedział, ze nie będzie migrantów z tytułu relokacji. Ale już na oświadczenie migrantów wg PUE można. To jest manipulator jakiego świat dawno nie widział. Półprawda, półśrodki ale zawsze do celu 🎯 oszust",0,0,0,0,20-06-25,2025-06-20,2025.0,6.0,20.0,0.0,"On wtedy wyraźnie powiedział, ze nie będzie migrantów z tytułu relokacji. Ale już na oświadczenie migrantów wg PUE można. To jest manipulator jakiego świat dawno nie widział. Półprawda, półśrodki ale zawsze do celu 🎯 oszust","On wtedy wyraźnie powiedział, ze nie będzie migrantów z tytułu relokacji. Ale już na oświadczenie migrantów wg PUE można. To jest manipulator jakiego świat dawno nie widział. Półprawda, półśrodki ale zawsze do celu 🎯 oszust",,,,0,0,0,223,35,0.0,niski,24,0.7719475166756293
63.0,dariuszmatecki,"Jako fundacja @OMAntypolonizmu w przyszłym tygodniu opracuję ulotki w językach arabskim, somalijskim, angielskim skierowane do migrantów na granicach i w polskich miastach. Będą tam informacje o tym, że polskie społeczeństwo ich tutaj nie chce, że nie są u nas mile widziani z wszelkimi tego konsekwencjami. Jako miejsca, w których mogą uzyskać tymczasową pomoc, może nocleg - wskazane będą adresy biur poselskich polityków KO, którzy odpowiadają dzisiaj za przyzwolenie na masową migrację i akceptację wszystkich migrantów, których podrzucają nam Niemcy. Ulotki wydrukujemy i będziemy dystrybuować wśród ekip @ROGranic ale również wśród niezależnych patroli obywatelskich a jest ich coraz więcej. Na Pomorze Zachodnie będą zjeżdżać ekipy z całego kraju. #RuchObronyGranic #MasowaMigracja",28,927,248,1203,26-06-25,2025-06-26,2025.0,6.0,26.0,0.0,"Jako fundacja w przyszłym tygodniu opracuję ulotki w językach arabskim, somalijskim, angielskim skierowane do migrantów na granicach i w polskich miastach. Będą tam informacje o tym, że polskie społeczeństwo ich tutaj nie chce, że nie są u nas mile widziani z wszelkimi tego konsekwencjami. Jako miejsca, w których mogą uzyskać tymczasową pomoc, może nocleg - wskazane będą adresy biur poselskich polityków KO, którzy odpowiadają dzisiaj za przyzwolenie na masową migrację i akceptację wszystkich migrantów, których podrzucają nam Niemcy. Ulotki wydrukujemy i będziemy dystrybuować wśród ekip ale również wśród niezależnych patroli obywatelskich a jest ich coraz więcej. Na Pomorze Zachodnie będą zjeżdżać ekipy z całego kraju. RuchObronyGranic MasowaMigracja","Jako fundacja w przyszłym tygodniu opracuję ulotki w językach arabskim, somalijskim, angielskim skierowane do migrantów na granicach i w polskich miastach. Będą tam informacje o tym, że polskie społeczeństwo ich tutaj nie chce, że nie są u nas mile widziani z wszelkimi tego konsekwencjami. Jako miejsca, w których mogą uzyskać tymczasową pomoc, może nocleg - wskazane będą adresy biur poselskich polityków KO, którzy odpowiadają dzisiaj za przyzwolenie na masową migrację i akceptację wszystkich migrantów, których podrzucają nam Niemcy. Ulotki wydrukujemy i będziemy dystrybuować wśród ekip ale również wśród niezależnych patroli obywatelskich a jest ich coraz więcej. Na Pomorze Zachodnie będą zjeżdżać ekipy z całego kraju.",@OMAntypolonizmu|@ROGranic,#RuchObronyGranic|#MasowaMigracja,,2,2,0,759,107,3.74,wysoki,24,1.0
311.0,szafarowicz2001,"Wstrząsająca relacja lekarza z Zielonej Góry - posłuchajcie, jakie skutki wywołuje masowa migracja z obcych kultur, którą wdrażają w Polsce ludzie Tuska ‼️",59,1246,73,1378,26-06-25,2025-06-26,2025.0,6.0,26.0,0.0,"Wstrząsająca relacja lekarza z Zielonej Góry - posłuchajcie, jakie skutki wywołuje masowa migracja z obcych kultur, którą wdrażają w Polsce ludzie Tuska ‼️","Wstrząsająca relacja lekarza z Zielonej Góry - posłuchajcie, jakie skutki wywołuje masowa migracja z obcych kultur, którą wdrażają w Polsce ludzie Tuska ‼️",,,,0,0,0,155,23,17.07,wysoki,24,0.7473703889845928
7.0,marekma25175489,"Ja jeszcze raz apeluję aby podbijać zasięgi WSZYSTKICH wpisów dotyczących relokacji migrantów. Ta sprawa to jest być albo nie być Polski. Tego cofnąć się nie da, musimy to zablokować. Ten temat dla #Koalicja13Grudnia i @trzaskowski_ to problem. #RekokacjaTuska",65,3081,141,3287,03-02-25,2025-02-03,2025.0,2.0,3.0,0.0,"Ja jeszcze raz apeluję aby podbijać zasięgi WSZYSTKICH wpisów dotyczących relokacji migrantów. Ta sprawa to jest być albo nie być Polski. Tego cofnąć się nie da, musimy to zablokować. Ten temat dla Koalicja13Grudnia i to problem. RekokacjaTuska","Ja jeszcze raz apeluję aby podbijać zasięgi WSZYSTKICH wpisów dotyczących relokacji migrantów. Ta sprawa to jest być albo nie być Polski. Tego cofnąć się nie da, musimy to zablokować. Ten temat dla i to problem.",@trzaskowski_,#Koalicja13Grudnia|#RekokacjaTuska,,1,2,0,244,37,21.85,wysoki,24,0.6878786982148183
11.0,koneserkopanin,"Nie, to komusze prawo kastrujące autochtonów i noszące na rękach migrantów jakie podpisał by i u nas Trzaskowski którego poparłeś. Więc ja bym się za wiele w tym temacie nie rozwijał na twoim miejscu.",0,12,4,16,06-08-25,2025-08-06,2025.0,8.0,6.0,0.0,"Nie, to komusze prawo kastrujące autochtonów i noszące na rękach migrantów jakie podpisał by i u nas Trzaskowski którego poparłeś. Więc ja bym się za wiele w tym temacie nie rozwijał na twoim miejscu.","Nie, to komusze prawo kastrujące autochtonów i noszące na rękach migrantów jakie podpisał by i u nas Trzaskowski którego poparłeś. Więc ja bym się za wiele w tym temacie nie rozwijał na twoim miejscu.",,,,0,0,0,200,34,3.0,wysoki,24,0.6979548063578959
