id,username,text,likes,retweets,replies,total_interactions,post_date_iso,date,year,month,day,hour,text_clean,text_no_links,mentions,hashtags,urls,n_mentions,n_hashtags,n_urls,char_count,word_count,amplification_ratio,reach_tier,cluster,cluster_prob
40.0,explicitepl,"Szczepkowska gadała, że ""Nawrocki jest jak zły sen"". W 2003 fetowała""koniec PISu"".Obrażała wyborców Brauna:""Społeczeństwo, w którym na Brauna może zagłosować 6,2 procent, nie jest stabilne""-ale to innych uważa za hejterów🤨Teraz w SZOKu, że Prezydentem nie będzie Trzaskowski",0,3,2,5,"Jun 5, 2025 · 8:44 AM UTC",,,,,,"Szczepkowska gadała, że ""Nawrocki jest jak zły sen"". W 2003 fetowała""koniec PISu"".Obrażała wyborców Brauna:""Społeczeństwo, w którym na Brauna może zagłosować 6,2 procent, nie jest stabilne""-ale to innych uważa za hejterów🤨Teraz w SZOKu, że Prezydentem nie będzie Trzaskowski","Szczepkowska gadała, że ""Nawrocki jest jak zły sen"". W 2003 fetowała""koniec PISu"".Obrażała wyborców Brauna:""Społeczeństwo, w którym na Brauna może zagłosować 6,2 procent, nie jest stabilne""-ale to innych uważa za hejterów🤨Teraz w SZOKu, że Prezydentem nie będzie Trzaskowski",,,,0,0,0,274,37,1.5,średni,14,0.9735572868574728
18.0,fil_stankiewicz,Co niby o tym świadczy? Przecież Mentzen i Konfederacja de facto poparli Nawrockiego przed drugą turą wyborów prezydenckich.,0,0,0,0,23-06-25,2025-06-23,2025.0,6.0,23.0,0.0,Co niby o tym świadczy? Przecież Mentzen i Konfederacja de facto poparli Nawrockiego przed drugą turą wyborów prezydenckich.,Co niby o tym świadczy? Przecież Mentzen i Konfederacja de facto poparli Nawrockiego przed drugą turą wyborów prezydenckich.,,,,0,0,0,124,18,0.0,niski,14,1.0
22.0,zydowskichwast,Jak sobie przypomnę jak Pan Braun cię pocisnął w kampanii i ta twoja piana wytaczająca sie z pyska w obronie brudasów z izrageja,0,0,0,0,07-07-25,2025-07-07,2025.0,7.0,7.0,0.0,Jak sobie przypomnę jak Pan Braun cię pocisnął w kampanii i ta twoja piana wytaczająca sie z pyska w obronie brudasów z izrageja,Jak sobie przypomnę jak Pan Braun cię pocisnął w kampanii i ta twoja piana wytaczająca sie z pyska w obronie brudasów z izrageja,,,,0,0,0,128,23,0.0,niski,14,0.9735572868574728
6.0,marcin__w,"Mnie szkoda potencjalnej koalicji, bo w Konfie są też wartościowi ludzie. To jak Pan Bosak walczył przed 2 turą wyborów, żeby nie wygrał Trzaskowski przekonuje mnie, że zależy mu na czymś więcej niż S. Mentzenowi.",0,0,1,1,29-07-25,2025-07-29,2025.0,7.0,29.0,0.0,"Mnie szkoda potencjalnej koalicji, bo w Konfie są też wartościowi ludzie. To jak Pan Bosak walczył przed 2 turą wyborów, żeby nie wygrał Trzaskowski przekonuje mnie, że zależy mu na czymś więcej niż S. Mentzenowi.","Mnie szkoda potencjalnej koalicji, bo w Konfie są też wartościowi ludzie. To jak Pan Bosak walczył przed 2 turą wyborów, żeby nie wygrał Trzaskowski przekonuje mnie, że zależy mu na czymś więcej niż S. Mentzenowi.",,,,0,0,0,213,35,0.0,średni,14,0.9403575103987852
16.0,iggyp288188,@szymon_holownia gratuluję. Osiągnąłeś poziom Brauna. Tak trzymać 🤡🤣,0,0,0,0,30-07-25,2025-07-30,2025.0,7.0,30.0,0.0,gratuluję. Osiągnąłeś poziom Brauna. Tak trzymać 🤡🤣,gratuluję. Osiągnąłeś poziom Brauna. Tak trzymać 🤡🤣,@szymon_holownia,,,1,0,0,51,7,0.0,niski,14,0.9735572868574728
26.0,wdragos20635,"W przypadku Brauna pomyliliście zaufanie z nieufnością. W rzeczywistości ufa mu 73,8% a nie ufa jedynie 17,1%. Ale miejmy nadzieję że następnym razem uda wam się lepiej przedstawić opinie społeczeństwa na temat polityków.",0,0,2,2,30-07-25,2025-07-30,2025.0,7.0,30.0,0.0,"W przypadku Brauna pomyliliście zaufanie z nieufnością. W rzeczywistości ufa mu 73,8% a nie ufa jedynie 17,1%. Ale miejmy nadzieję że następnym razem uda wam się lepiej przedstawić opinie społeczeństwa na temat polityków.","W przypadku Brauna pomyliliście zaufanie z nieufnością. W rzeczywistości ufa mu 73,8% a nie ufa jedynie 17,1%. Ale miejmy nadzieję że następnym razem uda wam się lepiej przedstawić opinie społeczeństwa na temat polityków.",,,,0,0,0,221,33,0.0,wysoki,14,0.9735572868574728
736.0,nominandumnon,Bydełko nie ufa Braunowi?😂😂 Ale za to pełne zaufanie do gangsterki z POPiSu która rypie ich w d.. 😂😂 jprd stracony narodek.,0,0,0,0,30-07-25,2025-07-30,2025.0,7.0,30.0,0.0,Bydełko nie ufa Braunowi?😂😂 Ale za to pełne zaufanie do gangsterki z POPiSu która rypie ich w d.. 😂😂 jprd stracony narodek.,Bydełko nie ufa Braunowi?😂😂 Ale za to pełne zaufanie do gangsterki z POPiSu która rypie ich w d.. 😂😂 jprd stracony narodek.,,,,0,0,0,123,22,0.0,niski,14,0.9735572868574728
4.0,adamche111,Proszę nie żartować tak brzydko. To wyborcy Mentzena i Brauna przeważyli szalę zwycięstwa na Karola Nawrockiego w wyborach prezydenckich. W przeciwnym wypadku prezydentem zostałby Rafał Trzaskowski fakt.pl/polityka/jak-glosowa…,0,0,0,0,31-07-25,2025-07-31,2025.0,7.0,31.0,0.0,Proszę nie żartować tak brzydko. To wyborcy Mentzena i Brauna przeważyli szalę zwycięstwa na Karola Nawrockiego w wyborach prezydenckich. W przeciwnym wypadku prezydentem zostałby Rafał Trzaskowski,Proszę nie żartować tak brzydko. To wyborcy Mentzena i Brauna przeważyli szalę zwycięstwa na Karola Nawrockiego w wyborach prezydenckich. W przeciwnym wypadku prezydentem zostałby Rafał Trzaskowski,,,fakt.pl/polityka/jak-glosowa…,0,0,1,197,26,0.0,niski,14,1.0
21.0,dorro1234,Może Mentzen przyjechał do batyra odhaczać punkty na podpisanej liście.,0,0,0,0,15-08-25,2025-08-15,2025.0,8.0,15.0,0.0,Może Mentzen przyjechał do batyra odhaczać punkty na podpisanej liście.,Może Mentzen przyjechał do batyra odhaczać punkty na podpisanej liście.,,,,0,0,0,71,10,0.0,niski,14,1.0
175.0,lesinski_a1555,"Czytasz: uczciwy i dobry, myślisz Grzegorz Braun.",0,0,0,0,"Jun 3, 2025 · 10:09 AM UTC",,,,,,"Czytasz: uczciwy i dobry, myślisz Grzegorz Braun.","Czytasz: uczciwy i dobry, myślisz Grzegorz Braun.",,,,0,0,0,49,7,0.0,niski,14,0.9735572868574728
584.0,magorzataj7,"Mam dość tego pierniczenia! Niektórzy zdają się być zawiedzeni, że nie wygrał Trzaskowski, że Braun jeszcze chodzi po wolności zamiast siedzieć w więzieniu i najgorsze, że Nawrocki ułaskawi Brauna zamiast wysłać do Niego seryjnego samobójcę, jak do Leppera! Ogarnijcie się ludzie!",0,0,0,0,"Jun 3, 2025 · 12:12 PM UTC",,,,,,"Mam dość tego pierniczenia! Niektórzy zdają się być zawiedzeni, że nie wygrał Trzaskowski, że Braun jeszcze chodzi po wolności zamiast siedzieć w więzieniu i najgorsze, że Nawrocki ułaskawi Brauna zamiast wysłać do Niego seryjnego samobójcę, jak do Leppera! Ogarnijcie się ludzie!","Mam dość tego pierniczenia! Niektórzy zdają się być zawiedzeni, że nie wygrał Trzaskowski, że Braun jeszcze chodzi po wolności zamiast siedzieć w więzieniu i najgorsze, że Nawrocki ułaskawi Brauna zamiast wysłać do Niego seryjnego samobójcę, jak do Leppera! Ogarnijcie się ludzie!",,,,0,0,0,280,41,0.0,niski,14,0.9735572868574728
27.0,mtacze,"Proszę pamiętać, że bez takiej mobilizacji wyborców Brauna byłoby ciężko. Jakże się myliłem sądząc, że Szczerba się do niczego nie nadaje.",0,0,0,0,"Jun 3, 2025 · 7:54 PM UTC",,,,,,"Proszę pamiętać, że bez takiej mobilizacji wyborców Brauna byłoby ciężko. Jakże się myliłem sądząc, że Szczerba się do niczego nie nadaje.","Proszę pamiętać, że bez takiej mobilizacji wyborców Brauna byłoby ciężko. Jakże się myliłem sądząc, że Szczerba się do niczego nie nadaje.",,,,0,0,0,138,21,0.0,niski,14,0.9735572868574728
12.0,wojtaswro09,"Nie podoba mi się działanie Bosaka. Bardzo go szanuję, jest mega inteligentny. Ale przed 1 turą oczywiście zaznaczając, że kandydatem jest Mentzen, mówił wszyscy byle nie trzaskowski. Po ogłoszeniu wyników z 1 tury, od razu dal poparcie Nawrockiemu...",0,0,0,0,"Jun 4, 2025 · 8:12 AM UTC",,,,,,"Nie podoba mi się działanie Bosaka. Bardzo go szanuję, jest mega inteligentny. Ale przed 1 turą oczywiście zaznaczając, że kandydatem jest Mentzen, mówił wszyscy byle nie trzaskowski. Po ogłoszeniu wyników z 1 tury, od razu dal poparcie Nawrockiemu...","Nie podoba mi się działanie Bosaka. Bardzo go szanuję, jest mega inteligentny. Ale przed 1 turą oczywiście zaznaczając, że kandydatem jest Mentzen, mówił wszyscy byle nie trzaskowski. Po ogłoszeniu wyników z 1 tury, od razu dal poparcie Nawrockiemu...",,,,0,0,0,251,38,0.0,niski,14,1.0
19.0,thaulus,"Po wyborach widać że elektorat Brauna jest bardziej bliski PiS niż Konfederacji. No i Braun jest dosyć hardcoreowym politykiem który odstrasza centrowych wyborców. A Konfederacja pracuje nad normalizacją stosunków ze wszyskimi, grając coraz mocniej na te centrum niż na prawicę",0,0,0,0,"Jun 4, 2025 · 11:16 AM UTC",,,,,,"Po wyborach widać że elektorat Brauna jest bardziej bliski PiS niż Konfederacji. No i Braun jest dosyć hardcoreowym politykiem który odstrasza centrowych wyborców. A Konfederacja pracuje nad normalizacją stosunków ze wszyskimi, grając coraz mocniej na te centrum niż na prawicę","Po wyborach widać że elektorat Brauna jest bardziej bliski PiS niż Konfederacji. No i Braun jest dosyć hardcoreowym politykiem który odstrasza centrowych wyborców. A Konfederacja pracuje nad normalizacją stosunków ze wszyskimi, grając coraz mocniej na te centrum niż na prawicę",,,,0,0,0,277,40,0.0,niski,14,0.9735572868574728
65.0,bart_wielinski,"""Ogolić na łyso"" i ""zamknąć w kuchni"". Rzeczniczka Brauna sponiewierana, bo źle zagłosowała. Źle, bo nie na Nawrockiego wroclaw.wyborcza.pl/wroclaw/…",3,90,10,103,"Jun 4, 2025 · 12:49 PM UTC",,,,,,"""Ogolić na łyso"" i ""zamknąć w kuchni"". Rzeczniczka Brauna sponiewierana, bo źle zagłosowała. Źle, bo nie na Nawrockiego wroclaw.","""Ogolić na łyso"" i ""zamknąć w kuchni"". Rzeczniczka Brauna sponiewierana, bo źle zagłosowała. Źle, bo nie na Nawrockiego wroclaw.",,,wyborcza.pl/wroclaw/…,0,0,1,128,19,9.0,wysoki,14,0.9735572868574728
29.0,maciejjudo93,Zyskał bo Konfederaci i Braunisci na niego zagłosowali.,0,0,0,0,"Jun 5, 2025 · 10:36 AM UTC",,,,,,Zyskał bo Konfederaci i Braunisci na niego zagłosowali.,Zyskał bo Konfederaci i Braunisci na niego zagłosowali.,,,,0,0,0,55,8,0.0,niski,14,0.9735572868574728
11.0,sembosso,"Występ Brauna w Wybory25 to więcej Konfederacji w mediach, a w drugiej turze głosy wrócą do @SlawomirMentzen",0,0,0,0,14-01-25,2025-01-14,2025.0,1.0,14.0,0.0,"Występ Brauna w Wybory25 to więcej Konfederacji w mediach, a w drugiej turze głosy wrócą do","Występ Brauna w Wybory25 to więcej Konfederacji w mediach, a w drugiej turze głosy wrócą do",@SlawomirMentzen,,,1,0,0,91,16,0.0,niski,14,0.9735572868574728
35.0,murzynfrogxxx,Rok temu. 9 czerwca 2024 roku odbyły się wybory do Parlamentu Europejskiego. Mniej więcej o tej godzinie ludzie nie mogli się nadziwić jak to Grzegorz Braun się dostał i to jeszcze w takim stylu. Ale po roku mogę śmiało powiedzieć... Wolałem jak pan Grzegorz był na miejscu w sejmie i patrzył im na ręce.,0,73,41,114,09-06-25,2025-06-09,2025.0,6.0,9.0,0.0,Rok temu. 9 czerwca 2024 roku odbyły się wybory do Parlamentu Europejskiego. Mniej więcej o tej godzinie ludzie nie mogli się nadziwić jak to Grzegorz Braun się dostał i to jeszcze w takim stylu. Ale po roku mogę śmiało powiedzieć... Wolałem jak pan Grzegorz był na miejscu w sejmie i patrzył im na ręce.,Rok temu. 9 czerwca 2024 roku odbyły się wybory do Parlamentu Europejskiego. Mniej więcej o tej godzinie ludzie nie mogli się nadziwić jak to Grzegorz Braun się dostał i to jeszcze w takim stylu. Ale po roku mogę śmiało powiedzieć... Wolałem jak pan Grzegorz był na miejscu w sejmie i patrzył im na ręce.,,,,0,0,0,304,54,1.78,wysoki,14,0.9735572868574728
665.0,pawelmozol,To Braun dowiózł wynik na prezydenta. Wybory do sejmu to ok. 900 nazwisk na listach.,0,0,0,0,11-06-25,2025-06-11,2025.0,6.0,11.0,0.0,To Braun dowiózł wynik na prezydenta. Wybory do sejmu to ok. 900 nazwisk na listach.,To Braun dowiózł wynik na prezydenta. Wybory do sejmu to ok. 900 nazwisk na listach.,,,,0,0,0,84,15,0.0,niski,14,0.9735572868574728
6.0,tomasz_rok,"Zgadzam się z Panem Sumlińskim. Za kilka lat będzie już bez znaczenia, czy wybory wygra Mentzen, Bosak, czy Braun.😡",1,15,6,22,15-06-25,2025-06-15,2025.0,6.0,15.0,0.0,"Zgadzam się z Panem Sumlińskim. Za kilka lat będzie już bez znaczenia, czy wybory wygra Mentzen, Bosak, czy Braun.😡","Zgadzam się z Panem Sumlińskim. Za kilka lat będzie już bez znaczenia, czy wybory wygra Mentzen, Bosak, czy Braun.😡",,,,0,0,0,115,19,2.5,wysoki,14,1.0
24.0,bartekbrogg,"Dlaczego Mentzen i Zandberg, tak różni, walczą o tych samych wyborców? To nie ideologia, to bunt przeciw systemowi i szukanie autentyczności. Czy wiesz, co naprawdę napędza ich wybory? piped.video/orvRzaFI8ik?si=Cdtp… #KONFEDERACJA #Polityka #Mentzen #Zandberg",0,0,0,0,25-06-25,2025-06-25,2025.0,6.0,25.0,0.0,"Dlaczego Mentzen i Zandberg, tak różni, walczą o tych samych wyborców? To nie ideologia, to bunt przeciw systemowi i szukanie autentyczności. Czy wiesz, co naprawdę napędza ich wybory? piped.video/orvRzaFI8ik?si=Cdtp… KONFEDERACJA Polityka Mentzen Zandberg","Dlaczego Mentzen i Zandberg, tak różni, walczą o tych samych wyborców? To nie ideologia, to bunt przeciw systemowi i szukanie autentyczności. Czy wiesz, co naprawdę napędza ich wybory? piped.video/orvRzaFI8ik?si=Cdtp…",,#KONFEDERACJA|#Polityka|#Mentzen|#Zandberg,,0,4,0,256,33,0.0,niski,14,1.0
398.0,dawbrapl,"Unieważnijmy wybory, niech Kandydaci LEGALNIE zdobędą podpisy poparcia Skończy się na tym że Legalnie w wyborach będzie Braun, Mencen i Nawrocki , to myślisz że kto wygra? I jeżeli Braun to co lewaki będziecie kwiczeć wtedy? Pewnie że żartowaliście i pierwsze wybory byly legalne",0,0,0,0,29-06-25,2025-06-29,2025.0,6.0,29.0,0.0,"Unieważnijmy wybory, niech Kandydaci LEGALNIE zdobędą podpisy poparcia Skończy się na tym że Legalnie w wyborach będzie Braun, Mencen i Nawrocki , to myślisz że kto wygra? I jeżeli Braun to co lewaki będziecie kwiczeć wtedy? Pewnie że żartowaliście i pierwsze wybory byly legalne","Unieważnijmy wybory, niech Kandydaci LEGALNIE zdobędą podpisy poparcia Skończy się na tym że Legalnie w wyborach będzie Braun, Mencen i Nawrocki , to myślisz że kto wygra? I jeżeli Braun to co lewaki będziecie kwiczeć wtedy? Pewnie że żartowaliście i pierwsze wybory byly legalne",,,,0,0,0,279,44,0.0,niski,14,0.9735572868574728
9.0,leszekmozga,"Minęło 1,5 roku. Braun dalej rozwala wystawy, Bąkiewicz legitymuje ludzi na granicy, Mejzy spodnie się kurczą, a kieszenie rozszerzają, Matecki fałszuje wybory, Obajtek mieszka w willi od Orlenu Kaczyński, Morawiecki i Ziobro nie wspomnę BRAWO @Adbodnar, @TomaszSiemoniak!",1,41,1,43,30-06-25,2025-06-30,2025.0,6.0,30.0,0.0,"Minęło 1,5 roku. Braun dalej rozwala wystawy, Bąkiewicz legitymuje ludzi na granicy, Mejzy spodnie się kurczą, a kieszenie rozszerzają, Matecki fałszuje wybory, Obajtek mieszka w willi od Orlenu Kaczyński, Morawiecki i Ziobro nie wspomnę BRAWO , !","Minęło 1,5 roku. Braun dalej rozwala wystawy, Bąkiewicz legitymuje ludzi na granicy, Mejzy spodnie się kurczą, a kieszenie rozszerzają, Matecki fałszuje wybory, Obajtek mieszka w willi od Orlenu Kaczyński, Morawiecki i Ziobro nie wspomnę BRAWO , !",@Adbodnar|@TomaszSiemoniak,,,2,0,0,247,37,41.0,wysoki,14,0.9735572868574728
29.0,taplarski_dziad,"Hej Republiczka @RepublikaTV , o Panu @GrzegorzBraun_ to sugeruję, żeby z szacunkiem. Za chwilę wybory. Już raz jęczeliście do Brauna i jego wyborców . ☝️",0,9,5,14,03-07-25,2025-07-03,2025.0,7.0,3.0,0.0,"Hej Republiczka , o Panu to sugeruję, żeby z szacunkiem. Za chwilę wybory. Już raz jęczeliście do Brauna i jego wyborców . ☝️","Hej Republiczka , o Panu to sugeruję, żeby z szacunkiem. Za chwilę wybory. Już raz jęczeliście do Brauna i jego wyborców . ☝️",@RepublikaTV|@GrzegorzBraun_,,,2,0,0,125,23,1.8,wysoki,14,0.9735572868574728
213.0,kiedyotwarte,"i tu jest właśnie różnica. Mentzen na razie dużo mówi co trzeba zrobić, a Kaczyński robi - patrz kolejne wygrane wybory prezydenckie ;-)",0,0,0,0,30-07-25,2025-07-30,2025.0,7.0,30.0,0.0,"i tu jest właśnie różnica. Mentzen na razie dużo mówi co trzeba zrobić, a Kaczyński robi - patrz kolejne wygrane wybory prezydenckie ;-)","i tu jest właśnie różnica. Mentzen na razie dużo mówi co trzeba zrobić, a Kaczyński robi - patrz kolejne wygrane wybory prezydenckie ;-)",,,,0,0,0,136,23,0.0,niski,14,1.0
1.0,giertychroman,"Mentzen wykonał kawał roboty dla zwycięstwa Nawrockiego, to teraz Kaczyński mu dziękuję z właściwą dla niego wdzięcznością. Proszę się cieszyć panie pośle, że nie potraktował Pana jak Leppera, który też pomógł Kaczyńskiemu wygrać wybory prezydenckie.",7,248,157,412,30-07-25,2025-07-30,2025.0,7.0,30.0,0.0,"Mentzen wykonał kawał roboty dla zwycięstwa Nawrockiego, to teraz Kaczyński mu dziękuję z właściwą dla niego wdzięcznością. Proszę się cieszyć panie pośle, że nie potraktował Pana jak Leppera, który też pomógł Kaczyńskiemu wygrać wybory prezydenckie.","Mentzen wykonał kawał roboty dla zwycięstwa Nawrockiego, to teraz Kaczyński mu dziękuję z właściwą dla niego wdzięcznością. Proszę się cieszyć panie pośle, że nie potraktował Pana jak Leppera, który też pomógł Kaczyńskiemu wygrać wybory prezydenckie.",,,,0,0,0,250,35,1.58,wysoki,14,1.0
23.0,pawel11p,"Nawrocki podpisał tą deklarację żeby wygrać wybory a Gdyby Mentzen tą deklarację Kaczyńskiego podpisał, to wybory by przegrał i to z kretesem.",0,0,0,0,31-07-25,2025-07-31,2025.0,7.0,31.0,0.0,"Nawrocki podpisał tą deklarację żeby wygrać wybory a Gdyby Mentzen tą deklarację Kaczyńskiego podpisał, to wybory by przegrał i to z kretesem.","Nawrocki podpisał tą deklarację żeby wygrać wybory a Gdyby Mentzen tą deklarację Kaczyńskiego podpisał, to wybory by przegrał i to z kretesem.",,,,0,0,0,142,22,0.0,niski,14,1.0
7.0,marian_konarski,"Moje przesłanie do Karola Nawrockiego, od jutra Prezydenta Rzeczpospolitej Polskiej. Panie Prezydencie Rzeczpospolitej Polskiej, Karolu Nawrocki. Mam nadzieję że nie zapomni Pan że to dzięki głosom wyborców Grzegorza Brauna wygrał Pan wybory. Grzegorz Braun oficjalnie zarekomendował swoim wyborcom głosowanie na Pana i ponad MILION z nich tak zrobiło. Ja osobiście wstrzymałem się od głosu w II turze wyborów TYLKO dlatego że był Pan pomazańcem znienawidzonego przez ze mnie polakożercy i obłąkanego rusofoba, kaczyńskiego, choć w czasie kampanii broniłem Pana przed kretyńskimi atakami Pana przeciwników, zwłaszcza tymi dotyczącymi Pana przeszłości. Życzę Panu powodzenia w pracy dla Polaków i suwerennej Polski która możliwa jest TYLKO we współpracy z Białorusią i Rosją jako gwarantami naszej obecnej granicy zachodniej przy nienaruszalności wschodniej. Kto z moich Sz. Obserwujących, ale nie tylko, zgadza się ze mną to podaje dalej. Tylko podania dalej tworzą zasięgi.",1,14,3,18,05-08-25,2025-08-05,2025.0,8.0,5.0,0.0,"Moje przesłanie do Karola Nawrockiego, od jutra Prezydenta Rzeczpospolitej Polskiej. Panie Prezydencie Rzeczpospolitej Polskiej, Karolu Nawrocki. Mam nadzieję że nie zapomni Pan że to dzięki głosom wyborców Grzegorza Brauna wygrał Pan wybory. Grzegorz Braun oficjalnie zarekomendował swoim wyborcom głosowanie na Pana i ponad MILION z nich tak zrobiło. Ja osobiście wstrzymałem się od głosu w II turze wyborów TYLKO dlatego że był Pan pomazańcem znienawidzonego przez ze mnie polakożercy i obłąkanego rusofoba, kaczyńskiego, choć w czasie kampanii broniłem Pana przed kretyńskimi atakami Pana przeciwników, zwłaszcza tymi dotyczącymi Pana przeszłości. Życzę Panu powodzenia w pracy dla Polaków i suwerennej Polski która możliwa jest TYLKO we współpracy z Białorusią i Rosją jako gwarantami naszej obecnej granicy zachodniej przy nienaruszalności wschodniej. Kto z moich Sz. Obserwujących, ale nie tylko, zgadza się ze mną to podaje dalej. Tylko podania dalej tworzą zasięgi.","Moje przesłanie do Karola Nawrockiego, od jutra Prezydenta Rzeczpospolitej Polskiej. Panie Prezydencie Rzeczpospolitej Polskiej, Karolu Nawrocki. Mam nadzieję że nie zapomni Pan że to dzięki głosom wyborców Grzegorza Brauna wygrał Pan wybory. Grzegorz Braun oficjalnie zarekomendował swoim wyborcom głosowanie na Pana i ponad MILION z nich tak zrobiło. Ja osobiście wstrzymałem się od głosu w II turze wyborów TYLKO dlatego że był Pan pomazańcem znienawidzonego przez ze mnie polakożercy i obłąkanego rusofoba, kaczyńskiego, choć w czasie kampanii broniłem Pana przed kretyńskimi atakami Pana przeciwników, zwłaszcza tymi dotyczącymi Pana przeszłości. Życzę Panu powodzenia w pracy dla Polaków i suwerennej Polski która możliwa jest TYLKO we współpracy z Białorusią i Rosją jako gwarantami naszej obecnej granicy zachodniej przy nienaruszalności wschodniej. Kto z moich Sz. Obserwujących, ale nie tylko, zgadza się ze mną to podaje dalej. Tylko podania dalej tworzą zasięgi.",,,,0,0,0,974,138,4.67,wysoki,14,0.9735572868574728
20.0,marian_konarski,"Panie Prezydencie Rzeczpospolitej Polskiej, Karolu Nawrocki. Mam nadzieję że nie zapomni Pan że to dzięki głosom wyborców Grzegorza Brauna wygrał Pan wybory. Grzegorz Braun oficjalnie zarekomendował swoim wyborcom głosowanie na Pana i ponad MILION z nich tak zrobiło. Ja osobiście wstrzymałem się od głosu w II turze wyborów TYLKO dlatego że był Pan pomazańcem znienawidzonego przez ze mnie polakożercy i obłąkanego rusofoba, kaczyńskiego, choć w czasie kampanii broniłem Pana przed kretyńskimi atakami Pana przeciwników, zwłaszcza tymi dotyczącymi Pana przeszłości. Życzę Panu powodzenia w pracy dla Polaków i suwerennej Polski która możliwa jest TYLKO we współpracy z Białorusią i Rosją jako gwarantami naszej obecnej granicy zachodniej przy nienaruszalności wschodniej. Kto z moich Sz. Obserwujących, ale nie tylko, zgadza się ze mną to podaje dalej. Tylko podania dalej tworzą zasięgi.",0,5,1,6,06-08-25,2025-08-06,2025.0,8.0,6.0,0.0,"Panie Prezydencie Rzeczpospolitej Polskiej, Karolu Nawrocki. Mam nadzieję że nie zapomni Pan że to dzięki głosom wyborców Grzegorza Brauna wygrał Pan wybory. Grzegorz Braun oficjalnie zarekomendował swoim wyborcom głosowanie na Pana i ponad MILION z nich tak zrobiło. Ja osobiście wstrzymałem się od głosu w II turze wyborów TYLKO dlatego że był Pan pomazańcem znienawidzonego przez ze mnie polakożercy i obłąkanego rusofoba, kaczyńskiego, choć w czasie kampanii broniłem Pana przed kretyńskimi atakami Pana przeciwników, zwłaszcza tymi dotyczącymi Pana przeszłości. Życzę Panu powodzenia w pracy dla Polaków i suwerennej Polski która możliwa jest TYLKO we współpracy z Białorusią i Rosją jako gwarantami naszej obecnej granicy zachodniej przy nienaruszalności wschodniej. Kto z moich Sz. Obserwujących, ale nie tylko, zgadza się ze mną to podaje dalej. Tylko podania dalej tworzą zasięgi.","Panie Prezydencie Rzeczpospolitej Polskiej, Karolu Nawrocki. Mam nadzieję że nie zapomni Pan że to dzięki głosom wyborców Grzegorza Brauna wygrał Pan wybory. Grzegorz Braun oficjalnie zarekomendował swoim wyborcom głosowanie na Pana i ponad MILION z nich tak zrobiło. Ja osobiście wstrzymałem się od głosu w II turze wyborów TYLKO dlatego że był Pan pomazańcem znienawidzonego przez ze mnie polakożercy i obłąkanego rusofoba, kaczyńskiego, choć w czasie kampanii broniłem Pana przed kretyńskimi atakami Pana przeciwników, zwłaszcza tymi dotyczącymi Pana przeszłości. Życzę Panu powodzenia w pracy dla Polaków i suwerennej Polski która możliwa jest TYLKO we współpracy z Białorusią i Rosją jako gwarantami naszej obecnej granicy zachodniej przy nienaruszalności wschodniej. Kto z moich Sz. Obserwujących, ale nie tylko, zgadza się ze mną to podaje dalej. Tylko podania dalej tworzą zasięgi.",,,,0,0,0,889,128,5.0,wysoki,14,0.9735572868574728
24.0,kahatsa66,"Takie widoki będą coraz częściej. Dlaczego? Bo pis czuje się bezkarny, bo konfa czuje się bezkarna, bo Braun czuje się bezkarny, bo jakaś hołota wybrała przez sfałszowane wybory alfonsa, sutenera, faszystę, nazistę, kibola I ćpuna. I co? Nic. Rząd na to patrzy i co? NIC. UPADEK",0,6,4,10,10-08-25,2025-08-10,2025.0,8.0,10.0,0.0,"Takie widoki będą coraz częściej. Dlaczego? Bo pis czuje się bezkarny, bo konfa czuje się bezkarna, bo Braun czuje się bezkarny, bo jakaś hołota wybrała przez sfałszowane wybory alfonsa, sutenera, faszystę, nazistę, kibola I ćpuna. I co? Nic. Rząd na to patrzy i co? NIC. UPADEK","Takie widoki będą coraz częściej. Dlaczego? Bo pis czuje się bezkarny, bo konfa czuje się bezkarna, bo Braun czuje się bezkarny, bo jakaś hołota wybrała przez sfałszowane wybory alfonsa, sutenera, faszystę, nazistę, kibola I ćpuna. I co? Nic. Rząd na to patrzy i co? NIC. UPADEK",,,,0,0,0,278,46,1.5,wysoki,14,0.9735572868574728
