id,username,text,likes,retweets,replies,total_interactions,post_date_iso,date,year,month,day,hour,text_clean,text_no_links,mentions,hashtags,urls,n_mentions,n_hashtags,n_urls,char_count,word_count,amplification_ratio,reach_tier,cluster,cluster_prob
11.0,jonjonny19,Jesteśmy świadkami narodzin nowej sekty. Sekty wyborczej,0,0,0,0,30-06-25,2025-06-30,2025.0,6.0,30.0,0.0,Jesteśmy świadkami narodzin nowej sekty. Sekty wyborczej,Jesteśmy świadkami narodzin nowej sekty. Sekty wyborczej,,,,0,0,0,56,7,0.0,niski,52,0.9905636859940634
8.0,monikanowacka16,"Powiedzmy sobie jasno; za rok, 1 czerwca, będziemy obchodzić rocznicę skręconych wyborów i pana zapadnięcia się pod ziemię. Roz-czaro-wanie👎",0,0,0,0,01-09-25,2025-09-01,2025.0,9.0,1.0,0.0,"Powiedzmy sobie jasno; za rok, 1 czerwca, będziemy obchodzić rocznicę skręconych wyborów i pana zapadnięcia się pod ziemię. Roz-czaro-wanie👎","Powiedzmy sobie jasno; za rok, 1 czerwca, będziemy obchodzić rocznicę skręconych wyborów i pana zapadnięcia się pod ziemię. Roz-czaro-wanie👎",,,,0,0,0,140,19,0.0,niski,52,1.0
603.0,hipis_1,"Wybory już sie odbyły. Chyba, że to kampania ujadania pod te przyszłe do Sejmu.",0,0,0,0,"Jun 4, 2025 · 7:07 PM UTC",,,,,,"Wybory już sie odbyły. Chyba, że to kampania ujadania pod te przyszłe do Sejmu.","Wybory już sie odbyły. Chyba, że to kampania ujadania pod te przyszłe do Sejmu.",,,,0,0,0,79,14,0.0,niski,52,1.0
8.0,zabrze24info,Przedterminowe wybory w Zabrzu. Czas na kampanię i głosowanie jest wyjątkowo nieszczęśliwy - komentuje politolog. Więcej ⬇️ zabrze24.info/przedterminowe… #zabrze #zabrze24info #portal #wybory2025 #WyboryPrezydenckie2025 @UMZabrze,0,0,0,0,03-07-25,2025-07-03,2025.0,7.0,3.0,0.0,Przedterminowe wybory w Zabrzu. Czas na kampanię i głosowanie jest wyjątkowo nieszczęśliwy - komentuje politolog. Więcej ⬇️ zabrze24.info/przedterminowe… zabrze zabrze24info portal wybory2025 WyboryPrezydenckie2025,Przedterminowe wybory w Zabrzu. Czas na kampanię i głosowanie jest wyjątkowo nieszczęśliwy - komentuje politolog. Więcej ⬇️ zabrze24.info/przedterminowe…,@UMZabrze,#zabrze|#zabrze24info|#portal|#wybory2025|#WyboryPrezydenckie2025,,1,5,0,214,23,0.0,niski,52,1.0
2.0,etomaszek,Ty bardziej jak na jesieni będą wybory i koniec KO.,0,0,0,0,10-06-25,2025-06-10,2025.0,6.0,10.0,0.0,Ty bardziej jak na jesieni będą wybory i koniec KO.,Ty bardziej jak na jesieni będą wybory i koniec KO.,,,,0,0,0,51,10,0.0,niski,52,1.0
912.0,mariuszderwisz,"A mocodawcy Mateckiego, już pewnie klepią kolejną apkę na kolejne wybory. Tym razem protokoły, z jedynie poprawnymi wynikami, będą już w minutę po OTWARCIU lokali wyborczych.",0,0,0,0,10-06-25,2025-06-10,2025.0,6.0,10.0,0.0,"A mocodawcy Mateckiego, już pewnie klepią kolejną apkę na kolejne wybory. Tym razem protokoły, z jedynie poprawnymi wynikami, będą już w minutę po OTWARCIU lokali wyborczych.","A mocodawcy Mateckiego, już pewnie klepią kolejną apkę na kolejne wybory. Tym razem protokoły, z jedynie poprawnymi wynikami, będą już w minutę po OTWARCIU lokali wyborczych.",,,,0,0,0,174,26,0.0,niski,52,1.0
913.0,fuksiarzpl,Wybory wcześniej niż myślisz? 🗳️ Typuj polityczny kalendarz i zgarnij freebet!,2,16,20,38,08-06-25,2025-06-08,2025.0,6.0,8.0,0.0,Wybory wcześniej niż myślisz? 🗳️ Typuj polityczny kalendarz i zgarnij freebet!,Wybory wcześniej niż myślisz? 🗳️ Typuj polityczny kalendarz i zgarnij freebet!,,,,0,0,0,78,11,0.8,wysoki,52,0.944728784336942
29.0,johnmadbot,"Warto dodać, że strona podróży wyborczych Giertycha wciąż działa! Domenę odnowili w zeszłym roku, więc jak widać czeka na następne wybory... podrozewyborcze.pl/",0,1,1,2,10-06-25,2025-06-10,2025.0,6.0,10.0,0.0,"Warto dodać, że strona podróży wyborczych Giertycha wciąż działa! Domenę odnowili w zeszłym roku, więc jak widać czeka na następne wybory...","Warto dodać, że strona podróży wyborczych Giertycha wciąż działa! Domenę odnowili w zeszłym roku, więc jak widać czeka na następne wybory...",,,podrozewyborcze.pl/,0,0,1,140,21,1.0,średni,52,0.9933930825014384
739.0,pablopaulpawel,"Dwie reguły na przyszłe wybory: 1. Głosować jak najpóźniej 2. Nie brać udziału w ankietach / kłamać w ankietach. Następne wybory są dla prawicy, nic tego nie zmieni.",0,6,1,7,10-06-25,2025-06-10,2025.0,6.0,10.0,0.0,"Dwie reguły na przyszłe wybory: 1. Głosować jak najpóźniej 2. Nie brać udziału w ankietach / kłamać w ankietach. Następne wybory są dla prawicy, nic tego nie zmieni.","Dwie reguły na przyszłe wybory: 1. Głosować jak najpóźniej 2. Nie brać udziału w ankietach / kłamać w ankietach. Następne wybory są dla prawicy, nic tego nie zmieni.",,,,0,0,0,165,28,6.0,wysoki,52,1.0
12.0,koneserunii,❗️THE END❗️ Premier już wie że w przyszłym roku będą nowe wybory.,0,7,5,12,11-06-25,2025-06-11,2025.0,6.0,11.0,0.0,❗️THE END❗️ Premier już wie że w przyszłym roku będą nowe wybory.,❗️THE END❗️ Premier już wie że w przyszłym roku będą nowe wybory.,,,,0,0,0,65,12,1.4,wysoki,52,1.0
7.0,trzaskowski_,Wybory za nami. Wszystko przed nami.,213,1106,1513,2832,06-06-25,2025-06-06,2025.0,6.0,6.0,0.0,Wybory za nami. Wszystko przed nami.,Wybory za nami. Wszystko przed nami.,,,,0,0,0,36,6,0.73,wysoki,52,1.0
7.0,morgenstern616,"Słucham Sienkiewicz i mam wrażenie, że wybory jeszcze się nie rozstrzygnęły",3,253,105,361,14-06-25,2025-06-14,2025.0,6.0,14.0,0.0,"Słucham Sienkiewicz i mam wrażenie, że wybory jeszcze się nie rozstrzygnęły","Słucham Sienkiewicz i mam wrażenie, że wybory jeszcze się nie rozstrzygnęły",,,,0,0,0,75,11,2.41,wysoki,52,1.0
394.0,robson_r77,"Wybory się powtórzy, a potem znów wyjdzie @GiertychRoman apelujący o przeliczenie i kolejną powtórkę 😂 Serial minimum na 3 sezony",0,0,0,0,20-06-25,2025-06-20,2025.0,6.0,20.0,0.0,"Wybory się powtórzy, a potem znów wyjdzie apelujący o przeliczenie i kolejną powtórkę 😂 Serial minimum na 3 sezony","Wybory się powtórzy, a potem znów wyjdzie apelujący o przeliczenie i kolejną powtórkę 😂 Serial minimum na 3 sezony",@GiertychRoman,,,1,0,0,114,19,0.0,niski,52,1.0
115.0,wojciechsinski,"Wybory prezydenckie zakończone, V Kongres Korony odbyty... a to oznacza, że jesteśmy już w kampanii do Sejmu gdzie @KoronyPolskiej startować będzie we własnym komitecie wyborczym.",0,6,1,7,24-06-25,2025-06-24,2025.0,6.0,24.0,0.0,"Wybory prezydenckie zakończone, V Kongres Korony odbyty... a to oznacza, że jesteśmy już w kampanii do Sejmu gdzie startować będzie we własnym komitecie wyborczym.","Wybory prezydenckie zakończone, V Kongres Korony odbyty... a to oznacza, że jesteśmy już w kampanii do Sejmu gdzie startować będzie we własnym komitecie wyborczym.",@KoronyPolskiej,,,1,0,0,163,24,6.0,wysoki,52,1.0
130.0,sabinakociol,"Ma sie ten dar. Przewiduję jeszcze zamieszki 6 sierpnia, JD Vance'a jako kolejnego POTUSa, czwarty Mińsk i jeśli myślisz, że te wybory były ciężkie to za rok (jesień 2026) będzie taka jazda, że nie obędzie się bez ofiar śmiertelnych.",0,0,0,0,24-06-25,2025-06-24,2025.0,6.0,24.0,0.0,"Ma sie ten dar. Przewiduję jeszcze zamieszki 6 sierpnia, JD Vance'a jako kolejnego POTUSa, czwarty Mińsk i jeśli myślisz, że te wybory były ciężkie to za rok (jesień 2026) będzie taka jazda, że nie obędzie się bez ofiar śmiertelnych.","Ma sie ten dar. Przewiduję jeszcze zamieszki 6 sierpnia, JD Vance'a jako kolejnego POTUSa, czwarty Mińsk i jeśli myślisz, że te wybory były ciężkie to za rok (jesień 2026) będzie taka jazda, że nie obędzie się bez ofiar śmiertelnych.",,,,0,0,0,233,39,0.0,niski,52,1.0
99.0,wadek635160,❗️Pilne❗️ #PociagPrawych Eliza chce ponownych wyborów... 1 i 2 turę ..oraz te z 2020 r ...a tych z 2023 r już nie ... bo wtedy były dopiero wolne wybory..😄 a zwożenie wyborców ... przez ludzi z PO... którzy głosowali do 3 rano... na zaświadczenia ...już jej to nie martwi.,0,1,0,1,24-06-25,2025-06-24,2025.0,6.0,24.0,0.0,❗️Pilne❗️ PociagPrawych Eliza chce ponownych wyborów... 1 i 2 turę ..oraz te z 2020 r ...a tych z 2023 r już nie ... bo wtedy były dopiero wolne wybory..😄 a zwożenie wyborców ... przez ludzi z PO... którzy głosowali do 3 rano... na zaświadczenia ...już jej to nie martwi.,❗️Pilne❗️ Eliza chce ponownych wyborów... 1 i 2 turę ..oraz te z 2020 r ...a tych z 2023 r już nie ... bo wtedy były dopiero wolne wybory..😄 a zwożenie wyborców ... przez ludzi z PO... którzy głosowali do 3 rano... na zaświadczenia ...już jej to nie martwi.,,#PociagPrawych,,0,1,0,271,49,1.0,średni,52,1.0
162.0,dulassos,Mielibyśmy już rozpisane nowe wybory.,0,0,0,0,26-06-25,2025-06-26,2025.0,6.0,26.0,0.0,Mielibyśmy już rozpisane nowe wybory.,Mielibyśmy już rozpisane nowe wybory.,,,,0,0,0,37,5,0.0,niski,52,0.9624845373095926
449.0,piotrnamys,należało by rozpiać nowe wybory,0,0,0,0,27-06-25,2025-06-27,2025.0,6.0,27.0,0.0,należało by rozpiać nowe wybory,należało by rozpiać nowe wybory,,,,0,0,0,31,5,0.0,niski,52,0.976811354746672
271.0,a_artymowicz,"Przypominają mi się nadzieje po zwycięskich dla SLD wyborach 2001 i wynik tegoż SLD w 2005r. Następne wybory pokażą nie czy, bo raczej na pewno, ale jakim stopniu historia się powtórzy...",0,0,0,0,27-06-25,2025-06-27,2025.0,6.0,27.0,0.0,"Przypominają mi się nadzieje po zwycięskich dla SLD wyborach 2001 i wynik tegoż SLD w 2005r. Następne wybory pokażą nie czy, bo raczej na pewno, ale jakim stopniu historia się powtórzy...","Przypominają mi się nadzieje po zwycięskich dla SLD wyborach 2001 i wynik tegoż SLD w 2005r. Następne wybory pokażą nie czy, bo raczej na pewno, ale jakim stopniu historia się powtórzy...",,,,0,0,0,187,31,0.0,niski,52,1.0
213.0,falunia80,"Państwo z dykty, ile jeszcze? Kiedy wybory?",0,0,0,0,27-06-25,2025-06-27,2025.0,6.0,27.0,0.0,"Państwo z dykty, ile jeszcze? Kiedy wybory?","Państwo z dykty, ile jeszcze? Kiedy wybory?",,,,0,0,0,43,7,0.0,niski,52,0.944728784336942
26.0,danuta11073,"Do powtórnych wyborów. Uważam, że powtórne wybory to dobre rozwiązanie ale b. kosztowne no i pewnie muszą być na to podstawy!",0,0,0,0,28-06-25,2025-06-28,2025.0,6.0,28.0,0.0,"Do powtórnych wyborów. Uważam, że powtórne wybory to dobre rozwiązanie ale b. kosztowne no i pewnie muszą być na to podstawy!","Do powtórnych wyborów. Uważam, że powtórne wybory to dobre rozwiązanie ale b. kosztowne no i pewnie muszą być na to podstawy!",,,,0,0,0,125,21,0.0,niski,52,1.0
212.0,damian_pal14,O tym będą następne wybory,0,0,0,0,28-06-25,2025-06-28,2025.0,6.0,28.0,0.0,O tym będą następne wybory,O tym będą następne wybory,,,,0,0,0,26,5,0.0,niski,52,1.0
13.0,mszymanski101,Przyjdą wybory kolejne i karnie znów zagłosują na KO.,0,0,0,0,29-06-25,2025-06-29,2025.0,6.0,29.0,0.0,Przyjdą wybory kolejne i karnie znów zagłosują na KO.,Przyjdą wybory kolejne i karnie znów zagłosują na KO.,,,,0,0,0,53,9,0.0,niski,52,1.0
404.0,radoslawszafarz,By uczciwie przeliczyć wszystkie głosy- jest dużo czasu. Ponad miesiąc. #Wybory #Cuda #PrzeliczyćWszystkieGłosy,1,18,2,21,29-06-25,2025-06-29,2025.0,6.0,29.0,0.0,By uczciwie przeliczyć wszystkie głosy- jest dużo czasu. Ponad miesiąc. Wybory Cuda PrzeliczyćWszystkieGłosy,By uczciwie przeliczyć wszystkie głosy- jest dużo czasu. Ponad miesiąc.,,#Wybory|#Cuda|#PrzeliczyćWszystkieGłosy,,0,3,0,108,13,9.0,wysoki,52,1.0
28.0,emwu_,Narod prosi o przedterminowe wybory!,0,0,0,0,30-06-25,2025-06-30,2025.0,6.0,30.0,0.0,Narod prosi o przedterminowe wybory!,Narod prosi o przedterminowe wybory!,,,,0,0,0,36,5,0.0,niski,52,1.0
115.0,tigeriusz,"Aa i gadanie, że wybory są raz na pięć lat - realnie to w tym kraju wybory wypadają co 14 miesięcy. Bo każde wybory można sparalizować, nie tylko prezydenckie.",0,0,0,0,30-06-25,2025-06-30,2025.0,6.0,30.0,0.0,"Aa i gadanie, że wybory są raz na pięć lat - realnie to w tym kraju wybory wypadają co 14 miesięcy. Bo każde wybory można sparalizować, nie tylko prezydenckie.","Aa i gadanie, że wybory są raz na pięć lat - realnie to w tym kraju wybory wypadają co 14 miesięcy. Bo każde wybory można sparalizować, nie tylko prezydenckie.",,,,0,0,0,159,29,0.0,niski,52,0.9310114677631044
63.0,piotr__bach,"Czyli Bondar idzie w przedłużenie procedury potwierdzenia wyniku wyborów, żeby jutro powiedzieć że termin minął i potrzebne są nowe wybory.",0,0,0,0,01-07-25,2025-07-01,2025.0,7.0,1.0,0.0,"Czyli Bondar idzie w przedłużenie procedury potwierdzenia wyniku wyborów, żeby jutro powiedzieć że termin minął i potrzebne są nowe wybory.","Czyli Bondar idzie w przedłużenie procedury potwierdzenia wyniku wyborów, żeby jutro powiedzieć że termin minął i potrzebne są nowe wybory.",,,,0,0,0,139,20,0.0,niski,52,1.0
376.0,andrus_son,Opozycja jest duża . Na co czekacie? Wymuście wybory przedterminowe.,0,0,0,0,02-07-25,2025-07-02,2025.0,7.0,2.0,0.0,Opozycja jest duża . Na co czekacie? Wymuście wybory przedterminowe.,Opozycja jest duża . Na co czekacie? Wymuście wybory przedterminowe.,,,,0,0,0,68,10,0.0,niski,52,0.9473318746147305
1.0,r4zer90,"A 27 sierpnia to nie jest już po wyborach? W sensie kiedy mają być wybory w końcu? Zakładanie, że cokolwiek się dokończy po wyborach chyba jest z góry błędne.",0,0,0,0,06-07-25,2025-07-06,2025.0,7.0,6.0,0.0,"A 27 sierpnia to nie jest już po wyborach? W sensie kiedy mają być wybory w końcu? Zakładanie, że cokolwiek się dokończy po wyborach chyba jest z góry błędne.","A 27 sierpnia to nie jest już po wyborach? W sensie kiedy mają być wybory w końcu? Zakładanie, że cokolwiek się dokończy po wyborach chyba jest z góry błędne.",,,,0,0,0,158,29,0.0,niski,52,1.0
9.0,archer_post,"I jeszcze faki pokazuje, przyjdzie czas na wybory, pożyjemy zobaczymy",0,0,0,0,07-07-25,2025-07-07,2025.0,7.0,7.0,0.0,"I jeszcze faki pokazuje, przyjdzie czas na wybory, pożyjemy zobaczymy","I jeszcze faki pokazuje, przyjdzie czas na wybory, pożyjemy zobaczymy",,,,0,0,0,69,10,0.0,niski,52,0.9519454014527472
4.0,republikatv,Kiedy przyspieszone wybory? #włączprawdę #TVRepublika tvrepublika.pl/W-Telewizji-R…,0,0,0,0,02-08-25,2025-08-02,2025.0,8.0,2.0,0.0,Kiedy przyspieszone wybory? włączprawdę TVRepublika,Kiedy przyspieszone wybory?,,#włączprawdę|#TVRepublika,tvrepublika.pl/W-Telewizji-R…,0,2,1,51,5,0.0,niski,52,0.9987943725953792
23.0,joannak76637087,Przyszłoroczne wybory cząstkowe do Kongresu będą kluczowe dla Trumpa i MAGA. Oprócz teraz rozgrzanych tematów obyczajowych dojdą efekty wojny celnej i częściowe zużycie republikanów u władzy. Życzę im tego bo echo poniesie się też wtedy do partii PiS 😅,0,0,0,0,04-08-25,2025-08-04,2025.0,8.0,4.0,0.0,Przyszłoroczne wybory cząstkowe do Kongresu będą kluczowe dla Trumpa i MAGA. Oprócz teraz rozgrzanych tematów obyczajowych dojdą efekty wojny celnej i częściowe zużycie republikanów u władzy. Życzę im tego bo echo poniesie się też wtedy do partii PiS 😅,Przyszłoroczne wybory cząstkowe do Kongresu będą kluczowe dla Trumpa i MAGA. Oprócz teraz rozgrzanych tematów obyczajowych dojdą efekty wojny celnej i częściowe zużycie republikanów u władzy. Życzę im tego bo echo poniesie się też wtedy do partii PiS 😅,,,,0,0,0,252,39,0.0,niski,52,1.0
31.0,tygodnik_sieci,"Wejście smoka. Rozpoczyna się nowa epoka. Dokąd naszą ojczyznę poprowadzi człowiek, który wygrał wybory o wszystko? Czytaj więcej 👇 wpolityce.pl/tygodniksieci/7…",1,4,1,6,04-08-25,2025-08-04,2025.0,8.0,4.0,0.0,"Wejście smoka. Rozpoczyna się nowa epoka. Dokąd naszą ojczyznę poprowadzi człowiek, który wygrał wybory o wszystko? Czytaj więcej 👇","Wejście smoka. Rozpoczyna się nowa epoka. Dokąd naszą ojczyznę poprowadzi człowiek, który wygrał wybory o wszystko? Czytaj więcej 👇",,,wpolityce.pl/tygodniksieci/7…,0,0,1,131,19,4.0,wysoki,52,0.9353997960825507
20.0,kampala59272710,"nitter.net/mikeniasty/status/1953… Tak, że ten. Nic jeszcze nie wiadomo, wybory wciąż trwają.",0,0,1,1,06-08-25,2025-08-06,2025.0,8.0,6.0,0.0,"Tak, że ten. Nic jeszcze nie wiadomo, wybory wciąż trwają.","Tak, że ten. Nic jeszcze nie wiadomo, wybory wciąż trwają.",,,nitter.net/mikeniasty/status/1953…,0,0,1,58,10,0.0,średni,52,1.0
57.0,tobol_twm,"Wybory będą wcześniej, a napewno nowy rząd. Końcówka roku będzie ciekawa",0,0,0,0,06-08-25,2025-08-06,2025.0,8.0,6.0,0.0,"Wybory będą wcześniej, a napewno nowy rząd. Końcówka roku będzie ciekawa","Wybory będą wcześniej, a napewno nowy rząd. Końcówka roku będzie ciekawa",,,,0,0,0,72,11,0.0,niski,52,1.0
18.0,bartson50438286,@PasjonataM jak mylisz będą przyspieszone wybory ?,0,0,0,0,06-08-25,2025-08-06,2025.0,8.0,6.0,0.0,jak mylisz będą przyspieszone wybory ?,jak mylisz będą przyspieszone wybory ?,@PasjonataM,,,1,0,0,38,6,0.0,niski,52,1.0
2.0,onslow_ak,Czy następne wybory znowu będą wyborami o wszystko? 🫡,0,0,0,0,07-08-25,2025-08-07,2025.0,8.0,7.0,0.0,Czy następne wybory znowu będą wyborami o wszystko? 🫡,Czy następne wybory znowu będą wyborami o wszystko? 🫡,,,,0,0,0,53,9,0.0,niski,52,1.0
10.0,marcinziach,"Raczej wakacje, lato, piękna pogoda... Słaby czas na wybory",0,0,1,1,10-08-25,2025-08-10,2025.0,8.0,10.0,0.0,"Raczej wakacje, lato, piękna pogoda... Słaby czas na wybory","Raczej wakacje, lato, piękna pogoda... Słaby czas na wybory",,,,0,0,0,59,9,0.0,średni,52,1.0
9.0,maciej8153,znowu jakies wybory w PL?,0,0,0,0,16-08-25,2025-08-16,2025.0,8.0,16.0,0.0,znowu jakies wybory w PL?,znowu jakies wybory w PL?,,,,0,0,0,25,5,0.0,niski,52,1.0
4.0,_jot_jasz_,"Nie wierzę. Chyba czas, aby w UA odbyły się wybory.",0,0,0,0,17-08-25,2025-08-17,2025.0,8.0,17.0,0.0,"Nie wierzę. Chyba czas, aby w UA odbyły się wybory.","Nie wierzę. Chyba czas, aby w UA odbyły się wybory.",,,,0,0,0,51,10,0.0,niski,52,1.0
10.0,plackibezcukru,Tak się robi kampanię i wygrywa wybory bo oni już zaczęli pracować na wybory w 2027. A tak w ogóle to jprdl.,3,15,28,46,18-08-25,2025-08-18,2025.0,8.0,18.0,0.0,Tak się robi kampanię i wygrywa wybory bo oni już zaczęli pracować na wybory w 2027. A tak w ogóle to jprdl.,Tak się robi kampanię i wygrywa wybory bo oni już zaczęli pracować na wybory w 2027. A tak w ogóle to jprdl.,,,,0,0,0,108,22,0.54,wysoki,52,1.0
15.0,tomaszsudol1,Super wieści. Może będą przedterminowe wybory?,0,0,0,0,19-08-25,2025-08-19,2025.0,8.0,19.0,0.0,Super wieści. Może będą przedterminowe wybory?,Super wieści. Może będą przedterminowe wybory?,,,,0,0,0,46,6,0.0,niski,52,1.0
10.0,mario1679660,Krótko: Kiedy się weźmiesz za skręcone wybory?,0,0,0,0,20-08-25,2025-08-20,2025.0,8.0,20.0,0.0,Krótko: Kiedy się weźmiesz za skręcone wybory?,Krótko: Kiedy się weźmiesz za skręcone wybory?,,,,0,0,0,46,7,0.0,niski,52,1.0
26.0,nasion420,Ale kolejne wybory powinny być już kilka razy,0,0,0,0,22-08-25,2025-08-22,2025.0,8.0,22.0,0.0,Ale kolejne wybory powinny być już kilka razy,Ale kolejne wybory powinny być już kilka razy,,,,0,0,0,45,8,0.0,niski,52,1.0
11.0,czesiaryman,"Strzałka pokazuje wybory w 2023. Od tej pory Siemens idzie tylko w górę. Trzeba to mówić głośno, tusk ratuje szwabów kosztem nas, Polaków.",1,11,1,13,22-08-25,2025-08-22,2025.0,8.0,22.0,0.0,"Strzałka pokazuje wybory w 2023. Od tej pory Siemens idzie tylko w górę. Trzeba to mówić głośno, tusk ratuje szwabów kosztem nas, Polaków.","Strzałka pokazuje wybory w 2023. Od tej pory Siemens idzie tylko w górę. Trzeba to mówić głośno, tusk ratuje szwabów kosztem nas, Polaków.",,,,0,0,0,138,23,11.0,wysoki,52,0.934491467645844
7.0,wiktorkolumb,"Szanse jeszcze są, ale trzeba by przyspieszyć wybory...",0,0,0,0,25-08-25,2025-08-25,2025.0,8.0,25.0,0.0,"Szanse jeszcze są, ale trzeba by przyspieszyć wybory...","Szanse jeszcze są, ale trzeba by przyspieszyć wybory...",,,,0,0,0,55,8,0.0,niski,52,1.0
8.0,wybranowski,"Pani Poseł, mam pytanie. Czy Pani, podobnie jak ja, uważa, że będą wcześniejsze wybory? Bo Pani zabiegi o miejsce na liście KO są bardzo czytelne",0,2,2,4,25-08-25,2025-08-25,2025.0,8.0,25.0,0.0,"Pani Poseł, mam pytanie. Czy Pani, podobnie jak ja, uważa, że będą wcześniejsze wybory? Bo Pani zabiegi o miejsce na liście KO są bardzo czytelne","Pani Poseł, mam pytanie. Czy Pani, podobnie jak ja, uważa, że będą wcześniejsze wybory? Bo Pani zabiegi o miejsce na liście KO są bardzo czytelne",,,,0,0,0,145,25,1.0,średni,52,0.944728784336942
34.0,dominik29699310,"Bardzo dobre wybory, liczę że cadillac będzie w miarę konkurencyjny w przyszłym sezonie, już czekam aby ponownie zobaczyć bottasa i pereza",0,0,0,0,26-08-25,2025-08-26,2025.0,8.0,26.0,0.0,"Bardzo dobre wybory, liczę że cadillac będzie w miarę konkurencyjny w przyszłym sezonie, już czekam aby ponownie zobaczyć bottasa i pereza","Bardzo dobre wybory, liczę że cadillac będzie w miarę konkurencyjny w przyszłym sezonie, już czekam aby ponownie zobaczyć bottasa i pereza",,,,0,0,0,138,21,0.0,niski,52,1.0
22.0,denis34992581,Ja tak myślę że będzie veto i.... wybory.,0,0,0,0,26-08-25,2025-08-26,2025.0,8.0,26.0,0.0,Ja tak myślę że będzie veto i.... wybory.,Ja tak myślę że będzie veto i.... wybory.,,,,0,0,0,41,8,0.0,niski,52,0.940361026397672
1.0,mazakiem,Może następne wybory to czas na zmianę w ratuszu @warszawa ?,0,0,0,0,27-08-25,2025-08-27,2025.0,8.0,27.0,0.0,Może następne wybory to czas na zmianę w ratuszu ?,Może następne wybory to czas na zmianę w ratuszu ?,@warszawa,,,1,0,0,50,10,0.0,niski,52,1.0
145.0,pawelpiotrows15,"Spieszy im się, przyspieszają przetarg. Nie wiadomo co będzie w polityce w przyszłym roku. Nie przypadkiem nowy Siemens był testowany w ubiegłym mcu na torze pod Żmigrodem, aby uzyskał homologację. W końcu o tym były te wybory.",0,0,0,0,27-08-25,2025-08-27,2025.0,8.0,27.0,0.0,"Spieszy im się, przyspieszają przetarg. Nie wiadomo co będzie w polityce w przyszłym roku. Nie przypadkiem nowy Siemens był testowany w ubiegłym mcu na torze pod Żmigrodem, aby uzyskał homologację. W końcu o tym były te wybory.","Spieszy im się, przyspieszają przetarg. Nie wiadomo co będzie w polityce w przyszłym roku. Nie przypadkiem nowy Siemens był testowany w ubiegłym mcu na torze pod Żmigrodem, aby uzyskał homologację. W końcu o tym były te wybory.",,,,0,0,0,227,37,0.0,niski,52,1.0
15.0,kub4n000,Jest szansa na przedterminowe wybory?,0,0,1,1,27-08-25,2025-08-27,2025.0,8.0,27.0,0.0,Jest szansa na przedterminowe wybory?,Jest szansa na przedterminowe wybory?,,,,0,0,0,37,5,0.0,średni,52,1.0
169.0,tenpolityk,Kolejne dwa weta. To juz 6 Do końca roku będzie #sonda #wybory,0,0,0,0,27-08-25,2025-08-27,2025.0,8.0,27.0,0.0,Kolejne dwa weta. To juz 6 Do końca roku będzie sonda wybory,Kolejne dwa weta. To juz 6 Do końca roku będzie,,#sonda|#wybory,,0,2,0,60,12,0.0,niski,52,1.0
1.0,thepawellach,"A co jesli beda przedterminowe wybory?;p 28 jest celowo wiadomo, mam nadzieje ze przestrzeliliscie.",0,0,0,0,28-08-25,2025-08-28,2025.0,8.0,28.0,0.0,"A co jesli beda przedterminowe wybory?;p 28 jest celowo wiadomo, mam nadzieje ze przestrzeliliscie.","A co jesli beda przedterminowe wybory?;p 28 jest celowo wiadomo, mam nadzieje ze przestrzeliliscie.",,,,0,0,0,99,14,0.0,niski,52,1.0
16.0,hieronimberbel1,"Nie martw sie, za miesiąc powtórka. A za kolejny kiesiac kolejna. A potem wybory :)",0,0,0,0,28-08-25,2025-08-28,2025.0,8.0,28.0,0.0,"Nie martw sie, za miesiąc powtórka. A za kolejny kiesiac kolejna. A potem wybory :)","Nie martw sie, za miesiąc powtórka. A za kolejny kiesiac kolejna. A potem wybory :)",,,,0,0,0,83,15,0.0,niski,52,1.0
16.0,igoo23,To kiedy nowe wybory skoro sejm zerwany?,0,0,0,0,28-08-25,2025-08-28,2025.0,8.0,28.0,0.0,To kiedy nowe wybory skoro sejm zerwany?,To kiedy nowe wybory skoro sejm zerwany?,,,,0,0,0,40,7,0.0,niski,52,1.0
24.0,mareks89076959,Jednak w demokracji powinna być opcja referendum dotycząca nowych wyborów. 51% liczby wyborców biorących udział w poprzednich wyborach opowiada się za nowymi wyborami to robimy nowe wybory.,0,0,0,0,30-08-25,2025-08-30,2025.0,8.0,30.0,0.0,Jednak w demokracji powinna być opcja referendum dotycząca nowych wyborów. 51% liczby wyborców biorących udział w poprzednich wyborach opowiada się za nowymi wyborami to robimy nowe wybory.,Jednak w demokracji powinna być opcja referendum dotycząca nowych wyborów. 51% liczby wyborców biorących udział w poprzednich wyborach opowiada się za nowymi wyborami to robimy nowe wybory.,,,,0,0,0,189,27,0.0,niski,52,0.9434248970076472
25.0,bezczelnyy,Kolejna nowoczesna czy jakaś inna przystawka na nadchodzące wybory. Jacy oni przewidywalni,0,0,0,0,31-08-25,2025-08-31,2025.0,8.0,31.0,0.0,Kolejna nowoczesna czy jakaś inna przystawka na nadchodzące wybory. Jacy oni przewidywalni,Kolejna nowoczesna czy jakaś inna przystawka na nadchodzące wybory. Jacy oni przewidywalni,,,,0,0,0,90,12,0.0,niski,52,1.0
3.0,darekzimmerman,My patrioci już nie możemy się doczekać aż na jesień zostaną rozpisane nowe wybory i będzie to piękny widok gdy wyprowadzi się pani z Sejmu RP.,0,0,0,0,01-09-25,2025-09-01,2025.0,9.0,1.0,0.0,My patrioci już nie możemy się doczekać aż na jesień zostaną rozpisane nowe wybory i będzie to piękny widok gdy wyprowadzi się pani z Sejmu RP.,My patrioci już nie możemy się doczekać aż na jesień zostaną rozpisane nowe wybory i będzie to piękny widok gdy wyprowadzi się pani z Sejmu RP.,,,,0,0,0,143,26,0.0,niski,52,0.9715265264693708
